movieId,tmdbId,title,release_date,genres,overview,popularity,runtime,tagline,vote_average,vote_count,original_language,backdrop_path,poster_path,keywords
203184.0,600836.0,Projeto Ithaca,2019.0,Ficção científica|Thriller,"Um grupo de estranhos acorda a bordo de uma nave alienígena. Divididos eles morrerão. Juntos, eles podem encontrar um caminho para casa.",5.205,84.0,,6.4,70.0,en,/y1WIEyWYN6djFv4ebIx3gKWuJyw.jpg,/b1ku6nZmy3XEtPWA3HnrQ4zuJRk.jpg,
203208.0,417384.0,Histórias Assustadoras para Contar no Escuro,2019.0,Terror|Thriller,"A cidade de Mill Valley é assombrada há décadas pelos mistérios envolvendo o casarão da família Bellows. Em 1968, a jovem Sarah Bellows, uma garota problemática que mantinha um mau relacionamento com os pais, foi ao porão para escrever um livro repleto de histórias macabras. Décadas mais tarde, um grupo de adolescentes descobre o livro e começa a investigar o passado de Sarah. No entanto, as histórias do livro começam a se tornar reais.",82.474,108.0,Baseado na icônica série de livros.,6.5,1942.0,en,/qBI3Spq93lNxGzecdGpbwV5lOvU.jpg,/g0xdEeQwpyMQNtGrGr0i1TlgpQ4.jpg,k818|k3335
203212.0,532838.0,Deep Murder,2019.0,Comedy|Horror,"Set in an alternate reality in which everyone is a cliché from a tacky porn film, a group of increasingly self-aware stock characters are up against a mysterious killer offing them one by one.",3.29,95.0,"In porn, everyone can hear you scream.",4.1,18.0,en,/zOiPMWpw2gkvMNl3UrN2B6eVi5A.jpg,/7pMvAVA0bXLaJvpk9XeszXL3Hgk.jpg,k703
203218.0,521777.0,Bons Meninos,2019.0,Comédia,"Três meninos ainda inocentes, mas que estão prestes a atingirem a adolescência, matam aula em San Fernando Valley, na Califórinia, para conseguir consertar um drone quebrado antes que seus pais cheguem em casa. O que prometia ser um dia comum transforma-se em uma grande aventura repleta de perigos cômicos.",29.371,89.0,,6.9,1348.0,en,/meag1aZB1wffo91pl5KQYTdmg9z.jpg,/fo9hEe3yBjJYOxL3suygTuVxWmn.jpg,
203220.0,502149.0,Being Frank,2019.0,Comedy,A seventeen-year-old boy blackmails his father after discovering his secret second family,3.249,111.0,,7.0,24.0,en,/cz9TAWdvlXwCJQ5cNBaQDU9coC7.jpg,/3f9yRUkhYOAmPm5QRv6Oh6M6W0t.jpg,k1936
203222.0,420818.0,O Rei Leão,2019.0,Aventura|Família|Animação,"Simba é um jovem leão cujo destino é se tornar o rei da selva. Entretanto, uma armadilha elaborada por seu tio Scar faz com que Mufasa, o atual rei, morra ao tentar salvar o filhote. Consumido pela culpa, Simba deixa o reino rumo a um local distante, onde encontra amigos que o ensinam a mais uma vez ter prazer pela vida.",129.936,118.0,,7.2,7982.0,en,/1TUg5pO1VZ4B0Q1amk3OlXvlpXV.jpg,/wrHr8eEJYDAA7WYybyH162s4oZ4.jpg,k18035
203224.0,499701.0,Dora e a Cidade Perdida,2019.0,Aventura|Comédia|Família,"Ambientado na floresta peruana, o filme narra as aventuras de Dora (Isabella Merced) junto de seu macaco Botas, amigos que acabou de fazer na escola e um misterioso explorador a fim de salvar seus pais de mercenários. Mas Dora também terá de solucionar um grande mistério envolvendo Parapata, uma antiga cidade perdida dos Incas.",48.851,102.0,,6.8,1298.0,en,/ltt9yiCGmCQZunmxtkhtPxzmDzx.jpg,/zn6uvrCTymyl9dYkoU2XDODC8IC.jpg,
203228.0,525657.0,Filha do Lobo,2019.0,Ação|Thriller,"Claire volta para casa diante das recentes notícias do falecimento de seu pai, e encontra seu desafiador filho de 13 anos. Quando a notícia se espalha sobre a grande herança seu filho é sequestrado por uma gangue local liderada por uma figura misteriosa conhecida apenas como “Pai”.",11.173,88.0,,5.4,136.0,en,/pGzUGy5EJFfZudzKXXc2kyQN4mu.jpg,/8EF7LwraK66cyRdn1aKcVnV2dr5.jpg,
203230.0,506403.0,Submissão - Uma Luta Pela Qual Vale a Pena Morrer,2019.0,Drama,"Com Eric Roberts. Neste drama cristão, dois fuzileiros voltam para casa depois de passarem por inúmeros traumas no confronto com Estado Islâmico. Eles buscam um novo caminho, enquanto um tenta se recuperar de um vício, o outro reecontra o MMA.",4.018,94.0,,6.8,18.0,en,/fhBcOdFkfQYPIrgQ4ZKt5ZsbFKH.jpg,/qR8lTmDl30FbE9nNNQOUkDvSfMp.jpg,
203242.0,544003.0,John DeLorean: Visionário ou Vigarista?,2019.0,Documentário|Drama,"A história por trás de John Delorean (Alec Baldwin), grande figura do ramo automobilístico que entrou para a História por suas criações e polêmicas. Engenheiro modelo da General Motors, John largou o cargo para criar sua própria empresa e dar vida ao icônico automóvel Delorean. Apesar disso, uma série de polêmicas, problemas na justiça e a ligação com o tráfico de drogas colocam em xeque o brilhantismo do empresário e tudo que conquistou.",5.49,109.0,,6.2,42.0,en,/i3ErSy9O8NGNvb0S3Xv6Om8dk5z.jpg,/p9uoTEG3p3nLNI8wJowMpqUU4g5.jpg,
203244.0,486131.0,Shaft,2019.0,Ação|Crime,"Após a morte suspeita de um amigo, John Shaft Jr. (Jessie T. Usher) resolve pedir ajuda a seu pai, Shaft (Samuel L. Jackson), para resolver o caso. Ele aceita deixar a aposentadoria para iniciar a investigação, apesar dos problemas existentes com o próprio filho.",19.387,111.0,Mais Shaft do que você pode lidar,6.6,1268.0,en,/103d4ObBCWbB6PtOOjZ7C1FSpVl.jpg,/cH4g8WjAGw7lL0o2CS3tAAXskF7.jpg,
203254.0,601744.0,Loqueesha,2019.0,Comedy|Drama,A white guy pretends to be a black female talk radio host and becomes a huge hit.,2.297,98.0,Sometimes you have to become somebody else to find out who you really are,2.5,11.0,en,/zO185KGJRFJjtwHEGXxAo4SYGDv.jpg,/uwJiIxoNre4mih8F5ayRw2f7Vwb.jpg,
203278.0,508101.0,Convidado Vitalicio,2019.0,Romance|Comédia|Drama,"Para sobreviver a um verão cheio de casamentos, os amigos de longa data Ben e Alice concordam em ser o acompanhante um do outro nos casamentos para os quais foram convidados.",7.522,98.0,,7.1,202.0,en,/9TL90eOg7KfaJOqYSgimZ6yXnRJ.jpg,/A3AQzmmR6kee3uuBLm3ZGGCx1Hw.jpg,k13027
203280.0,566063.0,Ask Dr. Ruth,2019.0,Documentário,"Um documentário retratando a incrível vida da dra. Ruth Westheimer, uma sobrevivente do Holocausto que se tornou a mais famosa terapeuta sexual da América. Com a aproximação de seu aniversário de 90 anos, a Dra. Ruth revisita seu passado doloroso e sua carreira na vanguarda da revolução sexual.",5.083,100.0,,7.6,40.0,en,/tb92EyCyJou08SaQG0BhfEeUJvV.jpg,/pr57bIvTsM140Ub4Uc1FCwUElDK.jpg,
203296.0,532953.0,Purl,2019.0,Animação|Comédia,Purl conta a história de uma bola de tricô rosa que acabou de ser contratada por uma empresa composta apenas por homens e encontra muitas dificuldades para conseguir se adaptar à rotina tão corrida e ao convívio tão complicado.,7.083,9.0,,6.7,186.0,en,/upM4qYUJH2lcjsNOxHULchUQnZc.jpg,/joXAnXkoR2v2LzB4vx33WCNba24.jpg,
203302.0,606215.0,The Black Godfather,2019.0,Documentary,"Follows the life of Clarence Avant, the ultimate, uncensored mentor and behind-the-scenes rainmaker in music, film, TV and politics.",4.525,118.0,,6.9,23.0,en,/lrTKanWOB7tyOrK2m93pffSJoaS.jpg,/3BQArnXPwM5nHeS1tlGKLY7eapP.jpg,
203306.0,607822.0,Vault,2019.0,Crime|Drama,"Inspirado em eventos verídicos, o filme segue um grupo de pequenos criminosos que, em 1975, tentam fazer o maior assalto da história americana, roubando mais de 30 milhões de dólares (mais de 140 milhões ao câmbio de 2020) da máfia, no menor estado do país, Rhode Island.",5.655,100.0,,5.4,28.0,en,/6NLmvkjpsNfROCI4xdIq9gVwxON.jpg,/2UT32vwbUA9T5cwqO2E0ljyEtyO.jpg,
203322.0,463257.0,O Falcão Manteiga de Amendoim,2019.0,Aventura|Drama|Comédia,"Zak foge de sua casa de repouso para realizar seu sonho de se tornar um lutador.  É uma história de aventura que se passa num moderno mundo de  Mark Twain que começa quando Zak (22), um jovem com síndrome de Down, foge da casa de repouso onde vive para perseguir seu sonho de se tornar um lutador profissional. frequentando a escola de luta livre The Salt Water Redneck. Por circunstâncias fora do controle deles, Tyler (32), um novato fora da lei, se torna o improvável treinador e aliado de Zak. Juntos, eles percorrem os pântanos, escapam da captura, bebem uísque, encontram Deus, pescam e convencem Eleanor (28), uma amável funcionária de um lar de idosos com uma história própria, a se juntar a eles em sua jornada.",13.467,97.0,,7.4,870.0,en,/lewYqqt8epnjFhEOIIIINX9Z8EE.jpg,/dGNG2ActRe7eFL082KDdXl8Otpm.jpg,
203338.0,593280.0,Life Overtakes Me,2019.0,Documentary,"Hundreds of refugee children in Sweden, who have fled with their families from extreme trauma, have become afflicted with 'uppgivenhetssyndrom,' or Resignation Syndrome. Facing deportation, they withdraw from the world into a coma-like state, as if frozen, for months, or even years.",6.445,39.0,,6.3,54.0,en,/4dgCUtt9uO2ZnhwVNwAyJL0UrhH.jpg,/uv4a1MntQA8pydnTTf3iICEFcHB.jpg,
203375.0,359724.0,Ford vs Ferrari,2019.0,Drama|Ação|História,"Durante a década de 1960, a Ford resolve entrar no ramo das corridas automobilísticas de forma que a empresa ganhe o prestígio e o glamour da concorrente Ferrari, campeoníssima em várias corridas. Para tanto, contrata o ex-piloto Carroll Shelby para chefiar a empreitada. Por mais que tenha carta branca para montar sua equipe, incluindo o piloto e engenheiro Ken Miles, Shelby enfrenta problemas com a diretoria da Ford, especialmente pela mentalidade mais voltada para os negócios e a imagem da empresa do que propriamente em relação ao aspecto esportivo.",63.741,153.0,Eles levaram o sonho americano para um passeio.,8.0,5126.0,en,/2vq5GTJOahE03mNYZGxIynlHcWr.jpg,/n3lDb4EoeCUf1eRHH54GtTDVyQo.jpg,k818|k9672
203393.0,480042.0,Rota de Fuga 3: O Resgate,2019.0,Ação|Thriller|Crime,O especialista em segurança Ray Breslin e sua equipe devem realizar uma missão de resgate mortal para salvar sua namorada e a filha sequestrada de um magnata da tecnologia de Hong Kong de uma formidável prisão letã.,18.695,97.0,Prepare-se para os danos.,5.2,585.0,en,/ygWKYTu7OnZKF9H5NsgjL9iURGV.jpg,/wTqlEF01SGo4QONor55zUPxHZGP.jpg,k378
203395.0,561325.0,Pavarotti,2019.0,Documentário,"O Campeonato do Mundo de Futebol de 1990 em Itália foi o momento em que a ópera deixou de ser exclusiva das elites e atingiu as massas. A estrela da ópera Pavarotti juntou-se aos colegas tenores Plácido Domingo e José Carreras no palco em Roma, numa transmissão vista por 1.4 biliões de pessoas no mundo inteiro. A poderosa interpretação de ""Nessun Dorma"" continua a representar uma das mais populares e famosas performances que o mundo alguma vez ouviu, e assim Pavarotti realizou o seu velho sonho de tornar a ópera mainstream. Ron Howard toma uma abordagem íntima para contar a história de Pavarotti, indo para além da icónica figura pública para revelar o homem mesmo.",7.87,115.0,,7.5,51.0,en,/7HfN8FedrTiwXHbJpXwMHZFhGyn.jpg,/bf0Iim4D6XXrAAJGwHXyrWFqUz8.jpg,
203397.0,604130.0,Jo Koy: Comin’ In Hot,2019.0,Comedy,"Comedian Jo Koy takes center stage in Hawaii and shares his honest take on island life, ethnicity, fatherhood and more.",4.674,60.0,,7.1,16.0,en,/9LgFODicoHRBWBStsw53A4nLFXt.jpg,/qIrKVEwcw47IKVlyoMeDwiHBNI2.jpg,k9716
203399.0,609660.0,Adam Devine: Best Time of Our Lives,2019.0,Comedy|TV Movie,"Critically acclaimed comedian, Adam Devine, knows that growing up sucks and is here to tell you why. Filmed in front of a packed house at The Orpheum Theater in his hometown of Omaha, Nebraska, Devine's new Netflix comedy special will give a comedic take on the worst parts of growing up including puberty, parental judgment, and almost dying on your 21st birthday.",3.283,58.0,,6.5,20.0,en,/pISqDL70KzEiutMzWGruVN6DkjL.jpg,/pRAO7s2Kv4Qs75VUI7Ffx94GTTC.jpg,k9716
203417.0,606966.0,#FollowMe,2019.0,Terror|Thriller,"Três mulheres de Londres, uma Youtuber e suas duas amigas, desaparecem em um hotel na Califórnia enquanto viajavam de Los Angeles para São Francisco depois de postar nas redes sociais a hashtag #Followme.",2.37,90.0,,5.4,8.0,en,/tqJECgHEBnr29qy9dzHsZ8502CA.jpg,/sApRum4ZZBLkcupwWuFdLpZB6gH.jpg,k10714
203449.0,604196.0,The Lonely Island Presents: The Unauthorized Bash Brothers Experience,2019.0,Comedy|Music,The Lonely Island spoofs Jose Canseco and Mark McGwire in this visual rap album set in the Bash Brothers' 1980s heyday.,5.217,30.0,,6.2,76.0,en,/t2apQWKAn58VohPdML2BDPGrpkK.jpg,/dUrrHBV64W4BwXSzMlGdqjDdWIW.jpg,
203513.0,521029.0,Annabelle 3: De Volta para Casa,2019.0,Terror|Thriller|Mistério,"Determinados a impedir que Annabelle cause ainda mais estragos, os demonologistas Ed e Lorraine Warren levam a boneca possuída até a sala de artefatos em sua casa, colocando-a em ""segurança"" em um vidro sagrado e recorrendo à santa bênção de um padre. Mas, uma noite profana de terror os aguarda, pois Annabelle desperta os espíritos malignos da sala, que agora almejam um novo alvo: a filha de 10 anos do casal Warren, Judy, e seus amigos.",116.131,120.0,,6.5,2508.0,en,/dBt0DoFfbhOI4ypUfRj1uTq623M.jpg,/m8h2gz4El6bvYpDjyQhb7R49rSp.jpg,k6152
203517.0,454640.0,Angry Birds 2: O Filme,2019.0,Animação|Comédia|Aventura|Família,"Red e seus amigos dedicam a vida a proteger a Ilha dos Pássaros dos constantes ataques vindos da Ilha dos Porcos. Entretanto, quanto uma terceira ilha surge e começa a atacá-los, Leonardo, o rei dos porcos, decide procurar seu arqui-inimigo em busca de uma trégua para que, juntos, possam enfrentar a ameaça em comum.",64.401,97.0,Inimigos unidos! Retorna amigos...,7.2,1155.0,en,/d556j1SrMtHiFlajZY2JwWJvatV.jpg,/pMqAjEyj234escPleCthcmh84ka.jpg,k18035
203519.0,384018.0,Velozes & Furiosos: Hobbs & Shaw,2019.0,Ação|Aventura|Comédia,O corpulento policial Luke Hobbs se junta ao fora da lei Deckard Shaw para combater um terrorista geneticamente melhorado que tem força sobre-humana.,158.142,137.0,"Muita ação, adrenalina e pancadaria.",6.9,5381.0,en,/hpgda6P9GutvdkDX5MUJ92QG9aj.jpg,/w5HWdAJyAbfpXbXDmEt5OIpf6kQ.jpg,
203523.0,480100.0,Cine Pesadelo,2019.0,Terror,"Atraídos para dentro de um cinema assombrado, cinco estranhos testemunham uma série de projeções que mostram seus medos mais sombrios e seus segredos mais profundos. Agora, eles terão que enfrentar seus piores pesadelos, enquanto tentam escapar.",14.992,119.0,,6.0,159.0,en,/8zlo7jnuHM8aFc8th6FY3oAp6JV.jpg,/cRUvXumHXtKqJuc9uPXOkYjIAML.jpg,k9712|k9826
203557.0,559713.0,Música a Bordo,2019.0,Comédia|Drama,Um grupo de pescadores e cantores da Cornualha chega ao top 10 após assinar um contrato com um executivo musical de Londres.,6.678,112.0,,6.7,88.0,en,/xxjFyF0onOaH1MvTrOsuA47v74R.jpg,/sBJ5gFjeGDMjAbqpAZBva8tyhGo.jpg,k9672
203561.0,577026.0,The Plagiarists,2019.0,Drama,"Quando o carro de um jovem casal quebra, eles são ajudados por um senhor negro que os inspira com sua sabedoria. Quando descobrem, horrorizados, que as palavras do homem podem não ter sido dele, ficam obcecados pelo seu “crime” e são forçados a questionar a originalidade de suas próprias vidas.",2.009,77.0,,4.7,5.0,en,/5GeOjZx384WRGDGgs3cH2uTHoXx.jpg,/aUS25HDbKxkrZvVuVsqjpkMSC6B.jpg,k8201
203593.0,610619.0,Mike Epps: Only One Mike,2019.0,Comedy,"In a raw stand-up comedy special, Mike Epps mixes it up as he tackles sexual misconduct, special ed, aging body parts and much more.",3.039,63.0,,6.6,11.0,en,,/QxQmeKnyzo0X4vBAMCjS7Mgm1N.jpg,k9716
203603.0,589138.0,Memory Games,2019.0,Documentary,"Without memory we are nothing. Memory makes us human. It’s who we are. Memory Games offers a thrilling insight into the lives of four athletes from the United States, Germany, and Mongolia as they compete for the title of World Memory Champion. Their unique approaches to memorizing and recalling mind-boggling amounts of information and their life stories form the basis for a visually stunning and thought-provoking documentary that looks at how memory permeates every aspect of our lives.",2.801,85.0,,6.7,7.0,en,/nuFPLRbPjf2U7NY3SHk7CYNxJnn.jpg,/ajZXc9fW4OcHUy06uts1vIlsGET.jpg,
203619.0,610120.0,Anima,2019.0,Music|Romance,"In a short musical film directed by Paul Thomas Anderson, Thom Yorke of Radiohead stars in a mind-bending visual piece. Best played loud.",8.073,15.0,A one-reeler film by Paul Thomas Anderson,7.4,293.0,en,/lF9W3LAlYYfv7R2V2b1k0ZnA3a.jpg,/xCBOjFAzsz8d2kABIPfwIAOeJ5t.jpg,
203649.0,603519.0,Hip-Hop Beats,2019.0,Drama|Música,"No berço da black music de Chicago, o prodígio do hip-hop August Monroe conta com um mentor improvável para lidar com a ansiedade e com os limites da criatividade.",15.408,101.0,,6.8,195.0,en,/gdb1kP1O4DeORvYCD3sElP76dpT.jpg,/b8P13nIvkkizVBzd2RpegsRt5zP.jpg,
203671.0,590153.0,Segredos Em Uma Cidade Pequena,2019.0,Drama|Thriller|Cinema TV,"O pior pesadelo de uma mãe se torna realidade quando sua filha adolescente desaparece. Claire, uma mulher recentemente viúva se muda para uma pequena cidade com sua filha adolescente Sarah. No entanto, as coisas dão uma reviravolta para o pior quando Sarah desaparece depois de suas eliminatórias de basquete. A polícia diz a Claire que o caso é basicamente um beco sem saída, forçando-a a resolver o problema por suas próprias mãos. Ela começa a questionar várias pessoas na cidade, incluindo o técnico de basquete feminino, e acaba descobrindo uma série de segredos obscuros para revelar a verdade sobre o desaparecimento de sua filha.",12.146,93.0,,7.5,88.0,en,/nqCyfj1qsIDoCklNSynDTh4gOAs.jpg,/llnjXuqpoiMdiRmRqygsLXEqT6g.jpg,k9672
203683.0,535265.0,Assassinos Anônimos,2019.0,Ação|Thriller|Crime|Mistério,"A tensão está insuportável dentro do Assassinos Anônimos, um grupo de apoio para matadores, quando todos estão tentando descobrir qual deles está por trás de um atentado contra um importante senador – crime que colocou toda a polícia da cidade em alerta. Só que a trama é bem mais complexa do que um simples assassinato encomendado e, conforme os segredos vão sendo revelados, uma conspiração envolvendo alianças secretas e traições, tornando a sessão de hoje uma explosão de violência e caos. Agora, é matar ou morrer… Entre assassinos!",11.773,95.0,,4.8,139.0,en,/fwUmn4Bjc83Ds52sHK9wUi5x12d.jpg,/qVSKn1zByPWTzKSXnFFW8c1WoDP.jpg,
203691.0,566221.0,Democracia em Vertigem,2019.0,Documentário,"Documentário sobre o processo de impeachment da ex-presidente do Brasil, Dilma Rousseff, que foi considerado como um dos reflexos da polarização política e da ascensão da extrema-direita para o poder. O filme conta com imagens internas e exclusivas dos bastidores do Sindicato dos Metalúrgicos do ABC e do Palácio da Alvorada, enquanto ocorria a votação para a queda de Dilma.",5.699,121.0,Um alerta em uma época de crise da democracia.,7.8,287.0,pt,/j3ijMwyhRoKpJafCf5jTQYesJJ8.jpg,/z2aPe57jyW0TPYLVBXb8T0yBFGQ.jpg,
203697.0,550958.0,Lugares Santos,2019.0,Drama,"O cardiologista Harry Rosenmerch (James Caan) deixa sua família para criar porcos em Israel, onde faz amizade com um rabino (Tom Hollander). De longe, ele mantém uma relação difícil com seu filho David, que recentemente se assumiu gay, com a ex-esposa Monica (Rosanna Arquette) e com a filha Annabelle (Efrat Dor). Em certo momento, Monica descobre um câncer em estado avançado e decide relembrar a história de amor que viveu com Harry no passado.",3.598,100.0,,6.0,31.0,en,/6C9bSOkU7Z98xId5FASROjD1s61.jpg,/mgrrSTLo1FhfkmTtJlruwt54JG9.jpg,
203743.0,612295.0,Into the Forest,2019.0,Horror,Into the Forest follows three paranormal Youtubers on what should have been a simple documentary in the woods but quickly becomes a journey into heart-stopping horror.,2.093,67.0,,5.0,3.0,en,,/v9QaxwsAlmyUMkE69qPefQZJnU0.jpg,k5774
203745.0,459670.0,Turma da Mônica: Laços,2019.0,Família|Aventura|Comédia,"Floquinho, o cachorro do Cebolinha, desapareceu. O menino desenvolve então um plano infalível para resgatar o cãozinho, mas para isso vai precisar da ajuda de seus fiéis amigos Mônica, Magali e Cascão. Juntos, eles irão enfrentar grandes desafios e viver grandes aventuras para levar o cão de volta para casa. Adaptação em live action da graphic novel da Turma da Mônica lançada pelo selo MSP Graphic.",7.266,97.0,,7.6,212.0,pt,/q0mqVbh3pQDW9XBHRnyOMNwdzZL.jpg,/1ksQfIiWmyu9x4FbNBW5aNclVqu.jpg,
203751.0,580846.0,Katherine Ryan: Glitter Room,2019.0,Comedy,"Fresh from a tour, comedian Katherine Ryan shares shrewd observations about school bullies, revenge bodies and raising a very fancy child.",3.953,65.0,,6.8,24.0,en,/d1VUAW26Xkka5RQpWmsOe5ZEGWt.jpg,/sbjPjknkrpxAQb4aFJJqRVG6yA7.jpg,k9716
203805.0,504592.0,Divino Amor,2019.0,Drama|Ficção científica,"Brasil, 2027. Uma mulher profundamente religiosa usa sua posição em um cartório para evitar o divórcio entre casais em dificuldades. Enquanto espera por um sinal de reconhecimento pelos seus esforços, ela se vê confrontada com uma crise no seu próprio casamento que a aproxima ainda mais de Deus.",6.569,100.0,#QuemAmaDivide,6.1,55.0,pt,/8bTFAhCCyKS5nRdLAXHA6oXPex6.jpg,/drfb2OVV6mKnJqY4EUl6OHREk2l.jpg,
203821.0,516977.0,Virginia Minnesota,2019.0,Drama|Comedy,"A story of a fragmented friendship finding new ground, director Daniel Stine’s feature film debut Virginia Minnesota begins with a young woman at a crossroads. Her direction in life a question mark, Lyle (Rachel Hendrix) heads off on an impromptu road trip, running into a former friend, Addison (Aurora Perrinau). Addison is also adrift, and the two find themselves on the road together. Separated by a childhood trauma, Addison and Lyle must face their shared history in order to move on as adults. Through the trip they learn not only the influence of their lost friendship on their current lives, but how their new bond will shape their future as young adults.",2.448,97.0,,5.3,3.0,en,/gGgH4K5TejwDtnfCnsP2UONcg2l.jpg,/a4CN10iaSqQWYKJInq2t0vjmonN.jpg,
203835.0,602214.0,You Can’t Watch This,2019.0,Documentary,"Peer through the lens of a high profile political dissident, banished from the online world. After introducing the viewer to each of the five characters, the film recounts how each individual then came to lose their access to social media and the affect it had on them at the time, and since the event. With their stories told, they present the broader issues raised by their media de-platforming and what they foresee in their future in media and the whole of Western Culture at-large.",1.076,51.0,,7.4,7.0,en,,/3i8lu4dLVSgQ9Xo9JiQCxicKVrs.jpg,
203855.0,550506.0,Justiça Sem Fronteiras,2019.0,Drama,"Judy Wood é uma dedicada advogada que se divide entre o trabalho e o filho que cria sozinha. De repente, uma mulher obrigada a fugir de seu país após ser perseguida pelo Talibã muda sua vida. Judy passa a lutar pelas leis de refúgio feminino nos EUA, salvando a vida de milhares. Baseado em uma história real.",10.331,106.0,,7.1,41.0,en,/5aeU1u0HR3mNQf3yJYnpouG5NsI.jpg,/6mOic4rFKag7XrHUmpfXVkUlhZo.jpg,
203904.0,534259.0,A Música da Minha Vida,2019.0,Drama|Comédia,"Em 1987, durante o governo de Margareth Thatcher, um jovem aprende a viver sua vida, entender a sua família, e encontra o seu caminho após ouvir uma fita com músicas de Bruce Springsteen.",11.174,114.0,Para aqueles que já desejaram sonhar. Vocês não estão sozinhos,7.0,421.0,en,/v7o0sYZGtaAHWi81B6LvKUKGAXa.jpg,/uV0Mt7mkmt6uujYMqNdL6ceXPjz.jpg,k9672
203928.0,549551.0,Echo In The Canyon: Uma Celebração à Música,2019.0,Documentário|Música,"O documentário explora a história de Laurel Canyon e sua rica cultura musical, analisando suas raízes nos anos 60 e alguns dos principais nomes que vieram da região para crescer no mundo da música.",6.189,82.0,,6.9,24.0,en,/gWsseHW73OOKvmZFoAff91xgj09.jpg,/58ppMUxWFKHnGXfZUoWhhi8CVMR.jpg,
203930.0,589261.0,Deadly Assistant,2019.0,Drama|TV Movie,"Amanda Birch, after years of estrangement, returns to reconnect with her sister Lauren. Things only get worse when her sister mysteriously dies days later. The entire family is suspected in a murder investigation as it becomes clear that Lauren’s death was no accident.",3.451,84.0,,5.1,7.0,en,/eOKKAsr4HLEnhlLctoUOvOhQjC1.jpg,/4xa1q03ZWiIhGncx72BMEE6FODU.jpg,
203934.0,539892.0,Aberrações,2019.0,Ficção científica|Thriller|Drama|Mistério,"Chloe é uma menina de sete anos desesperada para escapar da proteção de seu paranoico pai e experimentar o mundo fora dos muros de sua casa caindo aos pedaços. Quando um dia seu pai pega no sono e ela aproveita para fugir, ela descobre um mundo lá fora cheio de mistérios e perigos muito maiores do que ela poderia imaginar.",53.65,105.0,,6.9,760.0,en,/7HNPNdNNvTQmDATWDmcRJVrv0B2.jpg,/bdeW3VjDtXuVXQEQMO4n9fbx8Jf.jpg,
203940.0,291867.0,Zeroville,2019.0,Comédia|Drama,"Um amante do cinema com grandes sonhos chega a Los Angeles e chama a atenção do Detetive de homicídios Slim. Com o tempo, conhece o Grande Viking que o apresenta ao intenso mundo do cinema e o lado negro do mundo do entretenimento.",7.122,97.0,,5.1,57.0,en,/gu99CJoQzpZvi6NanW5U1EIeOP4.jpg,/8FaAw8sRUPd0yaSgorqCUaqNqJs.jpg,k818
203954.0,572979.0,Leve-me para Algum Lugar Legal,2019.0,Drama,"No começo da vida adulta, Alma deixa a casa da mãe na Holanda e viaja para sua terra natal, a Bósnia, para encontrar o pai que nunca conheceu. Mas desde o início, nada corre como planejado. Seu primo Emir não é receptivo e zomba da vida fácil da jovem no Ocidente. Ao mesmo tempo, uma forte atração sexual leva a jovem a se relacionar com o melhor amigo de Emir, o problemático Denis. À medida que os obstáculos aumentam, Alma segue determinada a achar o pai. Ela só precisará conhecer a si mesma antes.",2.073,91.0,,6.0,16.0,en,/7OdsvVwS3ejlaCDZjZH1UFibh98.jpg,/gOnMrDfk1dFic2V2ilJHByoE2Oq.jpg,
203962.0,563489.0,Go Back to China,2019.0,Drama,"When party girl Sasha Li blows through most of her trust fund, she is cut off by her father and forced to go back to China and work for the family toy business.",3.343,95.0,,6.2,12.0,en,/eEaMKQf0eqs8Hx0LvwvZTrbdFN8.jpg,/7vOZVGqxc7gNKq5cuMFsiHgjODA.jpg,
