movieId,tmdbId,title,release_date,genres,overview,popularity,runtime,tagline,vote_average,vote_count,original_language,backdrop_path,poster_path,keywords
104638.0,50674.0,O Futuro Perdido,2010.0,Aventura|Ficção científica,"A civilização humana está quase extinta, mas um grupo de sobrevivente pós-apocaliptico luta para sobreviver num mundo onde a selva, as florestas e pântanos voltaram a ser como nas eras primitivas. Eles enfrentam mutantes, feras e doenças misteriosas em uma tentativa de restabelecer a raça humana.",7.287,90.0,,5.0,106.0,en,/fA11VdaJsy6jneGuZZfMDApyTmt.jpg,/rwP3xGH78aaNbGVFisFxx4LLuay.jpg,
105133.0,71700.0,Labirinto do Tempo,2010.0,Drama|Ação|Crime|Ficção científica,"Repeaters acompanha três pacientes de uma clínica de reabilitação que recebem um dia livre para visitar suas famílias e tentar reestabelecer laços. Kyle (Dustin Milligan) tenta se redimir com sua irmã; Sonia (Amanda Crew)tenta evitar seu pai doente, que acaba por falecer; e Weeks (Richard de Klerk) parte para visitar seu violento pai na prisão. As consequências desse dia não são nada agradáveis e mudam suas vidas para sempre.",6.392,89.0,,5.7,131.0,en,/zfDZNpwvHjIQhDf8mMyzMR15A97.jpg,/9nQuL87o5AcUayeZM3cOXw1VbIv.jpg,
105144.0,38746.0,Bare Knuckles,2010.0,Action|Adventure|Drama|Thriller,"Women will go to extreme lengths for those they love and single mother Samantha Rogers is no exception. Along with her young daughter, Milla, Sam struggles to make ends meet, taking her licks as a stunt double by day and cocktail waitressing at a rowdy bar at night. When Sam uses her skills to end a bar fight between two drunk women, down and out fight promoter Sonny Cool sees an opportunity to get back into the game. He tells Sam all about the ""show,"" a high class, underground illegal all female bare knuckle fight tournament, where brutality and elegance mix with high stakes and deception. Is the price too much for her...? Bare Knuckles..... a knockout punch of strength and determination, inspired by a true story.",1.57,0.0,She fought for everything.,3.5,4.0,en,,/vvGUEbRTiUYfOiOdEooTOmi8TRt.jpg,
105542.0,134472.0,Another Harvest Moon,2010.0,Drama,"Another Harvest Moon is a tender drama about four elderly Americans coping with life in a nursing home. FRANK, ELLA, ALICE and JUNE gather each morning for a game of cards. They have become a family to one another, offering unyielding support, constant bickering and strong opinions about life, death and everything in between.",1.176,89.0,When Dignity Means Everything.,5.0,2.0,en,,/a3iIEVY4LTxRFhSi6FiV2ZU4aPc.jpg,
105560.0,49004.0,A Escolha,2010.0,Drama|Thriller,"Paul (Josh) e Adrienne (Jamie-Lee) são um jovem casal que viaja do Texas para a california para a festa de casamento de um colega de faculdade. Conforme eles passam pelo deserto do Mojave, no meio da noite, o cansaço bate e Paul decide que é hora de fazer uma pausa. O casal para em um hotelzinho de beira de estrada, praticamente Ã s moscas, e aluga um quarto para passarem a noite. Já no quarto, Paul e Adrienne discutem e e o rapaz decid eir sozinho comer alguma coisa no restaurante do hotel. Lá, ele é abordado por um homem misterioso, que parece saber muito sobre a vida de Paul. É então qie o estarnho revela conhecer depois sobre Paul, inclusive revelando a ele um segredo do passado que poderia até acabar com o relacionamento que existe com Adrienne. E isso é apenas o começo de uma noite que revela grandes, e terríveis surpresas para o jovem casal.",4.603,102.0,,5.2,33.0,en,/r7ESeXAMywgQudo8TyfduJcju8T.jpg,/4melfxdqm3ui0OzTiaF8aOFChAw.jpg,
105715.0,38093.0,Jogada Certa,2010.0,Comédia|Drama|Romance,"Leslie Wright é uma fisioterapeuta que não consegue namorar, já que os homens sempre a vêem como uma boa amiga. Fã de basquete, um dia ela tem como cliente um grande astro do esporte, Scott McKnight. Ela passa a tratá-lo em tempo integral, iniciando um procedimento visando seu retorno às quadras, algo que muitos duvidam que vá acontecer. No meio deste processo, os dois percebem que há algo mais entre eles além do relacionamento entre médico e paciente.",11.803,100.0,,6.3,303.0,en,/z3XieQjXfT63WiKvlJACbOxxFYn.jpg,/dJuWCqpyJOERLdjMq7UHrAbYQsq.jpg,
105815.0,74008.0,Undocumented,2010.0,Horror|Thriller,"A documentary crew accompany a group of illegal immigrants crossing the Border, but their plans run afoul when they are captured by a gang of sadistic radicals in New Mexico.",4.28,96.0,I Want YOU To Go Home,6.3,24.0,en,/3CgF7M11BZvVl9LDlDnQ2GPo8qB.jpg,/cWdVZIBS7KobYvPuq2isygG6SMg.jpg,
105972.0,65056.0,Uma Pequena Ajuda,2010.0,Comédia|Drama|Romance,"Neste filme seguimos Laura (Fischer), que perdeu o marido recentemente e precisa de cuidar do seu filho sozinha. Para complicar mais as coisas, Laura acaba por se aproximar de um homem, com quem teve um relacionamento no passado – o marido da sua irmã.",5.489,109.0,,5.3,55.0,en,/20p0bMWormdEYqMeC0cyJgtS5Br.jpg,/40DnJufThofDAPpMcLKIIkTeB2U.jpg,
106136.0,44745.0,Nocaute,2010.0,Aventura|Ação|Thriller,"Um Lutador de rua respeitado, é forçado a fugir da cidade depois que seu irmão foi assassinado e que o dinheiro que deveria ser pago de volta a um gangster local é roubado. Ao encontrar-se na casa de seu pai, Brandon logo se envolve na gaiola subterrânea de combate circuito local. Com a ajuda de Drake Colby, ex-campeão de MMA, Brandon planeja um esquema, se eles sobreviverem.",5.498,94.0,,5.0,16.0,en,,/6OfVPybktlixESHrHQ5ZdN68prO.jpg,
106214.0,42950.0,E Se... Você Tivesse uma Segunda Chance?,2010.0,Drama|Comédia|Romance|Família|Fantasia,"Há 15 anos Ben Walker (Kevin Sorbo) abandonou sua namorada de anos e a vocação religiosa para dedicar-se a uma grande oportunidade na carreira. Agora rico e bem-sucedido, ele recebe a visita de um anjo, que mostra como sua vida teria sido muito melhor se ele tivesse feito outra escolha naquele momento.",6.694,111.0,,7.1,54.0,en,/5inZvu1ATfH7ZXfr1fT9Th6fwfH.jpg,/pqwZH7DzDdQuJhPuBrasC3e6GR.jpg,
106254.0,80188.0,Garoto Prodígio,2010.0,Ação|Crime|Drama|Thriller,"O garoto Sean testemunhou o assassinato brutal de sua mãe e cresceu obcecado por vingança. Dessa forma, torna-se um rapaz quieto e estudioso durante os dias, e um herói à noite. Mas o que é um verdadeiro herói? Quem decide o que é certo e o que é errado? Ao passo que os limites se atenuam, a vida dupla de Sean traz à tona muitas dúvidas, e suas duas vidas ficam prestes a se colidir.",6.605,93.0,,6.5,105.0,en,/zAGq8wnX53tflxiZD53lp9i2L2N.jpg,/AjTaVFalrJpsa9yB4DwFOM94C9b.jpg,k15009
106475.0,92119.0,Caught Inside,2010.0,Thriller,"A group of surfers arrives in a remote spot off the Australian coast, and the isolation and pressure push one person over the edge, leading to a violent outburst and a fight for survival.",1.875,93.0,Anyone is a weapon if you twist them right,5.4,11.0,en,/1VMjlqq9Q5rg7KDk95a1lhQKStg.jpg,/12BmWBW0bI73TM73fdRo2l0VWBJ.jpg,
106501.0,58258.0,The Chameleon,2010.0,Drama|Mystery|Thriller,"The amazing true story of Frédéric Bourdin, who after having plundered all the centers for runaway minors and deliquents in Europe, even thought he has come of age, now passes himself off as Nicholas Barclay, a 13-year-old American who had vanished three years ago. To his astonishment, Nicholas's family welcomes him like their son, leaving Interpol and the FBI aghast. It is the beginning of a race against time for the investigators, family and Bourdin. But who is manipulating whom? And who is Frederic Bourdin in reality?",3.466,106.0,How do you know what you see is really the truth?,5.3,37.0,en,,/lmT69QsDZzEjg9BWoiLXTVlRAqo.jpg,
106592.0,154663.0,The Happy Poet,2010.0,Comedy,"When Bill, the title character, secures a very small loan to start his dream business--a health food stand--his struggles as an idealistic micro-business owner begin.",1.655,85.0,"An all organic, mostly vegetarian comedy.",6.5,4.0,en,,/vuqOkQTR2an5FFBy1ugEtmLuUnP.jpg,
106686.0,94639.0,José e Pilar,2010.0,Documentário,"A relação e o cotidiano do casal José Saramago, escritor português, e Pilar Del Rio, jornalista 28 anos mais nova que o marido.",1.875,117.0,,7.5,22.0,pt,/1w2lTdUXgWolvdB65s9bcWm3suZ.jpg,/ifK7pLn4d683YBc6mwkgs2DOvxy.jpg,
107217.0,49852.0,O Quebra Nozes: A História Que Ninguém Contou,2010.0,Música|Fantasia|Ação|Família,"Viena, 1920. Mary (Elle Fanning) é uma solitária menina de nove anos. No Natal ela ganha de presente do Tio Albert (Nathan Lane) um quebra-nozes de madeira. Na mesma noite o boneco ganha vida e a leva para uma jornada em uma nova dimensão, onde seres inanimados se transformam em humanos e tudo tem proporções gigantescas.",8.118,110.0,,5.2,146.0,en,/xyfjxB68aORMLQDcXFUlXCouYt2.jpg,/8qpovUSOZiqFOpsHoByfKojI8iC.jpg,
107548.0,62989.0,Ice Quake,2010.0,Thriller|Science Fiction|Action,"As the permafrost melts in Alaska, underground rivers of volatile liquid methane form which sets off a series of devastating earthquakes. Forced apart by this violent occurrence, one family must find each other during the holidays and work to stop the deadly rivers that could cause a worldwide catastrophy.",6.912,91.0,,4.9,59.0,en,/7qDzSuR9SCSvVzGIec9joFLPXyS.jpg,/lT5k8PPJ0VbyRmX3WViBQXBbLCP.jpg,
107630.0,27584.0,Um Colégio Muito Maluco,2010.0,Comédia,"Henry é o melhor aluno de sua classe e justo quando experimenta maconha pela primeira vez, o diretor da escola decide fazer um teste de drogas que poderá acabar com sua formatura tão sonhada. Agora ele precisa elaborar um plano para se salvar!",50.424,99.0,,5.8,102.0,en,/bGKHMU4ufiBt2r19g1fsi0u12dT.jpg,/3pZzS9R1r6qHvstMxmGq54JkFDR.jpg,
107653.0,58515.0,The Lost Thing,2010.0,Animation|Drama,"A boy finds a strange creature on a beach, and decides to find a home for it in a world where everyone believes there are far more important things to pay attention to.",4.438,15.0,,6.8,56.0,en,/nc7OwIDJcWCb5snIbIuhiV9YN6N.jpg,/w272Z6vRaC1H6WZU5pIffaU04MR.jpg,
109015.0,75090.0,Beware the Gonzo,2010.0,Comedy,"Eddie ""Gonzo"" Gilman is starting a revolution. When the wild-eyed rebel journalist is ousted from his prep school's newspaper by its über-popular editor, Eddie fronts an underground movement to give a voice to all the misfits, outcasts, and nerds. Soon the power of the press is in Eddie's hands... but will he use it wisely?",3.645,94.0,Power to the picked on!,6.2,20.0,en,/aZeOKKcFl2g48ioDk4wZrY6rwpZ.jpg,/8HBvgkYWRtEtaKiqWeRaFEBFYqj.jpg,
109151.0,56441.0,The Elephant in the Living Room,2010.0,Documentary,"A film about the controversial world of exotic animal ownership within the suburbs of the United States. ""The Elephant in the Living Room"" offers an unprecedented glimpse into the fascinating subculture of trading and raising the most deadly and exotic animals in the world as common household pets.",2.371,96.0,Coming Soon - To a backyard near you.,6.7,13.0,en,/lgi9SXqkmHPycLq3ql7majZnOU9.jpg,/jtip2iGRS3VnFBAlT4vbZ06tjHS.jpg,
109273.0,43700.0,Big Money Rustlas,2010.0,Action|Comedy|Western,"The Insane Clown Posse heads back to the Wild West in this prequel to BIG MONEY HUSTLAS. Nothing happens in the dusty town of Mud Bug without the approval of gambling magnate Big Baby Chips (Violent J), and the locals turn and run when his henchmen come out to play. But when swaggering sheriff Sugar Wolf (Shaggy 2 Dope) teaches the locals to fight back, Big Baby Chips and his gang head for the hills in a hail of gunfire.",1.525,95.0,"The good, the bad and the outrageous!",4.1,8.0,en,/ibe3K5FSroekP138mGztxW0zE5l.jpg,/nmkRLtJ31QK0YBOYXyOhn73VNpA.jpg,
109653.0,52817.0,Bitter Feast,2010.0,Horror|Thriller,A celebrity chef exacts revenge on a food blogger who torpedoes his career.,3.927,105.0,,5.4,34.0,en,/7FQM8ZBcQD50ALbKArE6GGG7agh.jpg,/qzeZn0t0AtzTNdOHJNE9UbWm2vQ.jpg,k1930|k9748|k9826|k13006
109665.0,79073.0,Mensagens deletadas,2010.0,Terror|Thriller|Mistério,"Uma voz trêmula pede ao roteirista, Joel Brandt, que pegue o telefone em uma mensagem de sua secretária eletrônica. Pensando em uma brincadeira, Joel apaga a mensagem. O chamador é encontrado morto. Outro interlocutor deixa uma mensagem para Joel; há outro assassinato ... depois outro ... depois outro. O assassino tem a atenção de Joel e Joel tem a atenção da polícia. Agora o principal suspeito de uma série de assassinatos, Joel descobre que esse assassino psicótico o alvejou por uma razão encontrada em seu corpo de trabalho. Joel será capaz de reescrever seu final ou ser forçado a pagar o preço final?",3.121,92.0,,5.4,27.0,en,/uTX4CPryKPVzrI42unG1VrI002o.jpg,/5khvKgALf9czLPCEZU6hZWr68UT.jpg,
109747.0,119261.0,Black Limousine,2010.0,Drama|Thriller,A ghost story set in the city of dreams (IMDb.com).,3.854,102.0,Insanity Is Close Than It Appears.,7.1,9.0,en,,/oBwRHFuUSejCQmezwseNzHOB8g0.jpg,
109771.0,80837.0,Dead Genesis,2010.0,Drama|Horror|Thriller,"Seven months have passed since the dead took over. Many cities and states have been abandoned and left to die. Several self sufficient hunting groups have been established to take on the threat in a war aptly referred to as the 'War on Dead'. Jillian Hurst, a former news writer and amateur documentarian, has set out to make a pro-war propaganda film to support the W.O.D. She joins up with a pack of renegade hunters known infamously to North America as 'the deadheads'. The moral dynamics and hardships of fighting in a war against the undead are told from several different perspectives.",2.87,98.0,The War on Dead Begins,4.2,8.0,en,,/tsbcRTmfwGOMk5RS5sgdCVwDV2f.jpg,
109810.0,56743.0,Elena Undone,2010.0,Drama|Romance,"Com uma boa dose de drama, sexo, paixão e romance, “Elena Undone” combina com o encanto de se apaixonar pela primeira vez e a realidade do compromisso de um relacionamento. Elena, mãe e esposa de um pastor anti-gay que nunca experimentou o amor verdadeiro conhece Peyton, uma escritora lésbica. Elena se sente presa em um casamento sem amor, tentando aceitar a natureza e a magnitude de seus desejos. Apesar da mútua atração, Peyton tem receios em se envolver com Elena.",9.973,111.0,,7.1,124.0,en,/bzm9wSLsop9TlYd4mZ7FpbGh1wj.jpg,/m4SDHYqLbYHnq5Lb6XPZPHgBbID.jpg,k18035
109943.0,62156.0,De Pernas pro Ar,2010.0,Comédia,"Alice é uma mulher workaholic que tenta se equilibrar entre a rotina do trabalho e a família. Depois de perder o emprego e o marido, Alice vai descobrir com a ajuda da vizinha Marcela que é possível ser uma profissional de sucesso sem deixar os prazeres da vida de lado. O filme discute com leveza e humor os deliciosos conflitos das mulheres modernas.",5.7,96.0,"Com a vida pelo avesso, ela só tinha uma saída: viver com prazer.",6.5,195.0,pt,/ruseRsS1XTptLGX4f8YsFzNuvuZ.jpg,/8SNtshMPDMZhTcbiGtakOEJKljy.jpg,
110607.0,35074.0,Dinoshark,2010.0,Horror|Science Fiction,"The film opens with a baby dinoshark swimming away from a broken chunk of Arctic glacier that calved due to global warming. Three years later, the dinoshark is a ferocious predatory adult and kills tourists and locals offshore from Puerto Vallarta, Mexico. The protagonist, Trace, is first to notice the Dinoshark and witnesses his friend get eaten, but has trouble convincing people that a creature of such antiquity is still alive and eating people.",5.865,92.0,Fear what's below the surface,4.4,41.0,en,/c4qcuHrEGpIsvkq0B5fsWO2hylw.jpg,/fqX1vTVWULoJmfb7RZ9i2t0mJXo.jpg,
112506.0,139406.0,Radio Free Albemuth,2010.0,Drama|Thriller|Ficção científica,"Nick Brady começa a ter estranhas visões de uma entidade que ele nomeia de VALIS (Vast Alien Living Intelligence System), que faz com que ele leve sua família para Los Angeles onde eu Torna-se um executivo de sucesso empresa de música. Com a ajuda do melhor amigo, escritor de ficção científica Philip K. Dick e uma misteriosa mulher chamada Silvia, Nick se vê arrastado para uma conspiração político-místico perigosa de proporções cósmicas. A história se passa em uma realidade alternativa na América em 1985, sob o controle do presidente autoritário Fremont.",3.737,110.0,,4.9,36.0,en,/r9J18XjIGxs5MlDUzGFIgEve9p2.jpg,/6v8oqxTXu6BZAfoZKyQ2Sqjq2JJ.jpg,
112565.0,48375.0,Brother's Justice,2010.0,Comedy|Documentary,"Motivated by Box Office statistics, Dax Shepard has made a decision to leave comedy to pursue his dream of becoming an international Martial Arts action star.",1.685,80.0,,5.5,9.0,en,,/pjGaUzA4qlYSFR92Jlx1BBpMqqw.jpg,k779
113843.0,281468.0,Killing Us Softly 4: Advertising's Image Of Women,2010.0,Documentary,"The documentary focuses on images of women in advertising, in particular on gender stereotypes, the effects of advertising on women's self-image and the objectification of women's bodies.",0.6,45.0,,6.5,6.0,en,,/ix8R2EnT2dk8qEGvsoic3n5hr7D.jpg,
113860.0,254775.0,The Codes of Gender,2010.0,Documentary,"Arguing that advertising not only sells things, but also ideas about the world, media scholar Sut Jhally offers a blistering analysis of commercial culture's inability to let go of reactionary gender representations. Jhally's starting point is the breakthrough work of the late sociologist Erving Goffman, whose 1959 book The Presentation of the Self in Everyday Life prefigured the growing field of performance studies. Jhally applies Goffman's analysis of the body in print advertising to hundreds of print ads today, uncovering an astonishing pattern of regressive and destructive gender codes. By looking beyond advertising as a medium that simply sells products, and beyond analyses of gender that tend to focus on either biology or objectification, The Codes of Gender offers important insights into the social construction of masculinity and femininity, the relationship between gender and power, and the everyday performance of cultural norms.",3.169,73.0,Identity and performance in popular culture,6.5,7.0,en,,,
113991.0,57277.0,Care Bears To the Rescue,2010.0,Adventure|Animation|Comedy|Family,"You’re invited to the biggest celebration of the year – the Care-a-Lot Awards – where all the Care Bears come together to award their heroes who have spread caring and sharing throughout the year! Whether it’s Cheer helping a baby Gobblebug build a new home, Funshine rescuing the Nimbits, or Bedtime and Grumpy stopping a machine from running amok all over town, the Care Bears are always ready for helpful hero fun in this awesome adventure!",2.542,65.0,,4.0,3.0,en,,/sTCbk3XVtT8Q8e0QFjEmiUPR2SN.jpg,
114891.0,43922.0,Legendary,2010.0,Drama,"A book-smart teenager joins his school's wrestling team as a way to reunite his surviving family members, who split apart after the death of his father, a college wrestling legend, 10 years ago.",7.555,107.0,Some Legends are born out of Struggle.,6.9,90.0,en,/tn9UcOScgAp87PultwVErsQjaRc.jpg,/tu3uIbULL54pRXuvobGwDjy780n.jpg,
115137.0,37925.0,Celine: Through the Eyes of the World,2010.0,Documentary|Music,"A documentary–concert film chronicling the life of Canadian singer, Celine Dion during her 2008–2009 Taking Chances World Tour.",4.343,120.0,,6.9,8.0,en,/j8OUo2gF49U0MnmgFvXU1zzIDcT.jpg,/9F9XhXGbJD8s3N2uYyv9Qmmv8Cr.jpg,
115791.0,160210.0,Bones,2010.0,Drama,"The heart breaking coming of age story of four teens growing up in 1989 blue collar New York, and the bond that would tie them together for life.",2.916,90.0,,8.1,7.0,en,,/tpgJTYm50IRQSTRQPU7hfOti4FI.jpg,
115933.0,275287.0,LEGO Hero Factory: Rise of the Rookies,2010.0,Action|Animation|Family,A new Rookie team has been assigned to complete their training with Stormer and his crew - but someone from Stormer's past is trying to take down the Hero Factory and Stormer himself.,5.0,88.0,,8.0,5.0,en,,/d5MR7J85gcZz7QbH731kufV22WN.jpg,
116018.0,68197.0,Chasing Madoff,2010.0,Documentary,A look at how one investigator spent ten years trying to expose Bernie Madoff's massive Ponzi scheme that scammed an estimated $18 billion from investors.,3.069,91.0,,5.9,11.0,en,,/ueJlJoSpxBGCabhKh9YLwxzPPIV.jpg,
116056.0,39213.0,Coach,2010.0,Comedy|Romance,A slacker trust-fund type finds the motivation to pick up a job as the coach of middle school soccer team,2.452,87.0,Love is the Goal,5.3,16.0,en,,/reG2Jdrez8XW9TfbmvMVL8BT651.jpg,
116205.0,57749.0,A Clínica,2010.0,Mistério|Terror|Thriller|Crime,"A jovem grávida Beth viaja pelo país ao lado do seu noivo, Cameron, quando acorda em uma noite após passar por uma situação terrivelmente inusitada: seu filho foi sequestrado e ela está presa em uma clínica isolada, juntamente com um grupo de outras seis mães. E agora? Até onde ela está disposta a ir para sair deste lugar e salvar o seu bebê?",6.169,94.0,Você Sabe Onde Seu Filho Está Agora?,5.3,82.0,en,/r5ec8FpxaWv31v6tQ3q6ZnxzTYT.jpg,/lD7DQyw9AU3WKWcBLMQcb7SEWz6.jpg,
116215.0,52010.0,"Ultramarines: A Warhammer 40,000 Movie",2010.0,Animation|Science Fiction,"A squad of Ultramarines answer a distress call from an Imperial Shrine World. A full Company of Imperial Fists was stationed there, but there is no answer from them. The squad investigates to find out what has happened there.",8.272,76.0,In the grim darkness of the far future there is only war.,5.7,89.0,en,/oOBtTgunRkq4xKMoe7DrffHpKIf.jpg,/eFfkF9uVqOhAxIKEyNCHfRRdGgj.jpg,
116463.0,33570.0,Castelos de Gelo,2010.0,Drama,"A jovem, bela e talentosa Alexis Winston surge do nada para tornar-se uma estrela da patinação artística. No entanto, sua jornada ao estrelato não é fácil. Ela tem que se superar, reinventar e o mais doloroso, deixar o namorado em sua cidade natal. Quando uma queda tráfica e deixa cega, ela precisa de alguém que acredite em seu potencial, a ame e que possa convencê-la da força que tem para patinar e sonhar novamente.",5.317,95.0,,6.6,60.0,en,/1QpYBeKXAmxRNtCZYkqu1lp6sOj.jpg,/xTKPbJ1mFw25H91nZWdM7kFHMUz.jpg,
116513.0,76424.0,Master Harold... and the Boys,2010.0,Drama|TV Movie,"This movie is of Hally, an adolescent white South African. He is stuck between his intolerant father's outlook of him and those of his caretaker, Sam. Sam is a black waiter and Hally's friend and teacher. Hally is required to laugh at his father's racist jokes, by contrast, Sam exposes Hally to uplifting experiences. One day Hally was terribly humiliated by his father and Sam shows Hally how to be proud of something he can achieve.",1.772,87.0,,5.3,9.0,en,/hq6V3uNFFObXA6FLL5DZGtdMTxF.jpg,/eAT4fwyS1KA5LqCTbBvz6U8emTl.jpg,
116700.0,56929.0,Elle - Um Conto de Fadas Moderno,2010.0,Fantasia|Drama|Ficção científica|Família,"Elle (Ashlee Hewitt) quer ser uma cantora e compositora, mas seus sonhos são cortados pela morte repentina de seus pais. Ela vai morar com seu tio adotivo, que dirige uma pequena gravadora independente, do qual é bastante conhecida, a ""Sensation"", mas só faz aumentar a dor de Elle. O ambiente de música pop, muito diferente do que ela está acostumada no seu país de origem, contribui para amenizar os sentimentos de perda e frustração de Elle, e sua iludida culpa, que é causada pelo fato de que ela havia viajado, no momento da morte de seus pais. Mas quando ela conhece Ty Parker (Sterling Knight), um famoso cantor pop com uma real paixão pela música, a sua reprimida ambição é renovada através de um interesse em cantar e compor.",7.623,90.0,,5.2,66.0,en,/q8nG5vkEdPBJtAC9ORp1Jmo29YG.jpg,/goRFinpn7xptfhhitt2CjxRtriw.jpg,
116819.0,58760.0,Jackboots on Whitehall,2010.0,War|Animation|Comedy,A satirical alternative history of World War II where the Nazis seize London and England must band together to prevent a full on invasion.,3.851,87.0,The smallest epic film you'll ever see!,5.2,17.0,en,/wRYniGwsMpDPH1v02wwvdDQGhX4.jpg,/2OEDmBDoLeR0vwkUKZ5NDrXBeRZ.jpg,
117144.0,50198.0,See You in September,2010.0,Comedy|Romance,"Feeling abandoned by her therapist who's gone on an extended vacation, beautiful Lindsay gets help with her fear of commitment from an ad hoc support group formed by other New Yorkers also left high and dry by their shrinks. But when her pals dare her to date fellow group member A.J., Lindsay begins to wonder if she's finally found her match.",3.946,91.0,Fear of Commitment meet Fear of Abandonment...,4.5,17.0,en,/fPR1rbO8gLhObkO59MDNyLz1Xde.jpg,/nlL2qgqMkshVyN0gLjBKGjAPkqL.jpg,
117420.0,48186.0,Castelo do Medo,2010.0,Família|Fantasia|Terror|Cinema TV,"Os membros da família Sands estão passando por dificuldades financeiras quando descobrem uma herança muito peculiar: um castelo na Romênia. Sem outras possibilidades, David (Matt Winston) e seus filhos, Hunter (Chase Ellison) e Jordan (Victoria Justice), resolvem se mudar para o misterioso castelo, na cidade de Wolfsberge. Coisas estranhas começam a acontecer e a vida desta família vai se transformar radicalmente.",10.738,97.0,,6.4,234.0,en,/1tmcsKQo0QzAzpvm1Akmkmxstjq.jpg,/tEVzfKXGsis52HlcTy82ugu9LRa.jpg,
117525.0,100292.0,Ain't in It for My Health: A Film About Levon Helm,2010.0,Documentary|Music,"Starting with the image of a tour bus warming its engine in the stillness of an empty lot, this haunting, personal portrait of music legend Levon Helm evokes the mood of a lifetime spent on the road. Jacob Hatley's extraordinarily intimate documentary finds Helm, a founding member of The Band, at home in Woodstock in the midst of creating his first studio album in 25 years. The ultimate survivor, he's overcome drugs, bankruptcy, the bitter breakup of The Band and a bout of throat cancer -but then, as the rueful title indicates, he wasn't in it for his health",0.6,83.0,,6.4,10.0,en,,/vFb9ImYf1zo38BrXrRbrBOJ5SB0.jpg,
117694.0,63273.0,Endure,2010.0,Mystery|Thriller,"After a shocking photo of a young woman is found inside the twisted metal of a fatal car crash, veteran detective Emory Lloyd must risk everything to identify and find the woman before it's too late.",2.263,91.0,,7.8,4.0,en,,/yKT1i0hqVgdW4ELmNyFpNJFE3GV.jpg,
