movieId,tmdbId,title,release_date,genres,overview,popularity,runtime,tagline,vote_average,vote_count,original_language,backdrop_path,poster_path,keywords
142679.0,66211.0,Fire in Babylon,2010.0,Documentary,"Feature documentary about the great West Indies cricket team of the 1970s and '80s. Fire In Babylon is the breathtaking story of how the West Indies triumphed over its colonial masters through the achievements of one of the most gifted teams in sporting history. In a turbulent era of apartheid in South Africa, race riots in England and civil unrest in the Caribbean, the West Indian cricketers, led by the enigmatic Viv Richards, struck a defiant blow at the forces of white prejudice worldwide. Their undisputed skill, combined with a fearless spirit, allowed them to dominate the genteel game at the highest level, replaying it on their own terms. This is their story, told in their own words.",3.687,83.0,They brought the world to its knees and a nation to its feet,5.8,8.0,en,/96ZYtwQClNoyT0I5YonDHgS0UxW.jpg,/qzXbhFcvGzpLtslW3IDXx9nMVb6.jpg,
142683.0,51512.0,Dear Mr. Gacy,2010.0,Crime|Drama|Thriller,"A chronicle of the interaction between college student Jason Moss and the object of his obsession, serial killer John Wayne Gacy.",4.972,103.0,The shocking true story of one of America’s most notorious serial killers.,6.0,59.0,en,/s8E9DdKS8qTDmMq9imWxulPbUbh.jpg,/zftYdcc60ixcsQu6a5ndWCUJIQ4.jpg,
142845.0,58493.0,A Small Act,2010.0,Documentary,"A young Kenyan's life changes drastically when his education is sponsored by a Swedish stranger. Years later, he founds his own scholarship program to replicate the kindness he once received.",0.6,88.0,A single gesture. Limitless possibilities.,7.7,3.0,en,,,
143661.0,85566.0,Rage,2010.0,Drama|Horror|Science Fiction,"A thirty something man who lives in a suburb just outside of Portland says goodbye to his beautiful and loving wife and heads into town. There he unintentionally provokes the wrath of a mysterious motorcyclist. The confrontation between the two, sets in motion a day long battle. Beginning in the form of harmless taunts then quickly escalating into something more serious and then into something unimaginable.",1.7,85.0,,5.0,5.0,en,,,
143868.0,39285.0,Beleza no Mundo dos Negócios,2010.0,Romance|Comédia,"Hilary Duff vive Lane, uma repórter de moda que, durante uma cobertura no mundo dos negócios, busca encontrar um amor, enquanto escreve sobre relacionamentos amorosos.",9.0,87.0,Um objeto mudará sua vida para sempre,5.9,366.0,en,/aMbwTo6JSmQdHR6NxkwM8Qfq22.jpg,/zN9FYOXf5tUYjgget7yOzu8TlZU.jpg,k818
143880.0,46713.0,Caçada Implacável,2010.0,Ação|Aventura|Thriller,"Após o assassinato do policial Lee Davis da patrulha da fronteira, Jim Rhodes abandona sua carreira e se muda com sua filha Kim para o estado de Montana. Lá, sua filha é raptada e Rhodes terá que usar toda a sua capacidade para fazer justiça com as próprias mãos.",6.564,98.0,,5.6,94.0,en,/5SZVUjHTbX5VJGkwVrobWLxkk1U.jpg,/5TIqPkjW8xhj1N665ECuMZdrtDX.jpg,
144220.0,108614.0,The Seminarian,2010.0,Drama,"The Seminarian is a story about Ryan, a closeted gay student in his final semester of seminary studies. Despite his school's hostile stance towards homosexuality, Ryan has two gay classmates - Gerald and Anthony - in whom he secretly confides. He is also close to his religiously devout mother who, as things stand, is unaware of his sexual orientation. Ryan needs to complete a solid theological thesis in order to continue doctoral work at the university of his dreams. As he works on his thesis 'The Divine Gift of Love,' Ryan begins a relationship with Bradley - a guy he has met on the Internet who seems perpetually unable to commit himself. Ryan confides in Gerald and Anthony, only to learn about their romantic struggles as well. Consequently, Ryan questions his views on God's gift of love.",2.56,101.0,God is love.,5.8,14.0,en,/uk7RFHR3Oz0TqHUormPxApoPTp8.jpg,/e2IWAo4BjbeblSIZZFmOf4Vbecq.jpg,
144670.0,113377.0,Freedom Riders,2010.0,Documentary|History,"This is the story of more than four hundred Americans who participated in a bold and dangerous experiment designed to awaken the conscience of a complacent nation. These self-proclaimed, 'Freedom Riders' challenged the mores of a racially segregated society by performing a disarmingly simple act.",3.167,117.0,,7.4,9.0,en,/rDBlgWMJnlFaRu9jLISLXtGihZ6.jpg,/eFjSHiTE8PwvF7lbK7nr8HqDEKn.jpg,
145220.0,44224.0,Perseguidos,2010.0,Terror|Ação|Thriller,"Dois casais que se perdem, ficam presos em uma mini-van. Porém devem usar sua inteligência e coragem para defender-se do ataque de um grande urso para sobreviverem. Enquanto lutam, contra a astuta e inteligente criatura, segredos entre eles começam a surgir. Será que as revelações chocantes irão separá-los, antes que o urso o faça?",5.305,78.0,,4.1,18.0,en,/qG1C3GCQEHQcDgCay1hksczs0bN.jpg,/8xJjU8rQx2M2alAyGSRIxGzy3gx.jpg,k5774
145281.0,49347.0,Needle,2010.0,Horror|Thriller|Mystery,"In this cunning mystery-horror hybrid, college student Ben inherits a curious old mechanical box that churns out voodoo dolls. When a shadowy figure starts using the box to murder Ben's friends, Ben must find the killer.",4.99,90.0,Ten Suspects. Six Clues. One Killer...,5.1,39.0,en,/mduXCaZ1QaevkyJsvKcuXDTpv4j.jpg,/uSRehjXUupWXhkGiXjZvkpeOJuK.jpg,
145522.0,44037.0,Pânico no Lago 3,2010.0,Terror|Ação|Ficção científica|Thriller,"Crocodilos gigantes continuam aterrorizando a região de Lake Placid. O biólogo Nathan Bickerman (Colin Ferguson) está disposto a encarar o terrível predador, assim como Reba (Yancy Butler), uma destemida caçadora que busca seu próximo troféu.",13.559,93.0,É Hora de Fazer uma Boquinha,5.2,148.0,en,/czhbY7ge7xS5EENLr3k0UTArHFS.jpg,/pms0w4qAQ0roWzd8T1AcKtZHpEz.jpg,
145743.0,56663.0,Paul McCartney Really Is Dead: The Last Testament of George Harrison,2010.0,Documentary,"In the summer of 2005, a package arrived at the Hollywood offices of Highway 61 Entertainment from London with no return address. Inside were two mini-cassette audio tapes dated December 30, 1999 and labeled ""The Last Testament of George Harrison"". A voice eerily similar to Harrison's tells a shocking story: Paul McCartney was killed in a car crash in November of 1966 and replaced with a double!",3.561,95.0,,4.8,13.0,en,,/r5qcJxa71I7cl5UZhgAdhvsxauW.jpg,
146666.0,60695.0,O Meu Amigo Imaginário,2010.0,Drama|Romance,"Jane é uma mulher segura que está prestes a casar, mas não consegue se decidir quanto aos preparativos do casamento. Até que Michael, seu amigo imaginário de criança, reaparece na sua vida e a ajuda resolver todos os problemas, fazendo-a faz perceber o que realmente ela quer para sua vida.",6.06,88.0,,6.6,67.0,en,/vqogeJFlo484z7Lsu9qMs0GfE02.jpg,/95wNSQvguF9XdGP3KMeIbsVHU6b.jpg,
146676.0,70044.0,The Scouting Book for Boys,2010.0,Thriller|Drama,"Thomas Turgoose (This Is England) stars as David, a young boy who lives a carefree life on a coastal caravan park with his best friend Emily (Holliday Grainger). When David learns that Emily is being forced to move away, he helps her hide out in a remote cave on the beach. But as David watches the police close in on his missing friend, their innocent secret takes on a life of its own. When the real reason Emily wants to escape comes to light, David's world is shattered. Swept up in a situation out of his control, and with his feelings for his best friend growing stranger by the day, David is forced to take action.",3.46,93.0,,6.6,11.0,en,,/ardNGnDmDZn6UHn3Ly0cbAdIY4M.jpg,
146694.0,70448.0,All About Evil,2010.0,Horror,"Deborah quickly cultivates a rabid legion of San Franciscan gore fans who help catapult her to new-found local celebrity-- business booms so quickly, she's forced to bring on a full film crew of like-minded misfits to meet the demand! Her adoring public, and even her biggest fan-- high school student Steven-- don’t realize that the murders in the movies are all too real. But will this brooding youth catch the blame as Deborah's steady stream of 'actors' keep disappearing at an ever-quickening pace? What grisly fate awaits those that dare enter the Victoria theatre? Find out in ALL ABOUT EVIL!",3.615,98.0,People are dying to get into this movie,6.0,38.0,en,,/vJOtBW2q9mwLuEsxvQxhzQ7i74o.jpg,
146726.0,50652.0,Babá de Natal,2010.0,Comédia|Família,"Ally está procurando emprego como publicitária para poder pagar as contas em casa. Até que ela consegue uma entrevista com uma executiva de uma grande empresa do ramo, mas a vaga oferecida é para o trabalho como babá. Sem imaginar as consequências, a jovem aceita o desafio, que vai mudar sua vida.",6.944,87.0,Às vezes os grandes presentes vêm de pacotes inesperados,5.5,49.0,en,/4a8IdLU4Z77SpGtvWi9g1NtZ4Uu.jpg,/vQR1gVsnasLr2DaCkC2ejJotQTP.jpg,k207317
147014.0,117340.0,Hello Lonesome,2010.0,Drama|Comedy|Romance,"Lonely since his wife left him and alienated from his daughter, a cantankerous voice-over artist strikes up an unlikely friendship with his regular deliveryman. Many suburbs away, an elderly widow loses her license to drive and turns to her wry younger neighbor for nostalgic cuddles and comfort. Meanwhile, a young urban sports fanatic meets a girl online and unexpectedly falls in love, though the trials the couple endure prove even more unexpected. Adam Reid's enchanting, compassionate debut weaves together the worlds of six lonely individuals as they negotiate the age-old process of giving and receiving love. It isn't easy, and it never happens the way they expect it, but for these isolated souls, there's an oddball magic in the way they make connections they never imagined.",2.216,93.0,A little hello can go a long way.,6.3,15.0,en,,,
147396.0,54525.0,Secrets in the Walls,2010.0,Horror|Thriller|TV Movie,"A single mom and her two daughters move from their cramped Detroit apartment to a large house in the suburbs, but scratching, cries and shadows haunt their new home.",2.601,89.0,They are not alone.,5.8,47.0,en,/2bFBAip5x7Cv1eJh40w7OW5xkCL.jpg,/3CxckA26jBWU6sWkCO3lLOiC6Vs.jpg,
147584.0,46734.0,Eva,2010.0,Drama|Romance,Eva meets Tudor on the day of her 16th birthday. It is Tudor who is to make her feel whole as a woman. He becomes for her a source of both love and suffering through his constant mysterious departures and reappearances.,0.999,111.0,,5.1,4.0,en,,/cMNWfQQ3JPGJerexA127XnWgXA.jpg,
147586.0,44951.0,Beneath the Blue,2010.0,Drama,Dolphin experts confront the US Navy when its sonar program is suspected of causing the animals' deaths.,2.04,92.0,,5.5,22.0,en,/ke48FBp6j0RU2i4h5kJtMcpaxrs.jpg,/4JSNOxFACKXubfVViFCF3Y2HmWp.jpg,
147783.0,39446.0,At Risk,2010.0,Crime|Mystery,"Detective Win Garano is asked to reopen a twenty-year-old murder case, and soon finds himself endangered by the political ambitions of a district attorney.",2.724,86.0,,4.4,14.0,en,/8zoyL9tUn87raaNuusKbAFUwKuB.jpg,/wDNQd71WIGBBSK62UEUMzye0Py3.jpg,
148264.0,262742.0,Pastor Shepherd,2010.0,Comedy,The tale of a down-on-his-luck freeze-dried-pet-salesman and his journey to become the first-ever-cyber-evangelist.,1.243,91.0,Love Thy Neighbor,3.8,9.0,en,,/qnW6EZD1R5qrn19Aye8XwVTxaYG.jpg,
148412.0,32206.0,Quantum Apocalipse,2010.0,Ficção científica|Cinema TV|Mistério|Drama,"A NASA detecta que um cometa está em rota de colisão com a Terra, e os cientistas descobrem que a chave para salvar a humanidade é um garoto autista de uma pequena cidade no estado de Louisiana.",8.022,93.0,,3.9,61.0,en,/5tjLs17GK6XHAU1oztx97U97WF3.jpg,/7hMBhDknvIDFtkohTcggXvIwYxg.jpg,
149122.0,80041.0,The Runway,2010.0,Drama|Comedy,"The Runway is inspired by the true story of a South American pilot who landed his plane near Mallow, in 1983. Against all odds, the people of the town came together to build a runway to get him home and briefly caught the imagination of the nation. It is the story of Paco, a young boy without a father who adopts the pilot and convinces the town to build a runway to get him home.",1.21,101.0,,5.3,3.0,en,,/pqhlTz5l8HKozzWMqotb47LAZjz.jpg,
149322.0,63160.0,Successful Alcoholics,2010.0,Comedy,"Drake and Lindsay are successful alcoholics who may need to rethink their definition of ""success.""",1.756,26.0,A Comedy of Substance,6.4,14.0,en,,/Hgea79JxQ8TtGNXY4pxt9xpXvG.jpg,
149602.0,70712.0,Te presento a Laura,2010.0,Romance|Comedy|Drama,"This is the story of 23-year-old Laura who lives in the largest city in the world and yet feels alone. She also knows the exact date in which she'll die: April 30. What Laura doesn't know is what she'll do from now till then, and thus she enrolls in a group of optimists, which she finds pathetic but fun. In that group she writes a list of 10 things she wants to do before she dies, some that mean a lot and some that are a lot of fun. The first thing on her list is to save a life.",5.443,98.0,,6.8,83.0,en,/jWP8AEfYvIn7dbofQPSZr9qsSYB.jpg,/boacL0GNxCCJPgmQq4JSPmOQltk.jpg,
149696.0,73976.0,Como Esquecer,2010.0,Drama,"Júlia (Ana Paula Arósio) é uma professora de literatura inglesa que é abandonada pela namorada depois de um relacionamento que durou mais de dez anos. Por causa da separação, Júlia vai morar no Rio de Janeiro com seu melhor amigo, Hugo (Murilo Rosa), que é gay, e Lisa (Natália Lage).",1.483,100.0,,5.5,24.0,pt,,/adtZhgDIwwD6dABCvhEKchGSnjW.jpg,
150546.0,57393.0,Africa United,2010.0,Drama|Action|Comedy,The extraordinary story of three Rwandan children who attempt to realize the dream of their life: to attend the opening ceremony of the FIFA World Cup 2010 at Johannesburg.,3.816,88.0,Anything Is Possible,6.4,20.0,en,/y8rsbapuHK2HqSDpedmNScTguRR.jpg,/6KyW0erjBuZOGzIwvUMaj0U0K7b.jpg,
150623.0,74890.0,Valkaama,2010.0,Drama,"A Swedish poet, Lasse, has travelled around the world for years - alone, independently, restlessly. His heart knows no home except one that a prophecy from his childhood revealed to him: Valkaama, a mysterious place in northern Finland. Lasse always longed to settle there one day, along with Ari, a good friend bound to a wheelchair. In time, Lasses's travels have lost their youthful innocence. He decides to go on one last great journey with Ari. Meanwhile Ari gets in touch with someone who abruptly changes the perspective on his own destiny for the worse. In recent months Lasse has been living with Runa, a privileged young woman from Halmstad. Since the tragic death of her parents she has lived alone with her brother, Max. Runa has looked upon Lasse only as a friend, but as he leaves, she becomes overwhelmed by deep-set emotions. She makes a decision to find him, regardless of the consequences.",0.6,93.0,,3.0,2.0,en,/fd4gL1dCKrnaYbpPcZmbEOZGKy2.jpg,/9OIDrGePKJOcsls6vueSRnIMRaA.jpg,
150866.0,50526.0,Beats of Freedom,2010.0,Documentary|Music,A history of Polish rock and independence,1.494,73.0,,7.5,2.0,en,/npskuLOPJ4qsJxg6v5zGM5IeGaq.jpg,/Al2zy17XTss26BN4OjvUwf4hGzy.jpg,
151589.0,67198.0,Bloodworth,2010.0,Drama|Romance,"E.F. Bloodworth has returned to his home - a forgotten corner of Tennessee - after forty years of roaming. The wife he walked out on has withered and faded, his three sons are grown and angry. Warren is a womanizing alcoholic, Boyd is driven by jealousy to hunt down his wife and her lover, and Brady puts hexes on his enemies from his mamma's porch. Only Fleming, the old man's grandson, treats him with the respect his age commands, and sees past all the hatred to realize the way it can poison a man's soul. It is ultimately the love of Raven Lee, a sloe-eyed beauty from another town, that gives Fleming the courage to reject this family curse.",4.657,105.0,,6.6,23.0,en,/7tcCCbMR2kF38teW1cC4upWR2KC.jpg,/897XvJNBCFaEo669XZxd5o684T7.jpg,
152161.0,58913.0,"Em Seus Passos, O Que Faria Jesus?",2010.0,Família,"Raymond, que antes fora de uma próspera cidade, torna-se uma sombra de seu passado quando um empresário oportunista planeja substituir a igreja local por um cassino, corrompendo o clima saudável da cidade. Enquanto os moradores lutam por respostas, um homem, (John Schneider) chega a cidade apresentando uma questão mais importante; O que faria Jesus?",1.645,94.0,,3.9,7.0,en,/konRtVPJ580DOvYVhOty5yrPP1W.jpg,/mJfcvlF8B1bOYu7T0yDgoLL1HX3.jpg,
152330.0,211317.0,Standing Army,2010.0,Documentary,"Standing Army, directed by Enrico Parenti and Thomas Fazi, is an award-winning documentary film about the global network of U.S. military bases, the impact that these have on local populations, and the military-industrial complex that lies behind it.",1.278,75.0,,4.3,4.0,en,,/1SXK73Q4VFRagCEQcC5UyT3iuMH.jpg,
152747.0,81524.0,Foreign Parts,2010.0,Documentary,"A portrayal of a hidden enclave of auto shops and junkyards fated for demolition in the shadow of a new baseball stadium in Queens. The film observes this vibrant community of immigrants – where wrecks, refuse, and recycling form a thriving commerce – as it struggles for daily survival and contests New York City's development scheme.",0.879,81.0,,6.2,6.0,en,,/vJmvkDys5eNtYJKh8XcjxTvBFQ6.jpg,
153300.0,44436.0,ODDSAC,2010.0,Music|Horror,"Opening with torch-wielding villagers and a wall bleeding oil, this experimental film attaches vivid scenery and strange characters to the wonderful melodic wavelengths of the band Animal Collective, revitalizing the lost form of the ""visual album.""",0.92,54.0,,5.9,15.0,en,/pCebXYxUfGcyU1jQILCc2doVnix.jpg,/phadvNDxe6vzWuIPr1aG8MLqeW6.jpg,
153492.0,278778.0,Dancing Ninja,2010.0,Action|Comedy|Crime,An orphaned boy who dreams of being a ninja arrives in Hollywood and attempts to find his birth parents.,2.758,97.0,He's a Kung Fool Fighter!,6.0,8.0,en,/koTqXhCUth5sAJ1Oqfgbl5IFDR8.jpg,/xp0OMl25R6twf7q9sMSVqKte3tT.jpg,
153536.0,74727.0,Long Pigs,2010.0,Crime|Horror,"A documentary by two desperate young filmmakers who stumble upon the ultimate subject, a 33 year old cannibalistic serial killer named Anthony McAllister",2.965,81.0,Two desperate filmmakers began a documentary about a cannibalistic-serial killer. What follows is their actual footage.,5.4,15.0,en,,/n8dUraXlwL9VunQM7mIIXJFCBcv.jpg,k703|k10714
153957.0,61025.0,The Dark Side of Chocolate,2010.0,Documentary,"A team of journalists investigate how human trafficking and child labor in the Ivory Coast fuels the worldwide chocolate industry. The crew interview both proponents and opponents of these alleged practices, and use hidden camera techniques to delve into the gritty world of cocoa plantations.",0.84,46.0,,6.8,4.0,en,,/pGHmiTr92VOB89x8FNxMWayn9mD.jpg,
154192.0,347184.0,Sharunas Bartas: An Army of One,2010.0,Documentary,"A subjective portrait of the famous Lithuanian filmmaker. The film combines interviews of Bartas, talking about his films, his creative intentions, reminiscing about the beginning of his career as a filmmaker, and Coudray’s personal opinion on the director.",0.6,51.0,,6.0,3.0,en,,,
154234.0,326305.0,Aung San Suu Kyi - Lady of No Fear,2010.0,Documentary,"We know Aung San Suu Kyi as ""a golden bird in a cage""; she is a valuable icon representing freedom and democracy of which the suppressed population of Burma project much hope for. In the West she  stands out as a symbol of peace and reconciliation. She has been  awarded countless prizes for her effort, among them the Nobel Peace Prize.  But who is the person and woman behind it all? The Military Dictatorship has on several occasions offered her the opportunity to leave the  country. But why does Aung San Suu Kyi voluntarily choose to stay in her captivity instead of going into exile?  Lady of No Fear offers a strong and fascinating glimpse into Aung San Suu Kyis life and portrays some of the consequences her  freedom struggle has had, not only for her, but also for her closest friends and family indeed.",0.6,0.0,,5.8,4.0,en,,,
154937.0,36511.0,White Wall,2010.0,Action|Drama|Fantasy|Science Fiction|Thriller,"In the near future, everything has changed. Basic human rights have become the rarest of luxuries. No one knows when this started but everyone knows how. The VXII, the deadliest virus ever created, spread like wildfire and decimated the majority of the world's population. The non-infected survivors now cling to life in four quarantined cities behind a wall. Shawn Kors and his brother, Jude, survived the VXII only to grow up in a squalid internment camp for orphaned children. Under the care of the militia, they were pitted against other children in backwoods death matches. Shawn, Jude, and the few who escaped became notorious for their incredible fighting skills. They have since parted ways. Shawn now makes a comfortable living as a janitor at the local medic station. He spends his days dreaming of curing the VXII. When Shawn discovers the discarded body of a fellow internment camp friend, he is forced out of hiding and pulled into a rabbit hole of conspiracy and violence.",3.379,91.0,Blood Hurts!,2.9,9.0,en,/weNIhzw1siUIoD25TzdqPtLsKeD.jpg,/gvEIllqeRp8tKoV8llpnvPcPqJZ.jpg,
155579.0,41988.0,DC Showcase: Jonah Hex,2010.0,Animação|Ação|Faroeste,"No filme online DC Showcase: Jonah Hex, Quando cruéis assassinatos começam a acontecer em um bordel de um bar, Jonah Hex aparece para fazer justiça!",8.744,12.0,DC Showcase Jonah Hex,7.2,93.0,en,/5FJCntV3fWHMhhn3PmJKd9MEEx6.jpg,/ijUQRDaxpTmaawXe4QMaSEaqhMf.jpg,
155804.0,42291.0,The Buddha,2010.0,Documentary,"This documentary for PBS by award-winning filmmaker David Grubin and narrated by Richard Gere, tells the story of the Buddha’s life, a journey especially relevant to our own bewildering times of violent change and spiritual confusion. It features the work of some of the world’s greatest artists and sculptors, who across two millennia, have depicted the Buddha’s life in art rich in beauty and complexity. Hear insights into the ancient narrative by contemporary Buddhists, including Pulitzer Prize winning poet W.S. Merwin and His Holiness the Dalai Lama. Join the conversation and learn more about meditation, the history of Buddhism, and how to incorporate the Buddha’s teachings on compassion and mindfulness into daily life.",4.504,120.0,The Story of Buddha,6.3,10.0,en,/1RoXnKKYGAeTlh1tuASvWwDtyvc.jpg,/1nMwkLdJNvHKlqxl4iUN31yCSYO.jpg,
156690.0,327674.0,The Invited,2010.0,Horror,"A young married couple who are pregnant with their first child moves into their turn-of-the-century home where they discover that a great evil has resided there for nearly a century, unleashed by a previous occupant.",2.726,95.0,,3.3,9.0,en,,,
156700.0,57173.0,Monsterwolf,2010.0,TV Movie|Fantasy|Horror,"A creature of ancient legend manifests, bound to protect the ecological balance of the land and killing anyone that threatens it. This elusive guardian is initially both feared and celebrated by the locals, but when a deadly curse affects them all, they must unite and recapture the monster wolf’s spirit or face their ultimate doom.",3.232,86.0,,3.7,14.0,en,,/kJuGPV337ojSvJDmfI33358GcYO.jpg,
156783.0,49381.0,Jimmy Carr: Making People Laugh,2010.0,Comedy,Jimmy Carr: Making People Laugh features over two hours of material that's too rude for TV.,2.506,113.0,,7.3,28.0,en,,/w6vdQVNyiqcyszDNDJLo6NVVqsF.jpg,k9716
156789.0,204344.0,Internet Story,2010.0,Animation|Drama|Mystery,"A fast-paced and thought-provoking film told through fragments of internet videos, animations, blogs and news articles. A series of shocking events unfolds when a young man creates a public treasure hunt for his own amusement and a video blogger decides to pursue the riddles across country.",0.903,10.0,,7.6,9.0,en,/1U64qPO3E5YDSxzJX69MH1kVtuC.jpg,/qmTW7Su0DsR3jfQkYATTRw1bEAg.jpg,
157310.0,113347.0,A Drummer's Dream,2010.0,Music|Documentary,"A rare and unique assembly of some of the greatest drummers in the world. Explosive talent, passion, humour and irresistible personality come together in a magical setting when seven diverse drummers create a profound and unforgettable experience. You've never seen drummers like this before! Featuring Nasyr Abdul Al-Khabyyr, Dennis Chambers, Kenwood Dennard, Horacio ""El-Negro"" Hernadez, Giovanni Hidalgo, Mike Mangini and Raul Rekow, the film engages us with the rich music styles and influences that are as dynamic as the performers themselves. We are lifted to another dimension as we connect to the powerful forces of nature embodied in the music of these master musicians. The creative and spiritual freedom of expression these artists display is overwhelming - from Latin rhythms to the wildly original compositions of Kenwood Dennard. Rock, jazz, Latin fusion, soul - these master drummers have backed up the likes of Miles Davis, Dizzy Gillespie, Carlos Santana and now - each other.",1.544,84.0,,7.4,5.0,en,,/73N9J63JGvb6ZFbqyHiHoN8jDAU.jpg,
157375.0,40080.0,Um Casal Quase Perfeito 4 - Fogo e Gelo,2010.0,Drama|Romance,"Após perder seu parceiro de patinação artística, Alex abandona as competições. Desafiada por James, um patinador de alta velocidade rebelde, ela decide voltar a competir. Os dois formam uma turbulenta parceira na busca da medalha de ouro.",10.16,90.0,,6.4,122.0,en,/uOcvvphXD8Gl9qZW3OkezbSXjnj.jpg,/iHhTXggQ1umVRvzeSGrOlZ9qFX7.jpg,
157448.0,60961.0,Held Up,2010.0,Comedy,"Kaitlin Olson (It's Always Sunny In Philadelphia) stars opposite Jon Dore in this hilarious heist comedy written and directed by Jason and Randy Sklar (Cheap Seats). A disgruntled and bored bank teller named Ray (Jon Dore) finally gets his wish for some excitement when the branch is held up by two teams of crazy robbers disguised as Rocky I, Rocky II, Batman and Robin. As the robbery unfolds, the hostages fall victim to a comedic version of the Stockholm Syndrome and begin sympathizing with their dimwitted captors, which leads to an extended siege as Ray pursues a romantic relationship with one of the robbers (Kaitlin Olson).",1.379,86.0,Best. Heist. Ever.,4.3,6.0,en,,/sE9XWNeWB766n3UnmXJNF1Oe52e.jpg,
