movieId,tmdbId,title,release_date,genres,overview,popularity,runtime,tagline,vote_average,vote_count,original_language,backdrop_path,poster_path,keywords
135701.0,279977.0,The Mirror,2014.0,Horror,"There is a long-held belief that mirrors act as gateways to another dimension. ·Some also believe the looking glass plays host to a world filled with evil spirits. Such superstition has been the basis for ancient folklore legends about haunting and possession. And one tale about a supposedly haunted mirror was picked up by the media in 2012. Both the Daily Mail and Huffington Post reported on how the owners of a recently purchased antique mirror left them dogged by bad luck, financial misery, strange sightings and death-defying illness. Now writer/director Edward Boase brings that horrifying story to the screen starring Jemma Dallender (I SPIT ON YOUR GRAVE 2), Joshua Dickinson and Nate Fallows (‘Whitechapel’) as flatmates who buy the same eerie antique on ebay and set up round the clock cameras in the hopes of capturing evidence of bumps in the night. You have been warned!",4.764,88.0,,3.9,30.0,en,,/n1pUEQuhju702gfA0XGsZz0nBNV.jpg,
135844.0,255528.0,Blank: A Vinylmation Love Story,2014.0,Adventure|Family|Animation|Romance,"In search of his lost soul mate, an unpainted Vinylmation finds himself on a quest that alters the destiny of his entire world.",0.6,37.0,,5.0,6.0,en,,/b8UDSRj9ZSyRJofqqfENklcBHpU.jpg,
135852.0,286519.0,O Coro,2014.0,Música|Drama,"Stet (Garrett Wareing), um confuso garoto-problema de 11 anos de idade, sofre com a recente morte de sua mãe solteira em um acidente de carro. Ele acaba em um internato, onde ele se sente um peixe fora d'água. Logo, ele bate de frente com o maestro do coral do colégio, Carvelle (Dustin Hoffman), que reconhece algo especial na voz de Stet.  O professor vai influenciá-lo a descobrir seu dom criativo na música e o jovem rebelde vai provar que consegue atingir os padrões exigidos para participar do coral, orgulho da famosa escola.",7.792,106.0,"Um talento extraordinário, requer inspiração extraordinária",6.8,210.0,en,/yDI3qXoKMGUGGz0E2zrkHw4PRt4.jpg,/pMGLHCE5Rcw0DbsQ3TVcaTAIOVZ.jpg,k10873|k12990
135871.0,289159.0,The Invisible Front,2014.0,Documentary|Drama,"Between 1944–1953, courageous resistance movement took place in the Baltic region of Europe, uniting the partisan troops for struggle against the Soviet Union. “The Invisible Front” was a coded name used by the Soviet Interior forces to describe the resistance movement in Lithuania. Film depicts the story of the fighters through the words and experience of the partisan leader, Juozas Luksa, and interviews with eyewitnesses of those events - both the partisans and the Soviet fighters. Tales of horror, torture and courage are told in the rare archival footage that has never been screened before, and interviews with the surviving members of the resistance movement.",1.732,87.0,,6.5,4.0,en,,,
135877.0,265018.0,O Chupa-Cabra,2014.0,Terror,"Um grupo de cinco amigos americanos chegando à vida adulta viaja para o Panamá para relaxar e se reconectar. Eles fazem amizade com uma moradora local no bar do hotel e, apesar de alguns boatos ameaçadores, a garota vai contra as instruções do irmão e leva os americanos para um passeio pelas cataratas de uma selva próxima. O que começa como uma visita inocente a cataratas pitorescas logo se torna algo aterrorizante quando ela desaparece de repente. Conforme a noite cai, os amigos percebem, tarde demais, a verdade por trás dos rumores: o lendário sugador de sangue Chupacabra está os perseguindo.",6.16,86.0,,5.8,124.0,en,/21gPZm8rg9HtNpERmJGafW1FdTL.jpg,/QJXrBKKyq3sYqfzSo2x8YUGW8m.jpg,k9826
135927.0,296178.0,Póstumo,2014.0,Comédia|Drama|Romance,"Neste divertido e moderno romance, que nos fará contemplar o valor que damos para a vida, o amor e a arte, Liam é um artista frustrado que finge sua morte para valorizar suas obras. O plano é um sucesso, mas até quando ele conseguirá manter a farsa?",4.337,94.0,,5.9,39.0,en,/cKD6OSlrJxNjO61HIjFptl3ZVaF.jpg,/xO0OwIUxcHJBUPt5D9Jzxo6mhvu.jpg,
135974.0,269242.0,Alpha House,2014.0,Comédia,"Quando duas promessas calouros são aceitos na maior festa de fraternidade no campus (Casa Alpha), eles pensam que têm tudo. Isto é, até que o assistente de reitor obriga os Alphas para compartilhar sua casa com uma irmandade ou face expulsão da escola. Não querendo ver o seu sonho de se tornar Alphas destruído, as promessas convencer os outros membros da casa para ter de volta o que é deles, travando uma batalha épica entre os sexos para lutar pelo seu direito de festejar.",6.304,88.0,,4.4,51.0,en,/94zFmmvcY83vHdLKci3dOIVhnc8.jpg,/s00AwtusVVG8lpA3fquKaE63NWW.jpg,
136231.0,260211.0,Jeff Dunham: Achmed Salva a America,2014.0,Animação|Comédia,"Achmed está tendo um dia muito ruim. Como se explodir acidentalmente e se tornar esqueleto falante não fosse o bastante, o terrorista mais incompetente do mundo encontra-se levada para longe de sua terra natal por uma águia careca e levado para Americaville nos Estados Unidos.",3.759,60.0,,5.6,10.0,en,,/rLPItS9lGILjxb074f6rdg0MaiE.jpg,
136233.0,249021.0,Android Cop,2014.0,Action|Science Fiction,"In the year 2045, a Los Angeles Police Department detective and his new android partner enter the Zone, a forbidden section of the city plagued with an unknown disease. There, they discover the source of the illness and attempt to stop it using the android's advanced technology and weaponry.",5.355,88.0,The Future of Law Enforcement,4.2,49.0,en,/9DYCjWFD9iw5S7uunqqBj7lx77b.jpg,/pStgVcVSMNDykydPzMTuAiXAb50.jpg,
136235.0,277594.0,Hercules Reborn,2014.0,Adventure|Action,"When a young man's bride is kidnapped by an evil king, he turns to Hercules for help. The fallen hero has been living in exile, banished for killing his family, but the young man's courage inspires Hercules. Together, they fight to rescue the bride and reclaim the honor of Hercules.",1.498,90.0,A fallen hero rises again!,4.3,59.0,en,/hB2af4Up4UpWhdm3MJoXNjH6izf.jpg,/zustI9EStTWz2PxVmy8KvWVpJTP.jpg,
136435.0,292342.0,Bill Maher: Live from D.C.,2014.0,Comedy,Standup special recorded live at the Warner Theatre in Washington DC. This originally aired directly after a live episode of Real Time with Bill Maher also shot in Washington at a different location.,2.075,60.0,,5.8,11.0,en,/oupQ1X185B63whKxsEPqgI6EzlB.jpg,/gNI5Y13U37p0KKwjlKcnD67vGkx.jpg,k9716
136455.0,284274.0,Homem de Ferro e o Capitão América Super-Heróis Unidos,2014.0,Aventura|Animação|Ação,"O Homem de Ferro e o Capitão América lutam contra o Treinador e o Caveira Vermelha, a fim de impedir que eles destruam a Terra. Os super-heróis precisam colocar as diferenças de lado para enfrentar as ameaças que estes vilões representam.",28.233,71.0,,6.2,93.0,en,/zxpQlh172HOLlG7UohW8sm7iOdz.jpg,/6E5OJfpoUM7k8C1bORXI1lXwhKD.jpg,k9715|k9717
136511.0,300685.0,Jeff Dunham: All Over the Map,2014.0,Comédia,"Neste documentário / stand-up especial, Jeff leva seus amigos na mala de viagem por todo o mundo, se apresentando em lugares como Islândia, Noruega, Abu Dhabi, Emirados Árabes, Londres e Israel.",1.11,83.0,,5.4,13.0,en,/lq0iZe2MoHNSErVNd3jkshyG7ak.jpg,/9o97CIpO5FgNXBYoXYxfgoV4lrz.jpg,k9716
136602.0,250574.0,Creep,2014.0,Terror|Thriller,"Aaron (Patrick Brice), é um filmografista que decide aceitar um emprego que viu nos Classificados, em que ele teria que filmar Josef (Mark Duplass), um homem com uma doença terminal e que quer guardar algumas memórias para seu filho não-nascido. Apesar da estranheza do homem, Aaron continua trabalhando pois a grana que recebe é muito boa e ele não pode recusar. No entanto, Josef vai se tornando mais bizarro e assustador e Aaron começa a temer que ele está em perigo e nas mãos de um homem mentalmente instável.",11.188,82.0,,6.4,941.0,en,/wklLM7prDAYL0jp9ZT8a1vO824y.jpg,/iUEpNzw0E7tOlXFL4nCpIpjcKd9.jpg,k6259|k9720|k9826|k10714
136626.0,226140.0,Noite do Terror 2,2014.0,Terror,"Jacob Goodnight levanta entre os mortos do necrotério da cidade após a carnificina do Hotel Blackwell. Sobram alguns estudantes de medicina, que precisam lutar pela sobrevivência contra um psicopata decidido a matá-los.",25.627,90.0,,5.3,227.0,en,/m81nJM5ws4V9IONDjyabsxDuhys.jpg,/jGLfL5zg5mt3GXtJtEsk7kqTP93.jpg,
136634.0,294093.0,Ilha Dos Dinossauros,2014.0,Aventura|Ficção científica|Família,"Umas férias torna-se a aventura de uma vida para um menino de 13 anos, quando preso em um mundo cheio de navios fantasmas, criaturas pré-históricas e uma jovem que diz vir por último. Juntos, eles embarcam em uma jornada que irá mudar o futuro de ambos para sempre.",14.394,90.0,,5.5,109.0,en,/b4UTMzwPcuxwETFVGHqg2HDM5u3.jpg,/xOe4S3eGogWQk4H8NhVe6eNJZSO.jpg,
136636.0,228358.0,Pesadelos do Passado 2,2014.0,Mistério|Terror|Thriller,Uma mulher que é atormentado por pesadelos envolvendo um serial killer e isso mostra ter uma terrível conexão com o mundo real.,8.483,96.0,,4.8,131.0,en,/lHjRpv4QjiZRiFNkB3XGvnwD2p2.jpg,/fqXXhzXRr0DYsZXbunJ9W6B7nqg.jpg,k10714
136644.0,260435.0,Awakened,2014.0,Thriller|Drama,"Samantha believes that her father murdered her mother. In her exhausting search for the truth about her young mother's untimely death 14 years earlier, Samantha receives help from beyond the grave.",2.665,107.0,Don't trust anyone,3.7,6.0,en,,/3XLGsN7mLpwIUYfGjCR7tXfjONL.jpg,
136646.0,301730.0,Elimination Game,2014.0,Action,"In the wake of a shocking civilian massacre in a foreign war zone, disgraced Navy SEAL Rick Tyler is sentenced to rot in a maximum security military prison until he is offered the opportunity to put his life on the line to win his freedom. A one-man force of nature, Tyler will have to take-on and take-down some of the world's most ruthless killers in some of the world's most brutal locations to win the game, obtain his freedom and find out why he was set up. The question is, can he accomplish all of this before Game On is Game Over?",2.857,90.0,It's live. With death.,4.7,15.0,en,/v2lzXdjug3Ui8y0gjBeBm3hxD2s.jpg,/bqAWGBLaSoURbqJUmhPe7XAxSG6.jpg,k236|k9826
136650.0,263913.0,Balls Out,2014.0,Comedy,"With marriage, graduation, and the real world looming on the horizon, fifth year senior Caleb Fuller reassembles the ol' team of misfits for one last epic run in Intramural football.",1.963,100.0,,4.4,28.0,en,/aa3MrbDYNaSsPX7AtvlsmmPMp3A.jpg,/lhBOEThBtatPlhfuiP9ti7Vfg7i.jpg,
136652.0,299221.0,Phantom Halo,2014.0,Thriller|Crime|Drama,"O mundo é um eterno palco para Samuel (Thomas Brodie-Sangster). Fã de Shakespeare, ele vive recitando obras clássicas no meio da rua enquanto seu irmão Beckett (Luke Kleintank) rouba carteiras. A família não tem mutio dinheiro para sobreviver e o patriarca Warren (Sebastian Roche), um ex-ator drámatico, é um agressivo bêbado que gasta o pouco que eles tem. Quando os irmãos descobrem que seu pai deve muito dinheiro para um agiota, eles vão ter que encontrar uma forma de pagar a dívida ou escapar dessa tragédia anunciada.",9.877,89.0,,6.1,39.0,en,/4asKjZzCsS6CxIDD3se0SuhaSav.jpg,/9mOs6So57dOxxgVttc4LNPoB4oT.jpg,
136654.0,254024.0,A Face De Um Anjo,2014.0,Drama|Thriller,"Thomas (Daniel Brühl) é um cineasta em busca de uma segunda chance em Hollywood depois do fracasso de bilheterias de seu primeiro longa. Ele vai a Siena, na Itália, para pesquisar sobre um brutal assassinato que está atualmente em julgamento na cidade. As ordens vêm de seus produtores, em busca de um produto palatável pra vender; a atmosférica cidade medieval e seus habitantes, porém, começam a exercer uma estranha influência sobre o diretor. Ele passa a ter visões e pesadelos desconcertantes enquanto segue em sua busca pela verdade, ao lado de Simone (Kate Beckinsale) uma jornalista que escreveu um livro sobre o assassinato e conhece tudo sobre o caso.",5.292,100.0,A História de um Crime Arrojado,5.1,132.0,en,/qBPrU3oA1s3eFvPVmq4vNnkRymU.jpg,/nFY7bO60ENfXRq4fqzA22snQUls.jpg,
136658.0,297462.0,À Moda Antiga,2014.0,Romance|Drama,"De um passado imoral para uma vida de princípios e fé em Deus. Essa é a trajetória de Clay (Rik Swartzwelder). Agora um novo homem, ele abandona sua vida de farras para gerenciar um antiquário em uma pequena cidade. De outro lado, chega Amber (Elizabeth Roberts), uma mulher de mente aberta que se encanta com as ideias de Clay sobre o amor. Ambos aprenderão que superar o medo e as feridas do passado pode ser uma tarefa difícil, mas vital na construção de uma relação sólida que honre a Deus.",3.714,115.0,,6.9,24.0,en,/z8mTuH7l9dqU8ZW2N5wMJc7ZWtX.jpg,/lbqKo9OITHXglaetK93F6spN05G.jpg,
136666.0,239568.0,Loucuras no México,2014.0,Comédia,Um grupo de amigos decidem investir numa divertida e romântica missão tentar reunir um grande amigo com a mulher que ele esteve perto de se casar.,6.322,93.0,,5.4,138.0,en,/2afgeexneWGIi5w2LUYNpo9QEFk.jpg,/qnhMdtcbZnzcA9cMuZttwosaXji.jpg,
136670.0,323474.0,Blood First,2014.0,Drama|Action|Crime,Two brothers love and loyalty to one another is tested by the code of the streets.,0.861,78.0,"It's blood first, business, then friends... don't ever get them confused.",5.9,5.0,en,,/fvspf36F3Z2bbGWcsd8cAJbZzSF.jpg,
136672.0,282248.0,The Living,2014.0,Thriller,"After an alcohol induced blacked-out night of drinking, Teddy discovers he has severely beaten his wife, Molly. As he attempts to redeem himself to her she must decide whether or not she will take him back as her mother, Angela, continuously expresses her disapproval, all the while her brother, Gordon, falls in way over his head as he tries to hire an ex-con, Howard, to kill Teddy.",3.006,89.0,,5.8,24.0,en,,/9E1RmLv161NuS7ylMvA1wemTn70.jpg,
136674.0,261103.0,A Abelha Maya: O Filme,2014.0,Família|Animação,"Maya é uma jovem abelhinha que, cansada da vida monótona na colmeia, decide viver aventuras épicas ao lado do seu melhor amigo Willy. Mas, como o mundo é perigoso para uma pequena abelha, essa simpática criatura conta a ajuda do gafanhoto Flip.",11.796,79.0,,6.2,130.0,en,/t0YxrTuGC8bKH9hNZEG3KaVnWQq.jpg,/smg2Uf596BuwztwQmb8lt2wAzDk.jpg,
136676.0,279988.0,Extinction,2014.0,Thriller|Adventure,"The amazing footage you will see in this documentary was recorded during an expedition to the Amazon in South America. It has been assembled as per the camera time codes. It has not been altered or tampered with in any way and after extensive testing has been considered absolutely genuine. What you will see will change the way you view the natural world. Are you ready for that? For in the heart of the rainforest, a team of researchers led by the respected Professor John Howson strived to protect endangered and vulnerable species from extinction. But their guides abandoned them after a series of strange and unexplainable events and the team soon got hopelessly lost in the jungle. When events took a horrifying turn, the team realized that they were in the hunting grounds of an apex predator. And now they were the ones on the endangered species list.",7.403,100.0,Nature Has Evolved,4.0,34.0,en,/18qzbskGhbAPjkFrtgPw1utxIF0.jpg,/oep1iDOJsoe2uD067iWNQdTDSqQ.jpg,k1299
136682.0,332662.0,The Scopia Effect,2014.0,Thriller|Horror|Science Fiction,"Reincarnation goes horribly wrong releasing dark forces across time. Basia accesses parts of her mind that should never be tampered with. Past lives merge with present as her reality becomes distorted, she fights for her very existence.",3.322,130.0,Death Should Be A Once in a Life Time Experience,5.1,13.0,en,,/tq0IrdVCrKpB1hon6J7Lt2FexHx.jpg,
136690.0,337218.0,Wild in Blue,2014.0,Horror,"A story about a madman with a movie camera. He's a narcissist, nihilist, sexual sadist and killer of innocent women. His name is Charlie and WILD IN BLUE is his world: a place of evil, violence and perversion where only his camera tells the truth. He set out to make an honest film for you - no lies whatsoever - and after the madness and all the hate, you will love him.",2.653,82.0,,4.8,15.0,en,,/pmhDygZPCgcvX6ryeYp7sROphFn.jpg,k9826
136698.0,327833.0,Skin Trade - Em Busca de Vingança,2014.0,Thriller|Ação|Drama,"Nick, um policial de Nova York, está atrás de uma gangue russa que está envolvida com o tráfico de pessoas, e para afastá-lo, eles matam sua esposa e filha como forma de vingança. Determinado a buscar justiça, Nick segue a guangue até Bangkok para acabar com os seus negócios. Lá, ele e um detetive decidem, juntos, destruir toda a organização e o comércio humano.",44.061,96.0,Dois policiais. Uma missão. Sem piedade.,6.1,176.0,en,/z5V013QpiGmWEYGNOpYchIIwjwo.jpg,/mtihyZb70nIbGm2RlSwKGIDtPtQ.jpg,k779
136714.0,330993.0,Disciples,2014.0,Horror,"A dark twisted apocalyptic shocker about a group of humans and demons who must band together to fight for the fate of humanity. When an ancient prophecy unleashes an evil spirit, hell is brought upon the world.",3.74,90.0,,4.0,8.0,en,,/3VWvGcdFIF3Ycowxf0NW8pr4de2.jpg,
136718.0,220471.0,Onde o Diabo se Esconde,2014.0,Terror|Thriller,"Algo muito estranho aconteceu na pequena aldeia de New Bethlehem, comunidade mantida sob o controle rígido de seus anciãos. Seis meninas nasceram no mesmo dia, de mães diferentes. Talvez mais uma coincidência, ou seria um presságio assustador de algo ainda por vir? Agora, na véspera do aniversário de 18 anos, as jovens estão desaparecendo misteriosamente, uma por uma. Poderia ser este o trabalho de um serial killer? Seria um dos anciãos da aldeia? Ou uma profecia terrível de algo maior?",9.245,86.0,,5.3,93.0,en,/adjmLN1vPxZXMy47gxghoAH0xB2.jpg,/7SgXIot1T40nqxnqnmXQtoiyHuw.jpg,k6152
136722.0,268508.0,Múmia: A Ressurreição,2014.0,Terror,"Em meio as areias do Egito, um grupo de arqueologistas descobrem uma múmia antiga. No processo, elese acabam desencadeando uma praga mortal da sua tumba eterna.",4.825,80.0,,4.0,55.0,en,/rhGGzsyd98xk950HFETPNrlVkHa.jpg,/nVPbuqzGTJCXzycYT4yOuducdm0.jpg,
136728.0,330995.0,Flutter,2014.0,Drama,"With her husband away indefinitely, a young mother struggles to nurture her son in the face of poverty, isolation and incarceration. FLUTTER explores the truest love on earth-the love of a mother and child.",1.753,96.0,An unconditional Love Story,6.1,5.0,en,/twxvL2oSVGMqutCTXvj62wigCRs.jpg,/lps9FHWm1QzByoQTAHYqZopKWEZ.jpg,
136730.0,262866.0,Insegurança,2014.0,Comédia|Ação,"Quando um negócio de segurança doméstica enfrenta tempos difíceis, os proprietários decidem começar a roubar casas locais na tentativa de aumentar sua renda e criar uma necessidade desesperada por seus serviços. O plano parece funcionar perfeitamente até que, na tentativa de acabar com a competição, acabam com mais trabalho do que esperavam.",2.607,93.0,,5.1,13.0,en,,/kn8xtTjqTR8CgvLjDAgp5z8Eifj.jpg,
136764.0,245685.0,Carteiro Paulo - O Filme,2014.0,Família|Comédia|Animação,"Como sempre, o Carteiro Paulo está feliz em cumprir seu dever de entregar cartas e encomendas pela cidade fictícia de Greendale. Um dia, são realizadas audições para o programa de talentos da TV ""You're the One"", em Greendale, que Paulo consegue aprovar. Como Paulo precisa ficar longe de Greendale enquanto participa do concurso, vários robôs Patbot 3000 são implantados para assumir as funções postais de Paulo. Isso logo acaba sendo um plano maligno para dominar o mundo, que Paulo deve agora parar.",4.599,88.0,,4.9,39.0,en,/x1zNrzip2FyjJKrqBhLwku0izrB.jpg,/vHsVk4IlvIKoVp4rE3qmAO6S5wD.jpg,
136784.0,291865.0,From the Dark,2014.0,Terror,Um casal em uma viagem pelo campo irlandês se encontra caçado por uma criatura que só ataca à noite.,5.796,90.0,,5.6,106.0,en,,/aEYLY8DIsXhCngDAT149AmVjaEl.jpg,k1299|k3133
136790.0,275696.0,3 Nights in the Desert,2014.0,Drama,"Com os 30 anos de idade chegando, três amigos decidem comemorar o fato de estarem finalmente entrando, de fato, na vida adulta. Eles, que antes tinham uma banda juntos, se reúnem no deserto para resolver questões pendentes, relembrar o passado e reavivar sonhos esquecidos. Para isso, terão que abrir mão de sua juventude de vez.",3.875,83.0,,4.9,24.0,en,/mdNemj9c8Hp0WnTrknEKyHqNl0z.jpg,/7737whrIW2043oi2hgB9L3Rzlsf.jpg,
136794.0,277610.0,Eat,2014.0,Drama|Thriller|Horror,"Novella McClure is like most struggling actresses in Los Angeles: she's in her early 30s, her fake name sounded cooler ten years ago, and she hasn't landed a role in three years. To top it all off, she's developed a disturbing habit of eating her own flesh. Novella desperately tries to hide her strange condition from her motherly landlord, Eesha, and somewhat psychopathic best friend, Candice, but her body and mind continue to deteriorate in the depressing world of failed auditions and sketchy night clubs. Can a romantic relationship with her psychiatrist prevent her from self destruction? Or will her fatal habit continue to eat away at her?",3.928,92.0,The story of a girl who finds herself - and then eats herself,5.3,39.0,en,,/aITe86bOUaoswzlNfHp4KyWXbPb.jpg,
136796.0,332488.0,Zombie Resurrection,2014.0,Horror,"15 months after the apocalypse, a group of survivors are forced to take refuge in an abandoned school, where they encounter a mysterious zombie with the power to bring the undead back to life.",4.644,79.0,Prey for salvation,4.8,12.0,en,,/5BcR9LEOUa52oJnwv5U5xbsR1mn.jpg,k12377
136798.0,276488.0,Aprisionados,2014.0,Thriller|Terror,Um estranho enigmático é detido na cela de uma delegacia de polícia em noite uma noite remota. O solitário e carismático começa a assumir as mentes de seus companheiros e as dos policiais. Ele começa a influencia-los a dobrar a suas vontades e os seus mal demônios interiores para explodirem em uma noite de sangue e caos.,6.66,92.0,,5.7,235.0,en,/ewy2aJDFtqMzCrDg0wsZ3G2MOpo.jpg,/lVVv2ULxGrzxtXHVIkFIXoMWgCb.jpg,k6149|k6259|k9826|k10714
136808.0,280923.0,Death Factory,2014.0,Horror,"A bus full of strangers find themselves fighting for their lives when one of them reads from an ancient Gothic tome, bringing six dead serial killers back to life, who proceed to hunt them down one by one.",4.327,80.0,Six of the most notorious serial killers.... ARE BACK!,3.5,18.0,en,,/8lO7ALkLHS8IMDe826IDvdkQi1m.jpg,k9826
136814.0,261824.0,X/Y,2014.0,Romance|Drama,"As Mark, Jen, Sylvia, and Jake navigate through their emotionally-arrested states, X/Y reveals the honest and wanton desire we all have to connect with someone and what is at stake when that connection fades.",4.021,82.0,,4.6,19.0,en,/7ziw8iXMjEkbJ9nCkKsDLedYbRb.jpg,/fvOTgIb5cKwr7kbZuWIq6zyfinJ.jpg,
136820.0,319986.0,Grace,2014.0,Drama,"Gracie knows hangovers. She's intimately acquainted with them. But this one? Why did she wake up, half-dressed, on a Florida beach, 1100 miles from home? And this time her father - who also knows about the tragedy of addiction from his struggles with Gracie's mom - isn't going to clean things up.",1.965,95.0,,6.1,4.0,en,,,k188991
136855.0,316744.0,Crazy Bitches,2014.0,Comédia|Terror,"O fim de semana de um grupo de garotas se transforma em um pesadelo quando, uma a uma, elas são assassinadas por sua vaidade.",2.212,100.0,,4.1,16.0,en,/oeWezvXdPo2lwQh5DNZ3yRQguzn.jpg,/rrFNWF6R9yrMmAYwjFMz1c5VUwV.jpg,
136857.0,312791.0,GirlHouse,2014.0,Terror|Thriller,"Um grupo de garotas resolve ganhar dinheiro alugando uma casa e transmitindo suas aventuras eróticas pela webcam. Um maníaco, fã dos vídeos, é desprezado e bloqueado por uma delas e decide se vingar com as próprias mãos.",6.675,100.0,Aproveite o show,6.0,221.0,en,/aoidrQ7c0Z170EvyoDSMDeq1mUV.jpg,/4zR3QYWoeY2mTwVWnVxUQQptqdM.jpg,k9826
136894.0,275657.0,All This Mayhem,2014.0,Documentary,"A searing account of what happens when raw talent and extreme personalities collide. In this unflinching, never-before-seen account of drugs and the dark side of professional skateboarding, brothers Tas and Ben Pappas' intense bond and charisma take them from the pinnacle of their sport into a spiraling world of self-destruction.",3.61,104.0,The rise and fall of skateboarding’s most notorious brothers,7.5,45.0,en,,/6jbwLGjsy2vvWAabKBtXBr8Hhnc.jpg,
136914.0,300600.0,RISE,2014.0,Crime|Thriller|Drama,"Rise follows real life events of a young nurse, Will McIntyre,  who has his freedom taken after a one night stand leads to a  charge of rape. Despite his innocence, he is found guilty upon  trial. We are taken into the maximum security prison where  Jimmy Cove, a hardened inmate, infamous for a string of armed  robberies is positively impacted by Will’s courage and  struggle to make sense of it all. Meanwhile, a Queen’s Counsel  Barrister, Julie Nile, is challenged to compromise her status  and wage to prove his innocence.",2.147,104.0,"Based on a true story, ‘Rise’ sees Will wrongly accused then  stripped of his career and freedom, he must survive maximum   security prison and the infamous Jimmy Cove to prove his   innocence...",6.2,6.0,en,/3j9jb4v4LxlDptmFCNCSxMlDcrt.jpg,/q8AsuiJnx9j28IY1ELkStmhhwM8.jpg,
136920.0,285549.0,Horsehead,2014.0,Fantasy|Horror,"Since her childhood, Jessica has been haunted by recurrent nightmares whose meaning escapes her. This peculiarity has led her to study the psychophysiology of dreams and to follow a therapy with Sean, her mentor and boyfriend, to try and understand the origin of her nightmares. Following the death of her maternal grandmother she hardly knew, Jessica reluctantly returns to the family home. Jessica then begins to wander in a nightmarish world inhabited by twisted versions of her family members. She gradually improves her skills as a lucid dreamer and investigates to solve the mystery that gnaws her and haunts the family home...",4.529,89.0,,5.4,78.0,en,/5v9YtGBrTmIpOP21FgsGWTpGgIj.jpg,/zbRQXLN90LOs7iTnJzNq15WFDn5.jpg,
