movieId,tmdbId,title,release_date,genres,overview,popularity,runtime,tagline,vote_average,vote_count,original_language,backdrop_path,poster_path,keywords
205559.0,527776.0,Mais que Vencedores,2019.0,Drama,"John Harrison (Alex Kendrick) é um treinador de time de basquete de ensino médio que tem seus sonhos arruinados quando a maior fábrica da cidade é fechada, fazendo com que centenas de famílias precisem se mudar. Relutante em mudar de esporte, ele se vê obrigado a treinar corredores, o que acaba o unindo com uma inusitada atleta para ganhar a maior corrida do ano.",85.573,119.0,O que te define?,7.8,150.0,en,/5FUwk37dQDRKs6Xxcw5Vcr5FtZZ.jpg,/lkaemscrvzhVexiS4LYfBE6lvR0.jpg,
205573.0,625561.0,Travis Scott: Voando Alto,2019.0,Música|Documentário,"Junte-se a Travis Scott e os Ragers em um passeio de montanha russa para Astroworld. O documentário inclui imagens nunca antes vistas, incluindo a criação de “Astroworld”, o álbum. A paternidade precoce. A fundação da Cactus Kack. Bastidores exclusivos da turnê e muito mais.  - Documentário original Netflix.",13.66,87.0,,7.0,165.0,en,/fqUPF6mPUNAmAsfUflka3UA2XGg.jpg,/oNOXntnRY7dFrgu1x6bQQmWBVdu.jpg,
205575.0,515741.0,Anjo Meu,2019.0,Drama|Thriller|Mistério,"Lizzie tem dificuldade em aceitar a morte da filha, mas uma esperança surge quando ela conhece Lola, uma garotinha de sete anos. Acreditando que a menina é a criança falecida, Lizzie fica obcecada, colocando todos em perigo.",12.15,98.0,,6.3,180.0,en,/61EpZBNVwXHgJmr0jPKO9qkIWnN.jpg,/dXKtyD0wTtyi7PrMNqA0ZVXM3Mi.jpg,
205583.0,539364.0,Delivery Macabro,2019.0,Terror|Comédia,Uma entregadora de pizza com problemas financeiros precisa lutar por sua vida quando sua última entrega da noite acaba sendo para um grupo de satanistas da alta sociedade que precisam de uma virgem para um sacrifício.,6.008,85.0,,5.2,70.0,en,/7xySmHLRPHy4SyfOLA50IcinewH.jpg,/7nEE8KLQGVim5hiTvVotOeGzME7.jpg,
205661.0,420809.0,Malévola: Dona do Mal,2019.0,Família|Fantasia|Aventura,"Os anos foram gentis com Malévola e Aurora. Seu relacionamento, nascido pelo desgosto, vingança e finalmente amor, floresceu. No entanto, o ódio entre o homem e as fadas ainda existe. O iminente casamento de Aurora com o príncipe Phillip é motivo de comemoração no reino de Ulstead e no reino dos Moors, pois o casamento servirá para unir os dois mundos. Quando um encontro inesperado introduz uma nova e poderosa aliança, Malévola e Aurora são separadas para lados opostos em uma Grande Guerra, testando sua lealdade e fazendo com que elas questionem se podem ser verdadeiramente familiares.",118.446,118.0,Vá além do conto de fadas.,7.4,4693.0,en,/skvI4rYFrKXS73BJxWGH54Omlvv.jpg,/llHTFUeUCWmkW5fR4J9kpa6Asep.jpg,k2343|k3205
205779.0,623392.0,Whindersson Nunes: Adulto,2019.0,Comédia,O megayoutuber Whindersson Nunes fala sobre seu começo humilde e muito mais em uma série de histórias divertidas e músicas engraçadas.,5.585,68.0,,8.1,55.0,pt,/AdREzGcaeCXioDPkYisRBGPCaab.jpg,/oilvqcZDNXpneiouCZEY2qZXmwp.jpg,k9716
205809.0,537055.0,Mulher-Maravilha: Linhagem de Sangue,2019.0,Ficção científica|Animação|Ação|Fantasia,"Veja a origem lendária de um dos renomados membros da Liga da Justiça, Mulher Maravilha, conforme ela enfrenta o mal com sua espada e seu laço mágico. Determinada e igualmente forte no corpo e no coração, ela assume a missão de ajudar uma jovem garota problemática que foi recrutada por uma organização mortal conhecida como Corporação Vilania, cujos membros criminosos almejam invadir Themyscira, o lar paradisíaco de nossa heroína. A batalha será épica, porque se há uma coisa que as Amazonas conhecem bem, é a guerra!",32.529,83.0,,7.2,326.0,en,/evBWuv3S9AOTwEop6goE3xs1MH0.jpg,/ulPe6Zqkr4ZODmOFJ67ef9MWh9A.jpg,k9715
205827.0,626040.0,Fanatic,2019.0,Thriller,This one-night stand was supposed to be harmless. Until it came back to haunt him -- and the ones he loves.,2.302,91.0,Her Obsession. His Nightmare.,4.2,5.0,en,/3IIOow1PUvml3N5QRlP333vtyui.jpg,/fBOPxcus8j1fvShP3nVUM9LeH9K.jpg,
205841.0,539651.0,Correndo Contra o Tempo,2019.0,Ficção científica|Thriller|Mistério|Crime,"Anos depois de ter toda sua família morta de maneira brutal em um aparente assassinato, um homem recebe uma estranha ligação de uma das falecidas. Convencido plenamente de que está ficando louco, seus limites são testados quando ele começa a se questionar se há alguma espécie de conspiração por trás de tudo ou se finalmente sua sanidade está indo embora.",14.861,103.0,Correndo Contra o Tempo,6.9,215.0,en,/7TWBC3JzOB0IeFKYjMQ1arTlTm8.jpg,/63pDQtG3PfTnJIKpAMZpZHKA13D.jpg,
205857.0,491283.0,Judy: Por Trás do Arco-Iris,2019.0,Drama|História|Música,"Inverno de 1968. Com a carreira em baixa, Judy Garland (Renée Zellweger) aceita estrelar uma turnê em Londres, por mais que tal trabalho a mantenha afastada dos filhos menores. Ao chegar ela enfrenta a solidão e os conhecidos problemas com álcool e remédios, compensando o que deu errado em sua vida pessoal com a dedicação no palco.",13.33,118.0,,6.8,861.0,en,/hJXxDoCwchAuJ4K3gwtno2chgr8.jpg,/1frazS4iRtqLG2lcJKuoLaqRTo4.jpg,k264384
205945.0,537061.0,Steven Universo - O Filme,2019.0,Animação|Família|Fantasia|Música|Cinema TV|Ficção científica,"Steven acha que seu tempo de defesa da Terra acabou, mas quando uma nova ameaça chega a Beach City, Steven enfrenta seu maior desafio.",36.803,82.0,,8.4,608.0,en,/re3ZvlKJg04iLpLRf1xTKHS2wLU.jpg,/ahA8oEtJuHLeSDSghIhZU7gWxWX.jpg,
205955.0,565591.0,Memory: As Origens de Alien,2019.0,Documentário,"Documentário que explora as origens do filme Alien (1979), enraizadas nas mitologias grega e egípcia, em quadrinhos underground, na parasitologia, na ficção de H.P. Lovecraft, na arte de Francis Bacon e na simbiose entre o escritor Dan O’Bannon, o designer H.R. Giger e o diretor Ridley Scott.",7.257,95.0,,6.2,45.0,en,/otCCPSoJnR4d0MtXzu3hdc6XOvr.jpg,/y65pt43FJENU4ANR83MdRhVdZ45.jpg,
205982.0,600335.0,Kardec,2019.0,Drama|História,"A biografia do educador francês Hypolite Leon Denizard Rivail, reconhecido mais tarde como Allan Kardec. Além de tradutor e escritor, Kardec é conhecido por ter codificado o espiritismo, uma das doutrinas mais praticadas no Brasil. Ele escreveu os cinco livros que compõem a Codificação da Doutrina Espírita, entre eles ""O Evangelho Segundo o Espiritismo"" e ""O Livro dos Espíritos"".",5.823,110.0,A história por trás do nome,6.7,61.0,pt,/iM2nGYS8oz2LqShBFpmQKd9pTgg.jpg,/gDfki2cMZnwHOUKNfVNWiRNMGht.jpg,
205986.0,627939.0,Survival Box,2019.0,Thriller,The gripping story of a handful of high school kids trapped in a wealthy Philadelphia family's backyard bunker.,2.026,85.0,7 friends. 20 feet underground. No escape.,5.8,11.0,en,,/aGJwofr8ngK5Z9GJw1eMoACnM2O.jpg,
205992.0,616584.0,Melanie Martinez: K-12,2019.0,Música|Terror|Fantasia,"Neste filme musical misteriosamente encantador de Melanie Martinez, Cry Baby, uma garota forte e sensível, é enviada para uma escola perturbadora do sono que se opõe severamente à individualidade. Com a ajuda de seus amigos mágicos e um Guia Angélico Espiritual, eles ganham a força que precisam para lutar contra a equipe maligna da escola e derrubar o sistema escolar opressivo do K-12.",10.676,96.0,,7.7,197.0,en,/m1M2JVjrSsoXSEjE7UdF3WBomKj.jpg,/nVi0yBBPj5Z96JgGWVIg94kv7bR.jpg,
205994.0,599777.0,They Come Knocking,2019.0,Horror|TV Movie,"After losing his wife to cancer, a father takes his two daughters on a road trip where he finds his family in the crosshairs of terrifying supernatural entities.",9.13,85.0,It's Father's Day of reckoning.,5.8,51.0,en,/qpomfWUHaUM0SjcCCTHHAeJ4t9N.jpg,/h6e5hOLb8gNzzyL3dJKixXYqZno.jpg,
205998.0,601083.0,Fronteira do Medo,2019.0,Terror|Thriller|Cinema TV,Uma mulher mexicana que viaja pela fronteira do Texas à procura do Sonho Americano acaba dentro de uma realidade virtual que simula ser o que ela procurava.,4.679,91.0,,5.6,25.0,en,/utVbqqAVDD7dy8NacUZ9Nx8IqCJ.jpg,/2OYXJ3zR7Q44RNY1ZFaLBfs2g4d.jpg,k8201
206008.0,575788.0,2040,2019.0,Documentário,"Preocupado com o futuro da filha, o cineasta Damon Gameau viaja o mundo em busca de novas abordagens e soluções para as mudanças climáticas. Ele se reúne com inovadores e agentes de mudança em muitos campos para criar uma visão de como essas medidas poderiam regenerar o mundo para as gerações futuras.",2.54,92.0,,6.6,28.0,en,/bi5X5qcuiSuhEunkRVVynpbetDI.jpg,/cEDynsKw3B0BzLyTRxRckSPax4Q.jpg,
206018.0,509853.0,Fanático,2019.0,Crime|Thriller,"Moose é um fã fanático que faz de tudo para conseguir um autógrafo de seu maior ídolo, Hunter Dunbar. Quando as ações de Moose começam a mudar, Dunbar logo se vê à mercê de seu perseguidor cada vez mais perigoso.",20.222,88.0,Quando o sonho de Hollywood se torna um pesadelo.,4.6,192.0,en,/ued7mN6bSZCiq667wdhmkUYZOgJ.jpg,/qaSbNW4jfGhxiBJM4BOEqkDwIrG.jpg,k9826
206036.0,616844.0,Impura,2019.0,Terror|Cinema TV,"Uma garota de 17 anos, cuja imagem aparece na campanha do movimento pela castidade de sua cidade, é atormentada por uma presença sobrenatural sinistra.",4.257,86.0,,5.7,31.0,en,/6C6SpTywoirL7HaCsvjcZPKgXWM.jpg,/hbn0EHzdDW8hLZOCGuf6FgQ7gev.jpg,
206068.0,513372.0,Hoax,2019.0,Horror,"An investigation into a camping trip gone wrong turns into a fight for survival when a team, including a brilliant primate specialist and led by a ruthless television producer, must come to grips with the possible existence of Bigfoot.",3.759,96.0,The Truth... Can Kill.,4.7,25.0,en,/c7scuAGv2t3gnwEvziRSHyjhULX.jpg,/hK7s0dsNLGyEFokHyvyyTj1KCYL.jpg,k5774|k9720|k9826
206071.0,565718.0,David Crosby: Remember My Name,2019.0,Documentary|Music,"You thought you knew him. Meet David Crosby now in this portrait of a man with everything but an easy retirement on his mind. With unflinching honesty, self-examination, regret, fear, exuberance and an unshakable belief in family and the transformative nature of music, Crosby shares his often challenging journey.",7.032,95.0,Who are you when the lights have gone out?,6.7,11.0,en,/m4fZRsub0P7qP8Sj9pmecXbQxwx.jpg,/7JQVQcP82yNHhZjZ5P5aQumrVsm.jpg,
206093.0,616904.0,Universo Anime,2019.0,Documentário,Você sabe o que é anime? Mergulhe nesse universo em entrevistas com as mentes mais notáveis do gênero e descubra a resposta.,4.478,58.0,,5.8,51.0,en,/wcvqUnNRzgaSb8lAA3i6G2kwbXt.jpg,/au7OEQKgYna0lX6ZnHcvndeedAk.jpg,
206103.0,541578.0,Screwball,2019.0,Documentary|History,Investigates the MLB's infamous doping scandal involving a nefarious clinician and his most famous client: the New York Yankees' Alex Rodriguez.,5.442,105.0,"A batsh*t tale of steroids, schemeres and baseball stars",6.3,21.0,en,/dqSlQWxcJZ6mM5ZIE7VzAVGaks9.jpg,/wJ7pHgBc6jHTrYYlQs2ToMmEz1r.jpg,
206109.0,587332.0,Avenues,2019.0,Drama,"On his 25th birthday, following the death of his brother, Max and his best friend Peter wander the wintry streets of Manhattan, contemplating life, livelihood, and what it means to be adult.",3.518,76.0,,7.3,8.0,en,/pAcFyuQWfXNEF4S0YAPCSIU8XIi.jpg,/miq2i3QPQPdAYc3kpfXVRQONzwj.jpg,
206117.0,604196.0,The Lonely Island Presents: The Unauthorized Bash Brothers Experience,2019.0,Comedy|Music,The Lonely Island spoofs Jose Canseco and Mark McGwire in this visual rap album set in the Bash Brothers' 1980s heyday.,5.217,30.0,,6.2,76.0,en,/t2apQWKAn58VohPdML2BDPGrpkK.jpg,/dUrrHBV64W4BwXSzMlGdqjDdWIW.jpg,
206131.0,602198.0,Em Busca de Zoe,2019.0,Drama|Mistério,"Faz um ano desde que sua irmã foi assassinada, mas Echo (Laura Marano) não consegue superar o ocorrido. A vida familiar está um caos, sua mãe toma muitos remédios e seu pai trabalha demais. No entanto, quando o antigo namorado de sua falecida irmã aparece com um diário, ela descobrirá muitos segredos escondidos.",10.361,95.0,,6.0,128.0,en,/cFp1VCRLbF7AP6gpUV3iEnuVB5M.jpg,/uqotnP1wZ7tn03cFmbzPFLRYx8O.jpg,
206133.0,508138.0,Uma Noite Infernal,2019.0,Thriller,"Melinda é solitária e instável, que está cansada de ser ofuscada por Sheila, sua colega de trabalho mais confiante e extrovertida. Quando o posto de gasolina é mantido sob a mira de uma arma por Billy, um homem desesperado que precisa de dinheiro rápido, Melinda encontra uma oportunidade de fazer uma conexão com o ladrão, independentemente de quem se machuque.",28.64,89.0,Deixe queimar.,6.1,151.0,en,/3C14xx4RteMksSUwgYfI52B8Iu6.jpg,/gHYWdnCcjb543TjpxxHCLnNzHZr.jpg,
206135.0,600892.0,O Jogo da Tortura,2019.0,Terror,"Uma mulher se inscreve em um jogo de resistência à dor na esperança de ganhar um prêmio de um milhão de dólares. Mas, ela logo descobre que o verdadeiro adversário é o homem que está comandando o jogo, já que ele usa métodos horríveis para manipulá-la e derrotá-la.",5.148,107.0,,5.7,31.0,en,/c1ujTXonJn9hb1wCiv4LGbm5Foe.jpg,/z4mNjHOeDJpmNMR588FwqpV9RUr.jpg,
206150.0,340104.0,Lucy in the Sky,2019.0,Drama|Ficção científica|Thriller,A astronauta Lucy Cola retorna à Terra após uma experiência transcendente durante uma missão no espaço e começa a perder o contato com a realidade em um mundo que agora parece pequeno demais.,9.233,124.0,,5.0,123.0,en,/rtpDfc1bYmSHLp8VK8xjxkolQY4.jpg,/ofhOB6EGSBqzGHA0MStMx9zWnML.jpg,
206152.0,566233.0,Raise Hell: The Life & Times of Molly Ivins,2019.0,Documentário,"Molly Ivins tinha 1,80 metro de problemas no Texas, um jornalista político presciente, autor de best-sellers e guerreiro do Bill of Rights. Ela não fez prisioneiros, deixando os dois lados do corredor rindo e desejando mais de sua sagacidade afiada. É hora de criar o inferno como Molly!",3.177,91.0,,7.2,5.0,en,/uUa6qR7CXLKpm42xZNTeAMMemzN.jpg,/rWrest5rxn9SYMLHNgM2RP1oanX.jpg,
206194.0,608504.0,Fiddler: A Miracle of Miracles,2019.0,Documentary,"The origin story behind one of Broadway's most beloved musicals, Fiddler on The Roof, and its creative roots in early 1960s New York, when ""tradition"" was on the wane as gender roles, sexuality, race relations and religion were evolving.",4.118,97.0,,6.8,10.0,en,/vf6VwtlTwQzQjG4LJOLsDB057t5.jpg,/kpSmPJJ53kFpblb8I0dhF658PNS.jpg,
206208.0,625128.0,Bill Burr: Paper Tiger,2019.0,Comedy,"Comedian Bill Burr talks male feminists, outrage culture, robot sex, and cultural appropriation in this standup comedy special shot in London.",5.635,67.0,,7.3,93.0,en,/duaRjNWKR3QjZOaWhHKxk9ZDIz3.jpg,/zho1ypBSxia3bHCSeB4Znpzh7nM.jpg,k9716
206216.0,444055.0,Billion Dollar Bully,2019.0,Documentary,"Today consumers Yelp everything from restaurants to dentists; plumbers to surgeons. The small business community sees Yelp's sales tactic as extortion. Does Yelp genuinely have an interest in helping people support the best local businesses, or are they a pay-to-play advertising platform?",2.344,82.0,,9.3,3.0,en,/BgMF4MPb23NepErrU6QNP7gBWM.jpg,/yMya3T5jvequSGah6D6nG0d8Sqs.jpg,
206218.0,592966.0,No Doubt,2019.0,Comedy|Romance,After connecting on an online dating site a young man and woman spend an evening together and connect ways they never imagined.,0.887,71.0,,4.9,6.0,en,/e5B6Z04H11sJucy34daXsnAfxTk.jpg,/wR4tf9b4KTyFiLNlRrv24cFIsWF.jpg,
206268.0,596980.0,Linda Ronstadt: The Sound of My Voice,2019.0,Documentary,"With one of the most memorably stunning voices that has ever hit the airwaves, Linda Ronstadt burst onto the 1960s folk rock music scene in her early twenties.",4.267,95.0,She broke all the rules.,7.7,21.0,en,/ciRQXaaxWkEOL6HE3zB4ILkYKCF.jpg,/qesNFICo3d9oj044hXK5qHjmovI.jpg,
206272.0,517116.0,A Casa do Terror,2019.0,Terror|Thriller,"No Halloween, um grupo de amigos encontra uma casa assombrada 'extrema' que promete alimentar-se dos seus medos mais sombrios. A noite torna-se mortal quando eles chegam à terrível conclusão de que alguns pesadelos são reais.",31.697,92.0,,6.7,697.0,en,/gjysasbU9gKgbu7yW7Z1aonoiTg.jpg,/pRapSkoVtHeXDPfUP4883njzIJ3.jpg,k3335
206274.0,483096.0,Gags The Clown,2019.0,Thriller|Horror|Comedy,"It's been eight days since the clown first showed up in Green Bay, WI. Now, over the course of one night, four different groups of people cross paths with the clown everyone calls ""Gags"" and his true intentions are finally revealed.",3.421,89.0,The Joke's On Us...,5.3,12.0,en,/eBcvQfWEcuGvCWejvZFWEjyi39W.jpg,/Aqr533DKYJZtwu1LdqiE5VHsPfy.jpg,
206293.0,625450.0,Crush à Altura,2019.0,Comédia|Drama|Romance,"Jodi é uma adolescente que tem que lidar com as inconveniências de ser a garota mais alta da escola. Tudo muda quando ela se apaixona por um bonito (e igualmente alto) intercambista, que vai morar na casa do melhor amigo de Jodi. Como resultado, Jodi se vê embolada num triângulo amoroso inesperado, que a ajuda a perceber que ela é bem mais do que suas inseguranças a faziam acreditar.",25.502,101.0,,6.4,1493.0,en,/8wfPjfUgmGpqCIW6gS0pS0pixnA.jpg,/o8rxwauv1GXVzx5N89QQ4SgUvYN.jpg,
206307.0,566232.0,"Miles Davis, Inventor do Cool",2019.0,Documentário|Música,"Um visionário, inovador e criador que desafiou a categorização e incorporou a palavra cool: uma incursão na vida e na carreira do ícone musical e cultural Miles Davis.",7.238,116.0,,7.3,53.0,en,/h4i7qGYxBXfxQcdgb6b8iSh9EMz.jpg,/haVC9AnnL1XE8uegdLTheM08K1N.jpg,
206325.0,612587.0,A.M.I.,2019.0,Terror,Uma garota de dezessete anos se vê em um relacionamento com uma inteligência artificial em seu smartphone e acaba em uma fúria assassina,5.615,77.0,,4.5,33.0,en,/1GYIRo2gAjVCjafgl2Lc0VGwhl3.jpg,/gMLRkQ1sBITIBTAaXlrJVfF3WFP.jpg,k1326|k9826|k10714
206329.0,489064.0,Os 3 Infernais,2019.0,Terror,"Após escapar da prisão onde viveu por 10 anos, Otis (Bill Moseley) conhece Winslow (Richard Brake) e organiza um plano para libertar sua irmã Baby (Sheri Moon Zombie), também. Os ""Rejeitados do Diabo"" então fogem para o México, matando inúmeras pessoas pelo caminho.",14.27,115.0,,5.9,277.0,en,/3reT93yfyvJD09NdrrXTbBfGnzq.jpg,/jmNEdjIerEEejsnQRbqSxE51lRy.jpg,k9826
206345.0,565341.0,O Som do Silêncio,2019.0,Drama,"Em Nova York, um técnico faz sucesso com um novo sistema capaz de alterar os sons nas casas das pessoas para que estejam de acordo com o humor dos habitantes. Acostumado a lidar com dezenas de pessoas diferentes, sua vida muda quando ele conhece uma cliente com um problema aparentemente impossível de resolver.",6.137,87.0,,5.9,24.0,en,/mrH2HxDl0p7evhNqSGN7SIYpVRG.jpg,/mr9k5YE4Lu4SiCXyiVZ5u0kKLST.jpg,
206357.0,625331.0,À Sombra das Torres - O 11 de Setembro em Stuyvesant,2019.0,Documentário,"Quando as Torres Gêmeas foram atacadas em 11 de setembro de 2001, os estudantes estavam apenas começando o dia em Stuyvesant, uma escola pública de prestígio em Nova York, a poucos quarteirões do World Trade Center. Este documentário narra esse dia trágico e suas consequências do ponto de vista dos ex-alunos de Stuyvesant.",5.663,35.0,,6.8,10.0,en,/48bjQ0qyXuuTlMxwdKkq5BVyMbA.jpg,/74re1Z4qF6p6QeP4Tq6YMasu3d0.jpg,
206383.0,522464.0,Palm Beach,2019.0,Comédia|Drama,"Um grupo de amigos se reencontram para comemorar um aniversário especial, com a icônica Palm Beach de Sydney proporcionando um cenário deslumbrante para o drama que se desenrola. Os bons tempos rolam, com muitas gargalhadas, refeições suntuosas, vinho fluindo e música fantástica, mas lentamente aumentam as tensões e surgem segredos profundos..",6.946,100.0,,5.9,19.0,en,/ksrNUYB5Ga2boCchEketSEJl247.jpg,/fAq7S0aBrrQUjhzVSFu4LzcLkq4.jpg,
206387.0,529459.0,Variações: Guardian Angel,2019.0,Music|History|Drama,"Film biography dwelling on the hectic artistic life of António Variações, a famous Portuguese pop rock singer from the 80s, who died from AIDS-related complications in 1984.",2.86,109.0,,7.5,22.0,pt,/fgUoRzSrxylUoRAlyUpORcSedLe.jpg,/mK0kFykY6zHMIJvIQGIpC6mCabW.jpg,k264384
206395.0,630068.0,Comedy Central Roast of Alec Baldwin,2019.0,Comedy|Documentary,"Sean Hayes serves as roast master as it is Alec Baldwin's turn in the hot seat. Robert De Niro, Jeff Ross, and Caitlyn Jenner among others take jabs at the actor/comedian.",5.399,65.0,,7.1,15.0,en,/l15MYJOSm7MFDuKep0edWWhWAXn.jpg,/vbasQnawBPneKDRneBvmfIe9phf.jpg,k9716
206399.0,576017.0,Para Sama,2019.0,Documentário|Guerra,A cineasta Waad al-Kateab filmou durante cinco anos sua vida na cidade de Aleppo tomada por rebeldes durante a rebelião síria.,7.489,95.0,Para Sama,8.3,188.0,en,/srNZKMACevekfN9Ca0C92gMvI7A.jpg,/w8ZytqAN2B56ejEvIVjubVNL3oo.jpg,
206403.0,447034.0,Um Romance nas Entrelinhas,2019.0,Drama|Romance,A história não contada do fascinante envolvimento amoroso entre a lendária escritora Virginia Woolf (Elizabeth Debicki) e a socialite e autora popular Vita Sackville-West (Gemma Arterton). Seleção do Festival de Toronto 2018.,7.67,110.0,,6.9,120.0,en,/fSOx3U1EUhJ3I4QnbldBwyqxEkw.jpg,/wzHj5QGYvMYymW4zY6aWFlZCWrZ.jpg,k9672
206415.0,512239.0,Teia de Corrupção,2019.0,Crime|Thriller,"Em Londres, o lutador de boxe Liam McDonagh sai da prisão com um único desejo: reatar o laço com seu filho e levar uma vida tranquila. Mas, quando descobre que seu irmão mais novo, Sean, está envolvido com criminosos de alto escalão, ele não vê alternativa a não ser arriscar-se novamente no ardiloso submundo do crime.",5.945,103.0,,6.2,41.0,en,/vfXQtrT70gauTsFHldxwx78iiLW.jpg,/jg1w7AVT0RtsGWn9uvETVefy50H.jpg,
206419.0,551332.0,Dois Papas,2019.0,Drama|Comédia|História,"A relação e as diferentes visões dos dois líderes mais importantes e poderosos da Igreja Católica na época, o Papa Bento XVI (Anthony Hopkins) e o Cardeal Jorge Mario Bergoglio (Jonathan Pryce), que depois veio a ser o Papa Francisco.",13.485,126.0,,7.6,2232.0,en,/mHz65gYQ3SmkQH3GKWSKWUkK5zW.jpg,/zqej6JbM15wolmXe3KqnZEtak1O.jpg,k9672
206423.0,598065.0,Tommaso Buscetta: O Nosso Mafioso,2019.0,Documentário|História,"A história de como o chefe mafioso siciliano Tommaso Buscetta (1928-2000), o Padrinho de Dois Mundos, revelou, a partir de 1984, os segredos mais profundos da organização, ajudando a condenar as centenas de mafiosos que foram julgados no julgamento realizado em Palermo entre 1986 e 1987.",5.485,93.0,,6.5,54.0,en,/gkfjclGZef5PS8Xm5c7XfZPCxdW.jpg,/sS6by6VYUJnR4MC9r9XwNMl5B1x.jpg,
206429.0,530227.0,Um Jovem com Muito Potencial,2019.0,Crime|Thriller,"Trabalhando exclusivamente em casa, o estudante de computação Piet tem sérias dificuldades de socialização. Após conhecer Klara em um projeto, Piet se apaixona por ela. Desesperado e solitário, sua paixão pode acarretar trágicas consequências.",3.045,85.0,,6.2,18.0,en,/1pSXsZAMenov1rzo6ATAWk2FfPj.jpg,/wN9htSUqw1nxC6WwH9USeiSfya1.jpg,
206431.0,565276.0,"Love, Antosha",2019.0,Documentary,"From a prolific career in film and television, Anton Yelchin left an indelible legacy as an actor. Through his journals and other writings, his photography, the original music he wrote, and interviews with his family, friends, and colleagues, this film looks not just at Anton's impressive career, but at a broader portrait of the man.",5.439,92.0,The extraordinary and unfinished life of Anton Yelchin.,7.0,30.0,en,/271s2hYoC5gqkR3E2f9BTYz8Bjv.jpg,/AntNP1sX7qKBT7hSYM4248RKMaL.jpg,
206457.0,565340.0,Ms. Purple,2019.0,Drama,"Kasie, stuck in LA’s Koreatown, works as a karaoke hostess getting paid for her companionship by drunken men. When her dad’s hospice nurse quits she reconnects with her estranged brother, Carey, forcing them to enter a period of intense self-reflection as their single father who raised them nears death.",3.241,88.0,,6.4,12.0,en,/mxetce9AsjnFOQLD6RpnWAlaEdO.jpg,/4Bdpl2i0nx1sgYCahwh4xeG21t0.jpg,
206497.0,565531.0,Onde Está Meu Conselheiro?,2019.0,Documentário,Corrompido. Impiedoso. Poderoso. Desprezível. Conheça o maior vilão da história da política.,5.399,97.0,,5.6,9.0,en,/kwVtMS75fciI3kP6AyjN3xDK5QZ.jpg,/dMu1szdo0akDa1dOgBaVn3up86e.jpg,
206499.0,584962.0,Between Two Ferns - O Filme,2019.0,Comédia,"Zach Galifianakis sempre sonhou em se tornar uma estrela. Mas quando Will Ferrell descobriu seu programa de acesso publico Between Two Ferns e publicou no Funny or Die, Zach virou um motivo de piadas viral. Agora, ele e sua equipe resolvem fazer uma viagem de carro para completar a série de entrevistas com celebridades do alto-escalão para restaurar sua reputação.",10.503,82.0,,5.9,560.0,en,/bffxv4SSJefy3CdgSqVTlWbRiOt.jpg,/cHxc8v1GkzdjjhF2qnpG6wdXrOT.jpg,
206501.0,416682.0,Ambition,2019.0,Thriller,"A young aspiring musician preparing for a competition, is incredibly confidant and gets herself involved in a frightening trap that she has to find her way out of. It raises the question: If an insane person is telling a story, is it real?",2.615,87.0,,5.1,10.0,en,/idWD9HpKPwEdSHq7o5vg5QzPVWW.jpg,/3NfOYiJspBptcSeTg7x5OOWAc8I.jpg,
206527.0,619278.0,O Plano Perfeito 2,2019.0,Ação|Thriller,Um negociador de reféns da NYPD se junta a um agente federal para resgatar dezenas de turistas mantidos reféns durante um sequestro de 10 horas no U.S. Federal Reserve.,19.626,105.0,,6.7,211.0,en,/5vyL5X9f1BMtUIFDSvrfKKvMtGG.jpg,/jhil4YZedFIT151N6BRkgKZebcI.jpg,
206633.0,470897.0,Estranho Mas Verdade,2019.0,Thriller,"Uma mulher surpreende a família do namorado falecido, dizendo que está grávida do filho dele.",9.182,96.0,Algumas coisas são impossíveis de conceber.,5.8,99.0,en,/aJW54WSihb4xRYjZW5ed7Oz3ATn.jpg,/uLONkqT3TGUJHN6enTSiQGRuViz.jpg,
206653.0,510388.0,Vilões,2019.0,Comédia|Terror|Drama,"Mickey e Jules são amantes em fuga, rumo ao sul para um novo começo no Sunshine State. Quando seu carro morre após um assalto a um posto de gasolina, eles invadem uma casa próxima em busca de um novo par de rodas. O que eles descobrem, em vez disso, é um segredo obscuro e um par de proprietários que farão de tudo para impedir que ele se espalhe.",6.918,90.0,,6.3,211.0,en,/z9Ipktaq5ZF4WAPFkQqnmPugd3I.jpg,/nFDevg9HeRftVxGGkvriABJO2VF.jpg,
