movieId,tmdbId,title,release_date,genres,overview,popularity,runtime,tagline,vote_average,vote_count,original_language,backdrop_path,poster_path,keywords
120610.0,222370.0,Jim Breuer: And Laughter for All,2013.0,Comedy,"Replete with long-form stories of family life, how he really got started as a comedian and his love of 1980s metal, Jim Breuer's hilariously personal stand-up special finds the ""Goat Boy"" comic at the top of his game.",0.727,58.0,,5.2,3.0,en,,/15Fi5AVVENEgVvgZFrLxlRK8xTE.jpg,k9716
120621.0,207871.0,Savannah,2013.0,Romance|História|Drama|Família,"Apesar de ser o herdeiro de uma grande plantação, Ward Allen (Jim Caviezel) nunca se conformou com uma vida de privilégios. Em pleno começo do século XX, ele prefere abandonar todas as suas posses e percorrer as estradas junto de seu maior amigo, o escravo liberto Christmas Moultrie (Chiwetel Ejiofor). Os dois lutam por justiça e liberdade contra os habitantes ricos da região. Em seu caminho, Allen se apaixona por uma mulher da alta sociedade (Jaimie Alexander), disposta a enfrentar seu poderoso pai para se casar com o homem que ama.",3.171,101.0,,6.4,22.0,en,/v8Y4cmPBqA7DxSE6iDICDJ7RIPH.jpg,/6MAuG6SU0yTIvCweElDNBXcofwQ.jpg,
120831.0,203534.0,Dealin' with Idiots,2013.0,Comedy,"Faced with the absurd competitiveness surrounding his son's youth league baseball team, Max Morris, a famous comedian, decides to get to know the colorful parents and coaches of the team better in an attempt to find the inspiration for his next movie.",4.764,86.0,,5.6,24.0,en,/8qwHzo2CgQHFmrOBW1FnUEXX4Eb.jpg,/c52xgJjiebRyGRFoH0Tybgvh8qg.jpg,
120845.0,199591.0,Presa Na Escuridão,2013.0,Thriller|Drama,"Sara Taylor, uma fotojornalista que ficou cega durante a guerra do Iraque, é forçada a entrar num jogo mortal de gato e rato com o sádico Hollander e o seu violento cúmplice Chad – dois homens que só vão parar quando conseguirem o que querem… uma fortuna em diamantes roubados que estão escondidos no apartamento de Sara. Sara jura não saber onde estão os diamantes, mas Hollander não desiste, e utilizando jogos psicológicos e tortura física, vai aplicando os seus horríveis truques com o objetivo de quebrar a resistência de Sara. Mas apesar de cega, Sara não é uma mulher indefesa. Ela luta. À medida que o suspense cresce até um clímax perturbador, Sara provoca um apagão que mergulha todo o apartamento na escuridão. Agora, a vantagem está do seu lado. Mas será o suficiente para salvá-la?",19.502,90.0,,5.8,127.0,en,/eTkN3Hs5T8xKSwH0AEzj3xKn4zV.jpg,/u4Yww5A1ndSDkqNYEQFyBaKzX1j.jpg,
120855.0,157301.0,Adam and Dog,2013.0,Animation|Drama,"The story about the dog of Eden. What happened in those first days of Creation that made Man and Dog so inseparable? The dog, as he lives through this curious world, encounters a strange creature; a human being named Adam - and with that discovers a new found connection to the world.",2.352,16.0,,6.6,42.0,en,/e1h6nlQrvR6OxIYdydmfUTeZyTf.jpg,/6u1NFKH6iccY54VAio46Ucjdfma.jpg,
120867.0,241287.0,Tropico,2013.0,Fantasy|Music|Drama,"Based on the Biblical story of sin and redemption, Adam and Eve explore modern LA; the land of gods and monsters.",2.412,27.0,"A tale of redemption told to the music of Body Electric, Gods & Monsters and Bel Air.",8.0,48.0,en,/yAQcGKXM8yM3DRGEWIIX4WNp9SO.jpg,/rCnuZ2lvwyyEoiWoefbrgrHZVdB.jpg,
120952.0,84197.0,Filly Brown,2013.0,Drama|Music,"“Majo” Tonorio, a.k.a. Filly Brown, is a raw, young Los Angeles hip-hop artist who spits from the heart. When a sleazy record producer offers her a crack at rap stardom, Majo faces some daunting choices. With an incarcerated mother, a record contract could be the ticket out for her struggling family. But taking the deal means selling out her talent and the true friends who helped her to the cusp of success.",3.354,100.0,This is my life.,6.6,14.0,en,/3zkkcYlzWThtyQApPLOLeRgo3EI.jpg,/5CdRIAll52h0s0cbFH0VKiCp7pg.jpg,
121027.0,212756.0,Stay,2013.0,Drama,A woman finds out she's pregnant and returns home when the expected father wants nothing to do with her.,3.538,99.0,,4.8,12.0,en,,/l2eK1OqZBzbNO0DLgKatKmcVky6.jpg,
121115.0,230222.0,Tarzan  - A Evolução da Lenda,2013.0,Animação|Ação|Aventura|Família,"Após seus pais serem mortos, um bebê é criado por uma gorila, que passa a tratá-lo como se fosse seu filho. Ao crescer ele se torna Tarzan (Kellan Lutz), o rei da selva. É quando precisa enfrentar um exército de mercenários enviado à floresta por um malvado executivo da Greystoke Energies, a empresa que um dia pertenceu aos pais de Tarzan. Para enfrentá-los ele conta com a ajuda de Jane Porter (Spencer Locke), uma jovem que chega à floresta após um acidente no avião em que estava.",12.907,94.0,,5.7,486.0,en,/7KiBr9MNqcNNJKj6FkEGfNHSAsH.jpg,/wIg7TclH6PUcvTWFh0QdtU5Wcvt.jpg,k818
121135.0,78383.0,A Enfermeira Assassina,2013.0,Terror|Thriller,"Abby Russell (Paz de la Huerta) é uma enfermeira responsável e amorosa. No entanto, quando a noite cai e ela termina o emprego, esta mulher sedutora usa as técnicas mais violentas e cruéis possíveis para punir os homens que cruzam o seu caminho.",18.093,84.0,,5.2,293.0,en,/4N0V8UW8u3JhH0NteA86T5otZJL.jpg,/k82jk8ZWy1W5NzI7NFnTvGUhrmF.jpg,k9748
121155.0,181330.0,Kevin Hart: Let Me Explain,2013.0,Comedy|Documentary,"Captures the laughter, energy and mayhem from Hart's 2012 ""Let Me Explain"" concert tour, which spanned 10 countries and 80 cities, and generated over $32 million in ticket sales.",6.454,74.0,Witness the rise of a legend,6.9,172.0,en,/fe89gg48SzmKaokXoyZISRwIRDO.jpg,/lzYQkVuEN0zw2JvJsMUsOU47nb4.jpg,k9716
121178.0,174645.0,Java Heat,2013.0,Action|Crime|Drama|Thriller,An American in Indonesia teams up with a Muslim cop to track down a terrorist.,4.364,104.0,,5.8,61.0,en,/80NkeBRqYaKpFJKDB2y3y05RRRm.jpg,/3jQZRqGnqTlwomPZyGziTSSIy6H.jpg,
121182.0,72359.0,Peeples,2013.0,Comedy,The story follows what happens when a child psychologist surprises his girlfriend by showing up at her political family's annual get-together at their Sag Harbor vacation home only to find them desperately in need of therapy.,4.094,95.0,,5.4,52.0,en,/lw0C0wuJoOB3yy4RXrdzL42dnhm.jpg,/6ZBSsBfxKK5GdTzz1BOKGl4BnzJ.jpg,
121196.0,209901.0,Nothing Left to Fear,2013.0,Horror,"Wendy, her husband Dan and their kids have just moved to the small town of Stull, Kansas, where Dan is the new pastor. But in this sleepy community of friendly neighbors, a horrific series of occurrences awaits them: Their teenage daughter is being tormented by grisly visions. Her younger sister has been marked for a depraved ritual. And deep within the heartland darkness, one of The Seven Gates of Hell demands the blood of the innocent to unleash the creatures of the damned.",14.409,100.0,Let Us Prey.,5.3,140.0,en,/l08JyZrIauqfsKXgUIpCqsNqBkd.jpg,/65aDPoEpgFvnAK1bgZysjxgSgyG.jpg,
121207.0,161321.0,O Poder de Alguns,2013.0,Crime|Drama,"As vidas de espiões, policiais, religiosos e crianças se entrecruzam em meio ao perigo, ao mistério e possíveis transformações. ""O poder de alguns"" mostra cinco personagens incomuns, que inadvertidamente são conectados a uma operação mafiosa. Em meio a essas situações de risco, uma alma esperançosa causa um efeito sobre todos, desvendando uma assustadora realidade por meio de uma mensagem inesperada.",4.851,96.0,,5.1,51.0,en,/r6kxASJb64Vx6nWM7o7hbFHJp9e.jpg,/pIsibPpOCJ49rEntZ1xb6oqqThI.jpg,
121227.0,209416.0,Supermensch: The Legend of Shep Gordon,2013.0,Documentary,"Supermensch documents the astounding career of Hollywood insider, the loveable Shep Gordon, who fell into music management by chance after moving to LA straight out of college, and befriending Janis Joplin, Jim Morrison and Jimi Hendrix. Shep managed rock stars such as Pink Floyd, Luther Vandross, Teddy Pendergrass and Alice Cooper, and later went on to manage chefs such as Emeril Lagasse, ushering in the era of celebrity chefs on television.",5.801,75.0,,7.3,60.0,en,/vGe38lBYBOLp0jthuBOIVGap4fM.jpg,/6cUD0vmz2ZCXeejLpPXkP2hJexl.jpg,
121239.0,152273.0,The Sarnos: A Life in Dirty Movies,2013.0,Documentary,"A love story about the legendary sexploitation director Joe Sarno and his loyal wife and business partner Peggy. The film relates their part in the history of sex film, their lives between New York and Sweden, and their struggle to produce one last erotic film.",1.821,78.0,,6.8,8.0,en,,/dHQLef3s9KLsnAUCjK8rRCsy0cn.jpg,
123163.0,228245.0,The Suspect,2013.0,Thriller,"Two African American social scientists pose as bank robbers in an effort to understand the racial dynamics of small-town law enforcement. However, their experiment takes an unplanned turn.",3.098,89.0,,5.5,27.0,en,/W0gP5SVQU7uPB39GSTCumYLtc5.jpg,/ixZSs07C94Nv4Hal6Ou9JrTOfYL.jpg,
123186.0,207883.0,Pregando o Amor,2013.0,Drama|Romance,"Lutando para se manter do lado certo da lei, Miles (Ja Rule) encontra a garota dos seus sonhos, mas ela não é o tipo mais comum de garota que ele está acostumado a namorar. Vanessa (Adrienne Bailon) é uma garota de igreja em todos os sentidos da palavra.",28.593,118.0,,6.2,60.0,en,/yRJs2vAsm4g8ZFkNY90EpV2O9qB.jpg,/iKezZLBZRZVAtyIDkerzelAzVOz.jpg,
123194.0,97732.0,See Girl Run,2013.0,Romance,"What happens when a 30-something woman allows life's ""what ifs"" to overwhelm her appreciation for what life actually is. Disregarding her current obligations, she digs into her romantic past in hopes of invigorating her present.",1.372,90.0,Sometimes going back is the only way forward.,4.8,21.0,en,,/1A5Q9iMg7kGsUOPgZcBsaTyhmXt.jpg,
123202.0,236324.0,Pesadelo Social,2013.0,Cinema TV|Drama|Mistério,As chances de uma aluna ingressar numa boa faculdade pesam na balança quando suas fotos inapropriadas são postadas na Internet.,5.032,91.0,,5.3,51.0,en,,/sP3i0hNIiBpA19LI9jN1pH0NfsV.jpg,
123306.0,157919.0,Jogo de Interesses,2013.0,Drama,"Este drama mostra o trabalho complexo de um conselheiro político, que deve lidar com as necessidades dos seus clientes, uma assistente especialista em criar polêmicas, uma jornalista ambiciosa, que quer dormir com ele para descobrir informações confidenciais...",0.6,99.0,,5.3,26.0,en,/An6oBoTRbPNdNDMuxTJ8GMuUujR.jpg,/byIf2xe1NjRTMQMbYTDWjclPqHx.jpg,
123308.0,217896.0,Meu Ofício é Matar,2013.0,Thriller,Ellen Benson é uma pacifista que não concorda com o uso de armas e com quem as usa. Mas violência chega à casa de Ellen quando o presidente dos Estados Unidos passa pela cidade e um assassino acha que a casa dela é perfeita para uma emboscada.  Remake do filme de 1954 estrelado por Frank Sinatra.,4.587,90.0,,4.2,37.0,en,/j4TmcsGzwNJZRkfUbY0YvgE5lcW.jpg,/75AzdT8J50GzveqWQGdmhNk1LZ8.jpg,
123314.0,228676.0,Noite das Travessuras,2013.0,Terror|Drama|Thriller,"Mischief Night conta a história de uma invasão de domicílio terrível na noite antes de Halloween. Emily Walton, uma jovem que sofre de cegueira psicossomática desde o acidente de carro que tirou a vida de sua mãe, deve convocar todos os seus instintos à sua disposição para proteger a si e seus entes queridos de um misterioso intruso",6.224,87.0,,5.0,75.0,en,/9gq85TC7e0HytQGWnSeKOn1Or0m.jpg,/qWq647LsRpqlewo7Fl2jua2X8RK.jpg,
123318.0,226672.0,A Tumba do Dragão,2013.0,Ação|Aventura,"Tomb of the Dragon vê criptozoologista Travis Preston em viagem à China para investigar uma série de assassinatos misteriosos que pode ou não envolver um animal lendário. Com a ajuda de sua equipe, incluindo a bióloga Sarah Anderson, Travis deve rastrear o animal, a fim de parar os assassinatos. Mas ele não tem que lidar apenas com a besta, porque seu concorrente também é sanguinário na caça ...",5.832,100.0,,4.2,51.0,en,/gLZ3gHpjA1oc2KbOSkRt2syY3pi.jpg,/keVjg9eot0fMK04W7U05EeLUY4S.jpg,k12554
123423.0,172386.0,De Volta a Ilha da Imaginação,2013.0,Família|Aventura,"Quatorze anos de idade, Nim, mais determinada do que nunca a proteger sua ilha e toda a vida selvagem que a chama de lar, enfrenta os desenvolvedores de resorts e caçadores de animais. Logo ela percebe que não pode depender apenas de suas coortes de animais e deve fazer sua primeira amiga humana - Edmund, que fugiu para a ilha do continente - para salvá-la em casa.",16.162,90.0,,6.1,346.0,en,/auLEgC09Pvwkzul8lwEkcWnlSC2.jpg,/uidrRc6Sp44ViXaHkLswVGVwPCh.jpg,k18035
123499.0,231474.0,Os Caçadores,2013.0,Aventura|Cinema TV,Uma família de arqueólogos decide caçar artefatos de contos de fadas que estão escondidos ao redor da Terra.,8.369,85.0,,5.7,294.0,en,/yRXI9FnsVKTEEWBwj7jm6S3QBsN.jpg,/1bflaemK5sNVl2PJAbsk9ZmmTTh.jpg,k3205
123553.0,252360.0,Em Nome do Rei: A Última Missão,2013.0,Ação|Aventura|Drama|Fantasia,"Hazen Kaine (Dominic Purcell) é um matador de aluguel americano, mas atualmente mora na Bulgária. Seu último serviço é assassinar os três filhos de um bilionário da realeza, mas, misteriosamente, ele é enviado para a idade média. Lá ele precisa enfrentar um forte exército e um dragão que cospe fogo numa batalha pela sobrevivência.",3.67,85.0,,3.6,46.0,en,/d1VlhkIFRc9Y8SrTURbPThcautn.jpg,/yetbsCuB6fmzI4lpJMvqwJcehti.jpg,
123985.0,220514.0,HazMat,2013.0,Horror,"The television crew of the ""Scary Antics"" hidden camera show sets up a disturbed young man for a practical joke, but the joke is on them when heads roll.",1.583,80.0,It's all fun and games until someone loses a head.,4.8,6.0,en,,/as2ykbbz5wWKx0TfZwYOOZzy83D.jpg,
124558.0,120854.0,Lizzie,2013.0,Thriller,"Lizzie, uma jovem com amnésia, vem lentamente a perceber que ela pode ter sido responsável pelo assassinato horrível de seus pais. Depois de voltar para a casa da família, Lizzie tem aterrorizante flashbacks de sua infância, e fica cara a cara com os verdadeiros horrores do seu passado.",4.154,93.0,,2.6,11.0,en,/19HKc2JAiOV8EQny38RLKZP9MJS.jpg,/u2oadguH83BHP9I4Ays3DcKOWMn.jpg,
124647.0,173488.0,Spark: A Burning Man Story,2013.0,Documentary,"Each year, 60,000 people from around the globe gather in a dusty windswept Nevada desert to build a temporary city, collaborating on large-scale art and partying for a week before burning a giant effigy in a ritual frenzy. Spark takes a peek behind the curtain with Burning Man organizers and participants, revealing a year of unprecedented challenges and growth.",3.371,90.0,,6.0,10.0,en,,/7p2okiyOSviAEPOwsSByc9jSvlw.jpg,
124799.0,198214.0,Ring of Fire,2013.0,Drama,"“Ring of Fire” recounts June’s meteoric rise to fame with The Carter Family, considered the First Family of country music, before breaking out on her own to perform, when she would become a legend in her own right. Taking a personal look at June’s first two marriages, life with her daughters and touching relationship with her son, the movie showcases her infamous courtship with Cash and June’s heroic role in saving his life during his battles with substance abuse, as well as how her unwavering faith in God, confidence and talent has taught lessons to generations.",2.644,90.0,,5.8,7.0,en,/yw4Rpxocz2g9DdSUFnPc5C4Rkaw.jpg,/t9mKjnSaKLLWsjxRq3nak42yP2x.jpg,
124807.0,217925.0,Made in America,2013.0,Documentary|Music,"Hip-hop artist Jay-Z organizes the ""Budweiser Made In America"" music festival.",2.985,93.0,Dream it. Do it.,6.0,4.0,en,/gimlHPgU1q2gbY6hpwwJNcS6iu8.jpg,/kp9fHTRLpxAnAEd3ibJSnGNltDN.jpg,
124825.0,217719.0,Snake & Mongoose,2013.0,Drama,"The untold story of how Southern California drag racers, Don ""The Snake"" Prudhomme and Tom ""The Mongoose"" McEwen combined with corporate giants to change the face of sports and ultimately became the most famous rivalry in racing history.",2.325,102.0,"Fast Friends, Arch Rivals!",5.2,9.0,en,/ofC9seWHqv5qoroJjbrhVZ1YIKY.jpg,/cjd3lITXneXITBVJXYW3nVxfS3x.jpg,
124849.0,164367.0,Long Distance Revolutionary: A Journey with Mumia Abu-Jamal,2013.0,Documentary,The film chronicles the life and revolutionary times of death row political prisoner Mumia Abu-Jamal.,3.22,120.0,,10.0,2.0,en,,,
124857.0,199556.0,Desejo de Vingança,2013.0,Ação,"A viúva de um repórter pede ajuda a um agente federal para investigar segredos do seu falecido marido, mas os dois se tornam alvo de ataques desconhecidos.",4.468,92.0,,4.9,50.0,en,/owAkwHQ5eE6sI2OjBOVUKFvArpE.jpg,/obu33DDft5eqrTyDjFkhpZ9JB3Z.jpg,
124955.0,143146.0,Ritual de Morte,2013.0,Terror,"Depois de receber um telefonema torturante, um homem chega a um decadente motel no meio da estrada, e descobre que sua ex-mulher matou um homem desconhecido que está ligado a uma seita perigosa.",3.549,90.0,,5.1,12.0,en,/jlufVc658uHWv9AKrV0KNjJsMtx.jpg,/astvvy4aRD4meXdGEjO9SlzShDy.jpg,
125077.0,238206.0,Eddie Izzard: Force Majeure Live,2013.0,Comedy,"Force Majeure (French) (pronounced: fors mah-ZHur), ""superior force"", ""chance occurrence, unavoidable accident"": 2 years and 27 countries, Force Majeure Live was filmed during Eddie's mammoth 2013/2014 tour and takes you on a truly hilarious journey, offering a rare glimpse in to the mind of the master of surrealism.",2.477,85.0,,6.3,9.0,en,,/imCKF1whhjxf5BkirYDLv2AGySl.jpg,k9716
125085.0,229526.0,Killer Holiday,2013.0,Horror|Thriller,"Taylor, a former juvenile delinquent, convinces straight-'A' student, Cammi to join her and her friends on a Spring Break road trip through the California desert. Ignoring evil premonitions from Cammi, the 8 friends party heavily as they get farther and farther away from civilization along old Route 66 with a killer in pursuit. Anxiety builds as each stop along the way proves stranger and stranger until the group is lured to an abandoned amusement park with a mysterious past far off the main highway. There the group discovers that the park comes complete with broken down vintage carnival rides, shocking surprises, the smell of death, and an enticing, young tattooed serial killer named Spider.",0.742,103.0,a KILLER thriller.,3.3,8.0,en,,/lEYfyJSn2BiOi9vRBhjo1z4Dn2p.jpg,
125139.0,251783.0,Todos Os Tons do Prazer - Pleasure or Pain,2013.0,Drama|Thriller,"Uma jovem e bela mulher acaba sendo seduzida por um milionário obcecado por sexo. Aos poucos, ele passa a controlar cada um de seus passos, cercando-a com diversos amantes absolutamente irresistíveis. O conflito central, entre dor e prazer, acaba se tornando não apenas literal, mas também metafórico – levando a uma conclusão que pode ser ao mesmo tempo trágica e irresistível.",6.757,99.0,,4.7,42.0,en,/4IliFwuwilCXhnEAiglytsb0IVP.jpg,/7g45pYcGLxKV5gsav8kKxhGYJOX.jpg,
125215.0,203264.0,Operação Perigosa,2013.0,Ação|Crime,"Depois que uma transação de drogas não dá certo, dois traficantes nova-iorquinos se deslocam para Miami, onde estabelecem uma operação de fraude de crédito lucrativo. Porém, logo a dupla atrai a atenção dos policiais, e também dos maiores criminosos da cidade... E, tanto os policiais quanto os criminosos exigem uma porcentagem dos ganhos dos fraudadores.",3.182,83.0,,4.7,15.0,en,,/zyjF9qiVgiKbwg1L7RUkcWqzSAX.jpg,
125291.0,188357.0,Ricardo Coração de Leão,2013.0,Ação|Aventura,"Na Europa da Idade Média, os reinos da Inglaterra e da França estão a beira da guerra. O rei inglês, Henrique II, já com a idade avançada e a saúde já debilitada, prepara o seu sucessor, um de seus filhos, para governar e levar o reino a vitória contra os inimigos franceses. « Ricardo Coração de Leão » Entretanto, nenhum dos filhos do rei está disposto a assumir o cargo. Preocupado com o futuro, Henrique decide que é hora de testar a lealdade de de seu Ricardo, pondo a prova sua habilidade e sua honra. O rei resolve tomar a espada e o título de nobreza de Ricardo e o envia para Knights Martyr, um castelo secreto, isolado do reino. O lugar é uma prisão perigosa, onde os prisioneiros precisam lutar para se manterem vivos. E é lá que Ricardo terá que provar seu valor.",2.103,100.0,,1.9,6.0,en,/qIC7RCaRxCQh00rpLA3QBk5h5d7.jpg,/sZNxiQdBwpQsnx8Xmgq3ZS5vG8u.jpg,
125367.0,208495.0,Mission Park,2013.0,Crime,"Four friends from the rough side of town grow apart when two are consumed by a life of crime, and the other two become FBI agents sent deep undercover - to bring down those childhood friends.",2.182,101.0,,5.4,9.0,en,,/z8sLzGK0tidgPwz9ioCXEfSSHtE.jpg,
125453.0,188507.0,Guerreiros no Espaço,2013.0,Ficção científica|Aventura|Família,"Um grupo de inteligentes adolescentes é recrutado para um acampamento de verão da Nasa, onde deverão competir com as suas maiores habilidades para o desafio final. Mas, quando uma nave com três astronautas fica presa no espaço, esses jovens prodígios deverão embarcar em uma inesperada missão de resgate.",4.012,93.0,,5.2,32.0,en,/5VKelyRrOx1hYmWQhO56ZQKi5BF.jpg,/x3MSBbfWmCxAQcf603axXncfQ9g.jpg,
125628.0,159000.0,Citizen Koch,2013.0,Documentary,"Wisconsin - birthplace of the Republican Party, government unions, cheeseheads and Paul Ryan - becomes a test market in the campaign to buy Democracy, and ground zero in the battle for the future of the GOP.",1.351,85.0,,6.9,8.0,en,/vCLwz0DXRuJQPCQ8lBGbYzO6AW1.jpg,/sx6OQT1TmmvpOI0JpUc6qHMUpXj.jpg,
125656.0,242675.0,"Another Day, Another Time: Celebrating the Music of ""Inside Llewyn Davis""",2013.0,Documentary|Music,"A concert inspired by the Coen Brothers' film, 'Inside Llewyn Davis,' which is set in the 1960s Greenwich Village folk music scene, featuring live performances of the film's music, as well as songs from the early 1960s. Performers include the Avett Brothers, Joan Baez, Dave Rawlings Machine, Rhiannon Giddens, Lake Street Dive, Colin Meloy, The Milk Carton Kids, Marcus Mumford, Punch Brothers, Patti Smith, Willie Watson, Gillian Welch, and Jack White, as well as the star of the film Oscar Isaac.",3.775,101.0,,8.1,8.0,en,/mO7R3lOwl1XjciWbWnrP1EcksSj.jpg,/9mnpW214aiagIHP5WiePEfezMSj.jpg,
125786.0,256196.0,Burning Blue,2013.0,Drama|Romance|Guerra,Dois oficiais da Marinha se veem no meio de uma relação proibida jogando suas vidas e carreiras em risco. Baseado em fatos reais e na peça autobiográfica de D.M.W. Greer.,5.469,96.0,,6.3,48.0,en,/sQecLLi9qMG1VZYpFWaSippF7h7.jpg,/uUpBD2EHyDpCLPATj8LFghiDCTy.jpg,k264384
125912.0,203321.0,Não é Mais um Final Feliz,2013.0,Romance|Comédia|Drama,"Quando um editor problemático descobre que sua única autora exitosa está bloqueada, ele sabe que tem que fazer algo a respeito.",5.446,102.0,,6.3,91.0,en,/pSu4HvshUuE6X87KIT4P50bhoPT.jpg,/mD9HozGOwRGil9VZodf5ndbG6xD.jpg,
125922.0,196255.0,Gregory Go Boom,2013.0,Comedy|Drama,A paraplegic man leaves home for the first time only to discover that life on the outside is not like he had imagined it.,1.037,18.0,,6.6,12.0,en,/o93cDBnguf55qAa9Sdqwv7LmcQf.jpg,/abUerQjZYuw3SWFMYVN48VLrTcw.jpg,
126180.0,226363.0,Entre Amigas,2013.0,Comédia,"Esta comédia segue Sam, como sua vida é virada de cabeça para baixo em uma grande noite fora. Quando se reúne com seus velhos amigos da faculdade, Sam é forçado a reavaliar sua vida e construir uma fachada elaborada para convencer a si mesma e a seus amigos que ela tem tudo. Mas uma vez que seu trio disfuncional e dedicado de melhores amigos intervém, sua charada cuidadosamente criada começa a desmoronar em meio a tiros, cigarros, sidras e transgressões de banheiro. Diante de algumas realidades muito duras, Sam deve lutar para permanecer fiel a si mesma e reavaliar exatamente o que ela quer da vida.",4.988,86.0,,4.7,14.0,en,,/9wX1ZOgSisQF4tfuA5yaY7693CL.jpg,
126217.0,201426.0,Delivery: The Beast Within,2013.0,Thriller|Horror,"Delivery tells the story of Kyle and Rachel Massy, a young couple who agree to document their first pregnancy for a family-oriented reality show. The production spirals out-of-control after the cameras capture a series of unexplained events, leading Rachel to believe that a malevolent spirit has possessed their unborn child.",3.376,87.0,Not every child is a blessing.,5.4,18.0,en,,/2qaGSF8TraBlsUKIBZThm25cyZh.jpg,
126399.0,156277.0,Big Sur,2013.0,Drama,"Lutando contra o alcoolismo e contra a pressão do público, o escritor Jack Kerouac faz uma série de viagens a Big Sur. Ele repousa em uma cabana, enquanto começa a perceber sua deterioração física e mental.",4.377,100.0,,5.7,13.0,en,/uKCsoWh0LHFJ0yNfRmngtmIMZ21.jpg,/kflrKGGliVnIURJG3W1DcEXyTHH.jpg,
126785.0,211722.0,A Spell to Ward Off the Darkness,2013.0,Documentary|Music,"A man at three disparate moments in his life: as a member of a fifteen-person collective on a small Estonian island, alone in the wilderness of Northern Finland and as the singer of a neo-pagan black metal band in Norway. Three moments for a radical proposition for the creation of utopia in the present.",1.53,94.0,,6.7,13.0,en,/kZsEybguIAS5KlrVvpJW2e44ebC.jpg,/sAwikivr4aRGQpCmgBo5vL1AygP.jpg,
127021.0,173484.0,Rewind This!,2013.0,Documentary,Home video changed the world. The cultural and historical impact of the VHS tape was enormous. This film traces the ripples of that impact by examining the myriad aspects of society that were altered by the creation of videotape.,6.208,94.0,,7.0,52.0,en,/vM2loiNpqxl5Q0TX61snecRIY3.jpg,/4iOjFXiU1QyoqeKF3Eq5IyxtzjP.jpg,
