movieId,tmdbId,title,release_date,genres,overview,popularity,runtime,tagline,vote_average,vote_count,original_language,backdrop_path,poster_path,keywords
6712.0,66111.0,Luster,2010.0,Thriller,"Thomas Luster is a troubled businessman who tries to make sense of a life being driven out-of-control by a force closer to home than he first realizes. When he discovers that the man working against him is another side of his own personality he is forced to fight back against his manipulative alter-ego as murder, madness and mayhem combine to take Luster on the most bizarre and terrifying ride of his life.",3.073,0.0,Know Your Enemy,5.1,7.0,en,/oXlKJOEbj28ZMee4CiSawoJvEoA.jpg,/iJDGYqyCfMZEPx1QLkBl1bgtZsO.jpg,
73319.0,25195.0,Casa Comigo?,2010.0,Romance|Comédia,"Anna (Amy Adams) viaja a Dublin, Irlanda, para pedir o namorado Jeremy (Adam Scott) em casamento. Segundo a tradição local, o homem não pode recusar um pedido feito no dia 29 de fevereiro. Após contratempos na viagem, Anna vê-se obrigada a pegar carona com o charmoso e grosseiro Declan (Matthew Goode), dono de uma hospedaria. Logo, o que deveria ser uma simples travessia ganha rumos inesperados.",56.094,100.0,,6.9,1615.0,en,/6QwYCoxOAMW0AEpzoUikbwiGZ7x.jpg,/fsKP38fESXwpr8XbEuhnzJc4Yqp.jpg,k13027
73321.0,20504.0,O Livro de Eli,2010.0,Ação|Thriller|Ficção científica,"Trinta anos depois da guerra ter dizimado o mundo, um guerreiro solitário chamado Eli caminha por horizontes arruinados dando esperança para os que restaram. Apenas um outro homem compreende o poder de um livro que Eli carrega e está determinado a se apoderar dele. Apesar de Eli preferir a paz, ele arriscará a sua vida para proteger a sua carga preciosa, pois precisa cumprir o seu destino de ajudar a restaurar a humanidade.",24.876,118.0,Alguns vão matar para tê-lo. Ele vai matar para protegê-lo.,6.8,4807.0,en,/aPrrrGtSjXbw8XnpzsVJgF0ioq3.jpg,/hUS4hknUZGJKqdFWf04eNSaaRfC.jpg,
73929.0,22894.0,Legião,2010.0,Terror|Ação|Fantasia,"Deus perdeu a fé na humanidade e enviou o anjo Michael (Paul Bettany), juntamente com uma legião de anjos, para dar início ao apocalipse. Entretanto, ao chegar Michael resolve se opor às ordens recebidas e proteger os humanos. O palco da batalha será no interior dos Estados Unidos, onde fica uma lanchonete gerenciada por Bob Hanson (Dennis Quaid) e seu filho Jeep (Lucas Black). Juntamente com Charlie (Adrianne Palicki), uma garçonete grávida, e Percy Walker (Charles S. Dutton), eles precisam encontrar um meio para sobreviver aos anjos que desejam exterminá-los a todo custo.",275.582,100.0,O Céu vai transformar a Terra em um Inferno.,5.7,1906.0,en,/5739NMdQF4HObAywXCNzPar7HTt.jpg,/4w83G68shLcuFcHaWfdPxPu1pUA.jpg,k18034
74131.0,27569.0,Decisões Extremas,2010.0,Drama,Drama focado nos esforços do casal John e Aileen Crowley para encontrar um pesquisador que possa descobrir a cura para a doença genética rara de seus dois filhos,6.455,105.0,,6.2,230.0,en,/pvQXfATlhlLr6NFiIXkhbcOmds8.jpg,/9Wh61B9bQ0AfXIi3qnVEZZsT8kc.jpg,
74154.0,13477.0,Quando em Roma,2010.0,Comédia|Fantasia|Romance,"Beth Harper é uma bem-sucedida curadora de arte sem muita sorte no amor. Em Roma para o casamento da irmã, ela conhece o charmoso repórter Nick e visita a Fontana D'Amore, onde ao invés de jogar uma moeda como manda a tradição, decide roubar algumas que estavam no fundo. A partir de então vários homens passam a persegui-la dizendo-se apaixonados. Inclusive Nick.",10.918,91.0,,6.0,996.0,en,/aOpfWjifWK5l3DGRiXy1MpA42WY.jpg,/gAQVIp2hvxWLwxgouDNNS1Uc0QL.jpg,k9673
74156.0,12201.0,O Fim da Escuridão,2010.0,Crime|Drama|Mistério|Thriller,"Thomas (Mel Gibson) é um detetive policial que testemunha o assassinato da filha ativista na porta de sua casa. Perturbado pela perda e convencido de que ele era o alvo, Thomas parte para uma investigação obcecado por justiça. As evidências o levarão a descobrir um complexo esquema de corrupção envolvendo políticos e a indústria de armas nucleares norte americanas.",10.536,117.0,,6.3,1132.0,en,/eXVpAa5MLQalttIqiYfuEHZYIE9.jpg,/wilLtU5J83Ay8RalIzjzgXK511B.jpg,k9826
74450.0,32856.0,Idas e Vindas do Amor,2010.0,Comédia|Romance,"'Idas e Vindas do Amor' nos traz um elenco de grandes astros e estrelas vivendo as histórias de um grupo de moradores de Los Angeles com pouco em comum, cujas vidas se cruzam, em meio a romances e corações partidos, durante um Dia dos Namorados. Casados e solteiros vivenciam os altos e baixos de encontrar, manter ou terminar relacionamentos no Dia dos Namorados.",23.718,125.0,,5.9,2560.0,en,/sNsANx5OxYifdcW7UXbyL9GoMCO.jpg,/bqhBPzeb3t9hBHlZnpg2SetXgPj.jpg,
74452.0,7978.0,O Lobisomem,2010.0,Terror|História|Drama|Thriller,"O ator Lawrence Talbot (Benicio Del Toro), quando criança, sofreu com a morte de sua mãe e nunca mais voltou a morar com o pai (Anthony Hopkins). Mais de duas décadas depois do ocorrido, ele é chamado por sua futura cunhada Gwen Conliffe (Emily Blunt) para ajudá-la a encontrar o noivo desaparecido. Ao retornar para a casa do pai, Talbot acaba se envolvendo numa investigação sobre violentas mortes que acontecem nas noites de lua cheia, entrando em contato com o seu passado e descobrindo um segredo que mudará para sempre a sua vida.",25.839,102.0,,5.8,1505.0,en,/juIHQJjA9ByHQcG63Hy5eJbVMbc.jpg,/2lsbwPdWfnr3NwVfPzASZI8FJlK.jpg,k10541
74458.0,11324.0,Ilha do Medo,2010.0,Drama|Thriller|Mistério,"Na década de 50, a fuga de uma assassina leva o detetive Teddy Daniels e seu parceiro a investigarem o seu desaparecimento de um quarto trancado em um hospital psiquiátrico. Lá, uma rebelião se inicia e o agente terá que enfrentar seus próprios medos.",68.841,138.0,O medo é contagioso.,8.2,18690.0,en,/U8QRD7jvTXEYsUXq74IFKaSiL5.jpg,/erl801HYIodoIBGZeFk0GTwCUBh.jpg,k818
74530.0,32657.0,Percy Jackson e o Ladrão de Raios,2010.0,Aventura|Fantasia|Família,"Ambientado no mundo atual, onde os doze deuses do Olimpo (instalados 600 andares acima do planeta, no edifício Empire State Building, em Nova York) estão vivos e criando uma nova raça de jovens heróis mitológicos que são semideuses metade mortais, metade imortais, Zeus suspeita que Percy, filho adolescente de Poseidon, tenha roubado seu raio, a arma mais poderosa do universo. Para provar sua inocência e evitar uma guerra devastadora entre os deuses, Percy embarca numa odisséia transcontinental com o objetivo de encontrar o verdadeiro ladrão. Ao longo do caminho, ele enfrenta inimigos cruéis decididos a detê-lo, e salva sua mãe das garras assassinas de outro deus grego, Hades.",237.708,119.0,Mundos colidem,6.2,5986.0,en,/sEyNWq9985lyUrwayWnvicT4FHA.jpg,/nuQFRVgKAXZNmjJhNuPO0dXcZqn.jpg,k818|k1299
74532.0,23742.0,Tiras em Apuros,2010.0,Ação|Comédia|Crime,"Jimmy Monroe (Bruce Willis) é um detetive veterano, que está ocupado com os preparativos para o casamento da filha (Michelle Trachtenberg). Juntamente com Paul Hodges (Tracy Morgan), ele precisa investigar o roubo de um raro cartão de baseball de 1952. Só que Hodges tem outro motivo para se preocupar: a suposta infidelidade de Debbie (Rashida Jones), sua esposa.",10.534,107.0,,5.6,1168.0,en,/zOhAS0w8NbIMmfbe0Yom1xmCsBy.jpg,/n7jukP3epnOIMMVWEpj95pRvrWX.jpg,k6149|k13027
74545.0,11439.0,O Escritor Fantasma,2010.0,Thriller|Mistério,"Um escritor de sucesso concorda em finalizar as memórias de Adam Long, o ex-primeiro-ministro britânico, e seu editor lhe garante que é a maior oportunidade de sua vida. Mas o escritor começa a descobrir evidências sugerindo que seu predecessor sabia de um segredo sombrio de Long e pode ter sido morto para evitar que a verdade viesse à tona.",10.362,128.0,,6.8,1653.0,en,/dXWJ3cNNx3BOk124s7VT5xrklTI.jpg,/oQXYpkNeXvL2GeUzKNhM825nKnd.jpg,k818
74580.0,23172.0,Missão Quase Impossível,2010.0,Ação|Comédia|Família,"Bob Ho é um agente secreto da CIA, que decide largar o serviço para poder se dedicar mais a Gilliam, sua namorada. Bob deseja se casar com Gilliam mas antes tem uma missão complicada: conquistar Farren, Ian e Nora, os filhos dela. Ele tem sua grande chance quando Gilliam precisa viajar de última hora, deixando as crianças sob seus cuidados. Só que uma das crianças faz, por engano, o download de uma fórmula secreta que está no computador de Bob. Esta é a chance aguardada por seus inimigos para atacá-lo.",47.598,94.0,Vida de espião não é mole não...,5.8,981.0,en,/wgLiHsGHVqGfBPmJeATwWXTEA3W.jpg,/ccoL6SB1efI9epaLrqxwHVZ8uKN.jpg,
74595.0,41894.0,Blood Done Sign My Name,2010.0,Drama|Crime,A drama based on the true story in which a black Vietnam-era veteran is allegedly murdered by a local white businessman who is later exonerated. The plot focuses on the role of a local high school teacher and the civil unrest that followed the acquittal.,1.842,0.0,No one changes the world alone.,6.2,10.0,en,/nYnVbZ36UTNBDeRM09WJ646RL3l.jpg,/6aoc3MexldhKq65EmlosHMkUxgz.jpg,
74685.0,29427.0,A Epidemia,2010.0,Mistério|Terror|Ação,"A primavera acaba de chegar numa tranquila cidade do interior, onde a simplicidade toma conta das pessoas e suas rotinas. Mas neste ano, a estação trouxe algo além de flores. Misteriosamente, os moradores tornam-se pessoas silenciosas e extremamente agressivas!  O casal David (Timothy Olyphant) e Judy (Radha Mitchell) se vêem cercados por aqueles que um dia já foram seus vizinhos e amigos, mas agora vagam pela cidade com um único objetivo em mente: matar, destruir, aniquilar.",24.157,101.0,,6.2,1493.0,en,/6SuxHL3Ug0GfluH9983KkrCSKHo.jpg,/vjxdIDla7z1vNjXyUaBcV7yRzcc.jpg,
74688.0,22971.0,Querido John,2010.0,Drama|Romance|Guerra,"John Tyree (Channing Tatum) é um jovem soldado que está em casa, licenciado. Um dia ele conhece Savannah Curtis (Amanda Seyfried), uma universitária idealista em férias, por quem se apaixona. Eles iniciam um relacionamento, só que logo John precisará retornar ao trabalho. Dentro de um ano ele terminará o serviço militar, quando poderão enfim ficar juntos. Neste período eles trocam diversas cartas, onde cada um conta o que lhe acontece a cada dia.",14.044,115.0,O que você faria com uma carta que mudou tudo?,6.9,3583.0,en,/9lpGLWrRxpDlqvO5DVjYkJN1Gzz.jpg,/uD0p6CgVhBBJKiYFdqeU1C6PMmd.jpg,k818|k9673
74698.0,23023.0,O Fada do Dente,2010.0,Comédia|Família|Fantasia,"Derek Thompson (Dwayne Johnson) é um jogador de hóquei frustrado que só faz sucesso por causa de suas violentas faltas que, invariavelmente, arrancam um dente do adversário. Daí vem o apelido, dado pelo fãs, de Fada dos Dentes. Ele, porém, não acredita em lendas e quase conta para a pequena Tess (Destiny Whittlock), filha de sua namorada (Ashley Judd), que esse negócio de fada trocar dente por moeda é uma grande mentira. Como punição por ser um ""destruidor de sonhos"", Derek é transformado em uma fada do dente.",75.141,101.0,,5.5,1587.0,en,/qAsxETj5fhZkW00KOzhHB6XQkaJ.jpg,/hk67XO1Fa1TVU3hmdCMqsnil1Ox.jpg,
74789.0,12155.0,Alice no País das Maravilhas,2010.0,Família|Fantasia|Aventura,"A Alice de 19 anos de idade, que regressa ao excêntrico mundo que encontrou pela primeira vez quando era criança reunindo-se assim com os seus amigos de infância: o Coelho Branco, Tweedledee e Tweedledum, a Ratazana, a Lagarta, o Gato Cheshire, e claro, o Chapeleiro Louco. Alice embarca numa fantástica viagem para encontrar o seu verdadeiro destino e acabar com o reino de terror da Rainha Vermelha.",49.547,109.0,Você tem um encontro muito importante.,6.6,11613.0,en,/20pkC7yJdCV4J1IMKfsCT9QU7zV.jpg,/fjaiHtykx4LcHJLzhKhn7tNPpAj.jpg,k818
74795.0,22972.0,Zona Verde,2010.0,Guerra|Ação|Aventura|Drama|Thriller,"Bagdá, 2003. Roy Miller (Matt Damon) lidera uma equipe, a serviço da inteligência do exército, em busca de armas de destruição em massa no Iraque. Depois de algumas tentativas frustradas, o militar se vê diante de um cenário caótico entre seus compatriotas, o que o deixa dividido entre aplacar o anseio do governo de encontrar algo que justificasse a invasão ou descobrir a verdade dos fatos.",20.905,115.0,,6.5,1713.0,en,/3EE9h3xYxIastf5xVLbezH3eGps.jpg,/wfpGtqT5Jq52pCTPELLc9M5hy04.jpg,k13065
74851.0,26389.0,Dupla Implacável,2010.0,Ação|Crime|Thriller,"James Reece (Jonathan Rhys Meyers) é o assistente pessoal do embaixador americano na França e leva uma vida pacata e confortável em Paris. Seu sonho é se tornar um agente da CIA, onde poderia ter mais ação ao realizar seu trabalho. Sua vida muda quando é designado como o novo parceiro de Charlie Wax (John Travolta), que precisa deter um ataque terrorista. A partir de então Charlie guia James em uma perseguição pelo submundo parisiense, para cumprir sua missão.",64.609,92.0,,6.2,1528.0,en,/x80JWzGysHoKMzYDV7t61TGeQ2m.jpg,/qpiASu5ZX5troHTXlhQGtOJ6lxb.jpg,
74916.0,27583.0,O Solteirão,2010.0,Comédia|Drama|Romance,"Roger Greenberg é solteiro, quarentão e propositalmente desocupado. Em busca de um lugar para recomeçar sua vida, ele concorda em cuidar da casa de seu irmão em Los Angeles e tenta se reaproximar do seu antigo colega de banda e de sua ex-namorada. Mas velhos amigos não são necessariamente melhores amigos, e Greenberg logo se vê forjando uma relação com a assistente pessoal de seu irmão, Florence. Apesar de suas tentativas de não se envolver, Greenberg percebe que ele pode, no mínimo, ter encontrado uma razão para ser feliz.",22.723,107.0,,5.8,415.0,en,/yatLdOw4i5roDD2fgd5jtEx0gs7.jpg,/6yUQ5ZxKmOusLmUmCPIY0nKzlCD.jpg,
74946.0,34016.0,Ela é Demais para Mim,2010.0,Comédia|Romance,"Kirk (Jay Baruchel) era motivo de piada entre os amigos quando o assunto era mulher. Até que um dia, sem querer, ele conheceu Molly (Alice Eve) e aí, o que antes era somente uma feliz coincidência virou uma grande aventura amorosa, temperada com muito humor e zoação dos colegas. Afinal de contas, como uma gata nota 10 pode ficar com um cara nota 5?",13.274,100.0,"Com uma gata dessas, você só tem uma chance",6.3,1568.0,en,/i80wifLk9w3q4Pq9UOPlfrsjKY1.jpg,/b4ISPeYaEYyu64wYDIa0o0RZCHt.jpg,
75341.0,23169.0,Lembranças,2010.0,Drama|Romance,"Tyler tem uma relação complicada com seu pai desde uma tragédia em sua família. Rebelde e problemático, ele acha que ninguém entende seu sofrimento, até que conhece a simpática e carinhosa Ally. Mas justamente quando o jovem redescobre a felicidade, segredos começam a surgir e ameaçam o romance.",15.663,113.0,Viver os momentos intensamente.,7.1,3021.0,en,/dmdfIman0PmPpFPJJJYQvPjlVyP.jpg,/pnmG02dRGXKeHSbzeCZxSGzaIBX.jpg,
75395.0,44363.0,Pânico na Neve,2010.0,Thriller,"Um dia típico nas montanhas se torna um pesadelo gelado para três esquiadores que ficam presos em um teleférico antes de sua última descida. A equipe da estação de esqui desliga as luzes da pista e o trio percebe, em pânico, que foram esquecidos. Com hipotermia e queimaduras de frio, os amigos são forçados a tomar medidas extremas para sair da montanha, antes que morram congelados.",18.487,93.0,,5.9,1397.0,en,/9mvdRoVrXNBt6y43tfJBlSoEysT.jpg,/1F0RJOWzYFeounRncvXjUCc8Tmp.jpg,
75404.0,34592.0,ZMD: Zombies of Mass Destruction,2010.0,Horror,"An idyllic island town is under attack by that most invasive of pests: zombies! Port Gamble is being overrun with braineaters, and the people seem powerless to stave them off. But wait, a rag tag band of rebels is trying to turn the tide and push the invading hordes of undead back.",5.521,92.0,They're just like you ... only dead,5.3,64.0,en,,/oOjyfFSm2tm1zGhpr6Bd80I4pbl.jpg,
75425.0,29426.0,A Ilha dos Mortos,2010.0,Comédia|Terror|Thriller,"Na Ilha Plum, localizada na costa marítima norte-americana, vivem duas famílias que travam uma briga histórica. De um lado está o patriarca Capitão Patrick O'Flynn (Kenneth Welsh), que deseja acabar com os zumbis, e do outro lado está Seamus Muldoon (Richard Fitzpatrick), que faz de tudo para não deixar ninguém exterminar seus parentes mortos-vivos antes deles se curarem.",16.598,90.0,,4.9,328.0,en,/my7iRgEZyvw7GO09vUJ06fe5oO3.jpg,/AnhG3WBU1piGtNSOfGuB7XIBsk.jpg,k12377
75803.0,34563.0,Our Family Wedding,2010.0,Comedy,"The weeks leading up to a young couple's wedding is comic and stressful, especially as their respective fathers try to lay to rest their feud.",7.539,103.0,To have and to hold... 'Til dads do us part.,5.7,95.0,en,/qu5NgAV3VWCptStuoXP3ggoP4s1.jpg,/zvRn8aM9lmuBbbJVJgxZl41zarB.jpg,k13027
75805.0,27573.0,Caçador de Recompensas,2010.0,Comédia|Ação|Drama,"Milo Boyd, um caçador de recompensas que está na pior, consegue o trabalho dos seus sonhos quando é designado para encontrar sua ex-esposa, a repórter Nicole Hurly. Milo acha que vai ser moleza, mas nada é fácil entre ele e Nicole. O ex-casal se digladia – até que se veem tendo de fugir para salvar suas próprias vidas.",17.069,110.0,,5.8,2277.0,en,/ilRHZg3rxrZKdA6EdwejPlgIw7O.jpg,/wyIANaZeJC1PXaSe9DrT3C0Hv8H.jpg,
75985.0,31867.0,Repo Men: O Resgate de Órgãos,2010.0,Ação|Ficção científica|Thriller|Crime,"É o ano de 2025 e uma empresa enorme conhecida como The Union revolucionou o mundo da medicina criando órgãos humanos artificiais. O único problema é que as pessoas que se beneficiam do transplante ficam com uma dívida pesada com a empresa. Se as contas não são saldadas, indivíduos chamados repo-men vêm cobrar a dívida.",10.82,111.0,Considere como um último aviso.,6.3,1452.0,en,/eQQXtiYSlBGWtabOb1XuRz7t6uV.jpg,/1uJZLLhEs6CVyQWohaa7xqthdaq.jpg,
76054.0,36970.0,Oceanos,2010.0,Documentário|Família,"Em Oceanos, os diretores Jacques Perrin e Jacques Cluzaud foram fundo nas águas que sustentam a vida da humanidade no planeta.  Filmado com a mais avançada tecnologia de captação de imagens subaquáticas é um documentário que tem tudo para encantar a família e, principalmente, aqueles que têm consciência dos perigos de um mundo descuidado por seus habitantes.",6.08,104.0,,7.3,253.0,en,/hZVk7Tc16mkfM3Y53ZQwMQIoolV.jpg,/3IivnJBV9Q76dVo24FA5dRK7AhJ.jpg,
76077.0,23048.0,A Ressaca,2010.0,Ficção científica|Comédia|Aventura,"Após viverem um tempo separados, quatro amigos juntam-se quando um deles quer se suicidar. Nenhum deles está feliz com suas vidas, então decidem ir para um resort de esqui, onde têm a oportunidade de curtirem um tempo juntos. Depois de uma noite bebendo dentro de uma banheira, eles acordam em 1986 e têm a chance de reescrever o passado.",13.218,101.0,"Esqueça o presente, mude o futuro, viva o passado",6.0,1891.0,en,/xGZqk56DoAT6o3ovh1B3a7CzgSV.jpg,/4Pp76a6I5nBFB5pnNlGS2ljsf86.jpg,k4379
76093.0,10191.0,Como Treinar o Seu Dragão,2010.0,Fantasia|Aventura|Animação|Família,"Soluço é um jovem viking que desafia a tradição, quando fica amigo de um dos mais mortais inimigos – um feroz dragão que ele chama de Banguela.",68.318,98.0,Uma aventura vai mudar dois mundos,7.8,10387.0,en,/kxklJL1v8MYEU5xdU6W5VvmBwVz.jpg,/spZbO7Ss6U9W5zSHjtH6FvXvCF7.jpg,k5774|k6054|k12554|k14643|k192913
76175.0,18823.0,Fúria de Titãs,2010.0,Aventura|Fantasia|Ação,"Perseu (Sam Worthington) descobre que é o filho mortal de Zeus (Liam Neeson), mas recusa-se a aceitar tal condição. Contudo, para salvar a cidade de Argos da fúria dos deuses do olimpo e da vingança de seu tio Hades (Ralph Fiennes), ele vai ter que enfrentar uma perigosa jornada contra terríveis criaturas como a Medusa para salvar os simples mortais e a bela Andrômeda (Alexa Davalos) do sacrifício para o monstro Kraken.",149.911,106.0,O confronto entre deuses e homens começou.,5.8,5012.0,en,/6cRukOzzqAo2El0wn3F5RDZIoyp.jpg,/R21t8SVfr6sQQ5mzjkecEU02YW.jpg,
76217.0,39830.0,Bass Ackwards,2010.0,Adventure|Comedy,"A man coming off a disastrous affair with a married woman has a lyrical, strange and comedic cross-country journey in a modified VW bus.",3.555,103.0,"One man's ride from Seattle to New York in a modified VW ""shorty""",5.1,9.0,en,,/uV7ZZ5v3I6HpnJ8hCag9Uwvucwb.jpg,
76251.0,23483.0,Kick-Ass: Quebrando Tudo,2010.0,Ação|Crime,"Usando sua paixão por histórias em quadrinhos, o adolescente Dave Lizewski decide se reinventar como super-herói, apesar da total falta de poderes especiais. O adolescente arruma uma fantasia, batiza-se de ""Kick-Ass"" e começa a combater o crime com a ajuda de amigos justiceiros.",65.248,117.0,Qualquer um pode ser um super herói.,7.1,9662.0,en,/P4bGyJQF0shAcRku3I2perNUQR.jpg,/Lw92onUVD9eg04JltAas5KWkSy.jpg,k9715|k9717|k9826|k18035
76293.0,35056.0,Uma Noite Fora de Série,2010.0,Comédia|Ação|Aventura,"Phil (Steve Carell) e Claire Foster (Tina Fey) são casados, têm filhos, mas o relacionamento caiu na rotina. Decidido a mudar o cenário, ele a convida para ir num restaurante super badalado e, sem mesa reservada, assume o lugar de outro casal que parecia ter faltado ao compromisso. Só não contavam com o fato de que os donos da tal mesa eram procurados por um mafioso e assim, a noite que era para ser divertida virou um salve-se quem puder pelas ruas de Nova York.",38.074,97.0,,6.1,2274.0,en,/2p119wtWAbsBkLBYbiF4qRULAIJ.jpg,/9yu4WtYuHtjrDxfZZaY26xluktZ.jpg,
76753.0,34583.0,A Final,2010.0,Thriller|Terror,"Um grupo de jovens marginalizados, foram humilhados e torturados. Agora, é a vez deles, e a vingança será terrível, levando adiante de seu plano macabro: suas vítimas sofrerão ao ponto de preferirem estar mortas.",24.797,93.0,,5.9,198.0,en,/c0W5mAgFMBMhb1MIuFlUh04zQxO.jpg,/ff7UI8q51sOArKafaaAOQnnfpne.jpg,k1930|k9748|k13006
76763.0,27586.0,The Runaways - Garotas do Rock,2010.0,Música|Drama,"Adaptação do livro ""Neon Angel: The Cherie Currie Story"", no qual Cherie conta como foi sua experiência à frente dos vocais de uma das mais populares bandas femininas de rock nos anos de 1970. Cherie Currie, ao lado de Joan Jett, Lita Ford, Sandy West e Jackie Fox (todas entre 16 e 18 anos de idade), formavam o grupo The Runaways. Num ambiente dominado pelos homens, as meninas do The Runaways conquistaram o público, vendendo milhões de discos e se apresentando em todas as partes do mundo. Como na maior parte das bandas de rock, disputas de ego e dinheiro foram determinantes no processo que levou à dissolução do grupo.",10.471,106.0,,6.4,627.0,en,/368rw036l155gmmmxPcGoXdBQK0.jpg,/h1RoNYKoVvR1HqfBeiR0o7i7AWQ.jpg,
76864.0,68987.0,Cooking With Stella,2010.0,Drama|Comedy|Romance,A woman cooks for clients and tries to keep her thefts of food and money from being discovered.,1.469,0.0,,3.9,7.0,en,,/mQVSTqxEs3t3run841iDd3NMap8.jpg,
77191.0,34803.0,Morte no Funeral,2010.0,Comédia,"Uma família desajustada se junta para o enterro do patriarca. Quando um homem misterioso aparece e ameaça chantagear a família com um segredo obscuro do falecido, seus filhos tentam de tudo para não deixar que os presentes descubram.",10.2,92.0,,5.7,706.0,en,/nDqJaOukBiTh1VSt9cmLlmidQUN.jpg,/raHwBfrpOQ2B24EXg2ntTD1Qn4g.jpg,k9826
77206.0,33217.0,Diário de um Banana,2010.0,Comédia|Família,"Greg Heffley está destinado a viver grandes coisas, mas primeiro ele precisa sobreviver à experiência mais assustadora e humilhante da vida de qualquer garoto - o ginásio. E isso não vai ser fácil, pois ele está cercado por garotos peludos sardentos, grandalhões intimidadores e uma fatia de queijo com piolhos nucleares.",26.168,92.0,"Não é um diário, é um filme.",6.2,1155.0,en,/xEd4sKtyCtm0bnbIwXgWuqZePpl.jpg,/tY58gmX8031nEX76v76acQyqi6U.jpg,
77364.0,34813.0,Os Perdedores,2010.0,Ação|Aventura|Crime|Mistério|Thriller,"Clay (Jeffrey Dean Morgan), Jensen (Chris Evans), Roque (Idris Elba), Pooch (Columbus Short) e Cougar (Oscar Jaenada) são integrantes de uma unidade de elite das forças armadas dos Estados Unidos. Eles são enviados em missão na Bolívia, mas lá são traídos por um poderoso inimigo o qual apenas se sabe seu nome: Max (Jason Patric). Dados como mortos, eles planejam virar o jogo contando com a ajuda de Aisha (Zoe Saldana), uma bela e misteriosa mulher.",95.072,97.0,,6.3,1328.0,en,/rfMpUe6lcIrxhbz8Yqes2oLVW1B.jpg,/5UH6cULJZBU4pgzNXShoWp5e3ha.jpg,
77414.0,35690.0,A Última Música,2010.0,Drama|Família|Romance,"Ronnie Miller tem 17 anos, é filha de pais divorciados e seu pai mora longe de Nova York, numa cidade praiana. Após três anos de separação, ela ainda sente raiva por tudo o que aconteceu até o dia em que sua mãe decide enviá-la para passar o verão com ele. Uma vez lá, depois de conhecer novas pessoas e paixões, ela encontra alguém que, além de bom músico e professor, é, acima de tudo, um verdadeiro pai.",15.663,107.0,"Uma história sobre família, primeiro amor, segundas chances e o momento da vida que a leva de volta para casa.",7.2,2951.0,en,/iRwwG4FaCMPiV35kLag6FmCBfca.jpg,/boLrhy8XsW3q6wPMFzIRIMxzmXD.jpg,
77421.0,39053.0,Cyrus,2010.0,Comedy|Drama|Romance,"With John's social life at a standstill and his ex-wife about to get remarried, a down on his luck divorcée finally meets the woman of his dreams, only to discover she has another man in her life - her son. Before long, the two are locked in a battle of wits for the woman they both love-and it appears only one man can be left standing when it's over.",5.323,91.0,John met the woman of his dreams. Then he met her son ...,5.9,302.0,en,/1XC5EcGNIW0LGPGRineTcDUGzVB.jpg,/94Adp61ssiAloSC4vxfCHpub9HO.jpg,
77455.0,39452.0,Exit Through the Gift Shop,2010.0,Documentary,"Banksy is a graffiti artist with a global reputation whose work can be seen on walls from post-hurricane New Orleans to the separation barrier on the Palestinian West Bank. Fiercely guarding his anonymity to avoid prosecution, Banksy has so far resisted all attempts to be captured on film. Exit Through the Gift Shop tells the incredible true story of how an eccentric French shop keeper turned documentary maker attempted to locate and befriend Banksy, only to have the artist turn the camera back on its owner.",7.139,87.0,The world's first Street Art disaster movie,7.6,663.0,en,/yGtoR1fi3e2xU7N91cb2DKJjtyL.jpg,/y6HK3PeQNeNLyruwtpCmV3TWuUx.jpg,
