movieId,tmdbId,title,release_date,genres,overview,popularity,runtime,tagline,vote_average,vote_count,original_language,backdrop_path,poster_path,keywords
150336.0,279973.0,O Recomeço de Ashley,2014.0,Cinema TV|Drama,"Depois de duas adolescentes passarem cruelmente por um online ""cyber bullying reverso"", a reputação de Ashley está arruinada. Ela e sua mãe, Julie, são excluídas, obrigando-as a fugir de uma ameaça crescente para as suas vidas, começar de novo em uma nova cidade e escola, com novos interesses românticos e as lições comoventes de Kevin, um professor de história excêntrico, que as atrai para fora da reclusão. No entanto, quando o passado reaparece para Ashley, ela precisa lidar com ele utilizando o que aprendeu com as aulas de história do Kevin, dando-lhe força para superar as dificuldades, ao invés de ceder às intimidações que a atormentam. Com o apoio de sua mãe e novos amigos, Ashley confronta seu passado doloroso, usando as próprias ferramentas de mídias sociais e tecnológicas que haviam a machucado para expor as mentiras e espalhar a verdade.",3.638,93.0,,6.3,46.0,en,/jSHqYTHCOasL7LgOCopUZi2dfxj.jpg,/f1bWiFnw0D4aMGN8Fu9ldvHWEqN.jpg,
150367.0,320420.0,Love Me,2014.0,Documentary,"Love Me follows Western men and Ukrainian women as they embark on an unpredictable and riveting journey in search of love through the modern ""mail-order bride"" industry.",3.035,94.0,,6.5,28.0,en,/kNxwpYF5y2oWb3g3fLJRGNhASaC.jpg,/fOYQuFwqT09boJ4djJfpB4ZLrbe.jpg,
150540.0,289190.0,Felt,2014.0,Drama|Horror,A women creates an alter ego in hopes of overcoming the trauma inflicted by men in her life,2.23,80.0,,5.0,19.0,en,/452pgx4qLoVTymgZ6g0gYGmF4s6.jpg,/o5uspPxfNQjP6ProPpC0gZGQaaN.jpg,
150598.0,288463.0,The Guvnors,2014.0,Crime|Thriller,"The Guvnors is a violent thriller set amongst the clans and firms of South East London, bringing two generations together in brutal conflict.",5.202,95.0,Revenge is its own executioner,5.3,45.0,en,/x5myjh1PkRaJ8r8EbWqaKkLKnN1.jpg,/6uVF1ON5p5awQGB8AgwDQrVrk1v.jpg,
150612.0,294825.0,Rumors of Wars,2014.0,Thriller,"A suspenseful, genre-bending film with two converging storylines. An aspiring college journalist records events in a diary about the turmoil of a society due to the insertion of a RFID chip mandated by the government. ? Years later in the rubble of a post apocalyptic society filled with decay and violence, the diary finds its way into to the hands of an officer in the New World Army who uncovers the truth about the past and discovers everything he stood for was a lie. But what will he do now?",3.673,89.0,In the end we all worship something.,3.1,9.0,en,,/h9RE887bPyYdprlM6hNprA441tX.jpg,
150659.0,303665.0,Jornada Para Le Mans,2014.0,Documentário,"As 24 horas de Le Mans é o evento de resistência do automobilismo mais prestigiada no mundo. A Fantelli Productions acompanha a equipe britânica Jota Sport, tendo um olhar intimista sobre a proeza de resistência humana e a maravilha da engenharia que é preciso para competir em uma das corridas mais difíceis do planeta. Veremos na tela o espetáculo que é Le Mans, através dos olhos e emoções dos homens através dos corações deles. É a prova de que com bastante trabalho duro, dedicação e paixão, você realmente pode conseguir qualquer coisa. Jornada Para Le Mans é o resultado do sangue, suor e lágrimas que vemos conforme viajamos com a equipe. Nossa jornada ocorre ao longo da temporada e durante a Le Mans de 2014.",3.414,96.0,,6.6,19.0,en,,/5EM3oAzzh7bQs4iD9HlXflFUMHo.jpg,
150682.0,257627.0,NSFW: Not Safe for Work,2014.0,Comedy|Drama|Romance,"Oft-nude blog star Elenore is winding her way through the power dynamics of a relationship with a powerful business woman when she meets Eugene, a married office drone. The two begin a peculiar pseudo-sexual relationship wrought with role playing and cloaked in a form of semi-anonymity that can only come from digitally-born casual relationships.",1.799,70.0,Intimately Hilariously Absurdly Sincerely Completely Sexy,2.4,7.0,en,,/pfbEeDLPmneEFlDCBVHWOKftXsX.jpg,
150688.0,253150.0,Plastic Galaxy: The Story of Star Wars Toys,2014.0,Documentary,"Plastic Galaxy explores the ground breaking and breathtaking world of 'Star Wars' toys. Through interviews with former Kenner employees, experts, authors, and collectors, the documentary looks at the toys' history, influence, and the passions they elicit today.",2.629,70.0,The Story of Star Wars Toys,6.8,22.0,en,/1dzQeKE3COKrvBs6Q2heIKP4cmT.jpg,/uJxlQhzz9gYDUvHJ6qaTc166JuZ.jpg,
150722.0,293006.0,Aliens on the Moon: The Truth Exposed,2014.0,Documentary,Never-before-aired NASA footage presents evidence that the Moon is being used as a base.,4.224,86.0,,4.0,20.0,en,/qp1qgw5OQFSYbv6mkKrswEOlYKx.jpg,/9lrjXC4K3ttVtFEQAvPm19xkD0h.jpg,k9951
150796.0,282377.0,The Lord of Catan,2014.0,Comedy|Drama|Fantasy,The Lord of Catan stars Amy Acker and Fran Kranz as a young married couple whose friendly game of Settlers of Catan plunges them into a vortex of madness and despair.,0.6,13.0,There can be only one.,7.5,3.0,en,,,
150850.0,279997.0,I Survived a Zombie Holocaust,2014.0,Comedy|Horror,"From the land of early Peter Jackson comes another Braindead movie in bad taste. It’s the third day of shooting the low budget horror ‘Tonight They Come’ on location in the wilds of New Zealand. Director SMP is already beside himself having to work with a self-obsessed leading man and a bimbo actress when into his line of fire comes a new runner, wannabe screenwriter Wesley Pennington. Clearly an accident-prone nerd, Wesley nevertheless tries his best to fit in with the crazed cast and demented crew while falling head over heels for Susan, the set caterer. But something nasty has entered the local water supply and suddenly the zombie extras start acting like genuine members of the living dead, gore stunts looks even more authentic and actual severed limbs fly. Reel life turns real as Wesley attempts to save the day while ensuring his latest script will get made.",2.279,104.0,"Shoot, Cut, Stay Alive",5.7,27.0,en,,/oawjYX3KXRS6l8qSFf71ttScHB3.jpg,k12377
150862.0,253304.0,Evaporating Borders,2014.0,Documentary,"Evaporating Borders is a poetically photographed and rendered film on tolerance and search for identity. Told through 5 vignettes portraying the lives of migrants on the island of Cyprus, it passionately weaves themes of displacement and belonging.",3.156,68.0,,7.4,5.0,en,,,
151333.0,228107.0,Anita B.,2014.0,Drama,"After World War II, Anita, a young survivor of Auschwitz, becomes involved in an intense and passionate affair that almost shatters her until she gains the strength to start a new life.",3.498,88.0,,5.8,45.0,en,,/kSP4MqjvLkuINd1ZTbY7ImURcll.jpg,
151369.0,276898.0,Spanish Lake,2014.0,Documentary,"A bold and unflinching documentary on 'white flight' in the area of Spanish Lake, Missouri, a post WW2 suburb. The town experiences rapid economic decline and population turnover due to racism and governmental policies which support the white exodus. The themes of the film parallel America's growing political divide, racial tension, and rise of anti-government sentiment.",1.394,82.0,A small town with big problems.,5.7,6.0,en,,/yy7twFC8VsyBo3LFYv9LFK8Kcyn.jpg,
151377.0,339763.0,The Nurse,2014.0,Thriller,"A young woman takes in her estranged father after he suffers a stroke, but his home-care nurse's attentive dedication may be masking a dark and dangerous secret.",3.365,90.0,,5.7,7.0,en,,/xK6O8jsqrsPV1wDWU5a6j05BPK4.jpg,
151523.0,320181.0,The Perfect 46,2014.0,Science Fiction|Drama,A geneticist creates a website that pairs an individual with their ideal genetic partner for children.,1.471,97.0,What if you could have the perfect child?,6.0,8.0,en,,,
151549.0,261815.0,Five Star,2014.0,Drama,"After John’s absent father is struck by a stray bullet, Primo takes it upon himself to verse the young boy in the code of the streets—one founded on respect and upheld by fear. A member of the Bloods since the age of twelve—both in the film and in reality—the streets of Brooklyn are all Primo has ever known. While John questions whether or not to enter into this life, Primo must decide whether to leave it all behind as he vows to become a better husband and father. Set during those New York summer weeks where the stifling heat seems to encase everything, Five Star plunges into gang culture with searing intensity. Director Keith Miller observes the lives of these two men with a quiet yet pointed distance, carefully eschewing worn clichés through its unflinching focus. Distinctions between fiction and real life remain intentionally ambiguous, allowing the story of these two men to resonate beyond the streets, as they face the question of what it means to be a man.",1.184,88.0,,5.3,13.0,en,/wCdKayjGr4tiW1Wmkr3jn9uxA2D.jpg,/rb1PBJPuArUcLdgBZbTGdadkVld.jpg,
151595.0,353378.0,A Eterna Namorada,2014.0,Romance|Comédia,"Na pequena cidade de Big Stone Gap, nas Montanhas Apalaches da Virgínia, Ave Maria Mulligan (Ashley Judd) é uma farmacéutica de 35 anos auto-proclmada a solteirona da cidade. Ela leva uma amável vida ao redor de amigos e hobbies, até um dia fatídico em 1978, quando ela percebe que não é nada do que imaginava que era. Cercada por propostas de casamento, parentes gananciosos e celebrações, Ave Maria Mulligan organiza uma viagem que pode mudar sua visão de mundo e seu lugar nele.",4.591,93.0,,6.2,58.0,en,/k3IIh0NNrt8j6nVUpZuIvgG38u3.jpg,/zlmVnq87c3xZxz9NAsS5cDaPMES.jpg,
151890.0,253020.0,A Estrada 47,2014.0,Drama|Guerra,"Na Segunda Guerra Mundial, o Brasil era aliado dos Estados Unidos, Inglaterra e França. Na época, foram encaminhados mais de 25 mil soldados da FEB (Força Expedicionária Brasileira) para combater os inimigos, representados pelo Eixo: Alemanha, Itália e Japão.",1.887,107.0,Os Soldados Brasileiros na Segunda Guerra Mundial,6.5,23.0,pt,/3vV4BnMSSblATxoZcGQGGawFcfc.jpg,/9DfdAhXIzxgGEUnGiThqhqX7yGz.jpg,
151931.0,248268.0,$50K and a Call Girl: A Love Story,2014.0,Drama,"Quando Ross é diagnosticado com câncer cerebral terminal e dado seis semanas de vida, o seu irmão mais velho, recém-contratado Seth se oferece para gastar o seu fundo de casamento de 50.000 dólares em uma viagem de final de vida.",3.561,90.0,,6.1,17.0,en,,/buer6JTPgKwNgtFZVfy6h33BCgR.jpg,
152119.0,262199.0,Hannibal Buress: Live From Chicago,2014.0,Comedy,"Hannibal is back with his hour-long stand-up special, ""Hannibal Buress Live From Chicago"", taped at the Vic Theatre in his hometown of Chicago, IL. Buress’ latest offering features more of the signature dry wit and cool delivery we’ve come to love.",3.102,67.0,,6.8,30.0,en,,/3Yuu7RPK6iXiiioATn0XOPwL85B.jpg,k9716
152157.0,305215.0,Um Chamado Especial,2014.0,Drama,"Cara Jarvis quer fazer parte da turma em seu novo colégio. Para impressionar e chamar a atenção de Brandon, ela faz amizade com Grace, uma menina com síndrome de Down. Uma amizade que ela tenta esconder quando conhece as populares Skylar e Quinn, que fazem uma falsa campanha para que Grace seja a rainha de volta às aulas. Grace vence, e é publicamente humilhada, e Skylar quer que Cara assuma a culpa. Agora, Cara deve reconquistar Brandon, restaurar sua amizade com Grace e salvar sua reputação na escola.",4.479,94.0,,6.8,4.0,en,/6HkWQYaodDgCRrwXdAxKIz0bSa.jpg,/b0hzeCAls3n9i0ImaMMPsGY2hYL.jpg,
152177.0,273509.0,Blood Widow,2014.0,Horror,"Laurie and Hugh are a successful young couple who have just closed on a weekend home away from the city. Unbeknownst to them, the neighboring property contains the crumbling remains of a boarding school that was shuttered in the wake of an unspeakable massacre. The sole survivor of that massacre still resides in the ruins of the school, hiding from the world and wanting only to be left alone. When Laurie and Hugh's friends explore the property, they have no idea that they disturbed an emotionally-broken killing machine: The Blood Widow.",4.824,84.0,Die in Silence.,4.5,50.0,en,/qsULiDlQdoLHv4OhvmhnKjHxyoY.jpg,/y74qbogS4r32ypQIEBpzLR4bMtq.jpg,k9826
152179.0,255278.0,O Caminho do Mal,2014.0,Thriller,"Depois de inexplicáveis assassinatos assombrarem uma pequena comunidade, Padre Henry recorre a um detetive da polícia local e juntos eles descobrem que um adolescente com um passado obscuro se mudou para a cidade e está de olho na filha do policial. O padre Henry encontra-se confrontado com uma força demoníaca muito poderosa e que pode se tornar fatal.",3.784,92.0,,4.0,29.0,en,/jOBQ9x9W5ASWyNYanezYdkj9kVe.jpg,/oEwzinZ8aTHmv1UjBuFhvlBlBR3.jpg,
152183.0,331745.0,Top Spin,2014.0,Documentary,Three teenagers battle their way through the world of competitive ping pong with their hearts set on the Olympics.,2.638,80.0,,6.9,16.0,en,/1Xd5E4p5AzHCuzpBrVW3Vm9BBt4.jpg,/stwQqyaZ2c6qZHVGE1q0gCf0oOM.jpg,
152187.0,371007.0,Ticky Tacky,2014.0,Drama|Comedy,"A wealthy and powerful man is betrayed by those closest to him, and under the guidance of his trusted confidant, devises a fiery requital.",1.206,15.0,,7.0,12.0,en,,,
152336.0,257450.0,Tubarão-Piranha,2014.0,Terror|Comédia,"Na tentativa de capitalizar em cima de peixes exóticos, cientistas engenhosos decidem cruzar a espécie do tubarão branco com piranhas. A criação dá certo e os animais passam a habitar aquários da classe média americana. Tudo vai bem até que as criaturas começam a se infiltrar no sistema de esgoto da cidade de Nova Iorque e se tornam uma ameaça real para os seres vivos, atacando-os com voracidade.",13.036,79.0,,6.8,28.0,en,/478ZsXOZUJOwXQovP2hmYme6rjV.jpg,/3Xc4Z9b2tKCw7PAneXm5LcUxLB5.jpg,
152451.0,253282.0,She's Lost Control,2014.0,Drama,"Ronah's life unravels when she starts working with a new client, Johnny.",4.34,90.0,,5.2,25.0,en,/ka6HuNDnmOmxqzbGhe9gF8Zqsvu.jpg,/tzikHOQrR4mefWaKsDiG0vP1WsQ.jpg,
152569.0,286940.0,The Boxcar Children,2014.0,Family|Animation|Adventure,"Four orphaned and homeless siblings happen upon an abandoned boxcar, which, they furnish with all the comforts of home. Fearful that they will be sent to live with their grandfather they have never met, the children keep their new home a secret.",3.213,86.0,,8.1,15.0,en,/mferwFDRlwqcZpPFdaL64p0Xxap.jpg,/t184N3Tl7JtwBynjhva18o8EBHN.jpg,
152633.0,248543.0,Boa Sorte,2014.0,Drama,"João é internado em uma clínica psiquiátrica pela família. Lá ele se apaixona por Judite. Ela não tem muito tempo de vida, mas isso não impede que vivam um intenso romance.",1.926,88.0,,7.4,24.0,pt,/orQ8AYBfZwUDx64jUqVobcmdpzG.jpg,/jj9nHVm6qtvb39na21C6vEs6rn8.jpg,
152674.0,257614.0,As the Palaces Burn,2014.0,Documentary|Music,"As the Palaces Burn is a feature-length documentary that originally sought to follow Lamb of God and their fans throughout the world, to demonstrate how music ties us together when we can’t find any other common bond. However, during the filming process in 2012, the story abruptly took a dramatic turn when lead singer Randy Blythe was arrested on charges of manslaughter and blamed for the death of one of their young fans in the Czech Republic. What followed was a heart-wrenching courtroom drama that left fans, friends, and curious onlookers around the world on the edge of their seats.",3.655,121.0,The only way out is through the fire.,7.1,19.0,en,,/nIodUzFLmrvwP4VoDxrhtFnSmFT.jpg,
152776.0,297472.0,Chemical Peel,2014.0,Horror|Drama,A weekend trip to the woods for a bachelorette party turns deadly when a nearby train accident causes a chemical reaction that overtakes the secluded valley. But waiting out the disaster inside could prove to be just as dangerous as being outdoors.,3.686,95.0,FEEL THE BURN.,5.4,13.0,en,,/sYk7OIQuMzPuZhcy8GOJ7CVSDSa.jpg,
152804.0,334894.0,Nightmare Code,2014.0,Horror|Science Fiction|Thriller,"After a programmer working on a top secret surveillance program snaps in a murderous rage, a notorious code wizard with problems of his own moves into the startup offices to figure out what went wrong and deliver the final product. But the deeper he delves into the code, the more the code takes on a malevolent life of its own.",3.543,90.0,,4.8,12.0,en,/xWn5mPpOq2VwYghmreO7fGn3wJR.jpg,/faY6eJBPwOIgo2cPHUCVBh2nF7Q.jpg,
152936.0,228184.0,Os Caras de Pau Em - O Misterioso Roubo do Anel,2014.0,Comédia,"O anel Tatu Tatuado de Topázio, da socialite Gracinha de Medeiros, está em exposição em um museu. Ela, então, contrata os atrapalhados seguranças Pedrão e Jorginho para vigiarem a joia, uma herança de família. O anel é roubado e a dupla acusada de furto. Para provar que são inocentes, eles terão que enfrentar mafiosos portugueses e uma quadrilha de ninjas.",2.277,98.0,O Misterioso Roubo do Anel,4.7,41.0,pt,,/l2OeMO0IRymakP83EZ30OeAQUl8.jpg,
153534.0,308269.0,"Gore, Quebec",2014.0,Thriller|Horror,"Gore, Quebec tells the story of two acquaintances who are set up by their mutual friends on a cottage weekend in Quebec. What was supposed to be an exciting and fun weekend, quickly turns into the blind date from hell, as the Couple discover that the cottage is not safe, and that their friends are already dead. The film begins in a home movie found-footage style, but quickly shifts into a more cinematic style once things start unraveling. With a serial killer terrorizing them, the Couple have to either protect one another to survive, or try to escape separately. Do you protect your fellow man, or is survival a solitary journey?",0.6,79.0,Not all Canadians are polite.,3.0,2.0,en,,,k9720
154186.0,287322.0,Blackbird,2014.0,Drama,A jovem cantor luta contra sua sexualidade e com o tratamento estranho dos outros em uma pequena comunidade batista do sul dos EUA.,3.735,99.0,Você escolherá ser o que você não teve nenhuma escolha em ser...,6.1,25.0,en,/s0a9MaV8fwBiQNcsy55Vm2sJn4B.jpg,/30ZQdfpt8097DwD3USxJDymHW8Q.jpg,k264384
154319.0,288286.0,A História da Eternidade,2014.0,Drama|Música|Romance,"Em um pequeno vilarejo no Sertão, três histórias de amor e desejo revolucionam a paisagem afetiva de seus moradores. Personagens de um mundo romanesco, no qual suas concepções da vida estão limitadas, de um lado pelos instintos humanos, do outro por um destino cego e fatalista.",1.728,120.0,,7.5,16.0,pt,/oah1L5vkdV1369DrEZnZ7nnNUbD.jpg,/mcJscYse8IyzEMcmbQUWaexksWy.jpg,
154358.0,334495.0,The Barkley Marathons: The Race That Eats Its Young,2014.0,Documentary|History,"In its first 25 years only 10 people have finished The Barkley Marathons. Based on a historic prison escape, this cult like race tempts people from around the world to test their limits of physical and mental endurance in this documentary that contemplates the value of pain.",5.946,90.0,,7.7,73.0,en,/owcXnnnEcbIkthtHrLhREPQ3Fpp.jpg,/1ugzwqaN5mcIgigfI1J3T1Zedym.jpg,
154846.0,263627.0,Lucky in Love,2014.0,Comedy|Drama|TV Movie,"When Mira's April Fool's Day tricks materialize, she finds herself promoted to the perfect job, dating the perfect man and living in the perfect home. Mira's newly upgraded life even involves working with her CEO and her good friend, on a coveted work project. When these seemingly positive changes result in big challenges, Mira realizes that the pursuit of perfection is a fool's errand. In order to achieve a life that's perfect for her, Mira must let go of perfection and chase what brings her true happiness.",4.421,90.0,,5.9,28.0,en,/s3q2Hk5KZdwVyNekNZmg1bUhlPu.jpg,/mv91QcucVwSSaHb1KNtlK04KQqK.jpg,
154945.0,302036.0,Beyond,2014.0,Romance|Science Fiction|Drama,A suspenseful sci-fi journey tracking the turbulent relationship of Cole and Maya as they struggle to survive in a world where the human population has been left decimated after an extra-terrestrial attack.,4.496,89.0,Survival is a Choice.,3.9,17.0,en,/yCCSMkP0Yolq4GBRyxT1IifyQpJ.jpg,/hENM7IzHFZgVuFjp5e0I138hHoR.jpg,
154947.0,258210.0,Fuga do Vulcão,2014.0,Ação,"Um avião comercial está preso dentro de um anel de vulcões em erupção, os passageiros e a tripulação devem encontrar uma maneira de sobreviver",5.102,91.0,,4.4,61.0,en,/thj7VHPEQcbsu3JqV4Nl7i7zzJr.jpg,/8BSo6rhPljuBKWiTQVbST07JkQF.jpg,
155170.0,277796.0,Hide and Seek,2014.0,Romance|Drama,"Four fragile young people flee London to start an unconventional utopia, creating a world of fantasy that overwhelms them.",4.358,82.0,A provocative modern tale of love and sex,4.8,31.0,en,/bVeWXM7nRlE1nTeiwPLcdyR8J4r.jpg,/4MGtTJRYlqqf3oGRnuPPGIBnJa2.jpg,
155183.0,287179.0,The Iron Ministry,2014.0,Documentary,"Filmed over three years on China’s railways, The Iron Ministry traces the vast interiors of a country on the move: flesh and metal, clangs and squeals, light and dark, and language and gesture. Scores of rail journeys come together into one, capturing the thrills and anxieties of social and technological transformation. The Iron Ministry immerses audiences in fleeting relationships and uneasy encounters between humans and machines on what will soon be the world’s largest railway network.",1.792,82.0,,6.3,4.0,en,/K0JDBZXY4z1Z59RxAAKgK0iv1X.jpg,/9wlqe0sqskGfFjn2Jnqpdpc6vr4.jpg,
155364.0,311156.0,All Hell Breaks Loose,2014.0,Action|Horror|Comedy,"Based upon obviously not true events, All Hell Breaks Loose is the story of love, leather, and violence. When the Satan's Sinners, a vicious motorcycle gang from hell, kidnaps one man's bride, they bite off more than they can chew. Now the man is out to save his wife, any way he can... even if it means dying over and over again. With the help of a shit-kicking sheriff, a perverted priest, and a cowboy who just might be God, all hell is bound to break loose.",0.6,92.0,Get the girl…save the day,4.5,2.0,en,,/QCZgr2gj93jGjvcYgm4smCpNdd.jpg,
155499.0,177622.0,I Dream of Wires,2014.0,Music|Documentary,"An independent documentary film about the phenomenal resurgence of the modular synthesizer — exploring the passions, obsessions and dreams of people who have dedicated part of their lives to this esoteric electronic music machine. Inventors, musicians, and enthusiasts are interviewed about their relationship with the modular synthesizer — for many, it's an all-consuming passion.",2.923,96.0,,6.6,16.0,en,,/rQJyWEvkxR2F0Zjl1OMjRg3ZfPY.jpg,
155603.0,299309.0,The Last Patrol,2014.0,Documentary,Four veterans of the Afghani war ride the American rails.,2.493,87.0,,5.0,3.0,en,,/pmEpKpWe04nPglnkScGoSdzLFkD.jpg,
155723.0,272160.0,Salvando o casamento,2014.0,Comédia,"A trama da comédia acompanha dois homens (Rappaport e Callen) que estão tentando se tornar os melhores maridos para as suas respectivas esposas. Em busca desse objetivos os dois maridos encontram uma grande obstaculo, um amigo de ambos muito mulherengo que vai tentar de toda forma trazer os amigos de volta aos velhos tempos.",2.512,95.0,,4.4,28.0,en,/owKONaJodHVbGtEVDoGStczLfSk.jpg,/oDy1YKJIe1IDAb9WFFrov12mVMl.jpg,
155737.0,300403.0,Shana: The Wolf's Music,2014.0,Adventure|Drama|Music,"The First Nations girl Shana is a very gifted musician. But to bring her violin to sing, she must follow the wolf. Nino Jacusso has filmed this captivating coming-of-age drama with sensational beauty and spiritual tenderness.",1.628,96.0,"A First Nations girl, a wolf and a violin – and the magic of music.",6.9,8.0,en,/puzVfjtTMH531PyNSaBbUr3BdPi.jpg,/wlyKPrXFsZHmxRyjX0CLqrFYp0S.jpg,
155741.0,228109.0,Two-Bit Waltz,2014.0,Comedy|Drama|Family,"Suspension from school, the loss of a friend, a broken heart and lack of inspiration lead to Maude's downfall in this romp through teenage error.  Your teenage years are never easy… but for Maude, things couldn't be worse. Within one week, she is suspended from school, stranded by her best friend, dumped by the boy she loved and inherits an enormous amount of money with the passing of her grandmother– only to be claimed under one condition: Maude must prove by age 18 that she knows exactly what to do with her life. But with her 18th birthday rapidly approaching, Maude must dive into a world of self-discovery or else lose the inheritance.",3.099,81.0,,5.5,16.0,en,,/l2icc2wJQTbUadBHBPBmehTRANM.jpg,
155766.0,384205.0,The Gift,2014.0,Romance|Drama,A department store gift wrapper is a lonely spectator at the centre of the festive season until a stage magician makes a surprising request.,1.062,8.0,,5.8,6.0,en,,/y4Q6EU7cLndLAFuDZZdNAD09hMU.jpg,
155848.0,250852.0,The Notorious Mr. Bout,2014.0,Documentary,"Viktor Bout was a war profiteer, an entrepreneur, an aviation tycoon, an arms dealer, and—strangest of all—a documentary filmmaker. The Notorious Mr. Bout is the ultimate rags-to-riches-to-prison memoir, documented by the last man you'd expect to be holding the camera.",0.744,94.0,,5.4,10.0,en,,/1Xz5XxPQqPWJRJspDTfYy47UZ5o.jpg,
155980.0,261899.0,Prospect,2014.0,Action|Science Fiction|Drama,"On the surface of a hostile planet of green forests where the atmosphere is toxic, a teenage girl and her father look for precious materials to enrich themselves. When the father is attacked by a wandering bandit, the daughter must take control of the situation.",1.249,14.0,,6.2,20.0,en,,/eUYlXch5nLuAa2oZ4ajl66LFo7a.jpg,
155988.0,295627.0,Spawn: The Recall,2014.0,Horror|Thriller,"A former witch loses her son while shopping. Knowing evil forces are still lurking, she frantically searches for him, but comes across a discovery.",1.4,7.0,Ye who enter abandon all hope,6.5,16.0,en,/8Y3XWdWd1PRY0cQXLyLnqFfneDb.jpg,,k9715
156017.0,251220.0,Who Took Johnny,2014.0,Documentary,"An examination of the infamous thirty-year-old cold case of Iowa paperboy Johnny Gosch, the first missing child to appear on a milk carton. The film focuses on Johnny’s mother, Noreen Gosch, and her relentless quest to find the truth about what happened to her son. Along the way there have been mysterious sightings, bizarre revelations, and a confrontation with a person who claims to have helped abduct Johnny.",3.927,80.0,,6.9,46.0,en,/kPG8nx4ynnakEQtiBweMMS7kvrp.jpg,/93QgSxYD68F3jeICIB8mYaZzhPi.jpg,
