movieId,tmdbId,title,release_date,genres,overview,popularity,runtime,tagline,vote_average,vote_count,original_language,backdrop_path,poster_path,keywords
149840.0,172767.0,500 MPH Storm,2013.0,Action|Science Fiction|TV Movie|Adventure|Drama|Thriller,"When an energy experiment goes haywire, a rash of massive hurricanes rips across North America. A high school science teacher must get his family to safety before the hurricanes merge, creating a ""hypercane"" with the power to wipe the US off the map.",6.576,90.0,A tornado is 100 mph. A hurricane is 150. This is something else!,5.3,56.0,en,/nddudkiXQbmE1cKUDQBSs4XAbME.jpg,/qHAAMu1eFRY5648otdCeP4OiaeT.jpg,k14760
150140.0,215908.0,Noah,2013.0,Drama,"In a story that plays out entirely on a teenager's computer screen, Noah follows its eponymous protagonist as his relationship takes a rapid turn for the worse in this fascinating study of behavior (and romance) in the digital age.",0.616,18.0,,7.5,16.0,en,/1bMEIfLx9WhrNy0teBkVg42jL7U.jpg,/qY2vwXELGgzwgsrTJgUOynblTiQ.jpg,
150252.0,159109.0,The Rambler,2013.0,Drama|Horror|Mystery,"After being released from prison, a man known as The Rambler stumbles upon a strange mystery as he attempts a dangerous journey through treacherous back roads and small towns en route to reconnecting with his long lost brother.",3.052,97.0,A journey into darkness,5.3,26.0,en,/loPyMZtq1E7iXIdoudejF4gskCQ.jpg,/xKmYCXKsua86RRweR2jhlkkLn9H.jpg,
150572.0,256735.0,The Husband She Met Online,2013.0,Drama|Mystery|Thriller,"When hotel event planner Rachel breaks up with her boyfriend John for cheating on her, she decides to go looking online for a new boyfriend. In the expanse of cyberspace, she meets a charming, wealthy man named Craig, who at first, seems perfect. He’s attractive, fun, romantic, and he’s been successfully running his mother’s global real estate company while his mother, Doris travels the world. But Craig is far from perfect. He's obsessive and controlling, and once he sets his sights on Rachel, he has no plans of ever letting go...",2.013,90.0,,5.4,6.0,en,/a9m6TBCsoNY8HzqpsLGN00yag1m.jpg,/6Wi760ZsAZ9AYdbDlF4qZSeWZfC.jpg,
150653.0,212753.0,Empire of Dirt,2013.0,Drama,"Like many Native families, Lena Mahikan grew up in the cycle of abuse. Her father, a residential school survivor, was an alcoholic until he killed himself when Lena was 10. Her mother, only 14 years her senior, turned to the slots. By the time Lena was 15, she was pregnant and, before giving birth, was kicked to the curb by her mom. The cycle continues and Lena is now watching helplessly as her own daughter, Peeka, spirals out of control, landing herself in the hospital following a drug overdose. As a final attempt at survival, Lena decides to return home and face her own mother and a past she’s desperate to escape.",1.785,99.0,,6.8,5.0,en,/2TuHQrNMKMGC3xq1zylMxc2RreU.jpg,/bQ5PHgOpVxRt5H4war72cOn2aD2.jpg,
150718.0,273245.0,DSKNECTD,2013.0,Documentary,"As clichés go, in 1999 the World as we knew it was about to change - and we'd been expecting it. Since childhood we'd been promised that the 21st century would bring us dramatic new technologies like flying cars and Utopian cities. Instead it bought us the smart-phone, social media, and virtual societies. And as it turns out these technologies began to transform society almost as dramatically as the moon colonies we'd been expecting.  Now over a decade into the revolution, 'DSKNECTD' explores how digital communication technology is profoundly changing the way we interact and experience each other - for the good and for the bad.",1.665,98.0,We need to talk.,6.7,3.0,en,,,
151371.0,217587.0,Being Ginger,2013.0,Documentary,The story of one redhead's attempt to regain his self-confidence.,0.776,69.0,Documentary,5.8,5.0,en,,/lLlPM57UqKygjEtWBVtct88Ke6I.jpg,
151509.0,224885.0,Red Wing,2013.0,Drama,"A socially thought-provoking and stirring love story based on the French novella, 'François Le Champi' by George Sand.",0.917,108.0,A Timeless Journey,6.9,5.0,en,/1FUHrbtWCx7pv4r4JDqh5Da8MiB.jpg,/oHCQ5gKtAOiyNLNDQva43sJ83kU.jpg,
151771.0,159514.0,A Montanha Matterhorn,2013.0,Drama|Comédia,Um homem de 54 anos mora sozinho e vive preso em uma rotina metódica. Sua vida se transforma com a chegada de um estranho que lhe influencia a explorar mais o mundo.,1.85,87.0,A heartwarming movie,6.6,19.0,en,,/hCZrQoZIHBlTV4luqWwvJRSp8d9.jpg,
151854.0,168145.0,Devil May Call,2013.0,Horror,"Samantha ""Sam"" works at a crisis hot-line where she listens to strangers and helps them deal with their pain. It's a pain she knows well since the hot-line saved her life once when she lost her sight and didn't know how to live in a world of darkness. On her last night on the job, Sam receives an terrifying visit from one of her regular callers who feels betrayed that she's leaving him. This man is no ordinary caller. He's a sadistic serial killer she's unknowingly been keeping from killing himself for over a year. With only a skeleton on the graveyard shift, there's very little that stands between him and Sam. He's come for her and won't let anything or anyone stand in his way. Will Sam survive the longest, darkest night of her life?",3.458,84.0,You won't see him coming,5.5,12.0,en,,/pCI0yWynKoQGh68jSCJ1iykjWfs.jpg,
151935.0,174369.0,Deep Powder,2013.0,Thriller|Drama,"Natasha is a reckless boarding school senior tabbed by her exclusive club to make its yearly cocaine run to Ecuador. Coming along for the ride is Danny, a twenty-year-old aspiring hockey player from the other side of the tracks, who may just discover that he has fallen for the wrong girl. Starring up-and-comers Haley Bennett and Shiloh Fernandez, this ’80s-set love story based on true events is a sexy, fast-paced and intense drama.",2.499,91.0,,5.2,6.0,en,,/yd9cOv2mchQGJOT7DTMn02LFvlm.jpg,
152039.0,250902.0,The Image Revolution,2013.0,Documentary,"Twenty years ago, seven superstar artists left Marvel Comics to create their own company, Image Comics, a company that continues to influence mainstream comics and pop culture to this day. Image began as more than just a publisher - it was a response to years of creator mistreatment, and changed comics forever. The Image Revolution tells the story of Image Comics, from its founders' work at Marvel, through Image's early success, company difficulties during the comics market implosion, and ultimately the publisher's new generation of properties like The Walking Dead. Filled with colorful characters, the film is a clarion call to artists to take control of their destiny.",2.847,81.0,,6.7,12.0,en,,/cRjdWCsxBYDK1KWMmGKthPTtZOf.jpg,
152139.0,200548.0,Fanie Fourie's Lobola,2013.0,Comedy|Romance,"After Fanie takes Dinky, a strong Zulu woman, to his Afrikaans family wedding, the two find an unexpectedly fun cross-cultural romance. But in order to marry Dinky, Fanie must negotiate to pay Lobola (a South African dowry).",1.359,97.0,,5.0,4.0,en,/JraJycGRIOnq2D1kWz4d4xAK3n.jpg,/5ltbokzinRE01yuYXuCrVXFWS3R.jpg,
152147.0,169798.0,Licks,2013.0,Drama,"The story of a young man, D, as he returns to his Oakland neighborhood after serving two years in prison for a robbery gone wrong. In the days after his release, we are taken into D’s world while he navigates the harsh realities that plague his inner city community. His judgment is tested by the insidious influences around him, forcing D to decide what direction to take his life.",1.354,93.0,,6.4,7.0,en,/CfOihJLOm5mjD8D1FIW9uA4By9.jpg,/50U9ZfzkLlbhP645BJ6MJBYJqQl.jpg,
152155.0,232320.0,A Amante do Pastor,2013.0,Drama|Cinema TV,"Gwen (Sarah Lancaster) não leva uma vida fácil. Envolvida em um relacionamento abusivo no passado ela se encontra cheia de dívidas e com um filho para criar. A vida de mãe solteira não é nada fácil e por isso o amor fica em segundo plano, é aí que ela encontra o homem perfeito, Ed Baker (Drew Waters), que aparece na hora certa levando Gwen a acreditar novamente no amor. Mas esse romance pode ser perigoso, mais perigoso ainda quando nem sua amiga Sidney (Natalia Cigliuti) se torna confiável.",1.396,0.0,Ninguém está acima da lei,3.6,5.0,en,,/8IXTSDbXE8YisN0CkfXOxVWo1S7.jpg,k9826
152165.0,164443.0,O Candidato,2013.0,Comédia,Uma consultora de educação tenta transformar um fornecedor de cervejas em um cavalheiro e candidato a uma vaga no congresso americano para beneficiar sua própria agenda política.,3.382,93.0,,5.4,61.0,pt,/vhJrbmZCf1oPAgZoKeFanQbh0gO.jpg,/ywepu6TUxC3mRtzxa7CCKFYJbiC.jpg,
152238.0,159006.0,God Loves Uganda,2013.0,Documentary,A powerful exploration of the evangelical campaign to infuse African culture with values imported from America's Christian Right. The film follows American and Ugandan religious leaders fighting sexual immorality and missionaries trying to convince Ugandans to follow biblical law.,3.35,83.0,Have you heard the Good News?,7.3,11.0,en,,/aKddEx01KVe1fji4DG5ZfsEL4Ey.jpg,
152322.0,157447.0,Prosecuting Casey Anthony,2013.0,Drama,"""Prosecuting Casey Anthony"" reveals Florida prosecutor, Jeff Ashton’s  inside story of the true crime drama that captivated and then shocked the nation when Caylee Anthony’s mother, Casey, was acquitted of killing her daughter, despite what many thought to be overwhelming evidence of guilt. The movie is seen from Ashton’s (Lowe) perspective and it takes viewers behind-the-scenes of both the investigation into Caylee’s tragic death and the ensuing trial, shedding new light on the many questions of what happened to the two year-old girl, how Ashton and his fellow prosecutors built their case and why a woman so shrouded in suspicion was proclaimed innocent. With in-depth information about the case and the accused, ""Prosecuting Casey Anthony"" examines what the prosecution got right, what they got wrong and why Ashton remains convinced of Casey Anthony’s guilt...",3.616,85.0,The verdict that no one saw coming.,5.6,14.0,en,,/bDdKlweMcTQVKXOs9aepO7V5Mkn.jpg,
152670.0,183176.0,Lord Montagu,2013.0,Documentary,"As the youngest member in parliament and sole heir to his family's estate, Lord Montagu's life was rich and privileged. However, in 1954 he become the focus of a national scandal that changed his life forever and set him on course to be one of England's most controversial and iconic aristocrats.",0.6,79.0,,7.1,4.0,en,,,
152755.0,203351.0,Círculo de Monstros,2013.0,Ação|Ficção científica,Criaturas surgem das profundezas do Oceano Atlântico dispostas a acabar com a vida na Terra. A última esperança da humanidade está em robôs gigantes projetados para combater os terríveis monstros.,0.6,85.0,,2.5,80.0,en,/ptxBoTFuoghCJOROYkTyuVnxltW.jpg,/nNyverKFzY0NzogqeStVtSTz4Nl.jpg,
152757.0,197624.0,AE: Apocalipse Terra,2013.0,Cinema TV|Ficção científica,"Após a destruição da Terra, um grupo de sobreviventes chega a um planeta exótico e, para sobreviver, precisa combater uma raça de impiedosos alienígenas.",4.135,87.0,,4.1,43.0,en,/zpWjBqhUT5Zh77wgEhryBD0YQfu.jpg,/tpKgGqRihA4ltEwQXqkYutmXHky.jpg,
152767.0,237200.0,Jerusalem,2013.0,Documentary,"JERUSALEM takes audiences on an inspiring and eye-opening tour of one of the worlds oldest and most enigmatic cities. Destroyed and rebuilt countless times over 5000 years, Jerusalem's enduring appeal remains a mystery. What made it so important to so many different cultures? How did it become the center of the world for three major religions?  Why does it still matter to us?",2.265,45.0,,6.4,23.0,en,/sqeLatijZZ2zykcxCqkhsdE89cy.jpg,/4OdwPojXJebuPIxiniRnGYKVWC0.jpg,
153478.0,214355.0,Cine Holliúdy,2013.0,Comédia,"Interior do Ceará, década de 1970. A popularização da TV permitiu que os habitantes da cidade desfrutassem de um bem até então desconhecido. Porém, o televisor afastou as pessoas dos cinemas. É aí que Francisgleydisson entra em ação. Ele é o proprietário do Cine Holiúdy, um pequeno cinema da cidade que terá a difícil missão de se manter vivo como opção de entretenimento.",2.545,91.0,,6.5,47.0,pt,/cajP2MOOFy8VvJr3d2H2vr1ZzVe.jpg,/rvTLvv9hxJEcdLfbhOWtZP7swkh.jpg,
153516.0,260163.0,Apocalyptic,2013.0,Horror|Drama,A local news crew become horribly involved with a doomsday cult.,2.757,84.0,,4.7,25.0,en,,/8cUqTiHp0alYeV2JKHiFKu4a9iu.jpg,
153520.0,178687.0,616: Paranormal Incident,2013.0,Horror,When Special Agent Watts and his Investigation Unit are called to the derelict Woodburrow Prison he thinks it's business as usual. But there's nothing usual about Woodburrow. A mysterious woman is found attempting to flee the scene and things begin to spiral out of control as an evil force picks the team off one by one. Soon Agent Watts is left alone to face what might be the world's most powerful evil... The Devil.,3.536,83.0,They were sent to find survivors... But something found them.,4.6,22.0,en,,/wnkauhqCuEloeaPpDnpxZbX5Kfp.jpg,
153528.0,205943.0,Severed Footage,2013.0,Horror|Thriller|Mystery,Twelve severed feet in running shoes found on the shores of Western Canada have baffled Police. A videotape is leaked anonymously from the authorities. This paranormal thriller may solve the mystery of the severed feet.,1.52,87.0,,2.8,6.0,en,,,
153530.0,169865.0,The Frankenstein Theory,2013.0,Horror|Science Fiction,"From the makers of The Last Exorcism comes a boldly original vision of horror. What if the most chilling novel of all time was actually based on a true account of a horrific experiment gone awry? When he is suspended from his university job for his outlandish ideas, Professor John Venkenheim leads a documentary film crew to the rim of the Arctic Circle in a desperate effort to vindicate his academic reputation. His theory: Mary Shelley's ghastly story, ""Frankenstein,"" is, in fact, a work of non-fiction disguised as fantasy. In the vast, frozen wilderness, Venkenheim and his team search for the legendary monster, a creature mired in mystery and drenched in blood. What they find is an unspeakable truth more terrifying than any fiction...a nightmare from which there is no waking.",3.896,87.0,,4.1,56.0,en,/ngvYhqkJDAp46nAHVeAz0uzhtOU.jpg,/kC8J8grw6G9EZfXun041hrVTKH5.jpg,
154484.0,222890.0,Stonados,2013.0,Science Fiction|TV Movie,A storm chaser tries to save Boston from destruction when a freak tornado bombards the city with huge boulders.,4.181,90.0,,5.1,42.0,en,/vaeDiIOXI94STXvl8kaYV4NzKgF.jpg,/yJXcOTPUP9NPNdlwsLc5OlvHS0Q.jpg,
154969.0,163313.0,Better Mus' Come,2013.0,Crime|Action,"The film follows warring political factions in 1970s Jamaica as they enlist the support of gangs to enforce their policies, and advance their political agenda. It is a fictionalized dramatization of real historical events, specifically, the Green Bay Massacre, where the government finally tracked down these gangs and had systematically wiped out.",0.6,104.0,,4.3,4.0,en,,/ySKZcS5bPlUg6WiMDVL5eeKoS0a.jpg,
155131.0,191824.0,Rushlights,2013.0,Crime|Drama|Romance,"Young lovers Billy and Sarah journey from L.A. to Texas with plans to make a false claim to the valuable assets left behind by a dead friend. But when their voyage brings them to Tremo, Texas, they find a bizarre and sinister world awaiting them.",3.009,96.0,All is fair in love and murder.,5.0,24.0,en,/cjWXBvA7DnaYjQHCG6yaL1ZTkJ.jpg,/rbwxKE98KFdWj3R9pSvavbMFGOT.jpg,
155411.0,216016.0,The Amityville Asylum,2013.0,Terror,"Lisa Templeton começa um novo emprego como faxineira no High Hopes Hospital, uma instituição mental em Amityville, Long Island. Inicialmente feliz por conseguir o emprego, Lisa logo percebe que nem tudo é o que parece. Intimidada pela equipe e pelas divagações psicóticas dos pacientes, ela fica ainda mais nervosa com as aparentes ocorrências sobrenaturais no turno da noite. Para preservar sua sanidade, Lisa deve descobrir a misteriosa história da instituição e seus internos. Mas a verdade é muito mais assustadora do que ela poderia imaginar.",5.304,88.0,Mate eles. Mate todos.,3.8,27.0,en,,/msJnHIicf6Pu8U0emMIvzEDV06Q.jpg,
155505.0,206289.0,Mademoiselle C,2013.0,Documentary,A documentary focused on former Vogue Paris editor-in-chief and fashion stylist Carine Roitfeld.,2.608,93.0,,5.1,19.0,en,,/h0xwdzbU07gaJm8olvIzkTOGA9e.jpg,
155511.0,212270.0,The Flying Man,2013.0,Action|Mystery|Science Fiction,"A new superhero is coming, only this time it's on his terms. Will he still be considered a hero?",0.725,9.0,,5.2,12.0,en,,/hlOo2PnM9Knb31WRocS2bR6cFPL.jpg,k9715
155537.0,136585.0,Return to Nuke 'Em High Volume 1,2013.0,Comedy|Horror|Science Fiction,"Return to the Class of Nuke 'Em High follows a young couple that are up against the school glee club. Unfortunately, the glee club has mutated into a gang called The Cretins. When the other students begin to undergo mutations, our couple must solve the mystery and save Tromaville High School",8.265,85.0,Readin'... Writin'... Radiation... Again!,6.3,88.0,en,/obCDcu6QIYMHX99phK10BM0BKRc.jpg,/j9ZHgqrSEzsuY4tE2lO506N4vhF.jpg,k8201
155733.0,224951.0,Evil Feed,2013.0,Ação|Terror,"O restaurante Long Pig é a mais nova sensação underground, onde somente os mais ricos podem experimentar os pratos mais refinados e a melhor haute cuisine canibal do mundo. Recém gerenciado por um filho que aposentou o pai delicadamente partindo sua cabeça, o Long Pig introduziu uma novidade, capturando lutadores de elite de MMA e servindo os perdedores aos clientes famintos. O entretenimento perfeito!  Jenna, uma aspirante a dublê, é seqüestrada junto com suas amigas por Triads, e acorda em uma cela do Long Pig esperando por seu turno para lutar no Fosso de Sangue. Para sobreviver, ela deve lutar antes que tenha sua pele arrancada e se torne a próxima refeição principal. Misture a máfia russa, canibais competitivos e uma massagista ninfomaníaca e você terá um filme de jantar louco, exagerado, sexy e sangrent",2.928,90.0,,4.5,20.0,en,,/ih0oWmPe6W5LpZkNxIO0s3rp73b.jpg,
155754.0,203124.0,Failure,2013.0,Comedy,"A young man discovers a strange woman in his house who just wants to ""meet him""...",0.6,4.0,,5.8,5.0,en,,,
155760.0,210302.0,Love's Routine,2013.0,Comedy|Drama,"LOVE’S ROUTINE is a dark comedy about a discordant elderly couple, who ultimately prove that love is greater than flesh and blood.",0.832,9.0,Love is a waiting game,6.7,6.0,en,,,k9673
155762.0,208091.0,Saving Norman,2013.0,Comedy|Drama,"Saving Norman tells the story of a hypochondriac ex-ping pong player who missed the biggest tournament of his career because of a cold. Now years later he lives a hermetic existence with his parrot Norman. But, when Norman seems to be suffering from a case of bird narcolepsy he calls in pet psychic Belinda who soon realizes that in order to help Norman, she'll first have to help his owner.",0.6,9.0,It isn't about the winning. It's the never taking part that counts.,6.0,6.0,en,,,
155836.0,157005.0,Google e o Cérebro do Mundo,2013.0,Documentário,"O Google em 2002 tentou implementar um dos projetos mais ambiciosos da história da internet: escanear todos os livros existentes para criar uma livraria virtual , projeto previsto por HG Wells em 1937 e chamado de ""World Brain"". Porém, existem outras intenções além da preservação de todo o conhecimento registrado pela humanidade... Durante os escaneamentos, os escritores e editores entraram com ações para parar a ação de escaneamento da Google, alegando direitos autorais.",2.696,90.0,,6.1,21.0,en,/hT0rv4bZhWNOSLrBSGYHo9JIzaY.jpg,/5hIa02gmwF6PyQ7Y9eWkIQ8Obfo.jpg,
155866.0,214170.0,When Björk Met Attenborough,2013.0,Documentary,"Award-winning musician Björk and legendary broadcaster and naturalist Sir David Attenborough have admired each other's work for years but this is the first time they have discussed their mutual love of music and the natural world on screen.  In this remarkable documentary, Björk explores our unique relationship with music and discovers how technology might transform the way we engage with it in the future.",2.298,48.0,,8.7,7.0,en,/4R8cpEIFti4WbP1VrsSR60xd626.jpg,/vvVKPkLpiifnlY9FIPzocNu9O1Q.jpg,
156019.0,229353.0,No Más,2013.0,Documentário,"Em meio à era de ouro contemporânea do boxe - a década de 1980 - havia dois lutadores que criaram uma rivalidade cativante. Em 1980, as duas lutas entre eles em um período de pouco mais de 5 meses tinha todos os elementos dos clássicos instantâneos.",1.216,79.0,,7.1,7.0,en,/sMOaseJEu24lRcJHYcX2jLVTOEp.jpg,/AqyLOQiGQLpIINWx8T4zTchFBum.jpg,
156557.0,321645.0,This Is Normal,2013.0,Drama,"A young deaf woman undergoes an experimental medical procedure that is supposed to ""cure"" her of her deafness and give her the ability to hear.",0.655,20.0,,8.0,2.0,en,,,
156567.0,276828.0,Wind,2013.0,Animation,"An animated short about the daily life of people living in a windy area who seem helplessly exposed to the weather. However, the inhabitants have learned to deal with their difficult living conditions. The wind creates a natural system for living.",0.6,4.0,,6.8,12.0,en,/fe3rjmR6GvPSbzHeKJdXxh8eRw3.jpg,,
156603.0,142914.0,In Search of Blind Joe Death: The Saga of John Fahey,2013.0,Documentary|History,"In Search of Blind Joe Death: The Saga of John Fahey is a documentary film about the legendary American guitarist, composer and provocateur John Fahey, 1939-2001. Fahey is often considered the godfather of 'American primitive guitar'. This cinematic exploration features Pete Townshend, Chris Funk of The Decemberists and Joey Burns of Calexico. These stellar musicians, along with Fahey associates and friends such as the famous 'Dr. Demento', radio broadcaster Barry Hansen, explore the legacy of this profoundly influential artist. The film was recorded in the Washington D.C. area where John Fahey was born, along the Mississippi Delta from Memphis to New Orleans, in Los Angeles, Toronto, Austin, New York and in Oregon where Fahey spent his last two decades.",0.965,58.0,,7.0,4.0,en,,/rsGkmeBZd6sooW0Inut4bJyC2fO.jpg,
156615.0,224944.0,Silent Retreat,2013.0,Horror|Mystery|Thriller,"Janey arrives at a silent retreat in the middle of the woods for rehabilitation, only to discover that the men who run it aren't afraid to show her what lurks beyond the trees.",3.038,85.0,The only way to escape the silence is to scream,5.2,25.0,en,/oblBj13d35CwQI6i9NdjtlsbaPK.jpg,/6IlkTIDgWyn7Bzw3z0De6RRC7uP.jpg,k9720
156787.0,238177.0,Jimmy Carr: Laughing and Joking,2013.0,Comedy,"Touring to over 1.5 million people and hosting hit shows '8 Out of 10 Cats', '10 O'Clock Live' and 'The Big Fat Quiz of the Year' means that Jimmy knows a thing or two about making people laugh. The show is packed with one-liners, stories & jokes—some clever, some rude and a few totally unacceptable.",3.085,92.0,,7.3,24.0,en,/pNmPRuHeb0NjhaA9jmKcktP9Rdd.jpg,/nRcmDqSDeCPL0qKEVK1ilVV2TXQ.jpg,k9716
156826.0,235046.0,Casa do Medo,2013.0,Thriller|Terror,"Depois de um grave acidente de carro, em que três de seus amigos morreram, Michelle é enviada para uma clínica de reabilitação. Algum tempo depois, a jovem tenta retomar sua vida. A primeira coisa que ela procura é um emprego. Uma oportunidade surge quando uma amiga dá a Michelle o cartão da Darkroom Inc., uma agência de modelos que está buscando uma garota com o perfil dela para uma sessão de fotos. Michelle aceita e vai ao local combinado. Entretanto, tudo parece muito suspeito. É quando ela descobre que foi vítima de uma armadilha. Michelle se vê em um porão, trancada em uma cela, onde ela pode ver, através de uma TV, pessoas sendo torturadas. E logo chega a vez dela de passar por este inferno. Seria isso uma forma de Michelle pagar por seus erros ou apenas um psicopata que a escolheu ao acaso?",10.594,81.0,,4.8,35.0,en,/ng54NnEO4uvIdFzUgcpWz8rgZvL.jpg,/xjZa1WejtaTzokIEWqvEuAFAGWI.jpg,k13006
156840.0,166660.0,Jurassic Attack,2013.0,Action|Science Fiction,"While returning from a military expedition a helicopter crash lands a commando unit in a dense, remote tropical jungle – a lost world populated by dinosaurs. Now they must find a way out of this isolated valley before becoming prey for prehistoric predators.",5.461,84.0,,4.0,34.0,en,/ids8ZO3KOhgGscQDpuAdtgGb8Tb.jpg,/38fYDRFOP6TD9xw6slBwq5GT3Id.jpg,
156925.0,170194.0,Riddle,2013.0,Mystery|Thriller,"Holly &amp; Nathan Teller live in a small town in Pennsylvania. Holly is on the cheerleading team and has a close relationship with her younger brother Nathan, who is subjected to bullying at school.  Nathan is taken for a car ride one day by the bullies, whose intent about what they are going to do with Nathan is not clear. He gives them the slip, but disappears and is still missing after three years.",4.917,100.0,A mysterious town. A deadly secret.,4.4,41.0,en,/iMY6L1aKXJjBk05IjCkEDWw2Fj1.jpg,/xa8GA9nkxnq4lxefP4XpgkGFjQX.jpg,
157132.0,161143.0,Alucinante Madagascar,2013.0,Animação|Comédia|Família,"O feriado favorito de Alex, Dia dos Namorados, chega repleto de surpresas hilariantes para toda a turma entrar de cabeça. Melman tem grandes planos para Gloria, Marty tenta impressionar uma nova amiga e todos querem colocar as mãos na poção mágica de amor do Rei Julien. Você vai se apaixonar por essa incrível aventura.",38.857,22.0,Uma nova aventura.,6.4,155.0,en,/1soVS8RuzmWHBOw3sym1krPe58v.jpg,/rUfOJAiI9fecyf4jpEFWJoly0l8.jpg,k6513|k267848
