movieId,tmdbId,title,release_date,genres,overview,popularity,runtime,tagline,vote_average,vote_count,original_language,backdrop_path,poster_path,keywords
98175.0,73935.0,Vampiras,2012.0,Comédia|Romance|Terror,Goody (Alicia Silverstone) e Stacy (Krysten Ritter) são duas jovens e modernas vampiras que vivem muito bem Nova York. Mas eis que o amor entra em suas vidas e ambas têm de tomar importantes decisões.,30.841,93.0,,5.3,216.0,en,/jRfYRzwE4eX1qcnMSTagL1xlxGS.jpg,/5egyjcnb0lCUBGvVAy6FARFXy4.jpg,k3133|k9673
98193.0,84288.0,A Guerra Invisível,2012.0,Crime|Drama|História|Documentário,"O sonho das mulheres que entram para o exército norte-americano é servir e proteger seu país. Mas uma vez no campo de batalha, elas sofrem um número crescente de abusos sexuais por parte de seus supostos companheiros.",6.075,93.0,,7.5,92.0,en,,/ph9Lo3pMNmTXFQa9wZVdCKL2tRe.jpg,k18035
98203.0,50620.0,A Saga Crepúsculo: Amanhecer - Parte 2,2012.0,Aventura|Fantasia|Drama|Romance,"Após dar a luz a Renesmee, quase morrer e ser transformada em vampira, Bella agora tem que proteger sua filha da ameaça dos Volturi, juntamente com a ajuda de seu grande amor Edward e seu melhor amigo Jacob.",105.696,115.0,O final épico que viverá para sempre,6.5,7316.0,en,/qkl57wzSFrpi2sRpoc2mZJbMuLP.jpg,/pVNobbWwSM2xpv2rRejxwnHf4xH.jpg,k818|k3133
98211.0,105586.0,Shakespeare High,2012.0,Documentary,"SHAKESPEARE HIGH is a feature-length documentary about a determined group of teens whose immersion in the Drama Teachers Association of Southern California's high school drama program compels them to overcome their difficulties and create better lives for themselves.  Among the many famous alumni/ae of this almost 100 year-old program are Kevin Spacey, Val Kilmer, Mare Winningham and Richard Dreyfuss, all featured in the movie.",0.988,81.0,,6.5,2.0,en,,/sEN5PDbGecnuEVp2IA1up76MnKk.jpg,
98230.0,58547.0,10 Anos de Pura Amizade,2012.0,Comédia|Drama,"Após dez anos, antigos amigos de escola voltam a se encontrar e descobrem que, apesar do tempo, certas coisas não mudam.",6.947,100.0,,5.8,431.0,en,/m3i3asfpbMyIW7tGOfq9w7T0Q7F.jpg,/mxHwFDH0HlAZjVAnX0gd619Bahk.jpg,
98237.0,84323.0,Price Check,2012.0,Drama|Comedy,"A middle aged, middle class, former music industry executive with a stay-at-home wife and son toils away at a supermarket chain. When a new high energy boss enters the company, she increases his fortunes and responsibilities while also creating tension in both his professional and personal life.",3.392,92.0,,5.4,27.0,en,,/xpgjWwyWaf1i9eNcdfYW7bEOoWI.jpg,k10085
98239.0,60747.0,Amanhecer Violento,2012.0,Ação|Thriller,"O dia estava tranquilo até um grupo de pára-quedistas aterrissar no campo de futebol de um colégio. Era o início de uma invasão da Coreia do Norte ao território americano, o que gera pânico nos habitantes da cidade. Decididos a defender o local, oito jovens se escondem nas montanhas e, adotando o nome de sua equipe de futebol, The Wolverine, planejam como revidar à invasão das forças militares inimigas.",70.908,93.0,,5.6,1239.0,en,/nEF7l3CvGNqvxmicr0z2iZrfqae.jpg,/rq9EOXrBIWvDb5bey2vrUHlIui1.jpg,k162365
98243.0,81188.0,A Origem dos Guardiões,2012.0,Família|Animação|Fantasia|Ação|Aventura,"As crianças do mundo inteiro são protegidas por um seleto grupo de guardiões: Papai Noel, Fada do Dente, Coelho da Páscoa e Sandman. São eles que garantem a inocência e as lendas infantis. Mas um espírito maligno, o Breu, pretende transformar todos os sonhos em pesadelo, despertando medo em todas as crianças. Para combater este adversário poderoso, a Lua designa um novo guardião para ajudar o grupo: Jack Frost, um garotinho invisível que controla o inverno. Sem conhecer sua própria vocação de guardião, ele embarca em uma aventura na qual vai descobrir tanto sobre as crianças quanto sobre seu próprio passado.",56.786,97.0,As lendas se unem.,7.3,5299.0,en,/puFbbiJxY0rjJtcvsTeSCQHNchR.jpg,/qexDkVYcoJMP9YguYw3ej1Xud3U.jpg,k6054|k6513|k207317
98279.0,101519.0,Um Fantástico Medo de Tudo,2012.0,Comédia|Thriller|Terror,Um autor de livros infantis (Pegg) que decide virar escritor de romances de mistério. Sua pesquisa sobre assassinos em série da era vitoriana o transforma em um paranoico - especialmente quando um executivo de Hollywood decide fazer um filme com base nas descobertas do escritor.,7.129,100.0,,5.7,221.0,en,/mUWjBk12lY0om9iEFK8wdhxj7It.jpg,/sMZyKSo8b47VW1h2zjjGUZIefV1.jpg,
98296.0,97614.0,A Fuga,2012.0,Crime|Drama|Thriller,"Em uma região próxima a fronteira com o Canadá, os irmãos Addison (Eric Bana) e Liza (Olivia Wilde) sofrem um acidente durante a fuga de um assalto cometido por eles. Para despistar a polícia, decidem se separar momentaneamente e seguem caminhos distintos. Enquanto isso, o jovem Jay (Charlie Hunnam) acaba de sair da prisão com a intenção de encontrar a mãe (Sissy Spacek) e o pai (Kris Kristofferson) durante o feriado de Ação de Graças. Mas ele acaba conhecendo Liza no meio do caminho e sem saber do passado dela, se deixa seduzir por sua beleza. Só que o tal irmão da garota vinha deixando um rastro de sangue por onde passava e seus destinos podem se cruzar a qualquer momento.",10.841,95.0,Não tente escapar do seu passado.,5.9,503.0,en,/vJTpt1O4ujcanoH1gqXao51b6JU.jpg,/xDR8WXaxuy84S4Q6tAYyByZve7L.jpg,k9826|k18035
98361.0,102780.0,Byzantium: Uma Vida Eterna,2012.0,Drama|Fantasia|Thriller,"Clara (Gemma Arterton) é uma jovem mãe vampira que morde sua filha Eleanor (Saoirse Ronan). Procurando por refúgio, a dupla mortal conhece o solitário Noel. Pouco tempo depois, a adolescente faz amizade com Frank (Caleb Landry Jones) e conta que elas sobrevivem com sangue humano há cerca de 200 anos. O segredo começa a se espalhar e o passado das mulheres vai voltar para assombrá-las.",7.032,118.0,,6.3,632.0,en,/hZAmxC0AGd85xE5RQDffI03jVxp.jpg,/pmQ46zB6qEWvPu8neE3noBsE5d8.jpg,k3133
98373.0,85446.0,"Ela Dança, Eu Danço 4",2012.0,Música|Drama|Romance,"Emily é a filha de uma ocupada empresária que chega a Miami com o sonho de se tornar dançarina profissional. Logo ela se apaixona por Sean, o responsável por criar elaboradas danças para a realização de flash mobs, aglomerações instantâneas de pessoas em um lugar público para realizar uma ação previamente combinada. Líder de um grupo chamado MOB, Sean resolve participar de uma disputa que pode render uma oportunidade de patrocínio.",24.833,99.0,Um passo pode mudar seu mundo,6.9,1760.0,en,/1RWL9614SMoYV7NSbkrGjAQE1EY.jpg,/pqTxJfMVYEtz3LpGjf1hCxqiZ7V.jpg,
98400.0,75204.0,Imaginaerum,2012.0,Fantasia|Drama,"Filme fantasioso baseado na música do 7º disco de estúdio da banda finlandesa Nightwish, que carrega o mesmo nome e tem 13 faixas. O protagonista do filme é um compositor com uma imaginação de outro mundo. Ele é um senhor de idade que pensa ainda ser um garoto. Enquanto dorme, ele viaja em seu passado distante, onde seus antigos sonhos retornam misturados com o mundo de música e fantasia do menino. Em seus sonhos, o senhor luta para encontrar as memórias que mais lhe importavam.",5.788,80.0,,5.8,113.0,en,/4yor13fR3xzwojRFkh9sc5XJMHb.jpg,/kQWx3rTawlFtj3an599mqe6VdTz.jpg,
98491.0,140420.0,O Avião de Papel,2012.0,Animação|Família|Romance,"Nova York, Estados Unidos. Ao ir para o trabalho, um homem se interessa por uma jovem que vê na estação de trem. Entretanto, não consegue falar com ela. Ao chegar ao escritório, ele a vê no prédio ao lado. Sem conseguir chamar sua atenção, ele passa a fazer aviões de papel com o material do trabalho e tenta acertá-los bem na janela do escritório em que ela está, em uma tentativa desesperada para que ela possa, enfim, notá-lo.",6.422,7.0,"Delicada, charmosa e doce.",8.0,1426.0,en,/48v92pR5a1JeczlrCwnr1eQBN2j.jpg,/38M9ttjqbLaKsxQYUHVX5BZQ5yE.jpg,
98585.0,112336.0,Hitchcock,2012.0,Drama,"Baseado no livro ""Alfred Hitchcock And The Making Of Psycho"", este filme revela os bastidores do clássico Psicose (1960). Na época, mesmo estando no auge de sua carreira, Hitchcock não conseguiu apoio para realizar a obra, porque os estúdios não queriam investir em um pequeno filme de terror. O resultado foi uma produção independente, de baixo orçamento, que encontrou grandes dificuldades para driblar a censura e para ser distribuída nos Estados Unidos, em função das cenas de violência e nudez. Além disso, diversos obstáculos surgiram durante as filmagens, como as brigas constantes entre Hitchcock e sua esposa, Alma (Helen Mirren), os problemas de saúde do diretor e seus desentendimentos com o elenco. Contrariando todas as expectativas, ""Psicose"" se tornou uma referência no cinema mundial, e um dos maiores sucessos na carreira do cineasta.",8.51,98.0,Boa noite.,6.5,1195.0,en,/rpJa6wu3wQ2XtAhq5qogAraduTG.jpg,/zlG4QzB00VM6QHUmRkKaboCOgat.jpg,
98766.0,80387.0,Carol Channing: Larger Than Life,2012.0,Documentary|Music|Romance,"If Carol Channing didn't exist, no one could have made her up. One in a billion, Carol , at 89, remains an unstoppable, megawatt dynamo. Broadway diva extraordinaire is just the icing. Carol Channing hovered at the pinnacle of the entertainment world from the late-1950's through the 1960's and beyond, living life sensationally large. As Carol has observed, '...if you're lucky enough to have two hit shows, the world passes through your dressing room'. At 89, she remains irrepressible.",1.933,87.0,,7.8,6.0,en,,/qW1NG3KjNVAkPezdCXFHAI0cleP.jpg,
98799.0,110392.0,A Liar's Autobiography: The Untrue Story of Monty Python's Graham Chapman,2012.0,Animation|Comedy,"John Cleese, Michael Palin, Terry Jones and Terry Gilliam pay tribute to their late Monty Python colleague Graham Chapman in this hilarious, 3-D animated adaptation of Chapman's brazenly fictionalized life story. (TIFF)",4.608,85.0,"Still Dead, And Now in 3D",6.5,32.0,en,/8BWpFYKWMh4va8Ckxy7VUtYdU4L.jpg,/b8AKAb65f0CyuYM9FBkFYxePAlu.jpg,
98809.0,49051.0,O Hobbit: Uma Jornada Inesperada,2012.0,Aventura|Fantasia|Ação,"Como a maioria dos hobbits, Bilbo Bolseiro leva uma vida tranquila até o dia em que recebe uma missão do mago Gandalf. Acompanhado por um grupo de anões, ele parte numa jornada até a Montanha Solitária para libertar o Reino de Erebor do dragão Smaug.",119.723,182.0,Dos menores começos vêm as maiores lendas.,7.3,15271.0,en,/gioXMobK8vbD6bcTsjKYKfgacNt.jpg,/asuSvb1MDN04HftUFxlp7i6ZHpV.jpg,k818
98834.0,127916.0,The Fitzgerald Family Christmas,2012.0,Drama|Family,The siblings of the Fitzgerald family must decide if the dad who abandoned them 20 years ago can come home for Christmas. Can the big Irish clan get past their grievances to be a family again?,2.764,103.0,A time to share the spirit of the season.,6.5,13.0,en,/gckd5pU4NaML6LijOuxB1Kb0IF.jpg,/dNvgepbxYluMY3szgG6n8msXmEe.jpg,k207317
98836.0,87504.0,Um Final de Semana em Hyde Park,2012.0,Comédia|Drama|História,"A história do caso de amor entre Franklin Delano Roosevelt e sua prima distante, Margaret Stuckley, centrou-se no fim de semana de 1939, quando o rei e a rainha do Reino Unido visitaram o norte de Nova York.",6.075,94.0,,5.4,155.0,en,/kXayeWmsH6zd8bNX1mgl8c7HmYc.jpg,/wOMeb1BV9gsjPcCo1IysIRwBgXK.jpg,
98838.0,84305.0,O Dobro ou Nada,2012.0,Drama|Comédia,"Beth Raymer (Rebecca Hall) é uma sonhadora incorrigível que trabalha como dançarina em uma casa de striptease em Tallahassee. Sua vida muda quando conhece Dink Heimowitz (Bruce Willis), um dos jogadores mais conhecidos da atualidade, que participará de um campeonato de pôquer em Las Vegas. Beth logo se torna sua assistente, mas precisa lidar com as ameaças da esposa de Dink, Tulip (Catherine Zeta-Jones), uma showgirl aposentada.",7.869,94.0,,5.3,184.0,en,/8DdQN1Hv18mhkn2qSMLvgWtQ2aB.jpg,/79ohgcR7sSDA3smxrUrBjf7JSGb.jpg,k10594
98845.0,106135.0,Uma Equipe de Honra,2012.0,Drama,"O índio americano Joe Logan quer modernizar sua reserva, mas precisa redescobrir seu espírito. Ele se torna o treinador da equipe de lacrosse da escola da tribo, que competirá com os alunos mais preparados de um colégio de elite.",4.729,106.0,,6.5,35.0,en,/bwAjdtmxmRD0PVhVxSq2tpo99A9.jpg,/7U4h600YDepnrTOwa2MmQgYi8lN.jpg,
98911.0,83738.0,"After Fall, Winter",2012.0,Drama|Romance,"WINTER is a dangerous, sexy, poignant and at times darkly funny story about two people who desperately want intimacy but have fashioned lives of reclusivity and emotional fracture which ultimately spells the doom of their great love. WINTER begins with Michael, in his mid forties, suicidal about his writing career, which once flourished and now is on a downturn. He leaves his home in New York and goes to Paris in hopes of igniting his passion for writing and life. He also has a penchant for S and M. Soon after is arrival he meets Sophie, a sexy, smart, soulful, nurse who helps dying people transition to the after world. She and Michael instantly have chemistry albeit combative. Sophie has a secret. Her other job is being a dominatrix. Throughout the film, Sophie is nursing a little girl, Anais, who is dying of leukemia. Written by Anonymous  (IMDB.com).",2.214,130.0,,5.8,14.0,en,/bY88AENx5hh46xZBShEd1j81Xjg.jpg,/jIFBowyZQkeydF18YHXHgiX1DpN.jpg,
98961.0,97630.0,A Hora Mais Escura,2012.0,Thriller|Drama|História,"Maya é uma agente da CIA que está por trás dos principais esforços em capturar Osama bin Laden, por ter descoberto os interlocutores do líder do grupo terrorista. Com isso ela participa da operação que levou militares americanos a invadir o território paquistanês, com o objetivo de capturar e matar bin Laden.",22.342,157.0,"A maior caçada humana da história, em busca do homem mais perigoso do mundo.",7.0,3526.0,en,/evPzxMacNWsjkUKQO4NXKe5Rl6a.jpg,/fWpjkM77R5o4MV0nxO2cnywkCoJ.jpg,k162365
98963.0,97989.0,O Som ao Redor,2012.0,Thriller|Drama|Crime,"A vida numa rua de classe média na zona sul do Recife toma um rumo inesperado, após a chegada de uma milícia que oferece a paz de espírito da segurança particular. A presença desses homens traz tranquilidade para alguns, e tensão para outros, numa comunidade que parece temer muita coisa. Enquanto isso, Bia (Maeve Jinkings), casada e mãe de duas crianças, precisa achar uma maneira de lidar com os latidos constantes do cão de seu vizinho.",6.005,131.0,,7.0,169.0,pt,/2sV51qQf5ItWKTqfIwbMgdImE4K.jpg,/qVSxFFAv7IoTccP7MTk5L92Gfon.jpg,
98973.0,84185.0,Perseguindo o Gelo,2012.0,Documentário,O fotógrafo ambiental James Balog usa câmeras com efeito time-lapse para capturar as mudanças das geleiras do mundo com o passar dos anos.,9.037,74.0,,7.5,127.0,en,/pTzzoMS3OQ2iM1RImLITf9w0ov7.jpg,/q4T6Wqh7ZXzf30odR2Yo2dLWdZ.jpg,
98975.0,125490.0,Antiviral,2012.0,Ficção científica|Terror,"Syd March (Caleb Landry Jones) trabalha em uma clínica que vende injeções de vírus colhidos em celebridades doentes para seus admiradores fanáticos. Depois de se infectar com o vírus que matou a superestrela Hannah Geist (Sarah Gadon), Syd deve desvendar o mistério que envolve essa estranha doença e salvar sua própria vida.",7.692,110.0,,5.9,256.0,en,/1wvlobvVBXabfZdKNUxbiGor2lp.jpg,/zvD0T5jOq7hPN40MT66dykHy27T.jpg,k8201
98991.0,121147.0,Freeloaders,2012.0,Comedy,Slackers who live for free in a rock star's mansion find that their ride on the gravy train is coming to an end with the sale of their pal's residence.,3.778,77.0,Living on easy street just got a little harder.,4.8,26.0,en,,/kvOBuP7Ckzmm77nSlxPHAwAra5b.jpg,
99024.0,96648.0,Desespero,2012.0,Terror|Thriller,"George, Max e Ricky formam uma banda de rock de garagem e estão esperando por sua grande chance cair do céu. Entre pequenos shows e constantes ensaios, eles ganham na cozinha de um hospício de segurança máxima para criminosos insanos. O pagamento é bom e eles têm risco mínimo - já que não existe qualquer contato físico com os internos. Uma noite, no entanto, antes do jantar, uma tempestade derruba o sistema de segurança. As portas são abertas e os lunáticos estão à solta. A ajuda está a caminho - mas eles terão que sobreviver até que ela chegue.",7.428,85.0,Três jovens estão prestes a conhecer a loucura em seu estado mais bruto.,5.6,82.0,en,/lyyCKESFs9zeyJ353Ri4ws2oGyv.jpg,/cJj5f0QFATBKWh8Lg9B1JI94bzR.jpg,
99030.0,83186.0,Wrong,2012.0,Comedy|Mystery,"Dolph Springer wakes up one morning to realize he has lost the love of his life, his dog, Paul. During his quest to get Paul (and his life) back, Dolph radically changes the lives of others -- risking his sanity all the while.",5.931,94.0,,6.3,240.0,en,/8hxsb8Aicvisg5DmnGYyIBvTh8r.jpg,/y2leAYKv7fMs3ZjngZY6HJjZTkE.jpg,k1930
99047.0,116979.0,Acorrentados,2012.0,Terror|Thriller|Crime,"Bob (Vincent D'Onofrio) é um serial killer que vigia suas presas ao redor da cidade junto ao seu protegido Tim (Eamon Farren), que precisa fazer uma escolha de vida ou morte: seguir os passos de Bob ou se livrar dele.",8.08,94.0,,6.7,322.0,en,/AeO9xTg9AmshtZtW1JSFGe8ZtGy.jpg,/8MJCvge2ReUSFWzPndKySrf94np.jpg,k10714
99058.0,84187.0,The Comedy,2012.0,Comedy|Drama,"Indifferent to the notion of inheriting his father's estate, a restless, aging New Yorker passes time with his friends in games of mock sincerity, irreverence, and recreational cruelty towards those around them.",4.32,95.0,,6.0,45.0,en,,/vODQ3Qiu8Ze4nrlMjDa7UmFSonJ.jpg,
99087.0,77875.0,Um Bom Partido,2012.0,Comédia|Romance,"George (Gerard Butler) é um ex-jogador de futebol que, na tentativa de se aproximar do filho, passa a treinar a equipe juvenil na qual ele joga. Só que ele não consegue se manter afastado das mães dos colegas de seu filho, a quem vive dando em cima.",8.08,105.0,,5.6,550.0,en,/7nri5lxSStrCPGQdN8XBm2eDVBf.jpg,/jYv6MqOoAIpxZd6ydJ4S5S2QHDZ.jpg,
99106.0,82687.0,Minha Mãe é uma Viagem,2012.0,Comédia,"O plano de uma rápida visita à sua casa toma um rumo inesperado, quando, por impulso, Andy (Rogen) convida sua mãe, Joyce (Streisand), para uma viagem de 8 dias e quase 5 mil km pelo país. Quanto mais longe vão, mais próximos ficam... Então, prepare-se para a divertidíssima aventura que pode provar que eles têm mais em comum do que Andy jamais imaginou.",8.004,95.0,"Inteligente, Charmosa e Divertida",5.6,542.0,en,/tE5TdJk84pJTzuhe2CCsxBSQidf.jpg,/540apAAAX5FQVvvthdZ8OhMM7ee.jpg,
99110.0,84333.0,Save the Date,2012.0,Comedy|Romance,"After breaking up with her boyfriend, a bookstore manager resists a seemingly perfect guy's attempts to woo her.",5.232,98.0,Sometimes you have to break a heart to be true to your own.,5.9,80.0,en,/weLm4P5vmefsfljTzIKUiJ2p0fo.jpg,/qSNMz9BRpEfVvpKIv3fROd2bLOI.jpg,k13027
99112.0,75780.0,Jack Reacher: O Último Tiro,2012.0,Crime|Drama|Thriller|Ação,"O ex-investigador militar Jack Reacher surge das páginas do livro de Lee Child e invade as telas, neste explosivo filme de suspense que os críticos consideram ""um thriller superior"". Quando cinco pessoas são assassinadas e todas as evidências apontam alguém que jura ser inocente, somente um homem está treinado para pegar os verdadeiros criminosos. A lei tem limites, mas Jack Reacher não, neste sucesso de ação máxima.",49.521,130.0,A lei tem limites. Ele não tem.,6.5,5421.0,en,/k7h4RNAarfOrF2r2YMN0P2FQSr4.jpg,/14Wj4HZOdPmN2DXNbXXvJH2DwIf.jpg,k703|k818|k6149|k9826
99114.0,68718.0,Django Livre,2012.0,Drama|Faroeste,"Django é um escravo, comprado pelo caçador de recompensas alemão Dr. King Schultz para auxiliá-lo em uma missão. A dupla acaba fazendo amizade e, após resolver os problemas do caçador, parte em busca por Broomhilda, esposa de Django. Para isso, eles devem enfrentar o vilão Calvin Candie, proprietário da escrava.",75.634,165.0,"O D é mudo, a revanche não será.",8.1,21399.0,en,/2oZklIzUbvZXXzIFzv7Hi68d6xf.jpg,/xFOZFOdQFijudZrgX53mHeBI2Ff.jpg,k6054|k9748|k10084
99117.0,89492.0,Bem-Vindo aos 40,2012.0,Comédia,"Após anos de casamento, Pete e Debbie estão chegando em uma fase de decadência. Enquanto tentam equilibrar romance, carreiras profissionais, pais e filhos, com seu próprio e hilariante, eles também tem que imaginar como aproveitar o resto de suas vidas.",16.472,134.0,,5.8,1737.0,en,/botG6F4zvVD6WnDxQCWTU7U5cTD.jpg,/j2Zt3IaAtRwHBIUrgArpXQzpOPP.jpg,k9673
99143.0,94352.0,Cirque du Soleil: Outros Mundos,2012.0,Fantasia|Família|Música|Drama,"O mais famoso circo acrobático do mundo traz Worlds Away, um espetáculo inédito concebido especialmente para um filme em 3D. A trama apresenta Mia (Erica Linz), uma jovem garota que decide visitar o circo. Chegando no local, ela observa um jovem (Igor Zaripov) arrumar a tenda do picadeiro, e os dois se apaixonam à primeira vista. Ela logo descobre que este homem é um famoso equilibrista e trapezista, e decide assistir a uma de suas apresentações. No entanto, quando o artista percebe a presença de Mia no público, ele erra sua manobra e cai em um mundo mágico, levando Mia consigo. Entre diversos perigos e seres mágicos, eles tentam se encontrar.",8.339,91.0,Experimente a aventura que levará você para outros mundos,7.0,135.0,en,/22RJPOcck5lnLDiLKy0kjqtgH15.jpg,/fIyOrVzesRYxadeJjo9LUTFuMdp.jpg,
99145.0,80278.0,O Impossível,2012.0,Thriller|Drama,"O casal Maria e Henry está aproveitando as férias de inverno na Tailândia junto com os três filhos pequenos. Mas em uma manhã, um tsunami de proporções devastadoras atinge o local, arrastando tudo o que encontra pela frente. Separados em dois grupos, a mãe e o filho mais velho vão enfrentar situações desesperadoras para se manterem vivos, enquanto, o pai e as duas crianças menores não sabem se os outros dois ainda estão vivos.",25.654,114.0,Nada é mais poderoso que o espírito humano.,7.3,5138.0,en,/6xyZP1DgByVN2NbTgYwQFhQVFsv.jpg,/pXFlIZkolvmOO9XnU4zeE9p4WfC.jpg,
99149.0,82695.0,Os Miseráveis,2012.0,História|Drama,"Na França do século 19, o ex-prisioneiro Jean Valjean, perseguido ao longo de décadas pelo impiedoso policial Javert por ter violado sua liberdade condicional, busca redenção pelo seu passado e decide acolher a filha da prostituta Fantine.",18.972,158.0,,7.4,4410.0,en,/nU6Xptg0KVxuVx737W5bvmP8wmg.jpg,/ksk8Ao5xNgHix2904FNaEGXoPEN.jpg,k13027
99171.0,85652.0,Mamitas,2012.0,Drama|Romance,"A teenager in Echo Park deals with the loss of his mother and his attraction to a girl not considered ""cool"" by his friends.",3.736,109.0,You never know who will change your life forever.,6.3,6.0,en,,/fD41klooPhp4SRPIriYUqCJh5of.jpg,
99178.0,87440.0,O Diário de Carson Phillips,2012.0,Comédia|Drama,"Na trama, o adolescente Carson Phillips quer realizar o sonho de se tornar um jornalista de sucesso e editor-chefe da revista literária The New Yorker, mas morre atingido por um raio. A partir desse fato, ele conta em flashbacks sua empreitada de chantagear outros estudantes de sua escola para entrar na equipe de sua revista literária de colégio e ajudá-lo a realizar seu sonho.",6.891,90.0,,6.3,196.0,en,/7LM4nm9QSmIUWvIVYGiEXwqMfO8.jpg,/kAuwNorQMImb6wkntssmrGRi2Nn.jpg,k1936
99217.0,128270.0,Not Fade Away,2012.0,Drama,"Set in suburban New Jersey in the 1960s, a group of friends form a rock band and try to make it big.",5.887,112.0,there is no past no future either. just the Now--,5.7,53.0,en,/szOA2o6ztv7wrKp8UOWDGr4Hfv0.jpg,/qHYG8V2L4mjQSOiTFG6jheMXZOo.jpg,
99220.0,121826.0,O Quarteto,2012.0,Drama|Comédia|Romance,"Cissy, Reginald e Wilf vivem em um lugar para músicos aposentados e estão organizando um importante concerto. A chegada de Jean, antiga companheira do quarteto e ex-amor de Reginald, vai remover velhos rancores e interromper a sua paz.",5.755,98.0,Quatro amigos buscam a harmonia perdida,6.5,289.0,en,/f9kWx1kENrdZc7IR2dcv96E2AQP.jpg,/vo4pmWqnGXkcLsHPhjikIjZEVSk.jpg,
99222.0,139455.0,Silent Night,2012.0,Comedy|Horror|Thriller|Mystery,The police force of a remote Midwestern town search for a killer Santa Claus who is picking off citizens on Christmas Eve.,7.605,94.0,He knows who's been naughty.,5.2,197.0,en,/pNHfwvBEqAyU2RuCyUUuxtSJJaI.jpg,/89xmDaISJ3igcAm582itRReuePq.jpg,k9826|k10714
99305.0,98886.0,Kumaré,2012.0,Documentary,"A documentary about a man who impersonates a wise Indian Guru and builds a following in Arizona. At the height of his popularity, the Guru Kumaré must reveal his true identity to his disciples and unveil his greatest teaching of all.",5.007,86.0,The true story of a false prophet,7.1,51.0,en,,/6XzJ4RAqNKI4V3K3UarK4MthJA8.jpg,
99415.0,88042.0,Uma Família em Apuros,2012.0,Comédia,"Quando Artie e Diane tomam conta dos netos e veem que os modernos métodos de educação excluem punição e diversão, eles esquecem as recomendações da filha e adotam suas antigas e inusitadas táticas para ensiná-los a serem crianças de verdade.",18.784,104.0,,5.9,383.0,en,/iEiQlWyV5RMgjJxOvHSHeP0vqfo.jpg,/yv9rgYbe1AyOuLoOO5EEbXJaVMr.jpg,k18035
99417.0,104732.0,Sexy Baby,2012.0,Documentary,"The cyber age is creating a new sexual landscape. While doing research for the film, we had intimate and candid conversations with kids in middle school classrooms, suburban shopping malls, nightclubs, college dorms, and even conducted an informal roundtable during a high school house party. While chronicling trends among small town and big city kids, we discovered this: Having pubic hair is considered unattractive and “gross.” Most youngsters know someone who has emailed or texted a naked photo of themselves. Many kids have accidentally or intentionally had their first introduction to sex be via hardcore online porn. Facebook has created an arena where kids compete to be “liked” and constantly worry about what image to portray – much of what was once private is now made public. And the list goes on.",3.537,83.0,A Documentary about sexiness & the cyber age,6.5,11.0,en,/ynKHbJIdILKph6tAXPkmCQoTHcF.jpg,/mno7Im3vPKWlp8XN9kVsubxFWvQ.jpg,
