movieId,tmdbId,title,release_date,genres,overview,popularity,runtime,tagline,vote_average,vote_count,original_language,backdrop_path,poster_path,keywords
82449.0,46660.0,I Love You Too,2010.0,Comedy|Drama|Romance,"Written by comedian Peter Helliar, I LOVE YOU TOO stars Brendan Cowell as Jim, a 30-something emotionally stunted man whose inability to declare his love to his girlfriend, Alice, threatens to cost him the best thing he ever had but leads him to befriend a talented dwarf who helps him find the words to get her back.",3.569,107.0,,6.0,25.0,en,/aZLiQIQZ9EqXQGTMIfxbFI9u4qs.jpg,/yhtLSMANn5GZqnzHjYYBkn8dEs9.jpg,
82459.0,44264.0,Bravura Indômita,2010.0,Drama|Aventura|Faroeste,"Depois que um bandido chamado Tom Chaney assassina seu pai, uma menina de 14 anos e mal-humorada, Mattie Ross, contrata Rooster Cogburn, um embriagado homem da lei para ajudá-la a encontrar Chaney e vingar seu pai . A dupla briguenta não está sozinha em sua busca. Um Texas Ranger, chamado LaBoeuf, também vem monitorando Chaney por razões próprias. Juntos, o trio se aventura em um território hostil para distribuir um pouco da justiça do Velho Oeste.",13.403,110.0,,7.3,4161.0,en,/ivo5vhAftxFiEZtDyOhepiYR24G.jpg,/dRFcmou6HSCsMUXVG5GVy9UH7R4.jpg,k818|k10085
82461.0,20526.0,Tron: O Legado,2010.0,Aventura|Ação|Ficção científica,"Quando Flynn, o maior criador de videogames do planeta, envia uma mensagem de um incrível mundo digital, seu filho descobre o caminho e embarca numa jornada pessoal para salvar seu pai desaparecido há anos. Com a ajuda da destemida guerreira Quorra, pai e filho se aventuram num universo cibernético incrível e travam a batalha definitiva do bem x mal.",110.365,126.0,,6.4,5718.0,en,/zK7wNuUQ4w0QQp9FF20YTPVgpyN.jpg,/wlHzvzXE9AvMgrVsKHg2PweC3aC.jpg,
82463.0,44009.0,Mais Um Ano,2010.0,Comédia|Drama,"Tom (Jim Broadbent) e Gerri (Ruth Sheen) são casados e levam uma vida confortável. O único filho deles é Joe (Oliver Maltman), que tem 30 anos e permanece solteiro. No verão Tom e Gerri resolvem visitar Ken (Peter Wight), um amigo dele dos tempos de colégio. Acima do peso e bebendo compulsivamente, Ken está infeliz. O casal decide fazer um churrasco para animá-lo e convida Mary (Lesley Manville), uma amiga de Gerri, para o evento. Mary está divorciada e em busca de um novo relacionamento. Após o churrasco ela aceita dar uma carona a Ken, que tenta assediá-la sexualmente.",6.939,129.0,,7.0,259.0,en,/8VPwE9Owon0lOUi1FdTfakEPVZM.jpg,/a00fyGan9XzaUULXYB3F8wIMp33.jpg,
82499.0,42888.0,Como Você Sabe,2010.0,Comédia|Drama|Romance,"Lisa Jorgenson reencontrou o amigo de longa data George no meio de uma crise em seu relacionamento com Manny. Enquanto Manny pelo coração de sua amada, George encara um tremendo problema financeiro, que só serve para temperar ainda mais esse complicado e divertido triângulo amoroso.",9.045,121.0,,5.2,743.0,en,/yJvXWCNGsHJOP3okeoYgYqin7y2.jpg,/3kTP5wjaPqAApRdnYobrJziLhAC.jpg,
82527.0,46829.0,A Minha Versão do Amor,2010.0,Comédia|Drama,"No final de sua vida, Barney Panofsky relembra seus triunfos e tragédias, começando pela relação malfadada com Clara, com quem se casa quando ela fica grávida. Quando o relacionamento se desfaz, ele retorna a Montreal e se casa mais duas vezes, encontrando, finalmente, a felicidade com Miriam, sua terceira esposa. Em meio a isso tudo, Barney se sustenta com seu trabalho na televisão, cria os filhos e ouve os conselhos do pai.",11.504,134.0,,7.1,327.0,en,/lQ5rAuqg3isxXAFTxueaXPsH2CS.jpg,/iGX5ZveRqPZcUyL5qJZvB1RTDcZ.jpg,k236
82534.0,44129.0,A Grande Virada,2010.0,Drama,"Bobby Walker (Ben Affleck) não tem o que reclamar da vida. Tem uma bela família, um bom emprego e um deslumbrante Porsche na garagem. O que ele não esperava era que, devido a uma política de redução de pessoal, fosse demitido. Phil Woodward (Chris Coioper) e Gene McClary (Tommy Lee Jones), seus colegas de trabalho, passam pela mesma situação. A mudança faz com que o trio tenha que redefinir suas vidas, como maridos e pais de família.",9.104,104.0,,6.5,520.0,en,/4iQ1BLft7WpJBBuPM91SMvO7FGO.jpg,/sElsIOipaH6G3RwxLFCM3xd4Yhd.jpg,
82606.0,50673.0,Life in Flight,2010.0,Comedy|Drama|Romance,A successful New York architect with a beautiful wife and an adoring young son is forced to reevaluate his outwardly idyllic life after a chance meeting with an urban designer reveals the cracks in the foundation of his paradise.,2.788,78.0,,6.8,5.0,en,/5pmQTkuPKKD6Vb0NN6KB1nPyxmE.jpg,/wAC7cXZa5lhCgCcAvMgvbiOmRUk.jpg,
82744.0,41283.0,Rápida Vingança,2010.0,Crime|Drama|Ação|Thriller,"Depois de cumprir 10 anos de prisão, Driver (Dwayne Johnson) só tem um objetivo: vingar a morte de seu irmão, assassinado em um assalto mal planejado. Mas tem gente disposta a atrapalhar seus planos. Um deles é um policial veterano (Billy Bob Thornton) prestes a se aposentar. O outro, é um matador de aluguel (Oliver Jackson-Cohen), viciado em adrenalina e bastante egocêntrico. Agora, é uma questão de tempo para saber que sai vivo desse jogo de caça e o caçador.",21.335,98.0,"Se você está na lista, considere-se morto",6.3,1427.0,en,/v1ajWq5IQOrlmSTGXmtEeHFIwdh.jpg,/rRwsd7JqmWAkgKbKDA9nAXoGbSR.jpg,k6149|k9748
82767.0,27585.0,Reencontrando a Felicidade,2010.0,Drama,"Becca e Howie Corbett são um casal feliz, cujo mundo perfeito é mudado para sempre quando seu pequeno filho Danny é morto por um carro. Becca, uma executiva que virou dona-de-casa, tenta redefinir sua existência em um lugar surreal de família bem-intencionada e amigos. Dolorosas, pungentes, e muitas vezes engraçadas, as experiências de Becca vão levá-la a encontrar consolo em um relacionamento misterioso com Jason, um jovem e perturbado artista de quadrinhos que conduzia o carro que matou Danny. A fixação de Becca com Jason a leva para longe das memórias de Danny, enquanto Howie mergulha no passado, buscando refúgio em estranhos que lhe oferecem algo que Becca é incapaz de dar. Os Corbetts, à deriva, fazem surpreendentes e perigosas escolhas enquanto decidem por um caminho que vai determinar seus destinos.",11.215,91.0,,6.7,425.0,en,/fTMCH5qMQIFqA25NQTpP0gddpef.jpg,/6LZFnJ8J90apcOBrsniAhFnRIsM.jpg,
82852.0,39451.0,Entrando Numa Fria Maior Ainda com a Família,2010.0,Comédia|Romance,"Greg Focker finalmente começou a obter o respeito de seu sogro Jack Byrnes, um ex-agente da CIA, mas um importante teste ainda está para acontecer: será que Greg poderá provar que está preparado para ser o próximo chefe da família Focker... ou o laço de confiança será desfeito para sempre?",34.301,98.0,,5.6,2614.0,en,/cCPR9HRyzdlr0blVuLZDpRuVJun.jpg,/kO5SkXZlsH2Yd54Ksy3e5cFt6mB.jpg,
82854.0,38745.0,As Viagens de Gulliver,2010.0,Família|Comédia|Aventura|Fantasia,"Lemuel Gulliver trabalha como entregador de correspondências para um jornal de Nova York. Quando viaja a trabalho para o Triângulo das Bermudas, seu barco é desviado por uma tempestade e vai parar na cidade mágica de Liliput, onde as pessoas são bem pequenas.",27.512,85.0,,5.2,1865.0,en,/1EnX8qIJUYv6mG0Asub6Om8158z.jpg,/dVuMRrE6zFvivQPifg7CQnV1b5j.jpg,
82928.0,52208.0,Nude Nuns with Big Guns,2010.0,Thriller|Action|Comedy,"Upon taking her vows to become a nun, Sister Sarah is abused, brainwashed and also drugged into submission by the corrupt clergy. On the verge of her own death from a lethal dose of drugs, Sister Sarah receives a message from God telling her to take vengeance on all those who did wrong to her. Armed with God's will and an arsenal of big guns, she dispenses Judgment Day on her former tormentors. When the church hires the merciless motorcycle gang ""Los Muertos"" to track down and to kill her they soon realize that this sister is one bad mother.",7.23,90.0,This sister is one bad mother!,4.7,91.0,en,/1GHfUGs8vatMrSZzs1T2I9FTrvv.jpg,/5EEtzqJeNZKbh0PTEBQmc8QotJs.jpg,k9748
83006.0,56320.0,The Scientist,2010.0,Drama|Science Fiction,A reclusive physicist creates an infinite-energy machine in his basement that changes his life and all those around him.,3.131,87.0,What Do You Think Happens When You Die?,4.7,7.0,en,,/a8Pi3MHOKw6lTPBPs6NF82qqWFx.jpg,
83067.0,33107.0,Viagem do Medo,2010.0,Terror|Thriller|Crime|Mistério,"Ellie (Odette Annable) e Stephanie (Amber Heard) são duas amigas americanas que estão passando as férias na Argentina. Elas querem conhecer o que o país tem de mais exótico a oferecer. Enquanto exploram o interior do país, Ellie acaba sendo raptada e envolvida em um terrível jogo de violência, exploração sexual e medo.",8.765,91.0,"Elas queriam diversão, mas encontraram o pior pesadelo",5.2,280.0,en,/l7HK05h1nW1PvmJUlJwJ0u390WC.jpg,/AdAC4YQfrmoINEM2YhCfpE2TFQi.jpg,k1930|k9826|k13006
83086.0,42297.0,Burlesque,2010.0,Drama|Romance,"Ali (Christina Aguilera) deixou sua pequena cidade natal em busca do sucesso em Los Angeles. Logo ao chegar ela conhece a boate Burlesque, especializada em shows musicais de belas mulheres, que sempre se apresentam usando playback. O local é gerenciado por Tess (Cher), que nega uma chance a Ali. Ela insiste e consegue ser contratada como garçonete, graças à ajuda do balconista Jack (Cam Gigandet). Ali passa a acompanhar todos os shows, decorando as canções e coreografias. Quando Tess e seu braço-direito Sean (Stanley Tucci) realizam uma audição em busca de novas bailarinas, Ali aproveita a chance para mostrar do que é capaz.",18.142,119.0,É Preciso uma Lenda Para Fazer Uma Estrela,7.2,1846.0,en,/uw4v9I6uug15VE9n8DMN9QsslC.jpg,/a0PLMzfbkQuNX5Ba2oM7MwkwGoY.jpg,
83089.0,82622.0,Maria purpurina,2010.0,Comédia|Drama|Romance,"Violet é a Maria purpurina mais fabulosa de Manhattan! Aos 40 anos, ela é a atrevida e divertida da balada, mas quando a festa termina, sempre volta para casa sozinha. Enquanto seu colega de trabalho Riley enloquece com a possibilidade de adoção com seu marido Markus, e seu colega de quarto Luke enfrenta a monogo-mania com seu namorado Darian. Em meio ao ritmo acelerado da alta moda em que trabalha, Riley diz para ela procurar uma versão masculina hétero de si mesma - o mítico João purpurina.",2.849,99.0,,5.3,12.0,en,,/9yGr3wXAXJ43D8ztPGeqEHFrLCO.jpg,
83134.0,46838.0,Tucker & Dale Contra o Mal,2010.0,Comédia|Terror,"Dois caipiras, Tucker e Dale, tornam-se vítimas da insanidade de um grupo de jovens em férias, que os confundiu com assassinos. Quando eles vêem Dale tentando salvar uma de suas amigas que está se afogando, acham que ele a está levando para ser assassinada em um cabana no meio da floresta. Tentando resgatar a amiga, o grupo de jovens se separa e Tucker e Dale tentam entender por que esses garotos estão se matando.",12.009,88.0,,7.4,2055.0,en,/phv4nTeSViYfabikRB6oVjceIbG.jpg,/bEaEfyZgT2WWoO3QlcGXaImik5o.jpg,
83158.0,32407.0,Malice in Wonderland,2010.0,Fantasy|Drama|Adventure,"A modern take on the classic fairytale, Alice in Wonderland, set in South East England.An American law student in London. Knocked down by a black cab, she wakes with amnesia in a world that's a million miles from home - Wonderland. We follow her adventures as she's dragged through an underworld filled with twisted individuals and the lowest low-lifers, by the enigmatic cab driver, Whitey. She needs to find out who she is, where she's from and use what wits she has left to get back home in one piece. As her journey progresses she discovers nothing is what it seems, realizes that fate and life are terminally entwined, and finds true love lurking in the unlikeliest place.",3.996,87.0,"Guns, Gangsters, Pimps & Prostitutes. Wonderland just got dirtier.",5.7,45.0,en,/kVftNpJHp6ahi7MhW6XRZkoLzCL.jpg,/rFbyN3bOtQEMgZzF30xE4570NKu.jpg,
83177.0,41515.0,Zé Colmeia: O Filme,2010.0,Comédia|Família|Animação|Aventura,"Jellystone, está perdendo visitantes e, por isso, o prefeito Brown decide fechá-lo e vender suas terras. Inconformados com a perda da única casa que eles conhecem, Zé Colmeia terá que provar que ele realmente é ""o mais esperto de todos os ursos"" e com seu inseparável amigo Catatau, irá unir forças ao Guarda Smith para encontrar uma saída e salvar o parque de ser fechado para sempre.",13.788,80.0,A vida é um piquenique.,5.7,672.0,en,/olt6xjI8QvrTmm1GTH6VtX6ROCl.jpg,/gzvKfp1g07jHNBRYpi74kDsWGIQ.jpg,
83180.0,50420.0,Countdown to Zero,2010.0,Documentary,A documentary about the escalating nuclear arms race.,2.34,91.0,Demand Zero.,6.4,29.0,en,,/4sSuBvqWwJq7LrMRRpCfpSck5EI.jpg,
83270.0,46138.0,Revolução em Dagenham,2010.0,Comédia|Drama|História,"As operárias da fábrica da Ford de Dagenham vivenciam uma rotina desgastante de trabalho, atrelada a condições precárias e longas jornadas. O basta vem em 1968 quando são classificadas como não qualificadas. Motivadas por Rita O’Grady, as mulheres passam a reivindicar a igualdade de direitos em relação aos salários e o fim da discriminação sexual. Inicialmente direcionada aos patrões, a manifestação se volta contra o governo em uma luta que foi fundamental para que o parlamento britânico consolidasse o Projeto de Paridade Salarial em 1970.",7.477,1.0,,6.7,215.0,en,/rQvPdR775LuasXP822NNC9cxnJ2.jpg,/4JMDUoApcRDINyeblreEGrjBtE2.jpg,k9672
83293.0,46689.0,Lixo Extraordinário,2010.0,Documentário,"Uma análise sobre o trabalho do artista plástico Vik Muniz no Jardim Gramacho, localizado na cidade de Duque de Caxias (RJ), que é um dos maiores aterros sanitários do mundo.",4.783,98.0,,7.7,89.0,en,/ocLcJGdAALet1c8wJFC4B00LSkc.jpg,/wvaVhCRVPSYZp2A3utfyrPl0dNw.jpg,
83302.0,23830.0,Apenas uma Noite,2010.0,Drama|Romance,"Michael e Joanna são um casal jovem e bem-sucedido que parece ter tudo na vida. Mas quando Michael se vê sozinho em uma viagem de negócios com uma nova colega atraente e Joana encontra o outro grande amor de sua vida, eles vivem uma noite de tentação.",8.201,93.0,,6.1,601.0,en,/BIg34fHGyVzVBQJI78cfmjV7QJ.jpg,/fHSWtiDvuC3mxljBQVjAp3mBX2a.jpg,k1326
83332.0,53079.0,Who Is Harry Nilsson (And Why Is Everybody Talkin' About Him?),2010.0,Documentary|Music,"The documentary explores the enigmatic life and music of Harry Nilsson in an attempt to answer the question, ""Who is Harry Nilsson?"" The film includes new and archive audio and film including interviews with Robin Williams, Yoko Ono, Van Dyke Parks, Randy Newman, Ray Cooper, the Smothers Brothers, and Micky Dolenz. ""Who is Harry Nilsson?"" uses promotional films, music videos, and home movies; segments from the unreleased documentary made during the recording of Son of Schmilsson (Did Somebody Drop His Mouse?); and excerpts from Nilsson's rare TV appearances in his BBC specials, the ""Smothers Brothers Comedy Hour"", ""Playboy After Dark"", and in an episode of ""The Ghost and Mrs. Muir"".",4.756,116.0,,7.5,24.0,en,/p3Pv71VLv4ffRziGxQKkZ4ncakc.jpg,/uh3jCuKCd50EwBYPSUMG9rK9v6y.jpg,
83369.0,49009.0,Caminho da Liberdade,2010.0,Drama|Aventura|História,"Denunciado por sua esposa em 1939 como um possível espião, Janusz encontra-se em um campo de trabalho da Sibéria. Vivendo em condições brutais, ele está determinado a escapar e uma nevasca lhe fornece a oportunidade perfeita e, junto a um pequeno grupo de prisioneiros, fogem. A fuga, porém, é a parte mais fácil, pois Janusz e seus companheiros têm pela frente uma caminhada de 6.500 quilômetros a pé pelo Himalaia congelado, antes que possam ser verdadeiramente livres.",10.035,133.0,,7.0,1134.0,en,/jcQfgcq1j7Vit4wQ54niXiLfvE8.jpg,/hJCkHUETeLWnEq53k4ZTp0ep2mX.jpg,k14638
83374.0,46528.0,O Caminho do Guerreiro,2010.0,Aventura|Fantasia|Ação|Faroeste|Thriller,"Na trama, um assassino oriental é forçado a fugir de seu país em direção à América, onde se esconde no oeste dos Estados Unidos. Mas as forças que o perseguiam não tardam a surgir no novo continente.",122.37,100.0,,6.5,406.0,en,/6FhmSHAmSjm5FGpLe2xqAl7ekFP.jpg,/gFB9jjKPuGWBUVmIcRHtMQZglin.jpg,k5774|k9748
83803.0,40619.0,Dia e Noite,2010.0,Animação|Família,"Quando Dia encontra Noite, há um choque de personalidades. Ambos estão assustados e desconfiados um do outro, então inicialmente não se entendem. Aos poucos, vão descobrindo as qualidades e apreciando as diferenças do outro, e seus mundos adquirem uma nova perspectiva. Faz parte da Coleção Pixar Curtas 02.",6.573,6.0,,7.8,683.0,en,/16Zih6SSQzWrDRMnAaiaszx2mbV.jpg,/glsCbkXasT7CL2MYAVVtmZcZ5N.jpg,
83827.0,52013.0,Marwencol,2010.0,Documentary,"After a vicious attack leaves him brain-damaged and broke, Mark Hogancamp seeks recovery in ""Marwencol"", a 1/6th scale World War II-era town he creates in his backyard.",4.599,83.0,"When his world was stolen, Mark Hogancamp made a world of his own.",7.3,46.0,en,/4U37NDLfuseMhnTqKPUda3klgl4.jpg,/ofKR8GJItiY5NtT4JBiXxmw8Sct.jpg,
83897.0,43653.0,The Living Wake,2010.0,Comedy,"A dark comedy set in a timeless storybook universe. Self-proclaimed artist and genius, K. Roth Binew, has one day to live. He has enlisted his best and only friend, Mills Joquin, to take him around on a bicycle powered rickshaw. In a final attempt to probe life’s deepest mysteries, Binew endures one ridiculous trial after the next. He concludes his day with a final performance, his living wake. On a makeshift stage in an open field, Binew’s friends and enemies gather to witness his madness one final time.",0.952,91.0,,5.3,3.0,en,/oH73J7kpaQJpj3JG0NanVVPU0xK.jpg,/xxxbBu9HIsSmbFK37Nq0QuncBzI.jpg,
83912.0,55061.0,Frankie & Alice,2010.0,Drama|Thriller,"A história de uma exótica dançarina com múltiplas personalidades, lutando para permanecer fiel a si mesma e ao mesmo tempo lutando contra dois alter egos muito originais: uma criança de sete anos, chamada Genius e uma sulista branca racista chamada Alice. Para reprimir as múltiplas vozes em sua cabeça, Frankie faz tratamento com uma psicoterapeuta para desvendar e superar o mistério dos fantasmas internos que a assustam. Com uma cintilante performance de Halle Berry, que foi indicada ao Globo de Ouro®.",5.003,101.0,,5.8,71.0,en,,/4zXkZirn2QezrEFHWeAOkOxdjxj.jpg,k9672
84017.0,48752.0,2012: Tempo de Mudança,2010.0,Documentário,2012: Tempo de Mudança é um documentário que apresenta maneiras de transformar nossa sociedade insustentável em uma cultura planetária regenerativa. Isso pode ser alcançado por meio de uma mudança de consciência pessoal e global e da implementação sistêmica do design ecológico.,3.428,85.0,,6.3,7.0,en,,/1MXvLCiB2zjX43wYasmjh2a1Yh6.jpg,
84019.0,47055.0,Cool It,2010.0,Documentary,A documentary that takes an alternative approach to dealing with the global warming crisis.,3.88,87.0,A light bulb won't solve global warming. This guy's bright ideas just might.,6.4,9.0,en,,/2VBdmy2PhfZyTVhbibcdTT3sKly.jpg,
84156.0,89704.0,Happy People: A Year in the Taiga,2010.0,Documentary,"In the center of the story is the life of the indigenous people of the village Bakhtia at the river Yenisei in the Siberian Taiga. The camera follows the protagonists in the village over a period of a year. The natives, whose daily routines have barely changed over the last centuries, keep living their lives according to their own cultural traditions.",5.08,94.0,The director of Cave of Forgotten Dreams and Grizzly Man takes you on an epic journey into the heart of the Siberian wilderness,7.5,89.0,en,/mrTHVR9Xdygn1AZKHR4opLFjM6m.jpg,/wSDdllenxdsPiMONxEQEBfiLvio.jpg,
84160.0,52461.0,Carrie Fisher: Wishful Drinking,2010.0,Documentary|Comedy,"""Wishful Drinking"" is based on Fisher's memoirs of the same title. The stage adaptation had its world premiere in 2006 at the Geffen Playhouse in L.A. It later played at Berkeley Repertory before opening on Broadway in October at Studio 54. The show takes audiences on a comic tour of Fisher's messy personal life and career. The actress-writer recounts stories about her work on the ""Star Wars"" series as well as her relationship with her parents Eddie Fisher and Debbie Reynolds. She also discusses her much-publicized problems with alcohol and drugs.",4.922,75.0,A show where one woman reconciles herself to being Carrie Fisher.,7.5,27.0,en,/1nHeGjnG5g3JMRx5Wp1pwkylfAW.jpg,/dA9y6kaqSTLkFiSJNqd6mnSKome.jpg,
84189.0,43947.0,Doce Vingança,2010.0,Thriller|Crime|Terror,"A escritora Jennifer aluga uma cabana isolada para escrever sua mais recente novela. A paz e o silêncio do local são quebrados por uma gangue local que a estupra e tortura, deixando-a como morta. Mas Jennifer retorna para se vingar, capturando os homens um a um e lhes causando muito mais dor do que ela sofreu.",51.386,108.0,O filme que vai testar todos os limites da sua coragem.,6.5,1630.0,en,/2hHkKgw9DW0pX0NLO4l8ds41p5M.jpg,/AkAj9j5yu01ObA5SCvP3HuN3it9.jpg,k9748
84242.0,31007.0,Corações Perdidos,2010.0,Drama,"Doug (James Gandolfini) e Lois (Melissa Leo) tiveram o casamento abalado devido a uma tragédia familiar, ocorrida anos atrás. Com o tempo, eles se distanciaram cada vez mais. Um dia Doug vai a Nova Orleans para participar de uma conferência e lá conhece Mallory (Kristen Stewart), uma jovem que trabalha em casas de striptease. Decidido a ajudá-la, Doug permanece na cidade. A situação logo provoca estranheza em Lois, que decide ir à cidade para encontrar o marido.",6.838,110.0,,6.6,321.0,en,/aKess0g91BMSYpq1VLqwaqz83JF.jpg,/lgz5ZJWpuXfHre3FnczTIEN5yc6.jpg,
84260.0,32612.0,O Viajante,2010.0,Terror|Thriller,"Em uma escura noite de Natal, em uma cidadezinha, o xerife encontra um homem misterioso que atende pelo nome de Sr. NInguém. Com o passar da noite, o xerife descobre que ele não é um simples desconhecido, mas um assassino vingador, com um passado que vai assombrar a todos.",6.7,96.0,Ninguém Está a Salvo,5.3,77.0,en,/x0tWCw6NzCzCPXupUdg2VetJXie.jpg,/fLd7jr7lFYWGCVQ2jwBiCAFY5zR.jpg,k207317
84262.0,38033.0,A Corrente do Mal,2010.0,Terror|Thriller,"O mundo está repleto de correntes, um sistema irritante usado para propagar mensagens absurdas usando a superstição das pessoas. Mas e se a pessoa que começou uma dessas correntes fosse um serial killer pronto para matar qualquer um que tentar interferir em seu planos? Elos devem ser mantidos.",7.524,96.0,"Se você quebrar a corrente, você morre!",4.4,95.0,en,/qT4dbhmVkJKAX1nvVkYmZxoO6xJ.jpg,/dNaeVtL0UcdOiRcayzv2zgxYetw.jpg,k6054
84407.0,43920.0,O Canil - Dog Pound,2010.0,Drama,"Retrata a vida de 3 jovens numa casa de correção para menores, onde a raiva e os conflitos gritantes pairam no ar e que mais tarde vão se tornar em dramas ainda maiores.",8.955,91.0,,7.4,278.0,en,/mHtx1fTr4xKTXEslALzADa2xlY7.jpg,/uyV9XhPpOE5MsvpTAd9FU585oIx.jpg,
84444.0,50779.0,And Everything Is Going Fine,2010.0,Documentary,"From the first time he performed Swimming to Cambodia - the one-man account of his experience of making the 1984 film The Killing Fields - Spalding Gray made the art of the monologue his own. Drawing unstintingly on the most intimate aspects of his own life, his shows were vibrant, hilarious and moving. His death came tragically early, in 2004; this compilation of interview and performance footage nails his idiosyncratic and irreplaceable brilliance.",3.936,89.0,A tribute to Spalding Gray,6.4,19.0,en,/xY2KqycNihucvl7lODD2gtppHLe.jpg,/eKZS0Pib1D2RgfKDvyJM2EulBql.jpg,
84532.0,44944.0,Para Garotas de Cor,2010.0,Drama,"PARA GAROTAS DE COR une as histórias de nove mulheres enquanto elas se deslocam entre a existência uma da outra. Crises, corações partidos e crimes colocarão essas nova mulheres na mesma órbita, onde elas encontrarão pontos em comum e compreensão. Cada uma falará sua verdade como nunca antes. E cada uma saberá que ela é uma pessoa completa, gloriosa e divina em todas as suas cores.",4.731,134.0,,6.9,51.0,en,/iV77OldeZnMpque4Y9hScKnjrCI.jpg,/rdYhmd7mhlV4BaXOiCR4kR7o3Cn.jpg,k9673
84570.0,45272.0,Onde o Amor Está,2010.0,Drama|Romance|Música,"Kelly Canter (Gwyneth Paltrow) era uma estrela da música country, mas o vício da bebida destruiu sua carreira. Agora que ela saiu da clínica de reabilitação, seu produtor e marido James (Tim McGraw) a quer de volta aos palcos de onde nunca deveria ter saído. Porém, esse recomeço pode ser difícil para ela e, para sair em turnê, os dois contratam jovens artistas para novos trabalhos e abertura de shows. Assim, Beau Hutton (Garret Hedlund) e Chiles Stanton (Leigthon Meester) entram para a trupe. É quando alguns conflitos começam a surgir e o medo de uma recaída vem à tona, mas o brilho de uma estrela nunca se apaga.",7.983,117.0,Não importa onde esteve se voltar com força,6.4,191.0,en,/hJgamYy7QSELC3UZSW9a3f0mjfe.jpg,/kVmt65EFE5uQfEIDQOmoXQKvDfk.jpg,k1326|k9673
84621.0,46441.0,Espelhos do Medo 2,2010.0,Terror|Mistério|Thriller,"Max Matheson (Nick Stahl) e sua namorada são um casal viajando de carro que, por um descuido, acabam sofrendo um terrível acidente que custa a vida da moça e quase custa a vida de Max. Ele, no entanto, sobrevive e um ano depois da tragédia, ainda se recuperando do trauma, ele consegue um emprego como segurança noturno de uma loja. Lá, ele descobre um espelho que permite que ele veja o espírito de uma mulher morta.",29.973,86.0,,5.6,296.0,en,/tGpJAfSwqpXjARSRrAWUiouUSnr.jpg,/1QDWqbAuc3wr5R4hUp21VYFifMw.jpg,
84696.0,50204.0,Burke & Hare,2010.0,Comedy|Thriller|History|Horror,Two 19th-century opportunists become serial killers so that they can maintain their profitable business supplying cadavers to an anatomist.,8.743,91.0,No Job Too Small. No Body Too Big. No Questions Asked.,6.1,362.0,en,/bvUsxlnOEATldJR808r4T2t1VIm.jpg,/gcSbKn6T4JGnaotGD91OMysDyEU.jpg,k9826
