movieId,tmdbId,title,release_date,genres,overview,popularity,runtime,tagline,vote_average,vote_count,original_language,backdrop_path,poster_path,keywords
157451.0,131673.0,It's in the Blood,2012.0,Horror|Thriller|Drama,"One year after a tragic incident tore their family apart, a grieving son and his estranged father embark on a journey into the wild to reconcile their past. When a horrifying accident leaves Russell badly injured, and strands them in the wild, it is up to October to save them both. However, this wilderness is not what it seems, and as they deteriorate, so to does their concept of reality.",2.847,81.0,You can't escape the wilderness within.,4.7,20.0,en,,/iRHoqlHYqUFKfGqQqYgYRYpiulM.jpg,
158320.0,100813.0,Koch Brothers Exposed,2012.0,Documentary,"Koch Brothers Exposed is a hard-hitting investigation of the 1% at its very worst. This full-length documentary film on Charles and David Koch—two of the world’s richest and most powerful men—is the latest from acclaimed director Robert Greenwald (Wal-Mart: the High Cost of Low Price, Outfoxed, Rethink Afghanistan). The billionaire brothers bankroll a vast network of organizations that work to undermine the interests of the 99% on issues ranging from Social Security to the environment to civil rights. This film uncovers the Kochs’ corruption—and points the way to how Americans can reclaim their democracy.",0.766,55.0,,7.0,3.0,en,/gN17YnDnuE7NHomrrF2BlXF19nd.jpg,/wQytlNtUVOzkZEsJJRtB7vjeeKj.jpg,
158360.0,119433.0,Todd Barry: Super Crazy,2012.0,Comedy,Super Crazy is the first feature length special from New York City's Todd Barry.,2.83,60.0,,5.6,6.0,en,,/6mujAjyocvJt5FHpNeSxY9emR7J.jpg,k9716
158392.0,119255.0,"Gangsters, Guns and Zombies",2012.0,Horror,"The whole ""zombie thing"" has been hyped up so much that everyone thinks it's the end of the world! Of course, where one man sees the dead rising from the grave, another sees opportunity. Q had a plan: drive the robbery getaway van, deliver everyone to the safe house and get paid - a nice, simple, plan. Unfortunately, life is never really that simple, and to top it all off, this is the first time Q has been a getaway driver. He's coping pretty well though, considering; TONY (the guy who is 'in charge' of the job) is a murderous nut case, DANNY was shot and is now bleeding all over the money in the back of the van, the Sat-Nav has a mind of its own, there's a guy in the back living up to his name ""CRAZY STEVE"", the safe-house already has police at it, and this whole ""zombie thing"" seems to be quickly becoming more of a ""zombie apocalypse thing""...",9.867,88.0,,4.3,17.0,en,/tyLvYSe1DFua6zvhxu4z1yqcQKx.jpg,/v6VkEaREnZn6hFMVDj8AHGziX3S.jpg,
158406.0,201006.0,Margarita,2012.0,Drama|Comedy,"Behind the facade of a beautiful urban home, a combination of complacency and bad investments has left power couple Ben and Gail disconnected, resentful and just about broke. When the cash-strapped yuppies fire their teen-aged daughter's lesbian Mexican nanny, Margarita, they set off a chain of events that lead to her deportation.",2.838,90.0,,6.0,11.0,en,,/sXUMhaJ7XmWwlsCFj32EqTdhqz6.jpg,
158613.0,122800.0,Assassinos de Aluguel,2012.0,Mistério|Drama|Ação|Crime,"Após o assassinato de um policial em Nova York, seu filho , Malo (50 Cent) decide seguir os passos do pai dentro da polícia. No entanto, ele logo encontra o antigo parceiro de trabalho de seu pai, um homem desonesto (intepretado por Robert De Niro) que decide testar sua lealdade e respeito. Aos poucos, a verdade sobre a morte do pai de Malo começa a ser desvendada.",8.145,96.0,"Para servir, proteger.... e roubar.",5.1,155.0,en,/jnOa0Re9s62DvuGJG4ZaOfy4sxy.jpg,/iEql7EXfQqURvGTEC9GJ3Rx9Baa.jpg,k9748
158755.0,117102.0,The Perfect Human Diet,2012.0,Documentary|History,"""The Perfect Human Diet"" is an unprecedented global exploration to find a solution to our epidemic of overweight obesity and diet-related disease - the #1 killer in America. The film bypasses current dietary group-think by exploring modern dietary science, previous historical findings, ancestral native diets and the emerging field of human dietary evolution; revealing for the first time, the authentic human diet. Film audiences finally have the opportunity to see what our species really needs for optimal health and are introduced to a practical template based on these breakthrough scientific facts.",2.842,90.0,An unprecedented global exploration for a solution to America's #1 killer.,5.7,16.0,en,/9J1baZY1bipG2VFPMwIqODlgmDT.jpg,/8vfN26337Z3Yn0RPBPvBF4AMZs7.jpg,
158769.0,117407.0,They Call It Myanmar: Lifting the Curtain,2012.0,Documentary,"Shot clandestinely over a two year period, this film provides a rare look into the second most isolated country on the planet held in a stasis by a brutal military regime for almost a half century. From over 100 interviews of people across Burma, including the recently released Aung San Suu Kyi, interwoven with stunning footage of Burmese life this documentary is truly unique.",2.24,84.0,-,6.9,5.0,en,,,
158771.0,119430.0,Owned & Operated,2012.0,Documentary,"Owned &amp; Operated is a mosaic of the world through the lens of the internet. Showing our lives as consumers, under the thumbs of privileged individuals and their methods of control. But the world is awakening, and the experience is something outside the normal rules of social interaction, causing excitement in those who are not served by the current system... and fear in those who are pampered by it.  This documentary attempts to present these events using the video, audio and written content uploaded to the internet by the collective human consciousness comprised of every individual participant.",1.4,106.0,Imagine a world where your every move matters. Welcome to that world.,8.8,4.0,en,,/oyxsKCYllGInpy8ywa38Ak3QJQC.jpg,
158811.0,243306.0,The Perfect Wedding,2012.0,Comedy,"Christmas is approaching, and Paul's adopted sister Alana is coming home for the holidays. This won't be just a regular family celebration, as she's recently engaged and the weekend will be spent planning her June wedding with her best friends Roy and Vicki. Problem is that Roy is Paul's ex-boyfriend, and the two young men haven't seen each other since their very messy breakup. Nervous about seeing his ex again, Roy talks his good friend Gavin into joining him for the weekend, and pretending to be his new boyfriend. When Paul and Gavin meet, sparks of attraction fly, but Gavin thinks Roy's still hung up on Paul. This charming romantic comedy is a funny look at family bonds, misunderstandings and the ""perfect wedding",1.148,82.0,,6.9,12.0,en,/u4MceZkeemAxPyRfumCrCFKHnlj.jpg,/1B7DOdbUONcKNHvTp4su3hi3VwW.jpg,
158815.0,109752.0,Chasing Leprechauns,2012.0,TV Movie|Comedy|Romance,"Michael Garrett, a New York corporate troubleshooter, is sent to a small town in Ireland to close a deal on a construction site believed to be inhabited by leprechauns. Michael sets out to get the approval of the town’s leprechaun expert, Sarah Cavanaugh, and soon finds that is easier said than done.",2.741,83.0,,6.0,4.0,en,/3H3eSHlu5AzntcyoBWbXkaGXYpR.jpg,/4VdAEpf5KGa7B6vX0ITpeSxfWAo.jpg,
158938.0,149218.0,Uma Proposta Perfeita,2012.0,Família|Romance|Cinema TV,"Jack é um executivo que tenta conciliar a vontade de impressionar o chefe, Drew Clayton, como relacionamento que tem com a filha dele, Demi Clayton. Apesar da desaprovação da sogra Clarisse, ele decide pedir a jovem em casamento em um baile. Para fazer o pedido perfeito, ele começa a fazer aulas de dança, mas nasce um sentimento entre ele e a bela professora Christine e Jack precisa decidir se está disposto a desistir do pedido de casamento e, possivelmente, de sua carreira.",3.09,84.0,,5.6,16.0,en,/oAhG9dLyBgYQjYaUiAQ9QBEeKx1.jpg,/f25Sisk90ZE8EHHf12NNRWHViO6.jpg,k207317
158940.0,147132.0,A Bride for Christmas,2012.0,Comédia|Romance|Cinema TV,"Depois de Jessie terminar seu terceiro noivado, ela jura distância de relacionamentos sérios, até encontrar 'o cara'. Isto, é até o encantador e cronicamente solteiro Aiden aparecer.  Mas sem o conhecimento dela, Aiden aposta com seus amigos que pode convencer uma mulher a casar com ele, até o Natal. Que é exatamente, daqui a quatro semanas.",6.965,84.0,,6.0,85.0,en,/7btCSdbZ01URLMvahgZnsc78NEJ.jpg,/d5oFtJZI0PREMTft27lgW4nr7JV.jpg,k13027|k207317
158942.0,145840.0,Pacto de Natal,2012.0,Romance|Cinema TV,"Rob (Joey Lawrence) e Julie (Emily Hampshire) são solteiros e, após se conhecerem pela internet, decidem fingir ser um casal durante as festas de fim de ano com suas famílias.",5.48,90.0,Não diga mentiras no Natal,6.6,32.0,en,/cDWX9YyCTZxAi6X2Wfok1pMqIqj.jpg,/2z04KmR9rZn5nOCu6MNR7OfHKf8.jpg,k207317
158944.0,211125.0,O Sabor do Verão,2012.0,Cinema TV|Drama,"Uma professora de música do Ensino Médio, Beth Landon, convida o mundialmente famoso cantor de country, Jason Keith para se apresentar no Festival de Morango da sua pequena cidade rural. Beth o tem como seu cantor favorito, mas quando ela finalmente encontra Jason ao vivo, torna-se óbvio que ele não vai ser fácil de lidar. Mas a estrela do rock Jason esconde um segredo sobre seu passado que poderia transformar sua carreira.",3.264,120.0,,6.3,17.0,en,/6yalIeJ7ht66oy1Mahuk4NUss87.jpg,/pOg6AIP2SGXds4aykLAuMjqBIFU.jpg,
158946.0,85887.0,A Taste of Romance,2012.0,Família|Romance|Drama|Comédia|Cinema TV,"O viúvo Gill Callahan aposentado do departamento de bombeiros depois de uma tragédia. Com a ajuda de alguns companheiros, ele começa uma lanchonete, que oferece comida simples para o seu gosto. A música de correspondência é demais para o gosto elitista de sua vizinha, Sara Westbrook, que é dona de um restaurante francês e aspira uma reputação totalmente refinada colidindo com o bairro de classe trabalhadora, levando a uma guerra de brincadeiras. Hannah a filha de Gill torna-se amiga de Sara e acaba agindo como uma casamenteira, ajudada pelo destino, no que parece uma tragédia.",5.914,83.0,,6.5,31.0,en,/l1Mf7c6JAnIkTpdmXYFOwL0QwjL.jpg,/n1irBtPuFrRR4HpO9mre2j2lfYQ.jpg,
158948.0,227552.0,Fixing Pete,2012.0,Romance|TV Movie,"Ashley is a journalist and does makeovers for a TV show. Her editor offers her the job of being the editor of a new fashion supplement, provided she does a makeover on a sports writer, who is an uncouth, loudmouthed, sexist slob.",3.768,120.0,,4.9,14.0,en,/3uLYYdtbAXUqQbPeOnvEgOfmjlW.jpg,/lcTwxtPeCbDd61yEWyqssZ6j3bG.jpg,
158982.0,113294.0,Fast Girls,2012.0,Drama,A street smart runner develops an intense rivalry with an equally ambitious wealthy young athlete.,4.833,91.0,,6.1,67.0,en,/1WoPau7XK17cWQGAOxmyisud0Iq.jpg,/wrsIUs4esWv3oncNpRI4ERon4bF.jpg,
159028.0,122293.0,The Philadelphia Experiment,2012.0,Adventure|Science Fiction|Thriller|Mystery,"A secret government research project tries reviving the World War II ""Philadelphia Experiment,"" which was an attempt to create a cloaking device to render warships invisible. When the experiment succeeds, it brings back the original ship (the Eldridge) that disappeared during the first test in 1943 - which brings death and destruction to the 21st century. It's up to the sole survivor of the first experiment and his granddaughter to stop it.",11.787,85.0,Past and present collide,4.8,96.0,en,/oe7zvJk79WBk3I8bNV9zLI0yXKE.jpg,/i7mGfgQqhv7i3s5yPNXFpBKTwge.jpg,k4379
159187.0,216203.0,Pieces of Talent,2012.0,Horror|Thriller,"Set in the small coastal town of Bright Leaf, North Carolina, “Pieces of Talent” centers around Charlotte, a disillusioned aspiring actress working a night job as a cocktail waitress in order to make ends meet. Charlotte catches a break when seemingly chance circumstances put her in contact with a local filmmaker, David Long. David and Charlotte form a quick friendship that leads to Charlotte landing the starring role in David’s newest project. David quickly becomes obsessed with Charlotte and begins building his masterpiece. He films each encounter with the ultimate goal of filming Charlotte as his final installment. David is a happily obsessed individual willing to do whatever it takes to make “true art.” He utilizes his charm and skills to make something dark and deranged seem utterly beautiful and loving.",3.004,95.0,Beautiful Horror,6.2,10.0,en,,/cm2Stq6A7CcHW1zXpztnk0WRG7w.jpg,
159435.0,139251.0,I Married Who?,2012.0,TV Movie|Comedy|Romance,"Straight-laced Jordan (Martin) is about to marry Peter (Snedeker), a clean-cut ambitious attorney. Before she walks down the aisle, Jordan and her best friends, Claire (Adrienne Frantz) and Jessica (Daphnee Duplaix), head to Vegas for a bachelorette party, because what happens in Vegas stays in Vegas, right? But when Jordan wakes up the next morning unable to recall the night before, she panics when she finds she’s in movie star Matt's (Ethan Erickson) hotel suite with a gigantic diamond on her finger and a marriage certificate lying nearby. Before Jordan can have the marriage annulled and put this nightmare behind her, the impromptu wedding explodes into a publicity stunt fueled by Matt’s manager Eric (Bruce Nozick) to promote his latest movie. With her wedding day approaching, Jordan finds herself more confused than ever when she starts falling in love with the movie star she’s married to instead of the fiancé she thought was her perfect match.",4.526,86.0,,6.2,23.0,en,/2UlFvv7JWZ5nVo6iDmajmLptxjm.jpg,/9KzNBsxjRhgNcqUkmyP5ttOLD4X.jpg,
159644.0,135652.0,Christmas in Compton,2012.0,Comedy,"Big Earl, the owner of a Christmas tree lot in Compton, California runs into some trouble when his son Derrick crosses the line to prove to his father that he is a success.",2.687,93.0,,3.3,4.0,en,,/lJbkGhey7T1Sse4iDOprl5E0i9x.jpg,k207317
160195.0,112937.0,Os Oogieloves e a Aventura no Grande Balão,2012.0,Família,"Goobie, Zoozie e Toofie são três Oogieloves, criaturas coloridas que procuram cinco balões mágicos dourados para a festa surpresa de aniversário de seu amigo Schluufy. O musical infantil tem uma proposta interativa, e pretende estimular as crianças no cinema a dançar e cantar durante os números musicais para mover a trama adiante.",2.797,88.0,,3.2,19.0,en,/jWlXrW9yzMaihDeEZrkIdJHVtiI.jpg,/8xzTcjmng5GOURYqEVxzzqSBC0M.jpg,
160402.0,110490.0,Rags: O Poder da Música,2012.0,Cinema TV|Comédia|Drama|Música,"Um talentoso aspirante a músico tem uma família que não o deixa correr atrás de seu sonho. Até que ele conhece a estrela pop Kadee Worth, que está cansada de ter sua carreira controlada por outras pessoas. Juntos, eles alcançarão seus objetivos.",9.248,88.0,,7.2,144.0,en,/6VMiDmy5gVmge1ZVny3P6rYiZo9.jpg,/7Jz0CIF5VTFbT9tLDnU8AEWdyoV.jpg,
160543.0,131737.0,Um Jogo de Mestres,2012.0,Ação|Crime|Thriller,"Dois gângster britânicos, Ray Collishaw (Craig Fairbrass) e Micky Mannock (Frank Harper) participam de grandes esquemas ilícitos, sonhando com um dia conseguirem sair do tráfico. Porém, quando participavam do transporte de um grande carregamento de cocaína da máfia russa, o navio vira e eles perdem toda a encomenda. Com uma grande dívida, eles planejam aplicar um golpe em Berlin para conseguirem o dinheiro e se livrarem dos russos.",2.806,97.0,,5.2,21.0,en,/ggIKrUzKjOGJ2SNlMwaj4xhqrp2.jpg,/9LWENzqjdRrTvsf0E002ytdc96P.jpg,
160551.0,312113.0,Black November,2012.0,Drama|Action|Crime,"A volatile, oil-rich Nigerian community wages war against their corrupt government and a multi-national oil corporation to protect their land from being destroyed by excessive drilling and spills.  To seek justice, a rebel organization kidnaps an American oil executive and demands that his corporation end the destruction and pollution.  Inspired by true events, Black November is the gripping story of how a community rises up and takes drastic measures to make sure their voices are heard.",2.391,95.0,Blood Will Be Spilled,5.6,6.0,en,/xmUuH4af9WvHYx6bvicq1kJKySG.jpg,/onBy6iJt3BX8MSc7GjzIRgE07oV.jpg,
161028.0,154441.0,Até que a Sorte nos Separe,2012.0,Comédia,"Tino (Leandro Hassum) é um pai de família comum que vê sua vida virar de ponta a cabeça após ganhar na loteria. Levando uma vida de ostentação ao lado da mulher, Jane (Danielle Winits), ele gasta todo o dinheiro em 15 anos. Ao se ver quebrado, Tino aceita a ajuda do vizinho Amauri (Kiko Mascarenhas), um consultor de finanças super burocrático e que por sinal vive seu próprio drama ao enfrentar uma crise no casamento com Laura (Rita Elmôr). Tentando evitar que Jane descubra a nova situação financeira, afinal ela está grávida do terceiro filho não pode passar por fortes emoções, Tino se envolve em várias confusões para fingir que tudo continua bem. Para isso, conta com ajuda do melhor amigo, Adelson (Aílton Graça), e dos filhos.",6.749,104.0,,6.4,251.0,pt,/aDu4NawDawBsBkRiEJUU2NDKdv.jpg,/xAd1DeclHsJ0lnrizw4bTYivFqB.jpg,
161030.0,93091.0,Crazy Eyes,2012.0,Drama|Comedy|Romance,"Zack (Haas) is a young, divorced father who starts to develop romantic feelings towards his friend Rebecca (Zima), whom he refers to as ""Crazy Eyes"". He spends a lot of time at a bar run by his best friend Dan Drake (Busey) and hanging out with Autumn (Raymonde). As he pursues a sexual relationship with Rebecca, Zack grows increasingly aware of the importance of his son's role in his life amidst the failing health of his own father.",3.618,95.0,Just another story about love,4.6,10.0,en,/1iehrUoWzfJ4wz9ld5OMPPsbheD.jpg,/o4FfGzHhjrCCJexUZvUYtC734aI.jpg,
161137.0,138701.0,The Weekend,2012.0,Comedy|Drama,"Based on a novel by Bernard Schlink (The Reader), The Weekend follows Jens as he leaves prison 18 years after being arrested as an RAF terrorist in Germany. Back with his family, friends, and ex-comrades, including his former lover Inga, Jens’ unexpected arrival disrupts their lives, forcing them to re-examine the violent idealism of their youth, especially as he insists on learning who had betrayed him to the police years before in this intense, gripping drama",1.146,97.0,,6.6,5.0,en,,/2NtwUTd2dOc6CyIuGfy9uzJf5lG.jpg,
161206.0,98948.0,Abraham Lincoln vs. Zombies,2012.0,Terror|Ação|Thriller,"Durante a Guerra Civil americana, Abraham Lincoln foi confrontado com um dos o problema político mais difícil: a epidemia torna soldados confederados em mortos-vivos. Este é um presidente que terá de lidar com as próprias mãos contra a praga de zumbis.",16.331,96.0,,4.2,89.0,en,/iMLGpzRJJzbQjrz8If7AoIbCe3O.jpg,/l8WPgGfGeP2yFwi8yJItyVqAXiR.jpg,k12377
161544.0,104185.0,Alien Tornado,2012.0,Science Fiction|Action|Thriller,"Aliens attack Earth with deadly electrical tornadoes, and it’s up to a farmer, his smart high-school daughter and a tornado blogger to thwart the horrific invasion.",9.316,85.0,,4.2,33.0,en,,/bCiOtKLJdYtjie64pO5925OC2vS.jpg,k9951
161834.0,180691.0,David Bowie & The Story of Ziggy Stardust,2012.0,Documentary|Music,BBC documentary telling the story of how David Bowie arrived at one of the most iconic creations in pop history - Ziggy Stardust - with contributions from colleagues and famous fans.,3.241,57.0,David Bowie & the Story of Ziggy Stardust,7.3,25.0,en,/cxwjgigqkP1OBkNCIs9ChjmCPCY.jpg,/B7pQQrxChSydU2Me9NyZazujQO.jpg,
161926.0,50497.0,When the Lights Went Out,2012.0,Thriller|Drama|Horror,"Yorkshire, 1974, the Maynard family moves into their dream house. It's a dream that quickly descends into a panic stricken nightmare as the family discovers a horrifying truth, a truth that will make the history books. The house is already occupied by the most violent poltergeist ever documented, a poltergeist that will tear you from your bed as you sleep and drag you helplessly into the darkness.",10.875,86.0,Set in 1974 and based on true events.,5.7,91.0,en,/vSJnG5qO64ERig9aSWcBiy8ybqG.jpg,/bdsUVOLDADbfIWSJflJSgE8J3Ai.jpg,
161998.0,150084.0,Mr. Blue Sky: The Story of Jeff Lynne & ELO,2012.0,Music|Documentary,"Documentary which gets to the heart of who Jeff Lynne is and how he has had such a tremendous musical influence on our world. The story is told by the British artist himself and such distinguished collaborators and friends of Jeff as Paul McCartney, Ringo Starr, Tom Petty, Joe Walsh, Olivia and Dhani Harrison, Barbara Orbison and Eric Idle. The film reveals that Lynne is a true man of music, for whom the recording studio is his greatest instrument. With access to Lynne in his studio above LA, this is an intimate account of a great British pop classicist who has ploughed a unique furrow since starting out on the Birmingham Beat scene in the early 60s, moving from the Idle Race to the multi-million selling ELO in the 70s and then, with Bob Dylan, Tom Petty, Roy Orbison and George Harrison, as a key member of the Traveling Wilburys.",3.767,60.0,,7.4,10.0,en,/qU3BdK8kUkSn3FFrKMBV0P17jnL.jpg,/b6laOMLs3RNSlj251zXzQt0chg7.jpg,
162070.0,198057.0,3 Days of Normal,2012.0,Comedy|Family|Romance,"3 Days of Normal follows the story of straight-laced deputy Bill Morgan who is quite content literally living within the quaint boundaries of Washington, New Hampshire. Bill’s stable and rather uneventful life is thrown for a loop when he finds and arrests a woman, Nikki Gold, passed out in her car from inebriation. Unbeknownst to him, the woman happens to be a popular movie actress longing for some normalcy in her hectic life.",2.426,81.0,,4.8,6.0,en,,/Vik6lnnA2oxwCcmxxh3RhfAXzP.jpg,
162078.0,296472.0,Wedding Day,2012.0,Drama|Thriller,"This thriller from directors Dale Fabrigar and André Gordon concerns two couples who decide to marry on the same day - readily anticipating the most joyous event of their young lives. All hell breaks loose, however, when three men - including a minister, a drug addict and a jealous brother - unleash violence on the ceremonies.",4.556,92.0,Not every wedding ends in a bouquet toss...,7.5,2.0,en,,/sQkkJf7j0MKDnQW7YL9nnyTSmo9.jpg,
162248.0,99758.0,O Desvio,2012.0,Crime|Drama|Thriller,"Um homem sofre um acidente de carro numa estrada da Austrália, e logo descobre que o outro motorista morreu, que há uma mulher ferida e uma pasta cheia de dinheiro. Quando ele faz a coisa certa e recorre às autoridades, provoca uma série de violentos problemas.",3.615,83.0,Baseado numa história real.,5.1,30.0,en,/eje8NORnjWcPVVRTFpTz7SGg0xh.jpg,/czR2IwkXWcfUNFXNdwhnUieWurF.jpg,
162472.0,91921.0,Ecstasy of Order: The Tetris Masters,2012.0,Documentary,"A documentary that captures the greatest world record Tetris players as they prepare for the Classic Tetris World Championship. From the days of Thor Aackerlund and his historic victory at the 1990 Nintendo World Championships, right up to the present and Harry Hong's perfect ""Max-Out"" score, this documentary expertly chronicles over two decades of Tetris Mastery.",4.519,93.0,,6.8,34.0,en,/awHwB8xH2iIq9nSntQCVeghcyv7.jpg,/orm6oS0RD6mlE5fMVmz62YAEyDR.jpg,
162888.0,144105.0,Frankie Boyle: The Last Days of Sodom,2012.0,Comedy,"A brand new live DVD from the brilliant comedian - coming in 2012. Recorded at his last ever tour.  Frankie Boyle has been pilloried, misrepresented and demonised. And for what? For Telling It Like It Is. Now he will attempt a final tour, to heal Britain's fools. To support its rioters. To offer the inchoate laughter of despair to a culture in freefall. These are The Last Days Of Sodom.",2.776,79.0,,7.0,15.0,en,/k2qi6rSUBAC57EIVm5m3KFQRKvt.jpg,/2vbv0X6byXr9p0aIfeH9l8HBeBU.jpg,
162998.0,98370.0,Wonder Women!: The Untold Story of American Superheroines,2012.0,Documentary,"Feature documentary exploring the concept of heroic women from the birth of the superhero in the 1940s to the TV and big screen action blockbusters of today. Heroic role models are important in childhood development, yet there are a dearth of these for girls. Wonder Woman provides a rare example of a female heroine who doesn't require rescue, determines her own missions, and possesses uniquely feminine values. Featuring Gloria Steinem, actors Lynda Carter and Lindsey Wagner, and a colorful cast of scholars, writers, and fans, the film challenges pop culture's gender biases by looking at how Wonder Woman's storyline changed over time while considering how women are rarely depicted as heroic, powerful, or world-changing",1.369,55.0,,5.8,6.0,en,/lTWbtILa4ciCuEhi5M6W15QAlFv.jpg,/iJCnt8AlgkfojrAa1Pc3j9XXJBX.jpg,
163004.0,135990.0,Shell,2012.0,Drama,"Abandoned by her mother when she was a child, Shell has stayed to take care of her dying father but now feels trapped within the beautiful but desolate landscape that surrounds her. With only her routine of running the decaying petrol station, taking care of her father, and spending afternoons in her bedroom with a local mechanic, life is passing Shell by with every passing truck that rattles her walls. One day a salesman stops to re-fuel and offers Shell a taste of the outside world that takes her closer than ever to the edge of the road and her desire to escape.",5.619,90.0,,6.4,34.0,en,/r6ywEjkxI7020Qmf3PF499Arku5.jpg,/i1ZReJ1M1xg2WNlfuygeLUgtvXH.jpg,
163529.0,329690.0,Comedy Central Roast of Roseanne,2012.0,Comedy,It's Roseanne Barr's turn to step in to the celebrity hot seat for the latest installment of The Comedy Central Roast.,4.212,90.0,,6.5,25.0,en,/2jTshXuyt4xPHImtmmABuSXo6F8.jpg,/sQmjQomhXUufN3OD9KWSVW9OJ1I.jpg,k9716
163573.0,129418.0,Bigfoot: The Lost Coast Tapes,2012.0,Terror|Mistério|Thriller,Filme inspirado na famosa lenda americana do Pé Grande. As filmagens aconteceram em locações onde foram registrados os maiores números de avistamentos do Pé Grande e foram feitas com base em depoimentos reais dos moradores locais.,4.486,89.0,,4.2,30.0,en,/1AR9edC3TEEC9Xl4lcSF1HLn7pD.jpg,/uXM0yEUdpZIEX00MKOYkCLYklSR.jpg,k236|k9720
