movieId,tmdbId,title,release_date,genres,overview,popularity,runtime,tagline,vote_average,vote_count,original_language,backdrop_path,poster_path,keywords
105835.0,146015.0,O Duplo,2014.0,Thriller|Drama,"Simon (Jesse Eisenberg) é um jovem e neurótico rapaz, que certo dia, tem um grande choque ao se deparar com seu novo colega de trabalho, um sujeito com a mesma aparência física que a sua, porém, personalidade exatamente oposta, chamado James. Além de aguentar as humilhações constantes de seu chefe (Wallace Shawn), agora, Simon descobre que seu sósia ocupa seu cargo pouco importante na empresa e tem que lidar com esse novo colega, que é tudo que ele não é: confiante, charmoso, bem sucedido e superficial.",8.677,92.0,"Um funcionário de uma agência do governo descobre que sua vida nada invejável muda para o horror com a chegada de um novo colega de trabalho que é tanto seu duplo físico quanto seu oposto - confiante, carismático e sedutor com as mulheres.",6.5,747.0,en,/sFNvHmELf07kwBQwxPN0OHGWVzF.jpg,/nXcqxN1FnQTnZf8I8Zy8Wp0ZNuh.jpg,k236|k818
107769.0,227348.0,Atividade Paranormal: Marcados pelo Mal,2014.0,Terror|Thriller,Jesse começa a experienciar fenômenos perturbadores e inexplicáveis após a morte de sua vizinha. Ele descobre que está possuído por uma entidade demoníaca. É apenas uma questão de tempo até que esteja completamente sob o controle dessa força maligna.,60.197,101.0,,5.4,1101.0,en,/eAISoFMi29BVBKH1VRpne4mJ26K.jpg,/r8IqmVSFxk5NSDToMDr6lP2UyrO.jpg,k6152|k9712
107910.0,124623.0,I Know That Voice,2014.0,Documentary,Filmmaker Lawrence Shapiro discusses voice-over acting with the talented people behind the characters.,6.375,95.0,A documentary that puts a face to the voices we all know and love,7.1,71.0,en,/p4r3FHgoELOxIoYlF9QVUBskfIQ.jpg,/eIYd9xNhFSyKhvd9oBvXq9kXdc6.jpg,
108156.0,168530.0,Policial em Apuros,2014.0,Ação|Comédia,"Ben trabalha como segurança em um colégio, e namora a bela Angela. Quando o namoro se torna sério, ele pensa em se casar com ela, mas antes tem que enfrentar o irmão protetor dela, James, um policial linha dura. Para entregar a mão de sua irmã a Ben, James faz uma proposta: os dois vão sair em patrulha juntos, durante 24h. Se ele provar ser digno de entrar na família, receberá a aprovação para o casamento.",19.362,99.0,Propor a irmã deste policial? Erro de novato.,6.2,1793.0,en,/4y5Ek9mjzWuvz8Y5SVbrSwx0X2L.jpg,/b0fok58kIjQoS7y3NK6sf5VzTXG.jpg,
108188.0,137094.0,Operação Sombra: Jack Ryan,2014.0,Ação|Drama|Thriller,"O agente Jack Ryan é mandado a Moscou para trabalhar como consultor financeiro de um bilionário. O empregador, na verdade, arma para que Ryan leve a culpa por um ataque terrorista ao sistema financeiro dos EUA. O herói precisa, então, correr para limpar seu nome e salvar sua esposa, que foi pega como refém do bilionário.",38.393,105.0,Operação Sombra - Jack Ryan,6.1,2299.0,en,/gjP487CUTanqW2aOrohX7m5FNG0.jpg,/r0Z5gDSgS1h6bzdt7L4psUTtSzn.jpg,k9826
108190.0,157350.0,Divergente,2014.0,Ação|Aventura|Ficção científica,"Uma emocionante ação e aventura que se passa em um mundo futuro, no qual a sociedade foi dividida em cinco facções distintas. Mas Tris não se encaixa em nenhum desses grupos – ela é Divergente, e o que a torna perigosa. Na mira da líder de uma das facções – determinada a eliminar todos os divergentes – Tris recorre à única pessoa em quem ela acredita que possa confiar: Quatro, um instrutor da facção de segurança, Audácia, e um homem cheio de segredos sombrios. Juntos, Tris e Quatro descobrem uma alucinante conspiração que testará sua coragem ao máximo... E mudará seus destinos para sempre.",68.73,139.0,,6.9,10799.0,en,/ipikQozG6cAtLqhaFqRneA0LI4o.jpg,/kLX3LtUcOsoJXfyp8D31aqwDoNc.jpg,k818|k9685
108200.0,240916.0,Um Álibi Perfeito,2014.0,Crime|Thriller,"Mitch (Dominic Cooper) sai com os amigos para um bar, e no fim da noite, embriagado, ele pega o carro para voltar para casa. Um homem aparece em seu caminho, e Mitch o atropela. Sem saber como agir, esse jovem advogado deixa o cadáver na rua e foge, pensando não ter sido visto por ninguém. Nos dias seguintes, outro homem, Clinton (Samuel L. Jackson) é incriminado pelo assassinato, e o advogado chamado para defendê-lo é justamente Mitch.",30.971,91.0,A prova é o fardo,5.9,442.0,en,/6QdHEPM8Efq1xFxeelq3OD0ifXv.jpg,/xz2GPDlXuVfH8FgL81dqSSsSF0Q.jpg,
108243.0,79316.0,O Herdeiro do Diabo,2014.0,Terror,"Logo após o casamento de Jack e Samantha, este casal apaixonado recebe a boa notícia: eles vão ter um bebê. A gravidez chega antes do planejado, mas os dois ficam contentes e começam a se preparar para a chegada do primeiro filho. Samantha começa a ficar cada vez mais tensa, nervosa. Inicialmente, todos acreditam que são apenas os hormônios em transformação, mas logo percebem que uma força maligna se apoderou do corpo dela.",24.119,89.0,,4.6,407.0,en,/22qysYEwRuULLU9Ep8IkxPFOUnR.jpg,/cgK5r6uh3tWxUzM1Oh72cNjFoe4.jpg,
108468.0,177047.0,Unidas Pela Vida,2014.0,Drama,"Quando Annie Parker (Samantha Morton) descobre que está com câncer, mesma doença que provocou a morte de sua mãe e de sua irmã, ela perde o controle, e sua vida se torna um caos. Decidida a não desistir, ela conta com a ajuda de uma pesquisadora que está tentando provar que o câncer pode ser genético.",7.237,91.0,,6.2,61.0,en,/9dc7SH3Jo9sL4ompJAFVS3RPzHw.jpg,/tGAH1vvayu1yMabxgr9iyqgvX0o.jpg,k1326
108571.0,250769.0,Mitt,2014.0,Documentary,A filmmaker is granted unprecedented access to a political candidate and his family as he runs for President.,3.975,93.0,"Whatever side you're on, see another side.",6.3,44.0,en,,/v1bfKOvTqQDseBAetUpNKn1Iq3q.jpg,
108689.0,100241.0,Frankenstein: Entre Anjos e Demônios,2014.0,Terror|Thriller,"Após enterrar o Dr. Victor Frankenstein, o monstro criado por ele é atacado por demônios, que pretendem capturá-lo. Ele consegue se salvar e segue sua vida. Porém, 200 anos depois, o monstro, agora com o nome de Adam, acaba se envolvendo em uma guerra entre dois clãs imortais na cidade ancestral de Darkhaven.",17.94,92.0,200 anos depois.... a lenda está viva!,5.3,1502.0,en,/boJ25eE6F32zddn62Cf9xVdmAjR.jpg,/yzhhMRxXimA3ODrDI18an61tcIy.jpg,k6152
108715.0,157099.0,Rolou Uma Química,2014.0,Drama|Comédia,"A vida sem graça de um farmacêutico de uma cidadezinha é virada pelo avesso, quando um encontro casual com uma bela mulher casada e solitária se torna uma aventura selvagem, nesta hilariante comédia de humor negro, estrelada por Sam Rockwell e Olivia Wilde. Doug Varney (Sam Rockwell) sempre foi ignorado durante anos, por todo o mundo, desde Kara (Michelle Monaghan), sua esposa dominadora, até pelos preguiçosos empregados da farmácia que ele comprou de seu sogro insuportável. Quando Doug começa um caso regado a álcool e drogas com Elizabeth (Olivia Wilde), a mulher mais bonita que já conheceu, ninguém fica mais surpreso que ele mesmo. Elenco: Sam Rockwell, Olivia Wilde, Michelle Monaghan, Ray Liotta, Jane Fonda.",11.506,92.0,Não Existe Fórmula Para a Felicidade,6.0,203.0,en,/qnx8XZfvCNhRZCWThq2UW2BV5Gb.jpg,/9PpwTNDsXnuGHcwBdpgybVSwsFN.jpg,
108797.0,236399.0,O Jardim dos Esquecidos,2014.0,Drama|Mistério|Thriller|Cinema TV,"Após a morte do pai, Chris, Cathy, e os irmãos gêmeos Carrie e Cory são levados pela mãe para o único lugar onde poderiam morar: a casa dos avós, a mansão Foxworth Hall. Enganadas achando que a nova vida seria cheia de luxos e sonhos realizados, as crianças não imaginavam que os avós as consideravam frutos do Demônio. Também não sabiam que seus pais eram parentes de sangue e que haviam cometido um pecado ao se casarem e terem filhos e que, segundo a avó, tais aberrações deveriam ser trancadas num pequeno quartinho na ala norte, tendo apenas um sótão onde brincar. Refilmagem de um clássico de terror de 1987.",12.404,86.0,,6.5,277.0,en,/8dpS7rlYt6BAHkHsAhEsJ4vqgCF.jpg,/11uRv4MRRilqIPphDzwp3fQNUkP.jpg,
108928.0,152760.0,Caçadores de Obras-Primas,2014.0,Guerra|Drama|História|Ação,"Durante o declínio de Hitler na Alemanha, um grupo de 13 especialistas vindos de países diferentes é reunido para reencontrar obras de arte roubadas pelos nazistas durante a Segunda Guerra Mundial. George Stout (George Clooney), um oficial americano e conservador de obras de arte, lidera a equipe.",24.707,118.0,,6.0,2922.0,en,/2B56HEsUkQUaRRQe1jDu4QA6Bgs.jpg,/pPr0yONkXWA9GgX3PAoM1YA8P9W.jpg,
108932.0,137106.0,Uma Aventura Lego,2014.0,Aventura|Animação|Comédia|Família|Fantasia,"Emmet é um Lego comum, até o dia em que é confundido com o Master Builder, o grande criador deste mundo de brinquedo, por ter encontrado a famosa peça de resistência. Este peça, procurada por todos há séculos, seria capaz de desarmar uma poderosa máquina criada pelo presidente do país, o perverso Sr. Negócios, que pretende colar todas as peças e impedir as mudanças no sistema. Mesmo sem ter grandes habilidades como criador, Emmet gosta de ser considerado um Lego especial, e faz de tudo para merecer a confiança de seus amigos, que incluem a rebelde Mega Estilo, o sábio Vitrúvius, e o gato-unicórnio UniKitty.",34.979,100.0,A história de um Zé-ninguém que salvou todo mundo.,7.4,6293.0,en,/9531Jp42H0ppRXjkxxgCulnQNZp.jpg,/Akt1i1g47sS4Bhz5bR43U371E0k.jpg,k6054|k9717
108945.0,97020.0,RoboCop: A Origem,2014.0,Ficção científica|Ação,"Em um futuro não muito distante, no ano de 2028, drones não tripulados e robôs são usados para garantir a segurança mundo afora, mas o combate ao crime nos Estados Unidos não pode ser realizado por eles e a empresa OmniCorp, criadora das máquinas, quer reverter esse cenário. Uma das razões para a proibição seria uma lei apoiada pela maioria dos americanos. Querendo conquistar a população, o dono da companhia Raymond Sellars (Michael Keaton) decide criar um robô que tenha consciência humana e a oportunidade aparece quando o policial Alex Murphy (Joel Kinnaman) sofre um atentado, deixando-o entre a vida e a morte.",24.094,118.0,Nós temos o futuro sob controle.,5.8,4466.0,en,/hTDAWiohFTwJaKNcCNlsKs64bip.jpg,/7vFsWZGc2ciJVt888FbeKBKWv16.jpg,k6149
109072.0,144336.0,Sabotagem,2014.0,Ação|Drama|Thriller|Crime,"Membro de uma força tarefa de elite da agência anti-drogas dos Estados Unidos roubam o quartel general de um cartel de drogas. A situação se complica quando eles começam a morrer pouco a pouco. Arnold Schwarzenegger, Sam Worthington, Olivia Williams, Josh Holloway e Mireille Enos integram o elenco.",35.234,110.0,Não deixe pontas soltas,5.6,1100.0,en,/5Ds8cbVWqrpToyPOpUMiwTVgoBJ.jpg,/j89bzqyw5Ouc8Itw5UXmvAeFmdk.jpg,
109157.0,141043.0,Uma Longa Queda,2014.0,Comédia|Drama,"Na noite de Ano Novo, quatro pessoas solitárias se encontram no topo de um prédio. Curiosamente, todos têm o mesmo plano: cometer suicídio. Diante da ironia da situação, eles se tornam amigos, e fazem um pacto: nenhum deles se matará até o Dia dos Namorados, em fevereiro. Nos meses que se seguem, os quatro acabam ajudando uns aos outros.",16.858,96.0,,6.2,715.0,en,/10SM8QFBZjHwIjQ8uq7yZE8NGyf.jpg,/dqsF7ZiiUeAh2Zz1kCPLCMEy1K2.jpg,
109183.0,99367.0,Saindo do Armário,2014.0,Comédia,"Michael e Matty são amigos há muito tempo, e os dois têm algo em comum: nunca perderam a virgindade. Eles decidem que a noite do baile de formatura será a data limite para fazerem sexo pela primeira vez, entretanto a pressão desta data acaba levando Matty a assumir sua homossexualidade. Michael fica surpreso, mas decide aceitar a orientação sexual do amigo e conhecer mais sobre a cultura gay. De quebra, começa a sair com a ex-namorada de Matty.",6.591,91.0,,5.8,190.0,en,/t7kSB7GF8A6xSsYvYURK4hwk4h.jpg,/cZzNqh2UYw12DHqGH1PQjufak2r.jpg,
109189.0,226857.0,Amor Sem Fim,2014.0,Drama|Romance,"Jade Butterfield (Gabriella Wilde) é uma jovem superprotegida pelos pais, que aparenta ter um futuro brilhante pela frente. Só que ela se apaixona perdidamente por David Elliott (Alex Pettyfer), um jovem mais humilde que tem um passado conturbado. O relacionamento não é aprovado pelo pai de Jade, Hugh (Bruce Greenwood), que recomenda cautela à filha. Ainda assim, ela se entrega de corpo e alma à paixão por David.",31.642,104.0,Diga adeus à Inocência,6.9,1405.0,en,/g27PNNr3GNo72hf86KIHjzx66H4.jpg,/slvVVYVxiKQ5rVKPIrFczozdomF.jpg,k818|k9673
109191.0,137321.0,Um Conto do Destino,2014.0,Drama|Fantasia|Mistério|Romance,"Baseado no livro de Mark Helprin. Durante um inverno rigoroso, o mecânico e larápio Peter Lake (Colin Farrell) invade uma mansão. Ele pensa que não há ninguém em casa, mas a filha do dono, uma jovem que tem pouco tempo de vida (Jessica Brown Findlay), o surpreende em plena ação, e os dois se apaixonam.",14.008,118.0,Esta não é uma história real. É um amor real.,6.3,1108.0,en,/nM6Ysyx8FN6YBmeiWwyyi6eGmpN.jpg,/kHVdSDgO1JLrKKK4Zn4WndRknAz.jpg,k818
109243.0,157847.0,Joe,2014.0,Drama,"Joe Ransom é um ex-presidiário que não consegue sair do passado. Afundado na bebida e amargurado com a vida, ele começa a trabalhar em uma madeireira, procurando uma distração. Lá ele encontra Gary, jovem de 15 anos abusado pelo pai que batalha para sustentar a família, e os dois tornam-se cúmplices.",9.389,118.0,,6.5,726.0,en,/n8s02jFQHkyMZrQL3qj0AtUrzhB.jpg,/29Z02vEXyPuI8VRckDGlaiG3B85.jpg,k818|k6149|k9720|k9826
109317.0,249923.0,Alguém para Ficar com Barry,2014.0,Comédia,"Três amigos tramam encontrar uma esposa ideal para consertar seu amigo socialmente inadequado, mas quando ele conhece uma mulher assim como ele, seus problemas se tornam duplos.",6.702,86.0,,5.7,129.0,en,,/aod4XeUKVEDuao4ekQ4sBApt6sw.jpg,
109372.0,222899.0,Sobre Ontem a Noite,2014.0,Comédia|Romance,"Bernie e Joan são dois paqueradores, apaixonados por tudo – de encontros a términos. Quando Bernie arruma o melhor amigo, Danny, para a colega, Debbie, faíscas voam enquanto ambos tentam passar de um encontro casual para um verdadeiro relacionamento.",15.302,100.0,,6.0,421.0,en,/1wyFgywBCCSnniSOHLlIZijNcty.jpg,/bygQv6CnrFxjiwyH6hiW9xbeOUD.jpg,
109374.0,120467.0,O Grande Hotel Budapeste,2014.0,Comédia|Drama,"No período entre as duas guerras mundiais, o famoso gerente de um hotel europeu conhece um jovem empregado e os dois tornam-se melhores amigos. Entre as aventuras vividas pelos dois, constam o roubo de um famoso quadro do Renascimento, a batalha pela grande fortuna de uma família e as transformações históricas durante a primeira metade do século XX.",29.315,100.0,,8.0,11539.0,en,/9udCLTxTFl28RxnK8Q05E154ZGa.jpg,/9bFFixCXZ53AKMpzbvygFVJ0ZLL.jpg,
109376.0,201086.0,Ritmo Cubano,2014.0,Comédia,"Quando era criança, Bruce adorava dançar, e possuía o talento necessário para se transformar em um dançarino profissional. Mas um momento de humilhação fez com que ele abandonasse esta paixão. Mais de duas décadas depois, Bruce trabalha em um escritório, é infeliz e não tem vida amorosa. Com a chegada de sua nova chefe, o funcionário pensa como fazer para seduzi-la, e descobre justamente que um de seus principais passatempos é a salsa. Bruce cria coragem e decide aprender a dançar novamente, contando com a ajuda do atrapalhado amigo Drew.",10.839,98.0,,6.0,248.0,en,/rXDnwxIyxdz8wf9IqQ64YK3YW0I.jpg,/io0LZoCtq63hUWd6d3x5FoalgDj.jpg,
109399.0,253046.0,Jailbait,2014.0,Crime|Drama|Thriller,"O filme segue a jornada de uma jovem enviada para a prisão por ter assassinado o seu padrasto. Anna Nix esta preste a conhecer o mundo tenebroso de um presidio, onde ela descobre relações complexas, drogas, doença mental e sua busca por redenção. E o pior ainda, terá que lutar por sua sobrevivência!",3.866,90.0,,4.6,69.0,en,/nbdzrIhES9Sw3CkXkEUEkIVAT6S.jpg,/bNaKWcYARKnvDBCFEIc0uOQxX2v.jpg,
109483.0,225565.0,Namoro ou Liberdade,2014.0,Comédia|Romance,"Após descobrir a traição de sua esposa, Mikey vai receber a ajuda dos amigos. Eles fazem um pacto em que os três devem ficar solteiros, mas Mikey está disposto a reconquistar a ex.",29.199,94.0,,6.2,2261.0,en,/9j4kCSoosMnHZOBSZzPDVxAc89I.jpg,/cxin8yPKsLpbnJ7wx8Wxkwouk4.jpg,k6054
109487.0,157336.0,Interestelar,2014.0,Aventura|Drama|Ficção científica,"As reservas naturais da Terra estão chegando ao fim e um grupo de astronautas recebe a missão de verificar possíveis planetas para receberem a população mundial, possibilitando a continuação da espécie. Cooper é chamado para liderar o grupo e aceita a missão sabendo que pode nunca mais ver os filhos. Ao lado de Brand, Jenkins e Doyle, ele seguirá em busca de um novo lar.",105.385,169.0,O fim da terra não será o nosso fim.,8.3,26889.0,en,/rAiYTfKGqDCRIIqo664sY9XZIvQ.jpg,/nCbkOyOMTEwlEV0LtCOvCnwEONA.jpg,k4379|k10084|k14544|k14760
109569.0,192102.0,3 Dias para Matar,2014.0,Ação|Drama|Thriller,"Ethan Renner (Kevin Costner), veterano agente secreto, está à beira da morte. Seu último desejo é reatar com sua filha, com quem perdeu contato há muito tempo. Temendo não ter tempo hábil para salvar seus relacionamentos com a menina e com a ex-esposa, este homem descobre a existência de uma potente droga que pode salvá-lo, contanto que ele aceite um derradeiro trabalho.",13.307,117.0,A pergunta é: matar ou morrer?,6.1,1715.0,en,/yNWVnD6kYcU5mX54aJrS9XkkIWQ.jpg,/kW6zkRGYiwHViMRUy0wJkbXIFBv.jpg,k18035
109578.0,225574.0,Sem Escalas,2014.0,Ação|Thriller|Mistério,"Durante um voo de Nova York a Londres, o agente Neil Marks (Liam Neeson) recebe uma série de mensagens SMS enigmáticas, dizendo que um passageiro será morto a cada 20 minutos caso US$ 150 milhões não sejam transferidos para uma conta bancária. Inicialmente Beil não dá atenção à ameaça, mas quando o primeiro passageiro aparece morto ele inicia uma investigação em pleno avião sobre quem possa ser o assassino.",11.593,106.0,O sequestro foi apenas o começo.,6.8,4373.0,en,/7UOWJEhNbePQeGSaVn9PvcRaujX.jpg,/mZMXCmoDwZpyXi0bnRxJVWui7VC.jpg,
109673.0,53182.0,300: A Ascensão do Império,2014.0,Ação|Drama,"Após a morte do pai, Xerxes (Rodrigo Santoro) dá início a uma jornada de vingança e ruma em direção à Grécia, com seu exército sendo liderado por Artemisia (Eva Green). Enquanto os 300 espartanos liderados por Leonidas tantam combater o Deus-Rei, os exércitos do resto da Grécia se unem para uma batalha com as tropas de Artemisia no mar. Themistocles (Sullivan Stapleton) é o responsável por liderar os gregos.",49.809,102.0,Aproveite a sua glória!,6.1,5253.0,en,/chjkfyo57JexWo1YeIZRMk8wA4m.jpg,/l9T9hsVca2mh0S29olWRUE3uBpz.jpg,
109723.0,242076.0,Profissão De Risco,2014.0,Crime|Drama|Thriller,"Jack (John Cusac) precisa entregar uma misteriosa sacola a Dragna (Robert De Niro) e recebeu recomendações para não olhar, de maneira alguma, o que estava dentro dela. Disposto a cumprir a tarefa, ele vai encotrá-lo em um motel de beira de estrada.",7.065,108.0,,5.3,247.0,en,/miRAPShIrXdEFKXPVC50WcLAmka.jpg,/x2kQsIt6dclw8oq30I417O1lGdd.jpg,
109740.0,248774.0,Uma Notícia Inesperada,2014.0,Comédia|Romance,"No Filme Donna Stern (Jenny Slate) é uma comediante de pouco sucesso. Após ser abandonada pelo namorado e despedida no emprego, ela acha que tudo está perdido, mas encontra Max (Jake Lacy), um rapaz gentil com quem passa uma noite. O resultado desse encontro é a gravidez inesperada de Donna. E agora, como contar ao homem que ela mal conhece?",6.177,83.0,,6.6,347.0,en,/2O7bt0Vu8YZTecUYoTupgbGHIj7.jpg,/jo1nr5BkhBKaoeaKj1YRvtgDoPx.jpg,
109846.0,82703.0,As Aventuras de Peabody e Sherman,2014.0,Animação|Aventura|Família,"Sr. Peabody é um magnata de negócios, inventor, cientista, ganhador do prêmio Nobel, chef, duas vezes medalhista olímpico e gênio... Que também é um cachorro. Usando a sua engenhosa invenção, a máquina WABAC, o Sr. Peabody e seu filho adotivo, Sherman, viajam no tempo para vivenciar eventos que mudaram o mundo em primeira mão e interagir com as maiores personalidades da história. Mas quando Sherman quebra as regras da viagem no tempo, nossos dois heróis entrarão em uma corrida para reparar a história e salvar o futuro, enquanto Sr. Peabody enfrenta o maior desafio de sua vida - ser pai.",38.335,92.0,A aventura mais divertida da história.,6.7,1904.0,en,/lkBwfDDgLw1giIdmJCbVObkTzFr.jpg,/ndGl3yPRbHlem0PuDJuUvUuY9dQ.jpg,k4379|k6054
109848.0,97370.0,Sob a Pele,2014.0,Thriller|Ficção científica|Drama,Uma bela mulher de cabelos negros e lábios vermelhos seduz os homens solitários que encontra em seu caminho. Ninguém imagina que sob sua pele se esconde uma perigosa alienígena que pode acabar com vidas para cumprir os desejos da sua espécie.,15.895,108.0,,6.1,2614.0,en,/eS5OdKN3kRZXQbWRSSCJ4Gh0z26.jpg,/odlj1i3d3eqBiLWJQTsJgckZmMv.jpg,k9951
109850.0,136797.0,Need for Speed: O Filme,2014.0,Ação|Crime|Drama|Thriller,"Aperte os cintos com Tobey Marshall, quando ele sai em uma missão de vingança contra o rico e arrogante Dino Brewster que o acusou de um crime que ele não cometeu. Tobey desafia seus limites ao máximo em uma corrida de alta octanagem em todos os Estados Unidos, pegando a estrada com os carros mais exóticos do mundo – oferecendo velocidade, perigo e ação reais.",107.709,132.0,Pela honra. Por amor. Por redenção.,6.3,3390.0,en,/syVAWAnY6fTBDDFntHsM8vFjKex.jpg,/yJh2piyBmY5BvfNBl8EsDNxaFh4.jpg,k10594
109853.0,242042.0,O Seu Jeito de Andar,2014.0,Comédia|Drama|Romance,"O filho ovelha negra (Scott Speedman) de uma família rica conhece uma jovem paciente psiquiátrica (Evan Rachel Wood) que foi criada em isolamento durante toda a sua vida. Certo dia, ele leva a jovem inocente para o casamento de seu irmão para convencer a família de que ele deu um jeito em sua vida. Ela impressiona a família com seu charme genuíno. No meio do caminho, eles se apaixonam de maneira improvável.",6.015,90.0,,6.5,488.0,en,/fX6fvCWfZzzRv23PSOhUsXiIxF4.jpg,/EquzxUdF0xSEwJx2eni7FYDA2g.jpg,k18035
109864.0,177494.0,Veronica Mars,2014.0,Comédia|Drama|Crime,"Veronica Mars (Kristen Bell) está de volta à Neptune para a reunião dos antigos alunos da escola. Ela reencontra seu ex-namorado Logan Echolls (Jason Dohring) e, após dez anos sem trabalhar como investigadora, aceita um novo caso. Logan, mais uma vez, está com problemas e precisa da ajuda de Veronica para provar que não está envolvido na morte da sua namorada, uma celebridade. Continuação da série Veronica Mars.",7.68,107.0,,6.6,895.0,en,/8iqFej0KibmJvdYOOarfxTkGuao.jpg,/1qUhPDaNalxl7CpVqcbjm09fZz0.jpg,k9826
109897.0,235260.0,O Filho de Deus,2014.0,Drama,"Vindo de uma pescaria fracassada, Pedro (Darwin Shaw) encontra Jesus Cristo (Diogo Morgado), que o convence a segui-lo. Logo Cristo reunirá 12 apóstolos que têm por missão espalhar seus ideais pela Terra. Entretanto, por mais que pregue o amor ao próximo e a compaixão, sua crescente popularidade desperta a ira de pessoas importantes de Jerusalém, que não desejam que o status quo seja alterado. A traição de um de seus apóstolos, Judas (Joe Wredden), faz com que Cristo seja capturado e levado a julgamento.",26.576,138.0,,6.9,212.0,en,/AuMXdzUnN9eaQ4SA3kxyjCfDCJT.jpg,/dawSGD2qjDGNL29yIF9oW4dICgS.jpg,k13006
110102.0,100402.0,Capitão América 2: O Soldado Invernal,2014.0,Ação|Aventura|Ficção científica,"Após os eventos catastróficos em Nova York com Os Vingadores, Steve Rogers, segue tentando se ajustar ao mundo moderno. Porém, quando um colega da agência S.H.I.E.L.D. é atacado, Steve se vê preso em uma rede de intrigas que ameaça colocar o mundo em risco. Em parceria com a Viúva Negra e Falcão, seu novo aliado, o Capitão América tem que enfrentar um misterioso e inesperado inimigo, o Soldado Invernal.",82.296,136.0,Em heróis nós confiamos.,7.7,15152.0,en,/xOe8nHr5bpPvq4JbGy4vpttDwg2.jpg,/iBFPjLLHXkBojKpWDluJxnpM24h.jpg,k9715|k9717
110127.0,86834.0,Noé,2014.0,Drama|Aventura,"Noé vive com a esposa Naameh e os filhos Sem, Cam e Jafé em um mundo devastado pelo pecado, onde os homens perseguem e matam uns aos outros. Um dia, Noé recebe uma missão divina do Criador: construir uma imensa arca, que abrigará os animais durante um dilúvio que acabará com a vida na Terra, de forma que a visão do Criador possa ser, enfim, resgatada.",32.017,137.0,O fim do mundo... é apenas o começo.,5.6,5135.0,en,/mJUS8Je7QV3TruhNxhD6oltRpTA.jpg,/nVdsXW3oJKBCMpNVZcg8teCk0cS.jpg,k3205
110130.0,227783.0,O Que Será de Nozes?,2014.0,Animação|Comédia|Família|Aventura,"Quando o teimoso esquilo Max destrói toda a comida que seus amigos recolheram para passar o inverno congelante, ele é expulso de um parque na cidade grande e precisa encontrar outras maneiras de sobreviver. Mas o lugar dos seus sonhos está muito perto dele: trata-se de Maury's Nut Store, uma loja repleta de nozes, castanhas, amêndoas. Max reúne os amigos e bola um plano para invadir o lugar e roubar toda a comida para suportar o inverno.",16.693,86.0,"Sem amêndoas, sem castanhas...",5.7,749.0,en,/i8m04vN53U9V5IKlGcNDoFCxavc.jpg,/77kZV9SUlQd3bEzekD2xC06VMAt.jpg,
110295.0,188207.0,Hércules,2014.0,Ação|Aventura,"A trama enfoca a história de amor entre o filho de Zeus e a princesa mortal de Creta, prometida para o irmão mais velho do semideus. Após serem enganados por um maléfico rei, Hércules e o capitão são vendidos como escravos e devem lutar lado a lado para retomar sua liberdade.",16.717,99.0,,4.7,1079.0,en,/9LctHvfUwzcT7RzwhRp8SpW5K00.jpg,/oZ4onew5xcg4JRMZb5luYWyP2y8.jpg,
