movieId,tmdbId,title,release_date,genres,overview,popularity,runtime,tagline,vote_average,vote_count,original_language,backdrop_path,poster_path,keywords
117444.0,110416.0,A Canção do Oceano,2014.0,Família|Animação|Fantasia,"A história da viagem de volta da última criança das selkies, mulheres que se transformam em focas. Depois do desaparecimento de sua mãe, Ben e Saoirse são enviados para viver com a avó na cidade. Quando eles resolvem voltar para a sua casa à beira-mar, a viagem torna-se uma corrida contra o tempo, quando eles são atraídos para um mundo que conhecem apenas nos contos populares de sua mãe. Mas isso não é uma história de ninar, essas pessoas estão em nosso mundo por muito tempo. Logo fica claro para Ben que Saoirse é a chave para a sua sobrevivência.",11.133,93.0,,8.1,1044.0,en,/AaIRBsx4hpa2fVQzeCfFyOdzCEM.jpg,/vR6HmQtRPUOUrRLKdADyhYnezTv.jpg,k3205
117456.0,241771.0,Nos Bastidores da Fama,2014.0,Romance|Drama,Uma jovem musicista em ascensão (Gugu Mbatha-Raw) se apaixona loucamente pelo policial incumbido de protegê-la (Nate Parker) neste romance comovente da cineasta e roteirista Gina Prince-Bythewood (Love & Basketball).,5.404,116.0,,7.0,319.0,en,/kXaaJ0eKrCNGzAbCTXvDz4ndsid.jpg,/lD1wNN4dkRCHbkEPu9vCQZh22nd.jpg,
117511.0,303623.0,Hello Ladies: The Movie,2014.0,Comedy|TV Movie,"When Stuart learns that his British ex-girlfriend is planning to visit Los Angeles with her husband, he sets out to impress them with his glamorous lifestyle, enlisting a Russian model he’s just met to play the role of his beautiful girlfriend. What could go wrong?",6.636,85.0,The final seduction begins.,6.5,117.0,en,,/s8vjHhKNn8gRzEJGGfNf1IhjfSW.jpg,
117517.0,251736.0,Listen Up Philip,2014.0,Comedy,"Anger rages in Philip as he awaits the publication of his second novel. He feels pushed out of his adopted home city by the constant crowds and noise, a deteriorating relationship with his photographer girlfriend Ashley, and his own indifference to promoting the novel. When Philip's idol Ike Zimmerman offers his isolated summer home as a refuge, he finally gets the peace and quiet to focus on his favorite subject: himself.",6.753,109.0,,6.0,109.0,en,/2UMgIoEqVVEgpTGaKes1G1m7Osb.jpg,/rHfrGEdTEW20W6L26qbJ0DFNDKo.jpg,
117533.0,293310.0,Cidadãoquatro,2014.0,Documentário,Uma documentarista e um repórter viajam para Hong Kong para o primeiro de muitos encontros com Edward Snowden.,8.79,113.0,,7.8,989.0,en,/9QDgu7iLJvy7iSQ9D0X9qnSby1V.jpg,/nOVhX69EAxtSKEEnr5UcSd5UVci.jpg,
117549.0,297608.0,A Possessão de Deborah Logan,2014.0,Terror|Mistério|Thriller,"Mia Medina (Michelle Ang) finalmente encontrou o tema perfeito para o filme de sua tese de doutorado sobre a Doença de Alzheimer. Nos próximos meses, as câmeras irão gravar o cotidiano de uma mãe, Deborah Logan (Jill Larson), e sua filha, Sarah (Anne Ramsay). Mas conforme os dias progridem, coisas estranhas começam a acontecer em torno de Deborah que não são compatíveis com quaisquer conclusões sobre a doença de Alzheimer.",31.283,90.0,,6.3,815.0,en,/rTWHdg3FsNTtF5jY2jOhMfjgZz9.jpg,/77i7EBUyQKOUiZeYQ5tWDGQb0AI.jpg,k9712|k10714
117555.0,250643.0,Alive Inside,2014.0,Documentary,"Five million Americans suffer from Alzheimer's disease and dementia—many of them alone in nursing homes. A man with a simple idea discovers that songs embedded deep in memory can ease pain and awaken these fading minds. Joy and life are resuscitated, and our cultural fears over aging are confronted.",4.609,74.0,Music is the strongest form of magic,7.5,62.0,en,,/xuKGqgNAer0XfCSVotrBaP5bCTT.jpg,
117572.0,294538.0,Hit by Lightning,2014.0,Romance|Comedy|Crime,"When Ricky Miller, a single, quiet 40-year old aspiring writer and manager of Debbie's (think Denny's) and probably the last person you'd notice in a crowd is 'hit by lightning' and meets the love of his life, the beautiful Danita on E-Happily.com, he is catapulted into a relationship online but it's a lot more than what he bargained for - this includes being asked to kill! Hounded by his best friend Seth who thinks no ""10"" would even go out with a guy like Ricky unless she had ulterior motives (or needed glasses), Ricky starts to get skeptical himself. Turns out, Danita confesses she's actually married to a handsome affable crime novelist and former Rabbi, Ben Jacobs. Is Danita telling Ricky the truth when she says wants to leave her husband but fears for her life if she does? Will Ricky go through with the plan to kill him so he and Danita can live happily ever after?",2.742,89.0,,4.8,28.0,en,/3chaO2JFB6Zh2b3ugtNaB6Te0Vu.jpg,/44pBplHzdLZoLiBYOFyUql3Ak1S.jpg,
117584.0,254435.0,O Menino no Espelho,2014.0,Família|Aventura|Drama,"Belo Horizonte, anos 1930. Fernando (Lino Facioli) é um garoto de 10 anos que está cansado de fazer as coisas chatas da vida. Seu sonho era criar um sósia, que ficasse com estas tarefas enquanto ele poderia se divertir à vontade. Até que, um dia, é exatamente isto que acontece, quando o reflexo de Fernando deixa o espelho e ganha vida.",0.6,78.0,,5.6,5.0,pt,/kWe48pyMQNb2IeYhEndU3cI5T2R.jpg,/l3inJ0LKrccEK5mNqQzmJlGjLPy.jpg,
117590.0,227159.0,Quero Matar Meu Chefe 2,2014.0,Comédia,"Após o trauma vivido no filme anterior, os amigos Nick (Jason Bateman), Dale (Charlie Day) e Kurt (Jason Sudeikis) resolvem abrir seu próprio negócio, de forma que eles mesmos sejam seus chefes. O problema é que, quando a companhia começa a deslanchar, eles sofrem um golpe do investidor (Christoph Waltz) que bancou o negócio. Sem ter como recorrer através dos meios legais, o trio decide partir para um ato desesperado: sequestrar o filho do investidor (Chris Pine) e, com o dinheiro do resgate, pagar a dívida contraída e manter a empresa.",25.634,108.0,Um novo crime. As mesmas ferramentas.,6.2,3421.0,en,/pM4xCEItOf6G3Uujvc6GttwWvtJ.jpg,/yXRwjL92nD5VN83kAmZKMmjMOJK.jpg,k378|k1930
117851.0,270946.0,Os Pinguins de Madagascar,2014.0,Família|Animação|Aventura|Comédia,"Vindos da franquia de animação Madagascar, Capitão, Kowalski, Rico e Recruta, a elite do pinguins espiões, são capturados em uma missão que tinha como objetivo presentear o integrante mais novo da tropa (Recruta) em seu aniversário. Eles caem nas garras do temido Dr. Otavius Brine, que se sentiu prejudicado pelo quarteto em um passado remoto. Agora, eles vão ter que impedir o maléfico plano do vilão de se vingar dos pinguins do mundo todo e, para isso, terão que juntar forças com uma especializada agência de espiões, a Vento do Norte, liderada pelo Agente Secreto. Enquanto isso, Recruta tenta provar seu valor como agente especial do time de pinguins.",78.844,92.0,Com esses rapazes é preto no branco!,6.5,3251.0,en,/msnknPOg9dx86b0YozXOFP8PgBI.jpg,/w9jno0ySammISRGvc0RZREjYUvg.jpg,k470|k6513|k9748|k10084|k267848
117859.0,299618.0,Fugly!,2014.0,Comedy,"Fame proves elusive for comic Jesse Sanchez, who reflects on life from the bottom of a bathtub in this film based on John Leguizamo's one-man show. The story that unfolds has it all: love, loss, mistakes, adventure and redemption.",2.176,86.0,A Latino comic's near-death experience forces him to revisit his personal and professional highs and lows.,5.1,7.0,en,,/cfYW2qgCmzE7G5PxLtdZGoxblHQ.jpg,
117861.0,253331.0,Preto ou Branco,2014.0,Drama,"O advogado Elliot Anderson (Kevin Costner) acaba de perder sua esposa em um acidente de carro. Os dois criavam, juntos, a neta Eloise (Jillian Estell), já que a mãe da menina morreu no parto. Enquanto luta com sua dor, ele recebe a visita inesperada da avó paterna da garota, Rowena (Octavia Spencer), que exige que a neta seja criada pelo pai, Reggie (Andre Holland), um viciado em drogas, cuja negligência faz Elliot culpá-lo pela morte de sua filha. Agora, os avôs de Eloise vão entrar em uma luta pela guarda dela.",7.075,121.0,,6.8,285.0,en,/oKO59zY6cIcQxsQmssRVCVneNdn.jpg,/xgkPqBYJdzvvQWSZKou6DXbP7cy.jpg,
117863.0,268386.0,Ragamuffin,2014.0,Drama,"RAGAMUFFIN is based on the true story of Rich Mullins, a musical prodigy who rose to Christian music fame and fortune only to walk away and live on a Navajo reservation.  An artistic genius raised on a tree farm in Indiana by a weathered, callous father, Rich wrestled all of his life with the brokenness and crippling insecurity born of his childhood.  A lover of Jesus and a rebel in the church, Rich refused to let his struggles with alcoholism, addiction and women tear him away from a God he was determined to love.  As he struggled with success in Nashville, depression in Wichita, and oblivion in the Four Corners, Rich became one of the first of his time to live honestly amidst a culture of religion and conformity.",1.586,137.0,His life was a whirlwind. His music was honest. His faith was reckless.,6.9,11.0,en,,/rEGqcU7bY6LlJ5t9jV6GfnIox92.jpg,
117867.0,252178.0,'71: Esquecido em Belfast,2014.0,Thriller|Ação|Drama|Guerra,"Um jovem soldado britânico é acidentalmente abandonado por sua unidade, depois de um aterrorizante conflito nas ruas de Belfast, em 1971. Incapaz de distinguir amigos de inimigos, o inexperiente recruta tem que sobreviver sozinho durante à noite e escapar em segurança, emmeio a um ambiente estranho, desordenado e mortal.",7.909,99.0,,6.7,839.0,en,/aTloiKdNs2c8vlstbx3wBWD6Thi.jpg,/asyYonjJkOn7Xl4hyfBMocD1i0K.jpg,k13065|k14601
117869.0,259610.0,Bastards,2014.0,Documentary,"At 14 Rabha El Haimer was an illiterate child bride, beaten, raped and then rejected. Ten years later, she is a single mother, fighting to legalise her sham marriage and secure a future for her illegitimate daughter. With unprecedented access to the Moroccan justice system, “Bastards” follows Rabha’s fight from the Casablanca slums to the high courts.",1.371,83.0,,5.5,2.0,en,,/bVjjPVd2nHs4Kfwt9JkT3nGjewR.jpg,
117871.0,256917.0,Promessas de Guerra,2014.0,Guerra|Drama,"Joshua Connor perdeu seus três filhos na batalha de Galípoli, em 1919. Após a morte da mãe deles, Joshua promete que irá enterrá-la ao lado dos filhos. Desta forma, ele viaja até a Turquia decidido a recuperar os corpos deles, para que possa enterrá-los em sua terra natal. Por mais que o país esteja agora em paz, devido à derrota dos turcos para os ingleses, Joshua enfrenta muitas dificuldades para chegar ao campo de batalha onde eles teriam morrido. Ele recebe então a ajuda de Ayshe, uma mulher que está à espera do marido, enviado para a guerra, e de seu filho, o pequeno Orhan.",10.072,111.0,A jornada de um pai na busca por seus filhos,6.8,983.0,en,/u0TGg4vCMH50jVuzG6zDOrsxP7S.jpg,/auwdpPHhajvXn26BLFmJ4HlxdM0.jpg,k9672
117879.0,278086.0,Altman,2014.0,Documentary,"Robert Altman's life and career contained multitudes. This father of American independent cinema left an indelible mark, not merely on the evolution of his art form, but also on the western zeitgeist. With its use of rare interviews, representative film clips, archival images, and musings from his family and most recognizable collaborators, Altman is a dynamic and heartfelt mediation on an artist whose expression, passion and appetite knew few bounds.",4.738,95.0,Maverick. Auteur. Rebel.,6.6,22.0,en,/xhQnBL5dcd36b8KVvwDROkuXLGp.jpg,/t7nTxUlFvKiucZVAkgEQ0dai0N.jpg,
117881.0,284293.0,Para Sempre Alice,2014.0,Drama,"A Dra. Alice Howland (Julianne Moore) é uma renomada professora de linguistica. Aos poucos, ela começa a esquecer certas palavras e se perder pelas ruas de Manhattan. Ela é diagnosticada com Alzheimer. A doença coloca em prova a a força de sua família. Enquanto a relação de Alice com o marido, John (Alec Baldwinse), fragiliza, ela e a filha caçula, Lydia (Kristen Stewart), se aproximam.",10.469,101.0,,7.5,2531.0,en,/yAF8ji93almEr5mk3pBezYWtTd5.jpg,/yFl1VT4lGER0RROB51iBcTaQDYJ.jpg,k818
117885.0,300441.0,Grumpy Cat's Worst Christmas Ever,2014.0,Comedy|Family|TV Movie,"A lonely cat living in a mall pet shop has a sour outlook on life until, in the midst of the holiday rush, she’s swept up into a robbery and a friendship with a human girl.",4.664,90.0,Ho ho no.,4.9,60.0,en,/fywyPmuSNfgfW9ArqjTTCWUEblP.jpg,/eAB7R9lSIW6WT3mbR4kXQa1iqg6.jpg,k207317
117887.0,116149.0,As Aventuras de Paddington,2014.0,Comédia|Aventura|Família,"Paddington (voz de Ben Whishaw) foi criado na floresta do Peru pelos tios Pastuzo (voz de Michael Gambon) e Luzy (voz de Imelda Staunton), mas um terremoto acaba separando o trio. Diante disto, o pequeno urso é enviado pela tia para Londres, local onde mora um explorador que visitou o Peru décadas atrás. Paddington faz a viagem clandestinamente e, ao chegar, acaba indo para uma estação de trem. Lá ele conhece a família Brown, que decide ajudá-lo a encontrar o tal explorador. Só que a vida na civilização e entre humanos não é tão simples assim.",29.874,95.0,,7.1,2704.0,en,/1cnL5EdrfJabI35R6cY6ee06zXY.jpg,/49ybMvALWRKVVpONPIKWYATLihH.jpg,k818|k18035
117893.0,203834.0,Jessabelle: O Passado Nunca Morre,2014.0,Thriller|Terror,"Após sofrer um terrível acidente, Jessie é forçada a retornar para a casa do pai, onde tenta lidar com suas pernas imobilizadas. Ela ainda terá de enfrentar a fúria de um espírito, chamado Jessabelle, que pode ter relação com as circunstâncias misteriosas de seu nascimento.",16.196,90.0,Os mortos estão de volta para a vida,5.4,612.0,en,/o2iN9n2ShVqobqnYR0odM6yIlgW.jpg,/zntIFehSIsMrARh2k6XJFGwsJJy.jpg,k6152
117899.0,302496.0,Beautiful Girl,2014.0,Drama,"Odessa is a beautiful girl addicted to the attention and money that being an adult film star brings. William, a lonely mechanic, has a crush on her, and she indulges his fantasy and leads him on. Thinking he can save her and help her find a normal life, he befriends her drug-fueled bodyguard, Angry Jack, to get close to her.",4.333,90.0,"When you look down on a pornstar, you're still looking...",5.2,8.0,en,,/pxcvdUjNasq2x9cuJWtpr7JY4VC.jpg,
117901.0,147778.0,Showrunners: The Art of Running a TV Show,2014.0,Documentary,"“Showrunners” is the first ever feature length documentary film to explore the fascinating world of US television showrunners and the creative forces aligned around them. These are the people responsible for creating, writing and overseeing every element of production on one of the United State’s biggest exports – television drama and comedy series.  Often described as the most complex job in the entertainment business, a showrunner is the chief writer / producer on a TV series and, in most instances, the show’s creator. Battling daily between art and commerce, showrunners manage every aspect of a TV show’s development and production: creative, financial and logistical.",3.487,88.0,Their Vision Is Television,6.2,39.0,en,,/kWEPPZKsF3OFNZgyEoFc56I3VOr.jpg,
117913.0,284995.0,Scooby-Doo! e a Maldição do Frankenstein,2014.0,Mistério|Animação|Família|Comédia,"Velma fica surpresa ao descobrir que herdou o castelo do seu tio tataravô Dr. Von Dinklestein em um local apavorante. Todos tentam convencê-la a ir atrás de sua herança, mas um fantasma explode a Máquina de Mistério como um sinal de alerta. A turma logo entra em ação e, desta vez, o assunto é pessoal.",21.733,73.0,,7.5,118.0,en,/8y0TzKXeyQa56YVduWU3R63d361.jpg,/wwUsjCsYvFi6huVtsrzVLxY41CG.jpg,
117920.0,212843.0,Burt's Buzz,2014.0,Documentary,"BURT'S BUZZ is an in-depth and personal look at the life of Burt Shavitz, known to millions around the world as the ""Burt"" of the Burt’s Bees natural product brand. The documentary explores what it means to be marketed as an icon, and how that life differs from the one of the man behind the logo.",1.805,88.0,,6.6,16.0,en,,/bGb3g4kbBqeKjSuesZqpEgzM3KG.jpg,
117928.0,306650.0,Kajaki,2014.0,Thriller|Guerra|Aventura|Drama,Uma companhia de jovens soldados britânicos encontra um inesperado e aterrorizante inimigo. Se encontram sob todas as possibilidades de uma mina. Uma mina que pode custar uma perna - ou suas vidas.,6.601,108.0,,6.6,207.0,en,/uYdFmBTXgzzUcxVoSumOKdOseDo.jpg,/ezusFw3mwp2GNviDbKh8ckkNDQU.jpg,k9672|k13065
117932.0,265449.0,Summer of Blood,2014.0,Horror|Comedy,Lousy lover and egocentric Eric Sparrow is dumped by his girlfriend after rejecting her marital proposal. After a few failed dates his luck turns when a chance encounter with a vampire turns him into a sex god.,3.307,86.0,,5.0,26.0,en,,/sUeLtLtocnQafixemcfva0dt0zu.jpg,
118082.0,244458.0,As Vozes,2014.0,Comédia|Crime|Terror|Fantasia,Suspense sobre um operário que é acusado de envolvimento na morte acidental de um colega da fábrica em que trabalha.,11.06,101.0,Nunca Ouça Seu Gato,6.3,1379.0,en,/d5tcsjdLw3uxBd318EIcTn9e35X.jpg,/loPVim3CabZEBL0yjalsJttmYpW.jpg,k10714
118103.0,276922.0,Come Back to Me,2014.0,Horror,"Sarah and Josh are married suburbanites. After a car accident, Sarah suffers blackouts and ends up pregnant though Josh is sterile. As her life spirals she hides a camera in her home and unlocks a horrific secret with far-reaching consequences.",5.44,90.0,,5.6,87.0,en,/nFbyhmUspWJdXnn1L8HQO6EsM8r.jpg,/28OBRBfGBgORAgQiXHVI3NMZySZ.jpg,k3725
118111.0,257442.0,Almost Married,2014.0,Comedy,"When Kyle returns from his stag-do with a sexually transmitted disease, he's left unable to have sex with his fiancée Lydia in the run-up to their wedding.",2.333,97.0,,4.9,12.0,en,,/o67VQMEy1YDXeLH5B5ARpbz7Qjb.jpg,
118117.0,289416.0,O Mistério de Grace,2014.0,Thriller|Terror,"Grace (Alexia Fast) é uma bela e ingênua, caloura virginal da faculdade tentando lidar com a cultura do campus e sua nova companheira de quarto extrovertida. Mas quando um terror toma conta de seu corpo e desencadeia o caos, Grace retorna às garras frias de sua avó severa (Lin Shaye) e às regras estritas da Igreja. Assombrada pela horrível morte de sua mãe e por seus impulsos destrutivos profundamente arraigados, Grace deve impedir o demônio interior, antes que seja tarde demais.",13.608,87.0,,5.0,154.0,en,/gK7abW0QK9mHtHCh62TCIPGmowf.jpg,/6ikvuPIo1kGuRQz70l3ecissZLS.jpg,k9712
118198.0,250798.0,O Príncipe Verde,2014.0,Documentário|Thriller,"O documentário conta a história de uma das fontes de informação mais valiosas de Israel, o filho de um líder do Hamas. Com o codinome “Príncipe Verde”, ele foi contratado aos 17 anos para espionar seu próprio povo durante mais de uma década. Com foco na relação complexa dele com seu contato israelense, o filme é um relato sobre terror, traição, escolhas e uma amizade que desafia todas as barreiras O palestino Mosab Hassan Yousef cresce com raiva e pronto para lutar contra Israel. Preso por contrabando de armas com 17 anos é interrogado pelo Shin Bet, o serviço de segurança de Israel, e enviado para a prisão. Chocado com as táticas cruéis do Hamas na prisão e a crescente campanha de ataques suicidas fora da organização, Mosab concorda em espionar para Israel.",2.85,101.0,,7.3,31.0,en,/yFPO0nShyUK3LM0W2YJ7qjf3Att.jpg,/xeUxtEDEA4AXWg7pV5oen0rn4EX.jpg,
118200.0,277846.0,Castles in the Sky,2014.0,Drama|History|TV Movie|War,"England, while the storm clouds of Nazism menace Germany. Robert Watson Watt and a team of eccentric and brilliant meteorologists struggle to turn the mere idea of radar into a functional reality.",2.695,90.0,,5.9,10.0,en,,/sEzXqrTIlTmhoDnJipVxM0NI0uA.jpg,
118202.0,282297.0,A Conspiração da Vaca: O Segredo da Sustentabilidade,2014.0,Documentário,"Documentário ambiental inovador que segue o intrépido cineasta Kip Andersen há medida que ele revela a indústria mais destrutiva que o planeta enfrenta hoje - e investiga porque as principais organizações ambientais do mundo estão com muito medo de falar sobre isso.  A agropecuária é a principal causa do desmatamento, consumo de água e poluição, é responsável por mais gases de efeito estufa do que o setor de transporte, e é o principal motor da destruição da floresta, extinção de espécies, perda de habitat, erosão do solo, de ""zonas mortas"" nos oceanos, e praticamente todos os outros problemas ambiental.  A medida que Andersen confronta os líderes do movimento ambiental, ele descobre cada vez mais o que parece ser uma recusa intencional de discutir a questão da agricultura animal, enquanto denunciantes da indústria e ""cães de guarda"" o alertam dos riscos para a sua liberdade e até mesmo para a sua vida se ele se atreve a persistir.",7.215,90.0,‎Há uma única indústria destruindo o planeta mais do que qualquer outra. Mas ninguém quer falar sobre isso.‎,7.8,385.0,en,/7KYqBgUtQGInqHVEMRnlyneuCpA.jpg,/5rn3jsTgqQWPQRDof3eHT3wd500.jpg,
118206.0,253295.0,Manny,2014.0,Documentary|Drama,"From abject poverty to becoming a ten-time boxing world champion, congressman, and international icon, Manny Pacquiao is the true definition of a Cinderella story. In the Philippines, he first entered the ring as a sixteen-year-old weighing ninety-eight pounds with the goal of earning money to feed his family. Now, almost twenty years later, when he fights, the country of 100 million people comes to a complete standstill to watch. Regarded for his ability to bring people together, Pacquiao entered the political arena in 2010. As history’s first boxing congressman, Pacquiao now fights for his people both inside and outside of the ring. Now at the height of his career, he is faced with maneuvering an unscrupulous sport while maintaining his political duties. The question now is, what bridge is too far for Manny Pacquiao to cross?",10.773,106.0,,6.3,56.0,en,/lJjuN6YOHIKfXdQE3WOPz4lWA4c.jpg,/mYnQXI0Dm4Tp9prSa6ZqX1NpXAk.jpg,
118244.0,306963.0,Wanderers,2014.0,Science Fiction,"Wanderers is a vision of humanity's expansion into the Solar System, based on scientific ideas and concepts of what our future in space might look like, if it ever happens. The locations depicted in the film are digital recreations of actual places in the Solar System, built from real photos and map data where available.  Without any apparent story, other than what you may fill in by yourself, the idea with the film is primarily to show a glimpse of the fantastic and beautiful nature that surrounds us on our neighboring worlds - and above all, how it might appear to us if we were there.",1.716,4.0,A short film by Erik Wernquist,7.2,45.0,en,/iZbl6fNMCe66FJtw6LA9HC7hiVs.jpg,/2e1XbXF7tYIhtqTf587PQxImpDI.jpg,
118246.0,246860.0,Acima das Nuvens,2014.0,Drama,"Maria Enders (Juliette Binoche) é uma famosa atriz que fica perturbada com o fato de que Joann (Chloë Moretz), jovem estrela de Hollywood, irá interpretar o papel que a fez famosa há vinte anos. Convidada a dividir o palco com a novata, uma insegura Enders viaja até os Alpes para ensaiar e conta com o apoio de sua assistente (Kristen Stewart) no confrontamento com seu passado.",6.617,124.0,,6.7,593.0,en,/1uWCcN9kGLFWG3UopkDtruelkJQ.jpg,/3xzxA0ZXo2DwImpS7DNSHkuTiTI.jpg,k236
118248.0,297596.0,Vingança ao Anoitecer,2014.0,Thriller|Drama,"Evan Lake (Nicolas Cage) é um condecorado agente da CIA cuja entrega, determinação e patriotismo constituem uma inspiração para todos. No entanto, uma doença terminal obriga-o a retirar-se. Mas a reforma vai ter de esperar. Quando o veterano descobre que o terrorista Muhammad Banir (Alexander Karim) ainda está vivo, decide lançar-se numa derradeira missão: dedicar o seu último fôlego a perseguir e eliminar de vez o seu inimigo de morte.",6.792,94.0,Uma segunda chance para achar a verdade,4.7,244.0,en,/cA5nHonKd09wNDM1BWpeiA7BzyH.jpg,/gL6riNxQeyPXT5YsgqE2aWhl1zi.jpg,
118256.0,262840.0,WolfCop,2014.0,Horror|Comedy,"It's not unusual for alcoholic cop Lou to black out and wake up in unfamiliar surroundings, but lately things have taken a turn for the strange...and hairy. WolfCop is the story of one cop's quest to become a better man. One transformation at a time.",5.963,79.0,Here Comes The Fuzz,5.3,153.0,en,,/kOhgErWiWKX2yg4xEXfG2yTFti5.jpg,k6149
118326.0,270005.0,No Rastro da Bala,2014.0,Crime|Drama|Thriller,"Desde que a família de Nick Tortano (Ben Barnes), vinda da Itália, se mudou para Boston, tudo o que ele queria era contribuir para o sonho americano deles. Só que começou a andar com as pessoas erradas e logo se envolveu no mundo do crime. Nick passou a idolatrar os gangsters italianos, até que conseguiu impressionar o chefe (Harvey Keitel) e se tornou bem visto na Família da máfia. Mas quando conhece Ali Matazano (Leighton Meester), se apaixona por ela e vê um motivo para deixar a gangue, o que é proibido. Seus chefes, que acham que a moça é uma distração para Nick, farão de tudo para encerrar o relacionamento dos dois.",4.948,110.0,"Até onde você iria para achar a verdade, e em quanto tempo?",4.6,43.0,en,/6y5MQBMMPvOMw7e5CLUjbRMrTl8.jpg,/k5U1M1frRT1AnP89dYw4eBpoWfE.jpg,
118350.0,305276.0,Crimes e Trapaças,2014.0,Drama|Ação|Crime,"Ethan Tell (Milo Ventimiglia) é um vigarista que conseguiu fazer um grande assalto: roubar 1 milhão de dólares. Mas ele acaba sendo pego pela polícia. Após cumprir sua pena, Tell está decidido a levar uma vida honesta. Um plano que dá muito errado, já que seus ex-parceiros, sua esposa, seu agente de condicional e dois detetives corruptos estão atras dele loucos para conseguir botar as mãos na grana roubada.",2.873,89.0,,5.6,34.0,en,/2xfXwsI5Wp1q7GKw9udcp4oPRcV.jpg,/taPRHVf3OH6mFDJvfyKOHi69TUb.jpg,
118354.0,245916.0,O Mensageiro,2014.0,Thriller|Crime|Drama|Mistério,"Gary é um jornalista que acidentalmente descobre documentos confidenciais envolvendo o governo dos Estados Unidos e a guerra contra as drogas. Conforme investiga o caso, percebe que os próprios políticos estão profundamente envolvidos e, com isso, passa a ser pressionado a abandonar a história.",11.623,112.0,Você Seria Capaz De Guardar Um Segredo Nacional?,6.7,676.0,en,/5M1aPJRY4ncQIIYKoVJNRPSOPwk.jpg,/lEqiMrf6udTINkszmU6mwwMbowv.jpg,
