movieId,tmdbId,title,release_date,genres,overview,popularity,runtime,tagline,vote_average,vote_count,original_language,backdrop_path,poster_path,keywords
106841.0,152737.0,Álbum de Família,2013.0,Comédia|Drama,"Barbara (Julia Roberts), Ivy (Julianne Nicholson) e Karen (Juliette Lewis) são três irmãs que são obrigadas a voltar para casa e cuidar da mãe viciada em medicamentos e com câncer (Meryl Streep), após o desaparecimento do pai delas (Sam Shepard). O encontro provoca diversos conflitos e mostra que nenhum segredo estará protegido. Enquanto tenta lidar com a mãe, Barbara ainda terá que conviver com os problemas pessoais, com difíceis relações com o ex-marido (Ewan McGregor) e com a filha adolescente (Abigail Breslin).",11.196,121.0,,6.9,1147.0,en,/6Ks5F73mhfjlKwIFMS9rPnV85yt.jpg,/ibWW2YJpRJzUrndO3Qdt8CLzodj.jpg,k236
106854.0,57210.0,Quando Anjos Cantam,2013.0,Comédia|Família|Drama,"Por trinta anos, Michael Walker (Harry Connick, Jr.) quis somente uma coisa no Natal: esquecer dessa data completamente. Isso até que um misterioso estranho, Nick (Willie Nelson), lhe vende a casa dos sonhos de sua família com a condição de que ele acompanhe os padrões da vizinhança. Michael logo percebe que a sua nova rua será o seu pior pesadelo. A Live Oak Lane fica famosa no Natal, quando recebe milhares de visitantes, sendo que a casa dele é a atração mais ilustre. O Natal é inevitável e o desprezo de Michael por ele explode com toda a pressão da família e dos vizinhos. Quando Nick volta e questiona por que Michael não está cumprindo sua parte no acordo, ele o força a enfrentar o seu passado e evitar que o filho repita os mesmos erros. ""Angels Sing"" é uma fábula cômica e comovente sobre a importância dos laços de família, o poder do perdão e a magia do Natal.",5.471,87.0,,5.6,40.0,en,/a4b0C19jG0HmotOGU9WNlJ0Zmwk.jpg,/sZJ5DUWrVAsPc3GKkliYn4O88Kq.jpg,k207317
106868.0,136850.0,Pacto de Vingança,2013.0,Crime|Thriller,"Sara é uma linda e ambiciosa jovem, procurando seu lugar enquanto cursa o segundo ano de Direito. Graças a um problema envolvendo a ciumenta namorada de um paquera, ela se torna a principal protegida de sua colega de classe, uma garota rica e repleta de privilégios - e não demora até que ambas se tornem muito mais do que amigas, mas cúmplices.",5.996,86.0,,5.5,64.0,en,/3iNrppLKW3NOF8aMRJ8zj5xFZ9S.jpg,/doZRNJ9JV9d6EkvxWJb88p6TWyj.jpg,
106879.0,214597.0,A Hora do Espanto 2,2013.0,Terror|Comédia,"Durante o dia, Gerri Dandridge (Jaime Murray) é uma professora universitária; à noite, ela se transforma em uma vampira com inesgotável sede por sangue humano. Quando um grupo de estudantes viaja para a Romênia, eles acabam caindo na teia de sedução de Gerri, e passam a correr grande risco. O grupo então pedem ajuda a Peter Vincent (Sean Power), apresentador de um programa de TV local chamando A Hora do Espanto e caçador de vampiros.",10.466,100.0,,4.9,195.0,en,/9P0IectpPQktF0mu2nkdihsdTSZ.jpg,/wNYnZDZoqsJCUvxpd0H9fx5RESt.jpg,k3133
106881.0,158916.0,Sweetwater,2013.0,Western|Thriller,"In the late 1800s, a fanatical religious leader, a renegade Sheriff, and a former prostitute collide in a blood triangle on the rugged plains of the New Mexico Territory.",6.41,96.0,Revenge is Sweet.,6.1,148.0,en,/l1ViZoAvwbfGMjxzOqTALmVhlfa.jpg,/q69vCHmShdsiXixCIdwJuyJXEXY.jpg,
106883.0,174311.0,Um Negócio Brilhante,2013.0,Comédia|Drama,"Um ex-presidiário e seu parceiro, viajam para Nova York com um esquema para ficar rico vendendo árvores de Natal rapidamente.",5.292,107.0,,5.2,75.0,en,/5dVuekvxRamQcLJEcJXmGDjxaWk.jpg,/spCLVHZnOCcjrGwCEaVi8ADKRsn.jpg,k207317
106889.0,212063.0,Tim's Vermeer,2013.0,Documentary,"Tim Jenison, a Texas based inventor, attempts to solve one of the greatest mysteries in all art: How did Dutch Master Johannes Vermeer manage to paint so photo-realistically 150 years before the invention of photography? Spanning a decade, Jenison's adventure takes him to Holland, on a pilgrimage to the North coast of Yorkshire to meet artista David Hockney, and eventually even to Buckingham Palace. The epic research project Jenison embarques on is as extraordinary as what he discovers.",6.312,80.0,,7.3,125.0,en,/pY6gDWUjRmh785MRVHLgnqM9fV2.jpg,/vEF0f8dktdp4NbUbpi0xSzwUAY8.jpg,
106892.0,158994.0,After Tiller,2013.0,Documentário|Drama,Um retrato complexo de médicos que se tornaram o principal alvo de militantes contra o aborto.,3.447,85.0,,7.5,12.0,en,/85kurGaFxSpKQLgkagJMME6kpC6.jpg,/hzdFkprVoEJL7WPDYjU17LQinAj.jpg,
106916.0,168672.0,Trapaça,2013.0,Drama|Crime,"Irving Rosenfeld é um grande trapaceiro, que trabalha junto da sócia e amante Sydney Prosser. Os dois são forçados a colaborar com Richie DiMaso, um agente do FBI que infiltra Rosenfeld no mundo da máfia. Ao mesmo tempo, o trio também se envolve na política do país, através do candidato Carmine Polito. Os planos parecem dar certo, até a esposa de Irving, Rosalyn, aparecer e mudar as regras do jogo.",27.356,138.0,Todo mundo trapaceia para sobreviver,6.8,6000.0,en,/ffJff2KWHd2rbwYWPRxKxTBypRB.jpg,/hDvBteFNrro6e4UdHBenC0hbDio.jpg,
106918.0,116745.0,A Vida Secreta de Walter Mitty,2013.0,Aventura|Comédia|Drama|Fantasia,"Walter Mitty (Ben Stiller) é o responsável pelo departamento de arquivo e revelação de fotografias da tradicional revista Life. Ele é um homem tímido, levando uma vida simples, perdido em seus sonhos. Ao receber um pacote com negativos do importante fotógrafo Sean O'Connell (Sean Penn), ele percebe que está faltando uma foto. O problema é que trata-se justamente da foto escolhida para ser a capa da última edição da revista. É quando, Walter, com o apoio de Cheryl (Kristen Wiig) é obrigado a embarcar em uma verdadeira aventura.",27.302,114.0,Pare de sonhar. Comece a viver.,7.1,6247.0,en,/5GRmcJ0ZK9fihN7YnQ7XHwCue5o.jpg,/dXZywWvykuyR7hvLUTmFk1Zy0le.jpg,
106920.0,152601.0,Ela,2013.0,Romance|Ficção científica|Drama,"Em um futuro próximo, um escritor solitário desenvolve um relacionamento improvável com um sistema operacional projetado para atender todas as suas necessidades.",25.47,126.0,Uma história de amor de Spike Jonze.,7.9,11444.0,en,/nG5zmbVeYlcDhckrPAe06fArywn.jpg,/yyDGhBY8RYXyXYADeFq1BDxpLkl.jpg,k9673
107000.0,177203.0,Ônibus Espacial Challenger,2013.0,Thriller|Cinema TV|Drama|História,"Neste filme estrelado por você acompanhará a investigação de Richard Feynman sobre o desastre do ônibus espacial Challenger, em 1986. Ela explodiu 73 segundos após seu lançamento, gerando um dos acontecimentos mais chocantes da história espacial americana. A Comissão Presidencial foi imediatamente convocada para investigar, mas descobrir a verdade se tornou um desafio quase impossível. Tudo por conta da complexidade do ônibus espacial e dos diversos interesses envolvidos. Richard Feynman era um dos cientistas mais talentosos de sua geração. Trabalhou no Projeto Manhattan, construindo a primeira bomba atômica. Vencedor do Prêmio Nobel por suas descobertas na física quântica, Feynman usou de uma integridade excepcional e uma lógica científica implacável para investigar os segredos do desastre. Assim ajudou a tornar o programa espacial dos Estados Unidos mais seguro.",5.37,90.0,,7.3,80.0,en,/7exe5nOzEp0MZNb7Ao4fl80OARz.jpg,/ltSiY7rORMGlSHGI7Lr0sgI8D6.jpg,
107002.0,159142.0,Linsanity,2013.0,Documentary,"The life story of basketball sensation, Jeremy Lin.",2.241,88.0,,6.8,22.0,en,/6hTcU96hEpFc4wpyhfYn4gMryTp.jpg,/bpBn0oq6kRuf2o34EL3goyh2NKC.jpg,
107004.0,172897.0,Algumas Garotas,2013.0,Comédia|Drama,"Algumas Garotas – Pouco antes de se casar, um jovem escritor bem-sucedido (Adam Brody) decide viajar pelo país e reencontrar suas ex-namoradas, para retomar a amizade e fazer as pazes após as brigas do passado. Entre elas está Lindsay, uma antiga professora de faculdade, a sedutora Tyler, a pequena Reggie, irmã de seu melhor amigo, a amargurada Sam e principalmente Bobbi, seu antigo amor de colégio. No caminho, ele aprende muito mais sobre relacionamentos e sobre as verdadeiras razões que levaram ao fim de tantos namoros.",5.623,90.0,,5.2,60.0,en,,/ozz4epRp9QMxZx8Uj5BQl8rhveb.jpg,
107042.0,238478.0,Six by Sondheim,2013.0,Documentary,This intimate documentary explores the life and career of the stage legend Stephen Sondheim through six of his best-known songs.,4.903,86.0,,7.6,15.0,en,/feWvR2V3rPdAoOxUC2oo6qIZfru.jpg,/jyz3kehw1dc8rMuM8QADKHUUkye.jpg,
107052.0,178290.0,The Punk Singer,2013.0,Documentary|Music,"A look at the life of activist, musician, and cultural icon Kathleen Hanna, who formed the punk band Bikini Kill and pioneered the ""riot grrrl"" movement of the 1990s.",5.812,80.0,,7.2,60.0,en,/5oQXOe2v2NjnsO2Cx5OtpA4zFIV.jpg,/cZroPc3jpZXGHNVYV453runyHlZ.jpg,
107069.0,193756.0,O Grande Herói,2013.0,Guerra|Ação|Drama|História,"Marcus Luttrell, oficial da marinha norte-americana , é enviado ao Afeganistão em busca de um homem de confiança de Osama Bin Laden. Quando ele se depara com um homem idoso e três crianças, ele recebe ordens para matar os quatro, mas Marcus não tem coragem de fazê-lo. O paradeiro dos americanos é descoberto e logo toda a equipe é atacada por 250 homens armados, enviados pela Al Qaeda.",35.707,121.0,,7.4,3291.0,en,/hmEbQB5UlcwobldcSDNlLZiUnmA.jpg,/9Xcir0rOyYydPhGRYgG0Ctt1sqf.jpg,k818|k162365
107083.0,197033.0,Geography Club,2013.0,Comedy|Drama|Romance,"A coming-of-age movie that tells a story unfolding in every high school around the country -- a story of kids hiding their true identities in plain sight, even as they feverishly pursue their hearts' desires.",6.331,79.0,They formed a club they thought nobody would join...,6.4,119.0,en,/bJ1BgraE85umtMmWhHHQKKiUWat.jpg,/oPwDoem41nOxe1tEI5p65tYTbpe.jpg,k818|k6054|k264384
107102.0,121573.0,My Amityville Horror,2013.0,Documentary|Horror,"For the first time in 35 years, Daniel Lutz recounts his version of the infamous Amityville haunting that terrified his family in 1975. George and Kathleen Lutz's story went on to inspire a best-selling novel and the subsequent films have continued to fascinate audiences today. This documentary reveals the horror behind growing up as part of a world-famous haunting and while Daniel's facts may be others' fiction, the psychological scars he carries are indisputable. Documentary filmmaker Eric Walter has combined years of independent research into the Amityville case along with the perspectives of past investigative reporters and eyewitnesses, giving way to the most personal testimony of the subject to date.",6.127,88.0,I just wanted somebody to believe me.,5.7,46.0,en,/4lmC5ZJlvV8pRJrNRNCuGhMf0cy.jpg,/sh7Hbs4PWFFTYOlMLXW3JZt0veK.jpg,
107117.0,214083.0,A Mentira Armstrong,2013.0,Documentário,"Documentário que apresenta o treino e a rotina do ciclista Lance Armstrond durante a sua volta ao esporte, e a preparação para o seu oitavo Tour da France.",7.088,122.0,,7.0,84.0,en,/uNLSPLDqdOprTfyJJUp806bSv0d.jpg,/hup4E7xFxNYB5VuyHdVGxAtDPxB.jpg,
107130.0,210024.0,An Adventure in Space and Time,2013.0,Drama,"This docudrama travels back in time to 1963 to see how Doctor Who was first brought to the screen.  Actor William Hartnell felt trapped by a succession of hard-man roles. Wannabe producer Verity Lambert was frustrated by the TV industry's glass ceiling. Both of them were to find unlikely hope and unexpected challenges in the form of a Saturday tea-time drama. Allied with a team of unusual but brilliant people, they went on to create the longest running science fiction series ever made.",6.1,83.0,The Story Begins Here...,7.7,149.0,en,/fAbeVshWuJBqTXikeJ9EbdchUMx.jpg,/lRrmdPMvCPGcLF6FrvS66STXAyU.jpg,k4379
107141.0,140823.0,Walt nos Bastidores de Mary Poppins,2013.0,Comédia|Drama|História,"Durante 20 anos, Walt Disney tentou adquirir os direitos de Mary Poppins da escritora australiana P.L. Travers, que sempre se recusou a vendê-los para que Disney fizesse um de seus desenhos bobos. Entretanto, a crise financeira faz com que ela tenha que negociar. Desta forma, Travers viaja até os Estados Unidos e passa a trabalhar juntamente com a equipe escolhida por Walt Disney para que Mary Poppins possa chegar às telas. Minuciosa e com muita má vontade, ela começa a encontrar problemas de todo o tipo. Como o contrato lhe dá o direito de cancelar a cessão dos direitos caso não concorde com a adaptação, Disney e sua equipe precisam aceitar seus caprichos para que o filme, enfim, saia do papel.",14.692,125.0,A história começa onde o livro termina.,7.4,2750.0,en,/pbTyzFmqah1uQJTig17NiOeCU2d.jpg,/cWvBOsWGpWlSpzeeNgtCBM6d0bO.jpg,k9672
107183.0,186279.0,The Battle of Amfar,2013.0,Documentary,"When AIDS struck in the early 1980s, a scientist and a movie star did not have to respond - but they did. Dr. Mathilde Krim and Elizabeth Taylor joined forces to create amfAR, the Foundation for AIDS Research. The fight against HIV has never been the same. The Perfect Host reveals how two powerful and very different women came together, and what their combined efforts achieved. With passion and wit, Taylor wielded celebrity as a weapon against government indifference while Krim's commitment to science ensured support for the most promising research areas. Today, the only man cured of AIDS can thank research championed by Mathilde Krim. Visually dazzling and emotionally compelling, this story offers a surprising perspective on the still ongoing fight against AIDS.",1.893,40.0,,5.8,5.0,en,/qnRQil6wfAtPLMAH4Zd6JOx1pIP.jpg,/cdPswia1JkVcCxDbXvJXtYkC3Lk.jpg,
107196.0,167502.0,Is the Man Who Is Tall Happy?,2013.0,Documentary|Animation,"A series of interviews featuring linguist, philosopher and activist Noam Chomsky done in hand-drawn animation.",4.82,88.0,An Animated Conversation with Noam Chomsky,7.1,64.0,en,,/y9yAjpCQRqtzcR5GdSVHuLdxuV0.jpg,
107302.0,228331.0,Um Homem Perfeito,2013.0,Drama,"Um marido mulherengo, inadvertidamente, se apaixona por sua esposa ao telefone quando ela finge ser outra mulher.",2.511,95.0,,4.3,26.0,en,/eur1aeBRVI8quipdANrcTwvSIDy.jpg,/vcEhYXtHUr4wWelnKcLJgmMokNa.jpg,
107314.0,87516.0,Oldboy: Dias de Vingança,2013.0,Drama|Thriller|Mistério|Ação,"Um arrogante executivo, Joe Ducett, é sequestrado e passa 20 anos em cativeiro, sem saber quem o sequestrou ou o motivo. Enquanto isso, ele descobre, pela televisão, que sua ex-esposa foi assassinada e que ele é o principal suspeito. Certo dia, Joe é libertado e, com a ajuda de uma assistente social, ele tem apenas três dias para descobrir a verdade sobre seu sequestro.",16.642,104.0,Não pergunte por que você foi preso. Pergunte por que você foi solto.,5.9,1534.0,en,/75VwJUzW0R4aJBSRdDRjZ4fdAwn.jpg,/dEkuyD3jBrbDKWW5cAuftKy5Ak1.jpg,k13141
107348.0,109443.0,Tudo por um Furo,2013.0,Comédia,"Depois de perder seu emprego para sua esposa e colega, Ron reúne o time do noticiário e investe contra um novo rival. Será que o maior âncora do mundo vai ser esmagado pelo peso de seu próprio ego (e seu cabelo de salão)?",18.841,113.0,,6.1,1984.0,en,/gVgUCWk2bfqOUyhtVGesR1Vggrk.jpg,/zt3gC0tFG4YnyBiwf18blTeRoly.jpg,
107352.0,170039.0,Quem Matou Lincoln?,2013.0,Documentário|Drama,"14 de abril de 1865. Um tiro. Um assassino se empenhou em matar um tirano, como ele acusou o 16º presidente dos Estados Unidos. E em um momento, nossa nação foi mudada para sempre. Este é o crime mais dramático e ressonante da história americana: a verdadeira história do assassinato de Abraham Lincoln. Dos produtores executivos Ridley Scott e Tony Scott, e narrado por Tom Hanks, o primeiro docudrama do National Geographic Channel, Killing Lincoln, baseado no best-seller do New York Times, combina re-criações com insight histórico numa emocionante crônica dos últimos dias do presidente Lincoln e seu assassino, John Wilkes Booth.",4.353,89.0,,5.8,43.0,en,/8t2wI3IZVWucJaULiYLlWTrQ6bS.jpg,/zqlOXMsJ0sSyForOe93BSfNW3Pi.jpg,
107354.0,173301.0,Good Ol' Freda,2013.0,Music|Documentary|History,"The story of Freda Kelly, a shy Liverpudlian teenager asked to work for a young local band hoping to make it big: The Beatles. Their loyal secretary from beginning to end, Freda tells her tales for the first time in 50 years.",4.761,86.0,The first independent film to have successfully licensed original Beatles recordings.,7.2,41.0,en,,/bZylt896XL9JEr8dJvjlDAZZChl.jpg,
107357.0,187541.0,Não Sou Louca,2013.0,Drama,"Nas profundezas da mente humana se escondem emoções, inseguranças e recordações que lutam para se libertar. A visão de cinco mulheres mostra como isso pode afetar suas vidas e a de seus entes queridos.",4.06,90.0,,6.8,34.0,en,,/kVcDZluWy2vBxi1rTfZ3OOxmXLg.jpg,
107368.0,230170.0,Sarah Silverman: We Are Miracles,2013.0,Comedy,"In her first-ever HBO solo special, Sarah Silverman takes the stage for an evening of adults-only stand-up comedy. Taped live in front of an intimate audience of 39 fans at Largo, a music and comedy club in Los Angeles, Sarah Silverman: We Are Miracles features Silverman taking aim at such subjects as cell-phone porn, crazy religions, specialty deodorants, terrible roommates, eyebrow waxing, her 19-year-old dog, Obama and Republicans, having babies, Pixar movies, the miracle of existence, and more.",4.232,60.0,,6.7,34.0,en,/g17lnnJo6yP4eEjN2bRzpjonn7K.jpg,/y0lI9LAOCMh04u8Z5CMPZwGNKLe.jpg,k9716
107380.0,210041.0,Mike Tyson: Verdade Fora de Disputa,2013.0,Comédia,"Dirigido por Spike Lee, o ex-campeão mundial de boxe Mike Tyson fala, de forma divertida, sobre os altos e baixos na sua vida.",4.645,90.0,,7.0,41.0,en,/1ckjmeqyOikTdGFcK9BkfsnB0cQ.jpg,/wVPuUYpAQTH01Hko5VUnZKkkcPt.jpg,k9716
107382.0,174325.0,Moms Mabley,2013.0,Documentary,"A feature documentary about Jackie ""Moms"" Mabley, an African-American stand-up comic and show-biz pioneer who emerged from the Chitlin' Circuit of African-American Vaudeville to become a mainstream star. Once billed as ""The Funniest Woman in the World,"" Mabley pushed the boundaries of comedy by tackling topics such as gender, sex, and racism and performed up until her death in 1975. A true passion project for first-time director Whoopi Goldberg, the documentary shows Mabley's historical significance and profound influence as a performer vastly ahead of her time.",3.893,72.0,The Original Queen of Comedy,7.0,8.0,en,/zQwg9bxjbZ1CzkCi7Hd4Z6DXSeP.jpg,/hR6rugHHYlwJvLzCyqvh97CDkK6.jpg,
107436.0,166271.0,Assombrada pelo Passado,2013.0,Terror|Mistério|Thriller,"O espírito de Lisa está preso a uma casa onde ela e sua família morreram. Quando Olívia se muda para a propriedade, o fantasma de Lisa decide assombrá-la para impedir que o passado se repita.",10.364,97.0,Ele te espera dormir,6.0,426.0,en,/be1ePwAZVHgZmy8Jxs0WEzaWk5b.jpg,/jGDGWy0Xl87R5cS9fb6UUf6lXxS.jpg,k9712|k10714|k162846
107447.0,158990.0,Wrong Cops,2013.0,Comedy|Crime|Mystery,A group of bad cops look to dispose of a body that one of them accidentally shot.,6.559,83.0,,6.2,201.0,en,/gbjt7NvOtxTEGT3HZ2XZBoUY4TB.jpg,/oTGY0n5MFueHv7GP1P9aPhuR11I.jpg,
107462.0,180894.0,Ninja 2: A Vingança,2013.0,Ação|Crime|Thriller,"Quando sua esposa grávida é assassinada, o professor de artes marciais Casey (Scott Adkins) vai fazer de tudo para descobrir quem cometeu esse crime. Ao descobrir uma outra morte, nas mesmas cricunstâncias de sua mulher, ele decide seguir essa pista. Obcecado e cheio de ódio, ele não vai descansar até conseguir se vingar.",24.812,95.0,,6.5,249.0,en,/pPaCOAdVQMuiGXefJRKZLaw9qxw.jpg,/bdPk58U7rNYzXfvvvm3buVhMRIx.jpg,k779
107501.0,95383.0,$ellebrity,2013.0,Documentary,"Fame has become what millions of us follow, believe in and seemingly what we care about most - as well as a billion-dollar-a-year industry. But what does our intense fascination with celebrity say about us? And how much is too high a price to pay for our own curiosity run rampant?  ""$ellebrity"" is a candid dialogue about the tone and texture of celebrity, past, present and future; an examination of our pop culture; and an honest look at the quality of our media consumption.",3.315,89.0,Fame today is more than an obsession,5.7,20.0,en,,/7fnqvdyUzSwh2ulgSx7hxzd8T7N.jpg,
107541.0,83869.0,Tão Descolada Quanto Eu,2013.0,Comédia|Drama,"Lucy Diamond é uma adolescente inteligente que vive em uma pequena cidade rural com seus pais Lainee e Chuck Diamond, um casal jovem que tenta recuperar os anos perdidos. Para escapar dos problemas, Lucy busca conforto em programas de culinária e se apega a Mario Batali, um cozinheiro famoso.",9.781,92.0,,5.9,105.0,en,/B5404avUm8hsKSySjoYWccLjZK.jpg,/heB02VA4vvluO4eR0GqX8cdc4tn.jpg,
107614.0,176085.0,White Reindeer,2013.0,Comedy,"After an unexpected tragedy, Suzanne searches for the true meaning of Christmas during one sad, strange December in suburban Virginia.",2.046,82.0,,5.4,20.0,en,/7StVyZiKacQxHfuwsvnSDt8XK8B.jpg,/qbfnubEPTR2XbCsVWtCj4HPsaTS.jpg,k207317
107636.0,199782.0,Springsteen & I,2013.0,Documentary|Music,"For 40 years Bruce Springsteen has influenced fans from all over. His songs defined more than a generation. This film gives the fans just as much time as The Boss himself, with never shown footage and live performances from his last tour.",3.104,77.0,A documentary project on Bruce Springsteen made by the people and for the people!,7.5,22.0,en,/ri6SRZCUxc2IPZWiRDxz0zvxp1z.jpg,/4EfNnkusEyw5fQYvHEGKMnrf7m1.jpg,
107675.0,225747.0,Vendetta,2013.0,Action|Thriller,"Special ops interrogation officer Jimmy Vickers (Danny Dyer) tracks down a gang who slaughtered his parents while at the same time avoiding being tracked down by his old unit and the cops. With police closing in and his old unit on his trail, he has to evade capture long enough to complete his gruesome crusade.",4.36,102.0,,6.1,43.0,en,/kwHmiuvVBNv7Bs6PpT756ltA6lJ.jpg,/kzYajz0VvUZduXHx8pHQzLO1bCM.jpg,
107700.0,171910.0,I Am Divine,2013.0,Documentary,"Harris Glenn Milstead, aka Divine (1945-1988) was the ultimate outsider turned underground hero. Spitting in the face of the status quos of body image, gender identity, sexuality, and preconceived notions of beauty, Divine succeeded in becoming an internationally recognized icon, recording artist, and character actor of stage and screen. Glenn went from the often-mocked, schoolyard fat kid to underdog royalty, standing up for millions of gay men and women, drag queens and punk rockers, and countless other socially ostracized misfits and freaks. With a completely committed in-your-face style, he blurred the line between performer and personality, and revolutionized pop culture.",5.116,90.0,The true story of the most beautiful woman in the world,7.7,62.0,en,/b9izlywWGhjkgNBOgBzFP8lSzrB.jpg,/dVu4I4UPVJOY8LuW6fPojgSQUpL.jpg,k264384
107702.0,64807.0,Ajuste de Contas,2013.0,Comédia,"Billy ""The Kid"" McDonnen (Robert De Niro) e Henry ""Razor"" Sharp (Sylvester Stallone) foram grandes boxeadores que, agora, estão aposentados. Entretanto, mesmo tendo subido no ringue pela última vez há décadas, eles aceitam se enfrentar em uma última luta para desempatar o confronto histórico. Enquanto se preparam para o confronto, os dois terão que confrontar pessoas de seus passados: a bela Sally (Kim Basinger) e o filho B.J. (Jon Bernthal).",20.78,113.0,,6.1,1001.0,en,/2nHUsjZM1lZxBDe49QZIy9WVxqa.jpg,/gRqX1Mw5ozOVUawihiTi91NTWUA.jpg,
107704.0,229296.0,Justin Bieber's Believe,2013.0,Documentary|Music,A backstage and on-stage look at Justin Bieber during his rise to super stardom.,7.393,92.0,,7.4,175.0,en,/z2JC9jdfoiJc9b7ppg9wnQX2Y1e.jpg,/5VCA3p9IWp8DPs5YMY24CAi1Wo2.jpg,
107710.0,230864.0,Marvin Hamlisch: What He Did For Love,2013.0,Documentary,"When Marvin Hamlisch passed away in August 2012 the worlds of music, theatre and cinema lost a talent the likes of which we may never see again. Seemingly destined for greatness, Hamlisch was accepted into New York’s Juilliard School as a 6-year-old musical prodigy and rapidly developed into a phenomenon. With instantly classic hits ‘The Way We Were’ and ‘Nobody Does It Better’ and scores for Hollywood films such as The Swimmer, The Sting and Sophie’s Choice and the Broadway juggernaut A Chorus Line; Hamlisch became the go-to composer for film and Broadway producers and a prominent presence on the international Concert Hall circuit. His streak was staggering, vast, unprecedented and glorious, by the age of 31 Hamlisch had won 4 Grammys, an Emmy, 3 Oscars, a Tony and a Pulitzer prize: success that burned so bright, it proved impossible to match.",2.755,82.0,,9.0,4.0,en,/kJoxU6OF4SBACVUES8one1QfnNR.jpg,/aOudv1pdxQC1NI77olO5RczrFqS.jpg,
107737.0,209504.0,Caçadores de Recompensa,2013.0,Ação|Ficção científica,"Depois de uma guerra entre grandes corporações destruir o planeta, caçadores de recompensas competem entre si para ver quem mata mais empresários. O objetivo é eliminar a praga da ganância corporativa.",7.058,93.0,"No ano de 2042, os CEOs estão matando. É hora de retribuir o favor. Se o traje servir, desperdice-o.",5.7,144.0,en,/rCF7jQLY0TeUVTbER0ySvdoYozz.jpg,/6le3HWdhCXz0z6go34x3eHbxcuR.jpg,
107756.0,115283.0,Filhos do Divórcio,2013.0,Comédia,"Carter (Adam Scott) não aguenta mais a relação conflituosa entre os seus pais, divorciados há quinze anos. Quando seu irmão anuncia que vai se casar, ele busca uma terapeuta para ajudá-lo a fazer com que o pai e a mãe possam tolerar um ao outro, e ir à cerimônia. No entanto, Carter descobre que esta psicóloga já conhecia o seu caso há muito tempo, e inclusive escreveu um livro baseado na experiência de Carter, que ela chama de A.C.O.D, ""Adult Children of Divorce"", ou ""Filhos adultos do divórcio"", em tradução literal.",7.221,88.0,"Uma comédia romântica, inteligente e borbulhante",5.5,191.0,en,/dOXYCfbKfHKRaQ3XU72vibXw3Ai.jpg,/iU5DZVXV8br0dnYl0ngu1Ih5WaS.jpg,
